Author,Gender,Date,Post Text,Likes,Comments,Shares,Page Link
Bill Gates,Male,2024-03-27,"Thirty years ago, we wanted to show just how much information a single CD-ROM could hold. The team decided a visual demonstration was necessary! © Louie Psihoyos",186898,"2,597","1,792",https://www.linkedin.com/search/results/content/?fromMember=%5B%22ACoAAA8BYqEBCGLg_vT_ca6mMEqkpp9nVffJ3hc%22%5D&heroEntityKey=urn%3Ali%3Afsd_profile%3AACoAAA8BYqEBCGLg_vT_ca6mMEqkpp9nVffJ3hc&keywords=bill%20gates&origin=CLUSTER_EXPANSION&position=0&searchId=0bf95569-b297-405a-bf67-0a43b5140a37&sid=RAV&sortBy=%22date_posted%22
Bill Gates,Male,2023-08-27,"Some memories stick with you forever. Others follow you around the internet for 28 years. Happy birthday, Windows.",75898,"1,984","1,332",https://www.linkedin.com/search/results/content/?fromMember=%5B%22ACoAAA8BYqEBCGLg_vT_ca6mMEqkpp9nVffJ3hc%22%5D&heroEntityKey=urn%3Ali%3Afsd_profile%3AACoAAA8BYqEBCGLg_vT_ca6mMEqkpp9nVffJ3hc&keywords=bill%20gates&origin=CLUSTER_EXPANSION&position=0&searchId=0bf95569-b297-405a-bf67-0a43b5140a37&sid=RAV&sortBy=%22date_posted%22
Bill Gates,Male,2024-02-27,Every trip with my dad was special—including our last visit to the Taj Mahal. I can’t wait to go back to India later this month.,51641,"1,183",203,https://www.linkedin.com/search/results/content/?fromMember=%5B%22ACoAAA8BYqEBCGLg_vT_ca6mMEqkpp9nVffJ3hc%22%5D&heroEntityKey=urn%3Ali%3Afsd_profile%3AACoAAA8BYqEBCGLg_vT_ca6mMEqkpp9nVffJ3hc&keywords=bill%20gates&origin=CLUSTER_EXPANSION&position=0&searchId=0bf95569-b297-405a-bf67-0a43b5140a37&sid=RAV&sortBy=%22date_posted%22
Bill Gates,Male,2022-04-27,"I really enjoyed reading these five books this year, and I think you will too.",43890,"1,274","1,438",https://www.linkedin.com/search/results/content/?fromMember=%5B%22ACoAAA8BYqEBCGLg_vT_ca6mMEqkpp9nVffJ3hc%22%5D&heroEntityKey=urn%3Ali%3Afsd_profile%3AACoAAA8BYqEBCGLg_vT_ca6mMEqkpp9nVffJ3hc&keywords=bill%20gates&origin=CLUSTER_EXPANSION&position=0&searchId=0bf95569-b297-405a-bf67-0a43b5140a37&sid=RAV&sortBy=%22date_posted%22
Bill Gates,Male,2024-02-27,"It was an honor to speak to the talented students at Indian Institute of Technology, Delhi. I'm confident that their generation will come up with new technologies to tackle tough problems and pave the way for scalable, sustainable ways to improve the human condition.",42140,471,297,https://www.linkedin.com/search/results/content/?fromMember=%5B%22ACoAAA8BYqEBCGLg_vT_ca6mMEqkpp9nVffJ3hc%22%5D&heroEntityKey=urn%3Ali%3Afsd_profile%3AACoAAA8BYqEBCGLg_vT_ca6mMEqkpp9nVffJ3hc&keywords=bill%20gates&origin=CLUSTER_EXPANSION&position=0&searchId=0bf95569-b297-405a-bf67-0a43b5140a37&sid=RAV&sortBy=%22date_posted%22
Bill Gates,Male,2021-04-27,"Most of the books on my summer reading list this year touch on what happens when people come into conflict with the world around them. I’ve included a look at how researchers are trying to undo damage done to the planet by humans, a deep dive about how your body keeps you safe from microscopic invaders, a president’s memoir that addresses the fallout from an oil spill, and a novel about a group of ordinary people fighting to save the trees. There’s also a fascinating look at the downfall of one of America’s greatest companies.I hope at least one of these books sparks your interest this summer.",31821,"1,227","1,181",https://www.linkedin.com/search/results/content/?fromMember=%5B%22ACoAAA8BYqEBCGLg_vT_ca6mMEqkpp9nVffJ3hc%22%5D&heroEntityKey=urn%3Ali%3Afsd_profile%3AACoAAA8BYqEBCGLg_vT_ca6mMEqkpp9nVffJ3hc&keywords=bill%20gates&origin=CLUSTER_EXPANSION&position=0&searchId=0bf95569-b297-405a-bf67-0a43b5140a37&sid=RAV&sortBy=%22date_posted%22
Bill Gates,Male,2024-03-27,"I learn something new and inspiring every time I visit India—and my latest trip was no exception. As always, I was blown away by the ideas and inventions coming out of this country.",31240,559,625,https://www.linkedin.com/search/results/content/?fromMember=%5B%22ACoAAA8BYqEBCGLg_vT_ca6mMEqkpp9nVffJ3hc%22%5D&heroEntityKey=urn%3Ali%3Afsd_profile%3AACoAAA8BYqEBCGLg_vT_ca6mMEqkpp9nVffJ3hc&keywords=bill%20gates&origin=CLUSTER_EXPANSION&position=0&searchId=0bf95569-b297-405a-bf67-0a43b5140a37&sid=RAV&sortBy=%22date_posted%22
Bill Gates,Male,2023-04-27,I’m lucky to have been involved with the PC and Internet revolution. I’m just as excited about this moment with artificial intelligence.,30546,"1,084","2,541",https://www.linkedin.com/search/results/content/?fromMember=%5B%22ACoAAA8BYqEBCGLg_vT_ca6mMEqkpp9nVffJ3hc%22%5D&heroEntityKey=urn%3Ali%3Afsd_profile%3AACoAAA8BYqEBCGLg_vT_ca6mMEqkpp9nVffJ3hc&keywords=bill%20gates&origin=CLUSTER_EXPANSION&position=0&searchId=0bf95569-b297-405a-bf67-0a43b5140a37&sid=RAV&sortBy=%22date_posted%22
Bill Gates,Male,2023-12-27,"When I think back on 2023, I will always remember it as the year I became a grandfather. It was amazing to watch my daughter Jenn and her husband Nayel welcome Leila into the world.  Another highlight was sharing the stage with Phoebe, my youngest, at the Bill & Melinda Gates Foundation Goalkeepers event. It’s been a special joy to watch my children grow up to become invaluable sources of wisdom in their own right. With the launch of my new podcast, I had the opportunity to meet and learn from incredible experts—and do fun things like gift Seth Rogen my very own ceramic creation and surprise a music legend like Questlove with a record. It’s been a wonderful year. I’m looking forward to all that’s to come in the next one.",29669,734,216,https://www.linkedin.com/search/results/content/?fromMember=%5B%22ACoAAA8BYqEBCGLg_vT_ca6mMEqkpp9nVffJ3hc%22%5D&heroEntityKey=urn%3Ali%3Afsd_profile%3AACoAAA8BYqEBCGLg_vT_ca6mMEqkpp9nVffJ3hc&keywords=bill%20gates&origin=CLUSTER_EXPANSION&position=0&searchId=0bf95569-b297-405a-bf67-0a43b5140a37&sid=RAV&sortBy=%22date_posted%22
Bill Gates,Male,2021-04-27,Avoiding a climate disaster will be really hard. But we can do it. This book is about what it will take to get to zero greenhouse gas emissions—from deploying the tools we already have like solar and wind to creating and rolling out breakthrough technologies that can take us the rest of the way.,27715,"1,665",791,https://www.linkedin.com/search/results/content/?fromMember=%5B%22ACoAAA8BYqEBCGLg_vT_ca6mMEqkpp9nVffJ3hc%22%5D&heroEntityKey=urn%3Ali%3Afsd_profile%3AACoAAA8BYqEBCGLg_vT_ca6mMEqkpp9nVffJ3hc&keywords=bill%20gates&origin=CLUSTER_EXPANSION&position=0&searchId=0bf95569-b297-405a-bf67-0a43b5140a37&sid=RAV&sortBy=%22date_posted%22
Bill Gates,Male,2023-11-27,"I love learning more about complex health issues like sanitation. So it was great to visit a sewer museum about thirty feet below Brussels. I learned a lot about the surprising history of the city’s wastewater system—and how scientists test wastewater for COVID, polio, and other diseases to keep people healthy. #WorldToiletDay",23739,910,446,https://www.linkedin.com/search/results/content/?fromMember=%5B%22ACoAAA8BYqEBCGLg_vT_ca6mMEqkpp9nVffJ3hc%22%5D&heroEntityKey=urn%3Ali%3Afsd_profile%3AACoAAA8BYqEBCGLg_vT_ca6mMEqkpp9nVffJ3hc&keywords=bill%20gates&origin=CLUSTER_EXPANSION&position=0&searchId=0bf95569-b297-405a-bf67-0a43b5140a37&sid=RAV&sortBy=%22date_posted%22
Bill Gates,Male,2024-04-06,I do!,23250,"1,346",371,https://www.linkedin.com/search/results/content/?fromMember=%5B%22ACoAAA8BYqEBCGLg_vT_ca6mMEqkpp9nVffJ3hc%22%5D&heroEntityKey=urn%3Ali%3Afsd_profile%3AACoAAA8BYqEBCGLg_vT_ca6mMEqkpp9nVffJ3hc&keywords=bill%20gates&origin=CLUSTER_EXPANSION&position=0&searchId=0bf95569-b297-405a-bf67-0a43b5140a37&sid=RAV&sortBy=%22date_posted%22
Bill Gates,Male,2024-02-27,"India’s culture of innovation always inspires me. During my trip last year, I took an electric rickshaw for a spin through the streets of Delhi.",22529,725,418,https://www.linkedin.com/search/results/content/?fromMember=%5B%22ACoAAA8BYqEBCGLg_vT_ca6mMEqkpp9nVffJ3hc%22%5D&heroEntityKey=urn%3Ali%3Afsd_profile%3AACoAAA8BYqEBCGLg_vT_ca6mMEqkpp9nVffJ3hc&keywords=bill%20gates&origin=CLUSTER_EXPANSION&position=0&searchId=0bf95569-b297-405a-bf67-0a43b5140a37&sid=RAV&sortBy=%22date_posted%22
Bill Gates,Male,2023-04-27,"As big as the problems facing the world are right now, my visit to India reminded me that our capacity to solve them is even bigger.",21627,717,427,https://www.linkedin.com/search/results/content/?fromMember=%5B%22ACoAAA8BYqEBCGLg_vT_ca6mMEqkpp9nVffJ3hc%22%5D&heroEntityKey=urn%3Ali%3Afsd_profile%3AACoAAA8BYqEBCGLg_vT_ca6mMEqkpp9nVffJ3hc&keywords=bill%20gates&origin=CLUSTER_EXPANSION&position=0&searchId=0bf95569-b297-405a-bf67-0a43b5140a37&sid=RAV&sortBy=%22date_posted%22
Bill Gates,Male,2023-09-27,"I’m looking forward to the week ahead. I’m in NYC for UNGA, New York Climate Week, and the Bill & Melinda Gates Foundation #Goalkeepers2030 event. This year marks the halfway point for the global Sustainable Development Goals—and a critical time to assess our progress and the work we still need to do. Read our report: https://gates.ly/3r92t1X",20360,702,226,https://www.linkedin.com/search/results/content/?fromMember=%5B%22ACoAAA8BYqEBCGLg_vT_ca6mMEqkpp9nVffJ3hc%22%5D&heroEntityKey=urn%3Ali%3Afsd_profile%3AACoAAA8BYqEBCGLg_vT_ca6mMEqkpp9nVffJ3hc&keywords=bill%20gates&origin=CLUSTER_EXPANSION&position=0&searchId=0bf95569-b297-405a-bf67-0a43b5140a37&sid=RAV&sortBy=%22date_posted%22
Bill Gates,Male,2024-02-27,"I had the opportunity to visit Bhubaneswar and learn about some remarkable programs that are transforming low-income neighborhoods in Odisha. ​ ​Odisha’s Jaga Mission employs a distinctive model of urban service delivery. It’s focused on integrating slum settlements into cities by putting those communities at the center of urban planning and governance. I was inspired by my meeting with representatives from the Slum Dwellers Association, who told me about how the Jaga Mission is improving life for their communities.​ ​I also enjoyed getting to know some of the women who have benefited from skill development programs and hearing their inspiring stories. Their achievements can provide a compelling blueprint for other nations, highlighting how empowerment and resilience can drive meaningful social progress.",16359,438,337,https://www.linkedin.com/search/results/content/?fromMember=%5B%22ACoAAA8BYqEBCGLg_vT_ca6mMEqkpp9nVffJ3hc%22%5D&heroEntityKey=urn%3Ali%3Afsd_profile%3AACoAAA8BYqEBCGLg_vT_ca6mMEqkpp9nVffJ3hc&keywords=bill%20gates&origin=CLUSTER_EXPANSION&position=0&searchId=0bf95569-b297-405a-bf67-0a43b5140a37&sid=RAV&sortBy=%22date_posted%22
Bill Gates,Male,2022-04-27,"Earlier this year, I published a book called How to Avoid a Climate Disaster. One of the main reasons I wrote it is that young people are showing so much passion for dealing with climate change. So I’m making a free download of it available for any college or university student, anywhere in the world this week.",15977,957,736,https://www.linkedin.com/search/results/content/?fromMember=%5B%22ACoAAA8BYqEBCGLg_vT_ca6mMEqkpp9nVffJ3hc%22%5D&heroEntityKey=urn%3Ali%3Afsd_profile%3AACoAAA8BYqEBCGLg_vT_ca6mMEqkpp9nVffJ3hc&keywords=bill%20gates&origin=CLUSTER_EXPANSION&position=0&searchId=0bf95569-b297-405a-bf67-0a43b5140a37&sid=RAV&sortBy=%22date_posted%22
Bill Gates,Male,2022-04-27,"2021 was an incredibly hard year for many people, including me, but there are reasons to be optimistic that 2022 will be better.",15444,813,524,https://www.linkedin.com/search/results/content/?fromMember=%5B%22ACoAAA8BYqEBCGLg_vT_ca6mMEqkpp9nVffJ3hc%22%5D&heroEntityKey=urn%3Ali%3Afsd_profile%3AACoAAA8BYqEBCGLg_vT_ca6mMEqkpp9nVffJ3hc&keywords=bill%20gates&origin=CLUSTER_EXPANSION&position=0&searchId=0bf95569-b297-405a-bf67-0a43b5140a37&sid=RAV&sortBy=%22date_posted%22
Bill Gates,Male,2022-04-27,"I know it’s hard to think about the next pandemic as the omicron variant surges around the world, but we have an opportunity to make sure the world never experiences this hardship again.  Bill & Melinda Gates Foundation is joining with Wellcome Trust and each pledging an additional $150M to support CEPI (Coalition for Epidemic Preparedness Innovations)'s future work on COVID and beyond.",15401,"1,078",522,https://www.linkedin.com/search/results/content/?fromMember=%5B%22ACoAAA8BYqEBCGLg_vT_ca6mMEqkpp9nVffJ3hc%22%5D&heroEntityKey=urn%3Ali%3Afsd_profile%3AACoAAA8BYqEBCGLg_vT_ca6mMEqkpp9nVffJ3hc&keywords=bill%20gates&origin=CLUSTER_EXPANSION&position=0&searchId=0bf95569-b297-405a-bf67-0a43b5140a37&sid=RAV&sortBy=%22date_posted%22
Bill Gates,Male,2022-04-27,Each of the writers on my summer book list took a meaty subject and made it compelling without sacrificing any complexity.,15320,346,467,https://www.linkedin.com/search/results/content/?fromMember=%5B%22ACoAAA8BYqEBCGLg_vT_ca6mMEqkpp9nVffJ3hc%22%5D&heroEntityKey=urn%3Ali%3Afsd_profile%3AACoAAA8BYqEBCGLg_vT_ca6mMEqkpp9nVffJ3hc&keywords=bill%20gates&origin=CLUSTER_EXPANSION&position=0&searchId=0bf95569-b297-405a-bf67-0a43b5140a37&sid=RAV&sortBy=%22date_posted%22
Bill Gates,Male,2024-03-27,"I had an incredible four days in India, meeting with political leaders, government officials, scientists, philanthropists, women who are lifting their communities from poverty, and many others. It’s always exciting to see the world-changing ideas and innovations coming out of India—and have some fun in between. Here are a few photos from my trip.",14883,721,302,https://www.linkedin.com/search/results/content/?fromMember=%5B%22ACoAAA8BYqEBCGLg_vT_ca6mMEqkpp9nVffJ3hc%22%5D&heroEntityKey=urn%3Ali%3Afsd_profile%3AACoAAA8BYqEBCGLg_vT_ca6mMEqkpp9nVffJ3hc&keywords=bill%20gates&origin=CLUSTER_EXPANSION&position=0&searchId=0bf95569-b297-405a-bf67-0a43b5140a37&sid=RAV&sortBy=%22date_posted%22
Bill Gates,Male,2023-08-27,"I met an incredible force for change on my trip to India: Kusuma, a remarkable young woman working wonders at her local postal department.India has been a leader in developing digital public infrastructure to accelerate inclusive financial development—enabling branch postmasters, like Kusuma, to use smartphone devices and biometrics to offer banking services to customers across India. She's not just providing integrated financial services; she's delivering hope and financial empowerment to her community.Learn more about the work Kusuma is doing here: https://b-gat.es/3OJlI9L #G20India",13987,243,240,https://www.linkedin.com/search/results/content/?fromMember=%5B%22ACoAAA8BYqEBCGLg_vT_ca6mMEqkpp9nVffJ3hc%22%5D&heroEntityKey=urn%3Ali%3Afsd_profile%3AACoAAA8BYqEBCGLg_vT_ca6mMEqkpp9nVffJ3hc&keywords=bill%20gates&origin=CLUSTER_EXPANSION&position=0&searchId=0bf95569-b297-405a-bf67-0a43b5140a37&sid=RAV&sortBy=%22date_posted%22
Bill Gates,Male,2024-02-27,India’s greatest gift is its ability to innovate. I’m thrilled to be headed back this week to learn about some of the incredible breakthroughs they’ve made.,12880,435,444,https://www.linkedin.com/search/results/content/?fromMember=%5B%22ACoAAA8BYqEBCGLg_vT_ca6mMEqkpp9nVffJ3hc%22%5D&heroEntityKey=urn%3Ali%3Afsd_profile%3AACoAAA8BYqEBCGLg_vT_ca6mMEqkpp9nVffJ3hc&keywords=bill%20gates&origin=CLUSTER_EXPANSION&position=0&searchId=0bf95569-b297-405a-bf67-0a43b5140a37&sid=RAV&sortBy=%22date_posted%22
Bill Gates,Male,2023-04-27,"India plays a crucial role in the world’s fight to improve health, reduce poverty, avoid a climate disaster, and more.",12874,445,541,https://www.linkedin.com/search/results/content/?fromMember=%5B%22ACoAAA8BYqEBCGLg_vT_ca6mMEqkpp9nVffJ3hc%22%5D&heroEntityKey=urn%3Ali%3Afsd_profile%3AACoAAA8BYqEBCGLg_vT_ca6mMEqkpp9nVffJ3hc&keywords=bill%20gates&origin=CLUSTER_EXPANSION&position=0&searchId=0bf95569-b297-405a-bf67-0a43b5140a37&sid=RAV&sortBy=%22date_posted%22
Bill Gates,Male,2023-08-27,"Better water sanitation leads to better health outcomes. The lack of access to toilets endangers people’s lives, creates an economic and health burden for poor communities, and hurts the environment. This World Water Week, I’m hopeful that inventing new toilets will improve people’s lives.",12366,588,425,https://www.linkedin.com/search/results/content/?fromMember=%5B%22ACoAAA8BYqEBCGLg_vT_ca6mMEqkpp9nVffJ3hc%22%5D&heroEntityKey=urn%3Ali%3Afsd_profile%3AACoAAA8BYqEBCGLg_vT_ca6mMEqkpp9nVffJ3hc&keywords=bill%20gates&origin=CLUSTER_EXPANSION&position=0&searchId=0bf95569-b297-405a-bf67-0a43b5140a37&sid=RAV&sortBy=%22date_posted%22
Bill Gates,Male,2022-04-27,"It’s Mosquito Week on Gates Notes. All week, I’m sharing updates from the fight against the world’s deadliest animal, like this story about how Africa’s malaria programs have kept up lifesaving malaria control and treatment efforts despite COVID-19’s disruptions.",12123,795,364,https://www.linkedin.com/search/results/content/?fromMember=%5B%22ACoAAA8BYqEBCGLg_vT_ca6mMEqkpp9nVffJ3hc%22%5D&heroEntityKey=urn%3Ali%3Afsd_profile%3AACoAAA8BYqEBCGLg_vT_ca6mMEqkpp9nVffJ3hc&keywords=bill%20gates&origin=CLUSTER_EXPANSION&position=0&searchId=0bf95569-b297-405a-bf67-0a43b5140a37&sid=RAV&sortBy=%22date_posted%22
Bill Gates,Male,2023-04-27,My message to the class of 2023.,11669,588,607,https://www.linkedin.com/search/results/content/?fromMember=%5B%22ACoAAA8BYqEBCGLg_vT_ca6mMEqkpp9nVffJ3hc%22%5D&heroEntityKey=urn%3Ali%3Afsd_profile%3AACoAAA8BYqEBCGLg_vT_ca6mMEqkpp9nVffJ3hc&keywords=bill%20gates&origin=CLUSTER_EXPANSION&position=0&searchId=0bf95569-b297-405a-bf67-0a43b5140a37&sid=RAV&sortBy=%22date_posted%22
Bill Gates,Male,2021-04-27,"I’ve participated in several virtual events to discuss my new climate book, with a few more to come. At each one, I’ve talked about how we need to transform the entire physical economy so we can stop emitting greenhouse gases by 2050, and at nearly every event, I’ve been asked some version of this question: “What about the people who will lose jobs in this transition?”",11646,795,391,https://www.linkedin.com/search/results/content/?fromMember=%5B%22ACoAAA8BYqEBCGLg_vT_ca6mMEqkpp9nVffJ3hc%22%5D&heroEntityKey=urn%3Ali%3Afsd_profile%3AACoAAA8BYqEBCGLg_vT_ca6mMEqkpp9nVffJ3hc&keywords=bill%20gates&origin=CLUSTER_EXPANSION&position=0&searchId=0bf95569-b297-405a-bf67-0a43b5140a37&sid=RAV&sortBy=%22date_posted%22
Bill Gates,Male,2024-03-27,"It’s always great to join Dax and Monica for an episode of Armchair Expert. They’re two of my favorite people, and this time we got to catch up in one of my favorite places: India. They joined me on my recent trip there, where we talked about remarkable global health progress, what makes the country so vibrant, and how AI can unlock potential in a number of different sectors—in India and around the world. I hope you’ll listen: https://spoti.fi/3ThCvmH",11457,316,113,https://www.linkedin.com/search/results/content/?fromMember=%5B%22ACoAAA8BYqEBCGLg_vT_ca6mMEqkpp9nVffJ3hc%22%5D&heroEntityKey=urn%3Ali%3Afsd_profile%3AACoAAA8BYqEBCGLg_vT_ca6mMEqkpp9nVffJ3hc&keywords=bill%20gates&origin=CLUSTER_EXPANSION&position=0&searchId=0bf95569-b297-405a-bf67-0a43b5140a37&sid=RAV&sortBy=%22date_posted%22
Bill Gates,Male,2024-02-27,"Happy birthday, Leila! You’ve had quite the first year—and I can’t wait to see what you learn, discover, and enjoy in year two.",10972,580,84,https://www.linkedin.com/search/results/content/?fromMember=%5B%22ACoAAA8BYqEBCGLg_vT_ca6mMEqkpp9nVffJ3hc%22%5D&heroEntityKey=urn%3Ali%3Afsd_profile%3AACoAAA8BYqEBCGLg_vT_ca6mMEqkpp9nVffJ3hc&keywords=bill%20gates&origin=CLUSTER_EXPANSION&position=0&searchId=0bf95569-b297-405a-bf67-0a43b5140a37&sid=RAV&sortBy=%22date_posted%22
Bill Gates,Male,2023-04-27,Many people look at the environmental challenges our planet faces and see little reason for hope. But I can’t help feeling optimistic that the world has much of what we need to prevent a climate disaster—and we can invent the things we need but don’t have yet. The Stanford Doerr School of Sustainability is accelerating research to address climate change.,10912,396,384,https://www.linkedin.com/search/results/content/?fromMember=%5B%22ACoAAA8BYqEBCGLg_vT_ca6mMEqkpp9nVffJ3hc%22%5D&heroEntityKey=urn%3Ali%3Afsd_profile%3AACoAAA8BYqEBCGLg_vT_ca6mMEqkpp9nVffJ3hc&keywords=bill%20gates&origin=CLUSTER_EXPANSION&position=0&searchId=0bf95569-b297-405a-bf67-0a43b5140a37&sid=RAV&sortBy=%22date_posted%22
Bill Gates,Male,2023-05-27,"Exactly 50 years ago today, I graduated from Lakeside School. I’m thankful to the school and its teachers for everything they gave me—including the opportunity to learn about computers and programming at a young age. Looking back, it’s incredible just how much my experience there shaped my future.",10461,332,166,https://www.linkedin.com/search/results/content/?fromMember=%5B%22ACoAAA8BYqEBCGLg_vT_ca6mMEqkpp9nVffJ3hc%22%5D&heroEntityKey=urn%3Ali%3Afsd_profile%3AACoAAA8BYqEBCGLg_vT_ca6mMEqkpp9nVffJ3hc&keywords=bill%20gates&origin=CLUSTER_EXPANSION&position=0&searchId=0bf95569-b297-405a-bf67-0a43b5140a37&sid=RAV&sortBy=%22date_posted%22
Bill Gates,Male,2023-11-27,"Imagine if you didn’t need to use different software—or separate apps—to draft a document, make a spreadsheet, or send an email. Imagine if you could, instead, just tell your device in everyday language what you want to do. In the next five years, that’s what you’ll be able to do. This type of software is called an agent. I’ve been thinking about agents for nearly 30 years and wrote about them in my 1995 book The Road Ahead. But they’ve only recently become practical because of advances in #artificialintelligence. Now, it’s clear that agents are not just inevitable—they’re the future of software, and they’re how most people will interact with their phones and computers sooner than many think.",10425,838,822,https://www.linkedin.com/search/results/content/?fromMember=%5B%22ACoAAA8BYqEBCGLg_vT_ca6mMEqkpp9nVffJ3hc%22%5D&heroEntityKey=urn%3Ali%3Afsd_profile%3AACoAAA8BYqEBCGLg_vT_ca6mMEqkpp9nVffJ3hc&keywords=bill%20gates&origin=CLUSTER_EXPANSION&position=0&searchId=0bf95569-b297-405a-bf67-0a43b5140a37&sid=RAV&sortBy=%22date_posted%22
Bill Gates,Male,2023-04-27,"India gives me hope for the future. I’m excited to visit next week and see the work being done by innovators and entrepreneurs to tackle big challenges like climate change, health, and hunger.",10219,632,311,https://www.linkedin.com/search/results/content/?fromMember=%5B%22ACoAAA8BYqEBCGLg_vT_ca6mMEqkpp9nVffJ3hc%22%5D&heroEntityKey=urn%3Ali%3Afsd_profile%3AACoAAA8BYqEBCGLg_vT_ca6mMEqkpp9nVffJ3hc&keywords=bill%20gates&origin=CLUSTER_EXPANSION&position=0&searchId=0bf95569-b297-405a-bf67-0a43b5140a37&sid=RAV&sortBy=%22date_posted%22
Bill Gates,Male,2023-10-27,"Most of the AI tools available today are bots: You ask them questions, and they spit back whatever relevant information is available within a single website or app. But imagine if, instead, the thing you were communicating with could contextualize your request, remember your preferences, and accomplish tasks across apps. That’s an agent—and this type of AI tool is not far off. https://lnkd.in/g2X4hAaw #artificialintelligence",10154,619,"1,387",https://www.linkedin.com/search/results/content/?fromMember=%5B%22ACoAAA8BYqEBCGLg_vT_ca6mMEqkpp9nVffJ3hc%22%5D&heroEntityKey=urn%3Ali%3Afsd_profile%3AACoAAA8BYqEBCGLg_vT_ca6mMEqkpp9nVffJ3hc&keywords=bill%20gates&origin=CLUSTER_EXPANSION&position=0&searchId=0bf95569-b297-405a-bf67-0a43b5140a37&sid=RAV&sortBy=%22date_posted%22
Bill Gates,Male,2022-04-27,"Over the past two decades, The Gates Cambridge Scholarship has reached more than 2,000 students from 111 different countries. We couldn’t be prouder of the difference they’re making, and the leaders they have become.",10109,545,263,https://www.linkedin.com/search/results/content/?fromMember=%5B%22ACoAAA8BYqEBCGLg_vT_ca6mMEqkpp9nVffJ3hc%22%5D&heroEntityKey=urn%3Ali%3Afsd_profile%3AACoAAA8BYqEBCGLg_vT_ca6mMEqkpp9nVffJ3hc&keywords=bill%20gates&origin=CLUSTER_EXPANSION&position=0&searchId=0bf95569-b297-405a-bf67-0a43b5140a37&sid=RAV&sortBy=%22date_posted%22
Bill Gates,Male,2023-08-27,"Happy birthday to the Oracle of Omaha and my dear friend, Warren Buffett. What an incredible 93-year ride it’s been so far!",9976,500,276,https://www.linkedin.com/search/results/content/?fromMember=%5B%22ACoAAA8BYqEBCGLg_vT_ca6mMEqkpp9nVffJ3hc%22%5D&heroEntityKey=urn%3Ali%3Afsd_profile%3AACoAAA8BYqEBCGLg_vT_ca6mMEqkpp9nVffJ3hc&keywords=bill%20gates&origin=CLUSTER_EXPANSION&position=0&searchId=0bf95569-b297-405a-bf67-0a43b5140a37&sid=RAV&sortBy=%22date_posted%22
Bill Gates,Male,2024-01-27,"I’m lucky to call Sam Altman a friend—but he’s also the person I call when I have questions about the future of AI. For the latest episode of Unconfuse Me, we sat down to talk about where the technology is headed and how it can help us solve big problems.",9873,316,573,https://www.linkedin.com/search/results/content/?fromMember=%5B%22ACoAAA8BYqEBCGLg_vT_ca6mMEqkpp9nVffJ3hc%22%5D&heroEntityKey=urn%3Ali%3Afsd_profile%3AACoAAA8BYqEBCGLg_vT_ca6mMEqkpp9nVffJ3hc&keywords=bill%20gates&origin=CLUSTER_EXPANSION&position=0&searchId=0bf95569-b297-405a-bf67-0a43b5140a37&sid=RAV&sortBy=%22date_posted%22
Bill Gates,Male,2023-09-27,"We haven't made the progress we hoped to on the SDGs. But being in New York last week was a good reminder that as big as these challenges are, they’re no match for the intelligence and energy of the people trying to solve them.",9805,285,170,https://www.linkedin.com/search/results/content/?fromMember=%5B%22ACoAAA8BYqEBCGLg_vT_ca6mMEqkpp9nVffJ3hc%22%5D&heroEntityKey=urn%3Ali%3Afsd_profile%3AACoAAA8BYqEBCGLg_vT_ca6mMEqkpp9nVffJ3hc&keywords=bill%20gates&origin=CLUSTER_EXPANSION&position=0&searchId=0bf95569-b297-405a-bf67-0a43b5140a37&sid=RAV&sortBy=%22date_posted%22
