Author,Gender,Date,Post Text,Likes,Comments,Shares,Page Link
Bill Gates,Male,2024-02-27,"The world is close to eradicating Guinea worm disease thanks to heroes like Makoy Samuel Yibi. As national director of South Sudan’s Guinea Worm Eradication Program, he and his team are determined to root out every last case until no one else has to suffer from this painful disease. The work he has done with The Carter Center helped reduce the number of cases in South Sudan from 20,000 in 2006 to just two last year.",1971,205,63,https://www.linkedin.com/search/results/content/?fromMember=%5B%22ACoAAA8BYqEBCGLg_vT_ca6mMEqkpp9nVffJ3hc%22%5D&heroEntityKey=urn%3Ali%3Afsd_profile%3AACoAAA8BYqEBCGLg_vT_ca6mMEqkpp9nVffJ3hc&keywords=bill%20gates&origin=CLUSTER_EXPANSION&position=0&searchId=0bf95569-b297-405a-bf67-0a43b5140a37&sid=RAV&sortBy=%22date_posted%22
Bill Gates,Male,2023-07-27,I had a great time getting unconfused with Seth Rogen and Lauren Miller Rogen. Unconfuse Me is now available wherever you get your podcasts: https://lnkd.in/gzX7ShYc,1963,84,127,https://www.linkedin.com/search/results/content/?fromMember=%5B%22ACoAAA8BYqEBCGLg_vT_ca6mMEqkpp9nVffJ3hc%22%5D&heroEntityKey=urn%3Ali%3Afsd_profile%3AACoAAA8BYqEBCGLg_vT_ca6mMEqkpp9nVffJ3hc&keywords=bill%20gates&origin=CLUSTER_EXPANSION&position=0&searchId=0bf95569-b297-405a-bf67-0a43b5140a37&sid=RAV&sortBy=%22date_posted%22
Bill Gates,Male,2023-07-27,"For the first episode of my new podcast, I sat down with Seth Rogen and Lauren Miller Rogen, the founders of HFC, which uses humor to raise awareness of an issue that is anything but funny: Alzheimer’s disease. We had a great conversation about their organization, hope for the future of Alzheimer’s research, the importance of a good night’s sleep, and why Seth started a cannabis lifestyle company. You can listen now on your favorite podcast platform.",1939,290,151,https://www.linkedin.com/search/results/content/?fromMember=%5B%22ACoAAA8BYqEBCGLg_vT_ca6mMEqkpp9nVffJ3hc%22%5D&heroEntityKey=urn%3Ali%3Afsd_profile%3AACoAAA8BYqEBCGLg_vT_ca6mMEqkpp9nVffJ3hc&keywords=bill%20gates&origin=CLUSTER_EXPANSION&position=0&searchId=0bf95569-b297-405a-bf67-0a43b5140a37&sid=RAV&sortBy=%22date_posted%22
Bill Gates,Male,2024-01-27,I’m thrilled about this collaboration—and I’m hopeful it will lead to even more progress in the fight against Alzheimer’s.,1938,139,69,https://www.linkedin.com/search/results/content/?fromMember=%5B%22ACoAAA8BYqEBCGLg_vT_ca6mMEqkpp9nVffJ3hc%22%5D&heroEntityKey=urn%3Ali%3Afsd_profile%3AACoAAA8BYqEBCGLg_vT_ca6mMEqkpp9nVffJ3hc&keywords=bill%20gates&origin=CLUSTER_EXPANSION&position=0&searchId=0bf95569-b297-405a-bf67-0a43b5140a37&sid=RAV&sortBy=%22date_posted%22
Bill Gates,Male,2023-05-27,"I have read a lot about Africa, but “Born in Blackness” still taught me so much I didn’t know: https://lnkd.in/gRzCkEZz",1931,84,73,https://www.linkedin.com/search/results/content/?fromMember=%5B%22ACoAAA8BYqEBCGLg_vT_ca6mMEqkpp9nVffJ3hc%22%5D&heroEntityKey=urn%3Ali%3Afsd_profile%3AACoAAA8BYqEBCGLg_vT_ca6mMEqkpp9nVffJ3hc&keywords=bill%20gates&origin=CLUSTER_EXPANSION&position=0&searchId=0bf95569-b297-405a-bf67-0a43b5140a37&sid=RAV&sortBy=%22date_posted%22
Bill Gates,Male,2023-11-27,"Cars and power plants get the most attention, but carbon emissions come from a wide range of human activities. The good news is that we’re making progress on reducing them in each slice of the pie. You can get a full breakdown in the latest State of the Transition report from Breakthrough Energy.",1881,172,132,https://www.linkedin.com/search/results/content/?fromMember=%5B%22ACoAAA8BYqEBCGLg_vT_ca6mMEqkpp9nVffJ3hc%22%5D&heroEntityKey=urn%3Ali%3Afsd_profile%3AACoAAA8BYqEBCGLg_vT_ca6mMEqkpp9nVffJ3hc&keywords=bill%20gates&origin=CLUSTER_EXPANSION&position=0&searchId=0bf95569-b297-405a-bf67-0a43b5140a37&sid=RAV&sortBy=%22date_posted%22
Bill Gates,Male,2024-03-27,The most unexpected connections can lead to incredible progress—and make the world a better place.,1866,154,115,https://www.linkedin.com/search/results/content/?fromMember=%5B%22ACoAAA8BYqEBCGLg_vT_ca6mMEqkpp9nVffJ3hc%22%5D&heroEntityKey=urn%3Ali%3Afsd_profile%3AACoAAA8BYqEBCGLg_vT_ca6mMEqkpp9nVffJ3hc&keywords=bill%20gates&origin=CLUSTER_EXPANSION&position=0&searchId=0bf95569-b297-405a-bf67-0a43b5140a37&sid=RAV&sortBy=%22date_posted%22
Bill Gates,Male,2024-01-27,Nuclear power will play an important role in meeting the world’s growing need for energy while eliminating carbon emissions. So I enjoyed this story on all the recent progress that’s been made at Lawrence Livermore National Laboratory.,1863,264,109,https://www.linkedin.com/search/results/content/?fromMember=%5B%22ACoAAA8BYqEBCGLg_vT_ca6mMEqkpp9nVffJ3hc%22%5D&heroEntityKey=urn%3Ali%3Afsd_profile%3AACoAAA8BYqEBCGLg_vT_ca6mMEqkpp9nVffJ3hc&keywords=bill%20gates&origin=CLUSTER_EXPANSION&position=0&searchId=0bf95569-b297-405a-bf67-0a43b5140a37&sid=RAV&sortBy=%22date_posted%22
Bill Gates,Male,2023-09-27,Here’s a look back at some of my favorite moments of Unconfuse Me so far. https://b-gat.es/4669v6C #InternationalPodcastDay,1860,148,84,https://www.linkedin.com/search/results/content/?fromMember=%5B%22ACoAAA8BYqEBCGLg_vT_ca6mMEqkpp9nVffJ3hc%22%5D&heroEntityKey=urn%3Ali%3Afsd_profile%3AACoAAA8BYqEBCGLg_vT_ca6mMEqkpp9nVffJ3hc&keywords=bill%20gates&origin=CLUSTER_EXPANSION&position=0&searchId=0bf95569-b297-405a-bf67-0a43b5140a37&sid=RAV&sortBy=%22date_posted%22
Bill Gates,Male,2023-11-27,"Climate change is one of the biggest challenges humanity has ever faced—but we have the human ingenuity to address it. This weekend, I got an update on some of the remarkable work being done by companies we’re supporting at Breakthrough Energy to develop and scale emerging climate technologies.",1858,132,64,https://www.linkedin.com/search/results/content/?fromMember=%5B%22ACoAAA8BYqEBCGLg_vT_ca6mMEqkpp9nVffJ3hc%22%5D&heroEntityKey=urn%3Ali%3Afsd_profile%3AACoAAA8BYqEBCGLg_vT_ca6mMEqkpp9nVffJ3hc&keywords=bill%20gates&origin=CLUSTER_EXPANSION&position=0&searchId=0bf95569-b297-405a-bf67-0a43b5140a37&sid=RAV&sortBy=%22date_posted%22
Bill Gates,Male,2023-08-27,"This back-to-school season, I’m thinking about Dana Miles and her thoughtful, compassionate, and practical approach to teaching.",1847,94,91,https://www.linkedin.com/search/results/content/?fromMember=%5B%22ACoAAA8BYqEBCGLg_vT_ca6mMEqkpp9nVffJ3hc%22%5D&heroEntityKey=urn%3Ali%3Afsd_profile%3AACoAAA8BYqEBCGLg_vT_ca6mMEqkpp9nVffJ3hc&keywords=bill%20gates&origin=CLUSTER_EXPANSION&position=0&searchId=0bf95569-b297-405a-bf67-0a43b5140a37&sid=RAV&sortBy=%22date_posted%22
Bill Gates,Male,2024-02-27,The College Success Foundation does fantastic work to help students in Washington state enroll in college. I’m excited to see the results of their expanded model.,1832,159,114,https://www.linkedin.com/search/results/content/?fromMember=%5B%22ACoAAA8BYqEBCGLg_vT_ca6mMEqkpp9nVffJ3hc%22%5D&heroEntityKey=urn%3Ali%3Afsd_profile%3AACoAAA8BYqEBCGLg_vT_ca6mMEqkpp9nVffJ3hc&keywords=bill%20gates&origin=CLUSTER_EXPANSION&position=0&searchId=0bf95569-b297-405a-bf67-0a43b5140a37&sid=RAV&sortBy=%22date_posted%22
Bill Gates,Male,2023-08-27,"We’re much further along than I would have predicted a few years ago in getting companies to invest in zero-carbon breakthroughs: https://lnkd.in/gMS3e9Y2Getting to zero will be the hardest thing humans have ever done. We need to revolutionize the entire physical economy—how we make things, move around, produce electricity, grow food, and stay warm and cool—by 2050. We have accomplished hard feats before, and I’m optimistic we’ll be able to do it again.",1827,164,123,https://www.linkedin.com/search/results/content/?fromMember=%5B%22ACoAAA8BYqEBCGLg_vT_ca6mMEqkpp9nVffJ3hc%22%5D&heroEntityKey=urn%3Ali%3Afsd_profile%3AACoAAA8BYqEBCGLg_vT_ca6mMEqkpp9nVffJ3hc&keywords=bill%20gates&origin=CLUSTER_EXPANSION&position=0&searchId=0bf95569-b297-405a-bf67-0a43b5140a37&sid=RAV&sortBy=%22date_posted%22
Bill Gates,Male,2024-01-27,"One of the most exciting parts of philanthropy is the ability it gives us to adapt quickly, take risks, and accelerate progress. The Skoll Foundation does this every day by collaborating with countries and communities to help them meet their goals—and make a difference in the world.",1817,151,97,https://www.linkedin.com/search/results/content/?fromMember=%5B%22ACoAAA8BYqEBCGLg_vT_ca6mMEqkpp9nVffJ3hc%22%5D&heroEntityKey=urn%3Ali%3Afsd_profile%3AACoAAA8BYqEBCGLg_vT_ca6mMEqkpp9nVffJ3hc&keywords=bill%20gates&origin=CLUSTER_EXPANSION&position=0&searchId=0bf95569-b297-405a-bf67-0a43b5140a37&sid=RAV&sortBy=%22date_posted%22
Bill Gates,Male,2023-09-27,"My journey into climate action started with a simple question, ""Where are all the lights?"" during my travels in sub-Saharan Africa. At Breakthrough Energy we believe innovation is key to making clean technologies affordable to everyone—solving climate change and making sure we do it equitably.",1816,176,84,https://www.linkedin.com/search/results/content/?fromMember=%5B%22ACoAAA8BYqEBCGLg_vT_ca6mMEqkpp9nVffJ3hc%22%5D&heroEntityKey=urn%3Ali%3Afsd_profile%3AACoAAA8BYqEBCGLg_vT_ca6mMEqkpp9nVffJ3hc&keywords=bill%20gates&origin=CLUSTER_EXPANSION&position=0&searchId=0bf95569-b297-405a-bf67-0a43b5140a37&sid=RAV&sortBy=%22date_posted%22
Bill Gates,Male,2023-12-27,"As Siddhartha Mukherjee explains in his latest book, we are just starting to grasp how cells interact with one another. The world of medicine moves very quickly, and The Song of the Cell will help you appreciate just how far we’ve come to achieve each breakthrough.",1810,149,93,https://www.linkedin.com/search/results/content/?fromMember=%5B%22ACoAAA8BYqEBCGLg_vT_ca6mMEqkpp9nVffJ3hc%22%5D&heroEntityKey=urn%3Ali%3Afsd_profile%3AACoAAA8BYqEBCGLg_vT_ca6mMEqkpp9nVffJ3hc&keywords=bill%20gates&origin=CLUSTER_EXPANSION&position=0&searchId=0bf95569-b297-405a-bf67-0a43b5140a37&sid=RAV&sortBy=%22date_posted%22
Bill Gates,Male,2023-05-27,"I’m fascinated by coalitions: how difficult they are to build, how complicated they are to maintain, and how easily they can break. I know from experience—in business, climate, health, and education—how necessary they are to creating any sort of change that lasts. So after watching one episode of the Danish drama Borgen, which follows the journey of the country’s (fictional) first female prime minister and her coalition government, I was hooked.",1797,125,71,https://www.linkedin.com/search/results/content/?fromMember=%5B%22ACoAAA8BYqEBCGLg_vT_ca6mMEqkpp9nVffJ3hc%22%5D&heroEntityKey=urn%3Ali%3Afsd_profile%3AACoAAA8BYqEBCGLg_vT_ca6mMEqkpp9nVffJ3hc&keywords=bill%20gates&origin=CLUSTER_EXPANSION&position=0&searchId=0bf95569-b297-405a-bf67-0a43b5140a37&sid=RAV&sortBy=%22date_posted%22
Bill Gates,Male,2023-11-27,"Since the first COP meeting in 2015, I’ve seen brilliant innovations continue to get us closer to a net-zero future. At COP28 this year, I’m hopeful that together, we can tackle every area of emissions: https://lnkd.in/gkWWMfq3",1795,152,136,https://www.linkedin.com/search/results/content/?fromMember=%5B%22ACoAAA8BYqEBCGLg_vT_ca6mMEqkpp9nVffJ3hc%22%5D&heroEntityKey=urn%3Ali%3Afsd_profile%3AACoAAA8BYqEBCGLg_vT_ca6mMEqkpp9nVffJ3hc&keywords=bill%20gates&origin=CLUSTER_EXPANSION&position=0&searchId=0bf95569-b297-405a-bf67-0a43b5140a37&sid=RAV&sortBy=%22date_posted%22
Bill Gates,Male,2023-07-27,"Dana Miles, the 2023 Washington State Teacher of the Year, encourages hearing people to learn some basic ASL signs to help them communicate with the Deaf community. I asked Dana if she could teach me a couple, and she was kind enough to say yes. I have a long way to go before I’m fluent, but I’m glad that I now know some key phrases.",1787,125,116,https://www.linkedin.com/search/results/content/?fromMember=%5B%22ACoAAA8BYqEBCGLg_vT_ca6mMEqkpp9nVffJ3hc%22%5D&heroEntityKey=urn%3Ali%3Afsd_profile%3AACoAAA8BYqEBCGLg_vT_ca6mMEqkpp9nVffJ3hc&keywords=bill%20gates&origin=CLUSTER_EXPANSION&position=0&searchId=0bf95569-b297-405a-bf67-0a43b5140a37&sid=RAV&sortBy=%22date_posted%22
Bill Gates,Male,2023-05-27,"CubicPV Inc. is on the leading edge of solar tech. Frank’s team is creating a new kind of solar panel that draws more energy from the sun. You can watch him explain the technology, which is called “tandem solar,” here.",1787,96,87,https://www.linkedin.com/search/results/content/?fromMember=%5B%22ACoAAA8BYqEBCGLg_vT_ca6mMEqkpp9nVffJ3hc%22%5D&heroEntityKey=urn%3Ali%3Afsd_profile%3AACoAAA8BYqEBCGLg_vT_ca6mMEqkpp9nVffJ3hc&keywords=bill%20gates&origin=CLUSTER_EXPANSION&position=0&searchId=0bf95569-b297-405a-bf67-0a43b5140a37&sid=RAV&sortBy=%22date_posted%22
Bill Gates,Male,2023-11-27,The time to make big bets on climate innovation is now: https://b-gat.es/3T35ADO,1784,192,85,https://www.linkedin.com/search/results/content/?fromMember=%5B%22ACoAAA8BYqEBCGLg_vT_ca6mMEqkpp9nVffJ3hc%22%5D&heroEntityKey=urn%3Ali%3Afsd_profile%3AACoAAA8BYqEBCGLg_vT_ca6mMEqkpp9nVffJ3hc&keywords=bill%20gates&origin=CLUSTER_EXPANSION&position=0&searchId=0bf95569-b297-405a-bf67-0a43b5140a37&sid=RAV&sortBy=%22date_posted%22
Bill Gates,Male,2023-07-27,This is a great example of the ways AI can be used to improve the working conditions—and effectiveness—of healthcare professionals.,1770,130,142,https://www.linkedin.com/search/results/content/?fromMember=%5B%22ACoAAA8BYqEBCGLg_vT_ca6mMEqkpp9nVffJ3hc%22%5D&heroEntityKey=urn%3Ali%3Afsd_profile%3AACoAAA8BYqEBCGLg_vT_ca6mMEqkpp9nVffJ3hc&keywords=bill%20gates&origin=CLUSTER_EXPANSION&position=0&searchId=0bf95569-b297-405a-bf67-0a43b5140a37&sid=RAV&sortBy=%22date_posted%22
Bill Gates,Male,2023-07-27,The second episode of my new podcast is out now! Join me as I get unconfused about how artificial intelligence will transform education.,1766,105,142,https://www.linkedin.com/search/results/content/?fromMember=%5B%22ACoAAA8BYqEBCGLg_vT_ca6mMEqkpp9nVffJ3hc%22%5D&heroEntityKey=urn%3Ali%3Afsd_profile%3AACoAAA8BYqEBCGLg_vT_ca6mMEqkpp9nVffJ3hc&keywords=bill%20gates&origin=CLUSTER_EXPANSION&position=0&searchId=0bf95569-b297-405a-bf67-0a43b5140a37&sid=RAV&sortBy=%22date_posted%22
Bill Gates,Male,2024-04-06,"From 1990 to 2019, childhood deaths fell by ◾ 90% from measles◾ 70% from pneumonia and diarrhea◾ 36% from malariaHere is how we make sure those numbers keep rising—and child mortality keeps falling: https://lnkd.in/gQdXMjAc",1761,183,73,https://www.linkedin.com/search/results/content/?fromMember=%5B%22ACoAAA8BYqEBCGLg_vT_ca6mMEqkpp9nVffJ3hc%22%5D&heroEntityKey=urn%3Ali%3Afsd_profile%3AACoAAA8BYqEBCGLg_vT_ca6mMEqkpp9nVffJ3hc&keywords=bill%20gates&origin=CLUSTER_EXPANSION&position=0&searchId=0bf95569-b297-405a-bf67-0a43b5140a37&sid=RAV&sortBy=%22date_posted%22
Bill Gates,Male,2024-01-27,Wordle is still a daily ritual for me. It’s very cool to see how people are adapting it for other writing systems!,1758,144,78,https://www.linkedin.com/search/results/content/?fromMember=%5B%22ACoAAA8BYqEBCGLg_vT_ca6mMEqkpp9nVffJ3hc%22%5D&heroEntityKey=urn%3Ali%3Afsd_profile%3AACoAAA8BYqEBCGLg_vT_ca6mMEqkpp9nVffJ3hc&keywords=bill%20gates&origin=CLUSTER_EXPANSION&position=0&searchId=0bf95569-b297-405a-bf67-0a43b5140a37&sid=RAV&sortBy=%22date_posted%22
Bill Gates,Male,2023-08-27,"Mosquitoes have rapidly evolved. By studying their genomes, researchers have learned they developed resistance to insecticides.You can check your answer here: https://lnkd.in/gjCieuc2",1747,471,43,https://www.linkedin.com/search/results/content/?fromMember=%5B%22ACoAAA8BYqEBCGLg_vT_ca6mMEqkpp9nVffJ3hc%22%5D&heroEntityKey=urn%3Ali%3Afsd_profile%3AACoAAA8BYqEBCGLg_vT_ca6mMEqkpp9nVffJ3hc&keywords=bill%20gates&origin=CLUSTER_EXPANSION&position=0&searchId=0bf95569-b297-405a-bf67-0a43b5140a37&sid=RAV&sortBy=%22date_posted%22
Bill Gates,Male,2023-10-27,"20 years ago, we took a big bet and launched the #GrandChallenges initiative to focus attention, resources, and scientific capacity on solving key health and development problems around the world. What started as a single initiative largely funded by our foundation has become a network of independent but interconnected R&D projects. From reinvented toilets to cutting-edge maternal health tools, the Grand Challenges model is a testament to what’s possible when the scientific community comes together, takes risks, and never stops working on the next big breakthrough. With urgent work left to do, the global health community must double-down on its commitment to innovation. It’ll take new collaborations and more funding for global health R&D to create a world in which all people lead healthy lives—and it’s a challenge we need to meet together.",1746,146,64,https://www.linkedin.com/search/results/content/?fromMember=%5B%22ACoAAA8BYqEBCGLg_vT_ca6mMEqkpp9nVffJ3hc%22%5D&heroEntityKey=urn%3Ali%3Afsd_profile%3AACoAAA8BYqEBCGLg_vT_ca6mMEqkpp9nVffJ3hc&keywords=bill%20gates&origin=CLUSTER_EXPANSION&position=0&searchId=0bf95569-b297-405a-bf67-0a43b5140a37&sid=RAV&sortBy=%22date_posted%22
Bill Gates,Male,2024-01-27,"A few years ago, I tasted fonio with Chef Pierre Thiam. His commitment to preserving food culture and supporting climate-smart foods is inspiring.",1729,156,67,https://www.linkedin.com/search/results/content/?fromMember=%5B%22ACoAAA8BYqEBCGLg_vT_ca6mMEqkpp9nVffJ3hc%22%5D&heroEntityKey=urn%3Ali%3Afsd_profile%3AACoAAA8BYqEBCGLg_vT_ca6mMEqkpp9nVffJ3hc&keywords=bill%20gates&origin=CLUSTER_EXPANSION&position=0&searchId=0bf95569-b297-405a-bf67-0a43b5140a37&sid=RAV&sortBy=%22date_posted%22
Bill Gates,Male,2023-07-27,"Kids deserve to learn in classrooms stocked with the supplies they need to succeed. That’s why this back-to-school season, every project on DonorsChoose will be getting a 50% match from the Bill & Melinda Gates Foundation (up to $2M). If you’re an educator in a public school, post a project by August 2nd!",1724,161,141,https://www.linkedin.com/search/results/content/?fromMember=%5B%22ACoAAA8BYqEBCGLg_vT_ca6mMEqkpp9nVffJ3hc%22%5D&heroEntityKey=urn%3Ali%3Afsd_profile%3AACoAAA8BYqEBCGLg_vT_ca6mMEqkpp9nVffJ3hc&keywords=bill%20gates&origin=CLUSTER_EXPANSION&position=0&searchId=0bf95569-b297-405a-bf67-0a43b5140a37&sid=RAV&sortBy=%22date_posted%22
Bill Gates,Male,2023-04-27,Capria’s Fund II is creating opportunities for the next generation of entrepreneurs in the Global South.,1689,125,189,https://www.linkedin.com/search/results/content/?fromMember=%5B%22ACoAAA8BYqEBCGLg_vT_ca6mMEqkpp9nVffJ3hc%22%5D&heroEntityKey=urn%3Ali%3Afsd_profile%3AACoAAA8BYqEBCGLg_vT_ca6mMEqkpp9nVffJ3hc&keywords=bill%20gates&origin=CLUSTER_EXPANSION&position=0&searchId=0bf95569-b297-405a-bf67-0a43b5140a37&sid=RAV&sortBy=%22date_posted%22
Bill Gates,Male,2023-07-27,"Long before anyone was talking about climate change, Eunice Newton Foote discovered the greenhouse effect in 1856. Her contributions to science have had a lasting impact.",1687,80,108,https://www.linkedin.com/search/results/content/?fromMember=%5B%22ACoAAA8BYqEBCGLg_vT_ca6mMEqkpp9nVffJ3hc%22%5D&heroEntityKey=urn%3Ali%3Afsd_profile%3AACoAAA8BYqEBCGLg_vT_ca6mMEqkpp9nVffJ3hc&keywords=bill%20gates&origin=CLUSTER_EXPANSION&position=0&searchId=0bf95569-b297-405a-bf67-0a43b5140a37&sid=RAV&sortBy=%22date_posted%22
Bill Gates,Male,2023-11-27,"In his new book, Vaclav Smil challenges the notion that we live in an unrivaled era of innovation by shining a spotlight on 1867-1914—a period when inventors created internal combustion engines, electric lights, the telephone, plastics, and more, and when humanity gained revolutionary insights in the fields of infectious disease, medicine, agriculture, and nutrition.",1672,154,122,https://www.linkedin.com/search/results/content/?fromMember=%5B%22ACoAAA8BYqEBCGLg_vT_ca6mMEqkpp9nVffJ3hc%22%5D&heroEntityKey=urn%3Ali%3Afsd_profile%3AACoAAA8BYqEBCGLg_vT_ca6mMEqkpp9nVffJ3hc&keywords=bill%20gates&origin=CLUSTER_EXPANSION&position=0&searchId=0bf95569-b297-405a-bf67-0a43b5140a37&sid=RAV&sortBy=%22date_posted%22
Bill Gates,Male,2023-12-27,"The Gates Foundation is committing over $100 million to increase opportunities for economic mobility for 50 million people living in poverty in the U.S.I’m excited about the impact this will have on improving job quality for workers earning low wages, removing barriers to safety net benefits for people in need, and providing local decision-makers with tools to improve opportunity in their own communities.",1667,204,65,https://www.linkedin.com/search/results/content/?fromMember=%5B%22ACoAAA8BYqEBCGLg_vT_ca6mMEqkpp9nVffJ3hc%22%5D&heroEntityKey=urn%3Ali%3Afsd_profile%3AACoAAA8BYqEBCGLg_vT_ca6mMEqkpp9nVffJ3hc&keywords=bill%20gates&origin=CLUSTER_EXPANSION&position=0&searchId=0bf95569-b297-405a-bf67-0a43b5140a37&sid=RAV&sortBy=%22date_posted%22
Bill Gates,Male,2023-09-27,I'm in awe of the people I get to work with. They don’t just imagine what a better world would look like—they're creating the climate innovations that will usher that world in.,1650,148,72,https://www.linkedin.com/search/results/content/?fromMember=%5B%22ACoAAA8BYqEBCGLg_vT_ca6mMEqkpp9nVffJ3hc%22%5D&heroEntityKey=urn%3Ali%3Afsd_profile%3AACoAAA8BYqEBCGLg_vT_ca6mMEqkpp9nVffJ3hc&keywords=bill%20gates&origin=CLUSTER_EXPANSION&position=0&searchId=0bf95569-b297-405a-bf67-0a43b5140a37&sid=RAV&sortBy=%22date_posted%22
Bill Gates,Male,2023-07-27,"To achieve the world’s climate goals, we need all the tools in the tool kit. Direct Air Capture (DAC) is one of those critical tools, making today’s DOE announcement a major milestone. This piece by Jack Andreasen from Breakthrough Energy is a great explainer on DAC and why we’ll need it alongside the clean energy transition.",1644,149,147,https://www.linkedin.com/search/results/content/?fromMember=%5B%22ACoAAA8BYqEBCGLg_vT_ca6mMEqkpp9nVffJ3hc%22%5D&heroEntityKey=urn%3Ali%3Afsd_profile%3AACoAAA8BYqEBCGLg_vT_ca6mMEqkpp9nVffJ3hc&keywords=bill%20gates&origin=CLUSTER_EXPANSION&position=0&searchId=0bf95569-b297-405a-bf67-0a43b5140a37&sid=RAV&sortBy=%22date_posted%22
Bill Gates,Male,2024-03-27,I bet my answer will surprise you: https://lnkd.in/gHgkm5zF,1637,374,50,https://www.linkedin.com/search/results/content/?fromMember=%5B%22ACoAAA8BYqEBCGLg_vT_ca6mMEqkpp9nVffJ3hc%22%5D&heroEntityKey=urn%3Ali%3Afsd_profile%3AACoAAA8BYqEBCGLg_vT_ca6mMEqkpp9nVffJ3hc&keywords=bill%20gates&origin=CLUSTER_EXPANSION&position=0&searchId=0bf95569-b297-405a-bf67-0a43b5140a37&sid=RAV&sortBy=%22date_posted%22
Bill Gates,Male,2023-11-27,"It was an inspiring weekend at COP28. Climate change is one of the biggest challenges humanity has ever faced—but with human ingenuity and innovation, we can avoid a climate disaster.",1616,175,54,https://www.linkedin.com/search/results/content/?fromMember=%5B%22ACoAAA8BYqEBCGLg_vT_ca6mMEqkpp9nVffJ3hc%22%5D&heroEntityKey=urn%3Ali%3Afsd_profile%3AACoAAA8BYqEBCGLg_vT_ca6mMEqkpp9nVffJ3hc&keywords=bill%20gates&origin=CLUSTER_EXPANSION&position=0&searchId=0bf95569-b297-405a-bf67-0a43b5140a37&sid=RAV&sortBy=%22date_posted%22
Bill Gates,Male,2023-11-27,"Our focus at COP28 in Dubai should be on innovating for the most vulnerable, making clean energy more accessible, and fighting disease and poverty. I'm eager to discuss how we can avoid a climate disaster and improve life for people now and in the future.",1597,185,81,https://www.linkedin.com/search/results/content/?fromMember=%5B%22ACoAAA8BYqEBCGLg_vT_ca6mMEqkpp9nVffJ3hc%22%5D&heroEntityKey=urn%3Ali%3Afsd_profile%3AACoAAA8BYqEBCGLg_vT_ca6mMEqkpp9nVffJ3hc&keywords=bill%20gates&origin=CLUSTER_EXPANSION&position=0&searchId=0bf95569-b297-405a-bf67-0a43b5140a37&sid=RAV&sortBy=%22date_posted%22
Bill Gates,Male,2023-11-27,"It’s not too soon for holiday music, right?",1577,192,59,https://www.linkedin.com/search/results/content/?fromMember=%5B%22ACoAAA8BYqEBCGLg_vT_ca6mMEqkpp9nVffJ3hc%22%5D&heroEntityKey=urn%3Ali%3Afsd_profile%3AACoAAA8BYqEBCGLg_vT_ca6mMEqkpp9nVffJ3hc&keywords=bill%20gates&origin=CLUSTER_EXPANSION&position=0&searchId=0bf95569-b297-405a-bf67-0a43b5140a37&sid=RAV&sortBy=%22date_posted%22
Bill Gates,Male,2023-05-27,"I recently had a chance to celebrate the hard work of Northern Arizona University’s class of 2023. It got me thinking about one of my favorite commencement speeches I’ve heard, and learned from, over the years. https://b-gat.es/42rpaLb",1559,64,74,https://www.linkedin.com/search/results/content/?fromMember=%5B%22ACoAAA8BYqEBCGLg_vT_ca6mMEqkpp9nVffJ3hc%22%5D&heroEntityKey=urn%3Ali%3Afsd_profile%3AACoAAA8BYqEBCGLg_vT_ca6mMEqkpp9nVffJ3hc&keywords=bill%20gates&origin=CLUSTER_EXPANSION&position=0&searchId=0bf95569-b297-405a-bf67-0a43b5140a37&sid=RAV&sortBy=%22date_posted%22
Bill Gates,Male,2024-01-27,A great new report from World Economic Forum found that every $1 invested in women’s health unlocks $3 in economic growth globally—yet another reason we need to keep working together and innovating on women’s health.,1548,227,86,https://www.linkedin.com/search/results/content/?fromMember=%5B%22ACoAAA8BYqEBCGLg_vT_ca6mMEqkpp9nVffJ3hc%22%5D&heroEntityKey=urn%3Ali%3Afsd_profile%3AACoAAA8BYqEBCGLg_vT_ca6mMEqkpp9nVffJ3hc&keywords=bill%20gates&origin=CLUSTER_EXPANSION&position=0&searchId=0bf95569-b297-405a-bf67-0a43b5140a37&sid=RAV&sortBy=%22date_posted%22
Bill Gates,Male,2023-12-27,"The people of Kemmerer, Wyoming are at the forefront of the transition to a clean, safe energy future. It’s great to partner with them on this exciting project.",1545,152,51,https://www.linkedin.com/search/results/content/?fromMember=%5B%22ACoAAA8BYqEBCGLg_vT_ca6mMEqkpp9nVffJ3hc%22%5D&heroEntityKey=urn%3Ali%3Afsd_profile%3AACoAAA8BYqEBCGLg_vT_ca6mMEqkpp9nVffJ3hc&keywords=bill%20gates&origin=CLUSTER_EXPANSION&position=0&searchId=0bf95569-b297-405a-bf67-0a43b5140a37&sid=RAV&sortBy=%22date_posted%22
