Author,Gender,Date,Post Text,Likes,Comments,Shares,Page Link
Ira Zlotowitz,Male,2024-04-06,Like it? I love this one!,36,3,3,https://www.linkedin.com/search/results/content/?fromMember=%5B%22ACoAAACLh-UBAabHGjZ6tXgzeFeDFY3RKkQxljI%22%5D&heroEntityKey=urn%3Ali%3Afsd_profile%3AACoAAACLh-UBAabHGjZ6tXgzeFeDFY3RKkQxljI&keywords=ira%20zlotowitz&origin=CLUSTER_EXPANSION&position=0&searchId=5b92b410-b505-477f-a2c0-4c74dbd5b9b1&sid=BOL&sortBy=%22date_posted%22
Ira Zlotowitz,Male,2023-10-27,"I was just speaking to Mendy Pollack and he was telling me that when he first joined me at Eastern Union 21 years ago, the 10 year T-bill was 4.33 and the mode was that rates were going up. Yet until now he hasn’t seen it higher!I told him that when I started CRE players didn’t even care about the 10 year as most loans were with local banks and not Agency or CMBS. Where was the 10 year T-bill when you started in business?",36,8,0,https://www.linkedin.com/search/results/content/?fromMember=%5B%22ACoAAACLh-UBAabHGjZ6tXgzeFeDFY3RKkQxljI%22%5D&heroEntityKey=urn%3Ali%3Afsd_profile%3AACoAAACLh-UBAabHGjZ6tXgzeFeDFY3RKkQxljI&keywords=ira%20zlotowitz&origin=CLUSTER_EXPANSION&position=0&searchId=5b92b410-b505-477f-a2c0-4c74dbd5b9b1&sid=BOL&sortBy=%22date_posted%22
Ira Zlotowitz,Male,2023-08-27,"Join this round!You, my LinkedIn audience, have been there with GPARENCY since before day one. I want to give you the opportunity to not just be a part of GPARENCY's journey, but to have a stake in the company you helped grow. I am excited to extend to you the investment opportunity outlined below before we conclude this funding round.Here is a summary of the email I sent to GPARENCY's investors last week:I wanted to follow up on my recent email (https://bit.ly/48bwbDW) and let you know that I'm personally investing an additional $125,000 in this round, in addition to the $750,000 investment from Abe and myself a few weeks ago. My confidence in this opportunity has only grown.This round is particularly unique because it's the last chance to leverage potential QSBS benefits and secure a liquidation preference on your capital. Personally, I'm using this opportunity to allocate funds in my children's names.As you saw in last week's email update, thank God, GPARENCY is thriving despite the challenges in the commercial real estate market. Our site traffic and membership signups have continued to grow. This is despite of a slow real estate market, which has negatively affected the number of people signing up for mortgage brokerage type services. The signs point to an even more substantial market exit than originally projected.In light of this, before I open the end of this round to the broader market, I've set aside $2mm l to reconnect with you and a select group of my initial investors. This will give you the opportunity to join me in this round and to be a part of something I believe in so strongly.I'd love to hear your thoughts on participating in this round before we open it to the broader market. Personally, it would mean a lot to me if you could consider an additional investment of between $25,000 to $250,000.I'm eager to receive your timely and positive response, and I'm excited about the potential we have to achieve great things together!This is not intended to be an offer or solicitation to purchase or sell any security. Before making a decision whether to invest in Gparency, a prospective investor should carefully review Gparency’s offering memorandum, including the risks associated with Gparency discussed in the offering memorandum, and make a determination based upon the prospective investor’s own particular circumstances, that the investment isconsistent with the investor’s investment objectives and risk tolerance.",36,9,1,https://www.linkedin.com/search/results/content/?fromMember=%5B%22ACoAAACLh-UBAabHGjZ6tXgzeFeDFY3RKkQxljI%22%5D&heroEntityKey=urn%3Ali%3Afsd_profile%3AACoAAACLh-UBAabHGjZ6tXgzeFeDFY3RKkQxljI&keywords=ira%20zlotowitz&origin=CLUSTER_EXPANSION&position=0&searchId=5b92b410-b505-477f-a2c0-4c74dbd5b9b1&sid=BOL&sortBy=%22date_posted%22
Ira Zlotowitz,Male,2023-09-27,"Here's Today's Interest Rates - For All Property Types!You don’t have to be the Wizard of Oz to know today’s interest rates in an ever-changing market. Interest rates are always shifting, but now you can have access to today’s lending information right in your pocket!Before you say deal or no deal, get instant interest rate insights for all property types. Click on the link in the comments below to log into our marketplace, and in minutes, you'll get a complete financial picture (and it won't cost you a dime):  #GPARENCY #realestate #commercialrealestate",36,6,1,https://www.linkedin.com/search/results/content/?fromMember=%5B%22ACoAAACLh-UBAabHGjZ6tXgzeFeDFY3RKkQxljI%22%5D&heroEntityKey=urn%3Ali%3Afsd_profile%3AACoAAACLh-UBAabHGjZ6tXgzeFeDFY3RKkQxljI&keywords=ira%20zlotowitz&origin=CLUSTER_EXPANSION&position=0&searchId=5b92b410-b505-477f-a2c0-4c74dbd5b9b1&sid=BOL&sortBy=%22date_posted%22
Ira Zlotowitz,Male,2023-07-27,"We are thrilled to announce the latest addition to our industry-leading acquisition calculator!Our brand new AI summary feature, powered by #chatgpt, gives you a comprehensive summary of your deal and surrounding neighborhood in minutes! This feature makes it easier than ever to give investors an overview of a listing's potential. This includes:✅ Listing and surrounding area overview✅ Cap rate✅ IRR✅ DSCR✅ Cash-on-Cash✅ Future Cash Flow Projections✅ Waterfall SplitsThe AI summary condenses all the vital information, making it a breeze to communicate the potential of each opportunity effectively.Experience the power of our AI summary feature in action now at the link in the comments. Try it out and let me know what you think!#AIpowered #realestate #calculator #innovation #propertyinvestments #irr",35,3,0,https://www.linkedin.com/search/results/content/?fromMember=%5B%22ACoAAACLh-UBAabHGjZ6tXgzeFeDFY3RKkQxljI%22%5D&heroEntityKey=urn%3Ali%3Afsd_profile%3AACoAAACLh-UBAabHGjZ6tXgzeFeDFY3RKkQxljI&keywords=ira%20zlotowitz&origin=CLUSTER_EXPANSION&position=0&searchId=5b92b410-b505-477f-a2c0-4c74dbd5b9b1&sid=BOL&sortBy=%22date_posted%22
Ira Zlotowitz,Male,2024-01-27,"I'm thrilled to announce my role as a judge in the 2024 #CoStarImpactAwards for Northern New Jersey!This event celebrates the major commercial real estate achievements of 2023.Know of an achievement we should consider? Don't miss your chance to nominate deserving projects and transactions. The deadline is January 31, 2024. You can submit projects at the link in the comments!#CoStar #CRE #CommercialRealEstate CoStar Group",35,2,0,https://www.linkedin.com/search/results/content/?fromMember=%5B%22ACoAAACLh-UBAabHGjZ6tXgzeFeDFY3RKkQxljI%22%5D&heroEntityKey=urn%3Ali%3Afsd_profile%3AACoAAACLh-UBAabHGjZ6tXgzeFeDFY3RKkQxljI&keywords=ira%20zlotowitz&origin=CLUSTER_EXPANSION&position=0&searchId=5b92b410-b505-477f-a2c0-4c74dbd5b9b1&sid=BOL&sortBy=%22date_posted%22
Ira Zlotowitz,Male,2024-01-27,"Non business related - pls vote I was at a business meeting and when the 4 of us got up to leave, I noticed that one person had both his gloves in one of his coat pockets. It was the first time I saw that so I asked him in surprise why both aare in one pocket. He answered back in the same tonality of surprise as he thought everyone puts gloves in one pocket. His reasoning was that by doing that they have a free pocket. We asked the other two and they were also split on this.I was surprised. Was wondering if there is a clear winner. Pls vote and comment.",35,21,1,https://www.linkedin.com/search/results/content/?fromMember=%5B%22ACoAAACLh-UBAabHGjZ6tXgzeFeDFY3RKkQxljI%22%5D&heroEntityKey=urn%3Ali%3Afsd_profile%3AACoAAACLh-UBAabHGjZ6tXgzeFeDFY3RKkQxljI&keywords=ira%20zlotowitz&origin=CLUSTER_EXPANSION&position=0&searchId=5b92b410-b505-477f-a2c0-4c74dbd5b9b1&sid=BOL&sortBy=%22date_posted%22
Ira Zlotowitz,Male,2023-12-27,"Would love your honest opinion on the topic of college. (After going back and forth with Google Bard we settled on this version of the post 😀)Recent revelations surrounding elite colleges have ignited a critical discussion about the value proposition of higher education, particularly within these institutions.Post ChatGPT's launch, I predicted that advancing AI would challenge the necessity of traditional college degrees, except for specialized fields like law or medicine. I envisioned alternative pathways, such as on-the-job training and online learning platforms, rising to prominence.This perspective contrasted sharply with my upbringing. Both my parents, a Rabbi and an early childhood educator, instilled the importance of education in me - they both had college degrees!When I initially voiced my prediction, the primary objection revolved around the irreplaceable ""network and branding"" effect of an elite degree. However, the recent issues at elite colleges have left parents of college-aged students disillusioned. With the prestige of these institutions in question, alternative options like on-the-job training and certificate programs are gaining traction, even offered by many colleges themselves.This begs the question: Is college still the essential stepping stone to success in today's world? Or are we entering an era where adaptability and lifelong learning will surpass the value of a prestigious degree? Join the conversation! Share your thoughts in the comments below as we explore the future of education together. #futureofwork #education #highereducation #AI #technology #alternativeeducation #lifelonglearning",34,38,0,https://www.linkedin.com/search/results/content/?fromMember=%5B%22ACoAAACLh-UBAabHGjZ6tXgzeFeDFY3RKkQxljI%22%5D&heroEntityKey=urn%3Ali%3Afsd_profile%3AACoAAACLh-UBAabHGjZ6tXgzeFeDFY3RKkQxljI&keywords=ira%20zlotowitz&origin=CLUSTER_EXPANSION&position=0&searchId=5b92b410-b505-477f-a2c0-4c74dbd5b9b1&sid=BOL&sortBy=%22date_posted%22
Ira Zlotowitz,Male,2023-08-27,"GPARENCY and LinkedIn just got a lot closer!Now, you can effortlessly access the GPARENCY Marketplace using your LinkedIn profile! LinkedIn has played a significant role in the history and launch of GPARENCY (thanks to all of you), and now it's going to play an even bigger role in our future. With this collaboration, accessing the GPARENCY marketplace is now more seamless than ever before.Give it a try now at the link in the comments and let me know what you think about this new unified login process!#LinkedIn #GPARENCY #CRE #CommercialRealEstate #Listings",34,3,0,https://www.linkedin.com/search/results/content/?fromMember=%5B%22ACoAAACLh-UBAabHGjZ6tXgzeFeDFY3RKkQxljI%22%5D&heroEntityKey=urn%3Ali%3Afsd_profile%3AACoAAACLh-UBAabHGjZ6tXgzeFeDFY3RKkQxljI&keywords=ira%20zlotowitz&origin=CLUSTER_EXPANSION&position=0&searchId=5b92b410-b505-477f-a2c0-4c74dbd5b9b1&sid=BOL&sortBy=%22date_posted%22
Ira Zlotowitz,Male,2023-08-27,"In the world of commercial real estate victories, few shine as bright as our recent achievement in the vibrant city of Chicago, IL! 🌟But this closing is so much more than just a success story—it's a prime example of strategic brilliance. At the heart of this achievement lies a partnership that left no stone unturned.Working with Bank Execution, we meticulously planned and executed this deal to ensure that every detail aligned seamlessly with the vision for this multifamily property.An 18-month interest-only period offers invaluable room for maneuvering, and an innovative 3,2,1 prepayment penalty structure gives our clients the freedom to explore new avenues as opportunities arise.At GPARENCY, we're not just securing deals; we're unlocking possibilities. Click the link in the comments below to see the possibilities that await you.#GPARENCY #realestate #mortgage #mortgagetips #financingavailable #CREF #commercialrealestate",34,3,0,https://www.linkedin.com/search/results/content/?fromMember=%5B%22ACoAAACLh-UBAabHGjZ6tXgzeFeDFY3RKkQxljI%22%5D&heroEntityKey=urn%3Ali%3Afsd_profile%3AACoAAACLh-UBAabHGjZ6tXgzeFeDFY3RKkQxljI&keywords=ira%20zlotowitz&origin=CLUSTER_EXPANSION&position=0&searchId=5b92b410-b505-477f-a2c0-4c74dbd5b9b1&sid=BOL&sortBy=%22date_posted%22
Ira Zlotowitz,Male,2023-09-27,Know someone in Athens Airport?Parents trying to connect with their kids who are in Athens airport but their phone is dead and they are going to miss the flight to get home for Shabbos.,34,6,0,https://www.linkedin.com/search/results/content/?fromMember=%5B%22ACoAAACLh-UBAabHGjZ6tXgzeFeDFY3RKkQxljI%22%5D&heroEntityKey=urn%3Ali%3Afsd_profile%3AACoAAACLh-UBAabHGjZ6tXgzeFeDFY3RKkQxljI&keywords=ira%20zlotowitz&origin=CLUSTER_EXPANSION&position=0&searchId=5b92b410-b505-477f-a2c0-4c74dbd5b9b1&sid=BOL&sortBy=%22date_posted%22
Ira Zlotowitz,Male,2024-04-13,"You’ve seen how far we’ve come…As we wrap up our best quarter to date, now is the best time to get in and join the momentum of success.Thank God, as planned, GPARENCY is going for our third raise and the excitement around the value GPARENCY brings to the industry has never been more clear.Our target investment is $25,000-$100,000 per accredited investor. Investors in this round will receive favorable terms not previously offered.Get in touch with me to learn more. Looking forward to revolutionizing the commercial mortgage brokerage business together!",33,12,7,https://www.linkedin.com/search/results/content/?fromMember=%5B%22ACoAAACLh-UBAabHGjZ6tXgzeFeDFY3RKkQxljI%22%5D&heroEntityKey=urn%3Ali%3Afsd_profile%3AACoAAACLh-UBAabHGjZ6tXgzeFeDFY3RKkQxljI&keywords=ira%20zlotowitz&origin=CLUSTER_EXPANSION&position=0&searchId=5b92b410-b505-477f-a2c0-4c74dbd5b9b1&sid=BOL&sortBy=%22date_posted%22
Ira Zlotowitz,Male,2023-06-27,"Want to buy Signature Bank notes?What if you could see every Signature Bank loan overlaid on an interactive map and have the ability to compare them to loans from banks like New York Community Bank (NYCB)?Get full market intel with our brand NEW feature: Lender Portfolios!Now you can see which banks financed specific properties, where banks are lending, valuable insights into the CRE landscape, and make the most informed decisions.Whether you're an investor, note buyer, developer, lender, broker, or simply seeking information, this targeted feature will give you an edge over your competitors—and it's completely free.Access Lender Portfolios now, link in comments.#GPARENCY #realestate #mortgage #mortgagetips #financingavailable #CREF #commercialrealestate #lenderportfolios",33,3,2,https://www.linkedin.com/search/results/content/?fromMember=%5B%22ACoAAACLh-UBAabHGjZ6tXgzeFeDFY3RKkQxljI%22%5D&heroEntityKey=urn%3Ali%3Afsd_profile%3AACoAAACLh-UBAabHGjZ6tXgzeFeDFY3RKkQxljI&keywords=ira%20zlotowitz&origin=CLUSTER_EXPANSION&position=0&searchId=5b92b410-b505-477f-a2c0-4c74dbd5b9b1&sid=BOL&sortBy=%22date_posted%22
Ira Zlotowitz,Male,2023-07-27,"Keep the closings coming! 🎉Even amid such a dynamic real estate landscape, we continue to achieve remarkable milestones. We're thrilled to celebrate yet another successful closing that only cost $4K!We aggressively pursued this 24-unit multi-family property deal and were able to secure an impressive 70% LTV ratio alongside flexible pre-payment options.A special thank you to our lenders for skillfully facilitating the closing alongside us!At GPARENCY, we always secure the most favorable terms for our members. See what GPARENCY can do by clicking the link in the comments below.#GPARENCY #realestate #mortgage #mortgagetips #financingavailable #CREF #commercialrealestate",32,2,0,https://www.linkedin.com/search/results/content/?fromMember=%5B%22ACoAAACLh-UBAabHGjZ6tXgzeFeDFY3RKkQxljI%22%5D&heroEntityKey=urn%3Ali%3Afsd_profile%3AACoAAACLh-UBAabHGjZ6tXgzeFeDFY3RKkQxljI&keywords=ira%20zlotowitz&origin=CLUSTER_EXPANSION&position=0&searchId=5b92b410-b505-477f-a2c0-4c74dbd5b9b1&sid=BOL&sortBy=%22date_posted%22
Ira Zlotowitz,Male,2023-07-27,Who is laughing now?,32,8,0,https://www.linkedin.com/search/results/content/?fromMember=%5B%22ACoAAACLh-UBAabHGjZ6tXgzeFeDFY3RKkQxljI%22%5D&heroEntityKey=urn%3Ali%3Afsd_profile%3AACoAAACLh-UBAabHGjZ6tXgzeFeDFY3RKkQxljI&keywords=ira%20zlotowitz&origin=CLUSTER_EXPANSION&position=0&searchId=5b92b410-b505-477f-a2c0-4c74dbd5b9b1&sid=BOL&sortBy=%22date_posted%22
Ira Zlotowitz,Male,2023-07-27,"GPARENCY is sponsoring the ReBeach Real Estate Conference on July 31st, and I hope you'll be there!If you're planning to attend the conference, I would love to meet you in person. Whether you're considering a GPARENCY membership for full brokerage services or just want to take advantage of our free marketplace features, our team would love to talk. Let's exchange ideas, explore potential collaborations, and work together to shape the future of commercial real estate!Schedule a time today by contacting the email in the comments.#GPARENCY #realestate #mortgage #mortgagetips #financingavailable #CREF #commercialrealestate #rebeach #realestateconference",32,2,0,https://www.linkedin.com/search/results/content/?fromMember=%5B%22ACoAAACLh-UBAabHGjZ6tXgzeFeDFY3RKkQxljI%22%5D&heroEntityKey=urn%3Ali%3Afsd_profile%3AACoAAACLh-UBAabHGjZ6tXgzeFeDFY3RKkQxljI&keywords=ira%20zlotowitz&origin=CLUSTER_EXPANSION&position=0&searchId=5b92b410-b505-477f-a2c0-4c74dbd5b9b1&sid=BOL&sortBy=%22date_posted%22
Ira Zlotowitz,Male,2023-07-27,"Reflecting on my journey, I've learned valuable lessons: embrace failures as opportunities, leverage your strengths to make an impact, and prioritize helping others while pursuing success. Maintain your reputation, adapt to change, and stay true to your vision. Keep pushing forward, taking risks, and creating new opportunities. #LessonsLearned #StayTrueToYourVision",32,5,2,https://www.linkedin.com/search/results/content/?fromMember=%5B%22ACoAAACLh-UBAabHGjZ6tXgzeFeDFY3RKkQxljI%22%5D&heroEntityKey=urn%3Ali%3Afsd_profile%3AACoAAACLh-UBAabHGjZ6tXgzeFeDFY3RKkQxljI&keywords=ira%20zlotowitz&origin=CLUSTER_EXPANSION&position=0&searchId=5b92b410-b505-477f-a2c0-4c74dbd5b9b1&sid=BOL&sortBy=%22date_posted%22
Ira Zlotowitz,Male,2024-03-27,How do you think this will shake out? Who will win and who will lose?The Lakewood Scoop,32,14,0,https://www.linkedin.com/search/results/content/?fromMember=%5B%22ACoAAACLh-UBAabHGjZ6tXgzeFeDFY3RKkQxljI%22%5D&heroEntityKey=urn%3Ali%3Afsd_profile%3AACoAAACLh-UBAabHGjZ6tXgzeFeDFY3RKkQxljI&keywords=ira%20zlotowitz&origin=CLUSTER_EXPANSION&position=0&searchId=5b92b410-b505-477f-a2c0-4c74dbd5b9b1&sid=BOL&sortBy=%22date_posted%22
Ira Zlotowitz,Male,2023-04-27,https://lnkd.in/eMP7j_Qqnews.GPARENCY.com What ideas do you have to improve this?,32,10,0,https://www.linkedin.com/search/results/content/?fromMember=%5B%22ACoAAACLh-UBAabHGjZ6tXgzeFeDFY3RKkQxljI%22%5D&heroEntityKey=urn%3Ali%3Afsd_profile%3AACoAAACLh-UBAabHGjZ6tXgzeFeDFY3RKkQxljI&keywords=ira%20zlotowitz&origin=CLUSTER_EXPANSION&position=0&searchId=5b92b410-b505-477f-a2c0-4c74dbd5b9b1&sid=BOL&sortBy=%22date_posted%22
Ira Zlotowitz,Male,2023-06-27,"Surviving and thriving in business requires two skills: pivoting and persevering. In this article, I share my experience with adapting to unexpected changes while launching my new business, GPARENCY. From shifting valuations to changing market demands, learn how we pivoted and persevered to become a premier mortgage broker in a struggling market. Read on to discover the importance of listening to your clients and being willing to adjust your strategy to match market conditions. #BusinessTips #Pivoting #Perseverance #GPARENCY""",32,13,1,https://www.linkedin.com/search/results/content/?fromMember=%5B%22ACoAAACLh-UBAabHGjZ6tXgzeFeDFY3RKkQxljI%22%5D&heroEntityKey=urn%3Ali%3Afsd_profile%3AACoAAACLh-UBAabHGjZ6tXgzeFeDFY3RKkQxljI&keywords=ira%20zlotowitz&origin=CLUSTER_EXPANSION&position=0&searchId=5b92b410-b505-477f-a2c0-4c74dbd5b9b1&sid=BOL&sortBy=%22date_posted%22
Ira Zlotowitz,Male,2023-06-27,"To be an industry disruptor, you need to shift your mindset and start thinking like an investor. Understand what product you're selling today to make ends meet that will flow into the product of your future, and what you're building today that will revolutionize the world tomorrow. Every company, entrepreneur, and employee needs to answer these questions to set themselves on an amazing trajectory. Plan for today and dream for tomorrow, building your company around a core mission that will anchor you through each phase of progress to come. #IndustryDisruptor #InvestorMindset #ShortTermRevenue #LongTermGrowth #CoreMission #GPARENCY",31,4,2,https://www.linkedin.com/search/results/content/?fromMember=%5B%22ACoAAACLh-UBAabHGjZ6tXgzeFeDFY3RKkQxljI%22%5D&heroEntityKey=urn%3Ali%3Afsd_profile%3AACoAAACLh-UBAabHGjZ6tXgzeFeDFY3RKkQxljI&keywords=ira%20zlotowitz&origin=CLUSTER_EXPANSION&position=0&searchId=5b92b410-b505-477f-a2c0-4c74dbd5b9b1&sid=BOL&sortBy=%22date_posted%22
Ira Zlotowitz,Male,2023-05-27,No more needs to be said!Link in comments to the article NVIDIA Jensen Huang Fortune Yahoo Finance Yahoo,30,17,0,https://www.linkedin.com/search/results/content/?fromMember=%5B%22ACoAAACLh-UBAabHGjZ6tXgzeFeDFY3RKkQxljI%22%5D&heroEntityKey=urn%3Ali%3Afsd_profile%3AACoAAACLh-UBAabHGjZ6tXgzeFeDFY3RKkQxljI&keywords=ira%20zlotowitz&origin=CLUSTER_EXPANSION&position=0&searchId=5b92b410-b505-477f-a2c0-4c74dbd5b9b1&sid=BOL&sortBy=%22date_posted%22
Ira Zlotowitz,Male,2023-11-27,"We're thrilled to announce the successful closure of another remarkable deal in Jersey City at an extraordinary rate of 6.33%. This rate is not just a game-changer—it's practically unheard of in today's market!We extend our heartfelt thanks to everyone involved, including our valued lender, TD Bank, for setting our clients up for unparalleled success.Ready to get access to rates you won't find anywhere else? Click the link in the comments below to take advantage of the smarter way to finance commercial real estate.#GPARENCY #realestate #mortgage #mortgagetips #financingavailable #CREF #commercialrealestate",30,5,0,https://www.linkedin.com/search/results/content/?fromMember=%5B%22ACoAAACLh-UBAabHGjZ6tXgzeFeDFY3RKkQxljI%22%5D&heroEntityKey=urn%3Ali%3Afsd_profile%3AACoAAACLh-UBAabHGjZ6tXgzeFeDFY3RKkQxljI&keywords=ira%20zlotowitz&origin=CLUSTER_EXPANSION&position=0&searchId=5b92b410-b505-477f-a2c0-4c74dbd5b9b1&sid=BOL&sortBy=%22date_posted%22
Ira Zlotowitz,Male,2024-01-27,“Self Motivation” - this is how you explain it!Agree? How do you stay self motivated?,30,7,0,https://www.linkedin.com/search/results/content/?fromMember=%5B%22ACoAAACLh-UBAabHGjZ6tXgzeFeDFY3RKkQxljI%22%5D&heroEntityKey=urn%3Ali%3Afsd_profile%3AACoAAACLh-UBAabHGjZ6tXgzeFeDFY3RKkQxljI&keywords=ira%20zlotowitz&origin=CLUSTER_EXPANSION&position=0&searchId=5b92b410-b505-477f-a2c0-4c74dbd5b9b1&sid=BOL&sortBy=%22date_posted%22
Ira Zlotowitz,Male,2023-07-27,"he silo effect in businesses can create enormous distances between departments, even if they're physically close. The problem arises when different teams have different goals and measures of success, leading to communication breakdowns. To overcome this, a common language or framework is necessary. One solution is to use a point system that is transparent and easy for everyone to understand. By speaking the same language, departments can understand each other's roles, priorities, and impact, leading to faster and better decisions.",30,2,2,https://www.linkedin.com/search/results/content/?fromMember=%5B%22ACoAAACLh-UBAabHGjZ6tXgzeFeDFY3RKkQxljI%22%5D&heroEntityKey=urn%3Ali%3Afsd_profile%3AACoAAACLh-UBAabHGjZ6tXgzeFeDFY3RKkQxljI&keywords=ira%20zlotowitz&origin=CLUSTER_EXPANSION&position=0&searchId=5b92b410-b505-477f-a2c0-4c74dbd5b9b1&sid=BOL&sortBy=%22date_posted%22
Ira Zlotowitz,Male,2023-07-27,"In these uncertain times, every closing is a cause for celebration—especially when it only costs $4K. 🎉We shopped this 100-unit multi-family property deal in Pennsylvania aggressively, securing a 75% LTV ratio with added flexible pre-payment options. In this market, a term sheet like this is a huge win!Congratulations to our client, and thank you to our lender for skillfully facilitating the closing. It's partnerships like these that fuel our success!Discover the power of GPARENCY and see what we can do for you by clicking the link in the comments below.#GPARENCY #realestate #mortgage #mortgagetips #financingavailable #CREF #commercialrealestate",30,4,0,https://www.linkedin.com/search/results/content/?fromMember=%5B%22ACoAAACLh-UBAabHGjZ6tXgzeFeDFY3RKkQxljI%22%5D&heroEntityKey=urn%3Ali%3Afsd_profile%3AACoAAACLh-UBAabHGjZ6tXgzeFeDFY3RKkQxljI&keywords=ira%20zlotowitz&origin=CLUSTER_EXPANSION&position=0&searchId=5b92b410-b505-477f-a2c0-4c74dbd5b9b1&sid=BOL&sortBy=%22date_posted%22
