Author,Gender,Date,Post Text,Likes,Comments,Shares,Page Link
Ira Zlotowitz,Male,2023-04-27,"This is the next step….….of AI integration. All customer service reps will work this way. At GPARENCY we plan to hook up our data to AI and creates bots where you can ask questions about the market, rates and listings. And when you need a broker, me and our amazing brokerage team will take over. Stay tuned for our first chatgpt integration with CRE news. Thoughts on this video?",66,52,3,https://www.linkedin.com/search/results/content/?fromMember=%5B%22ACoAAACLh-UBAabHGjZ6tXgzeFeDFY3RKkQxljI%22%5D&heroEntityKey=urn%3Ali%3Afsd_profile%3AACoAAACLh-UBAabHGjZ6tXgzeFeDFY3RKkQxljI&keywords=ira%20zlotowitz&origin=CLUSTER_EXPANSION&position=0&searchId=5b92b410-b505-477f-a2c0-4c74dbd5b9b1&sid=BOL&sortBy=%22date_posted%22
Ira Zlotowitz,Male,2023-06-27,Based on recent feedback it seems like Alex B Sheridan is spot on. Throughts?,64,28,1,https://www.linkedin.com/search/results/content/?fromMember=%5B%22ACoAAACLh-UBAabHGjZ6tXgzeFeDFY3RKkQxljI%22%5D&heroEntityKey=urn%3Ali%3Afsd_profile%3AACoAAACLh-UBAabHGjZ6tXgzeFeDFY3RKkQxljI&keywords=ira%20zlotowitz&origin=CLUSTER_EXPANSION&position=0&searchId=5b92b410-b505-477f-a2c0-4c74dbd5b9b1&sid=BOL&sortBy=%22date_posted%22
Ira Zlotowitz,Male,2023-09-27,Spot on!,64,3,0,https://www.linkedin.com/search/results/content/?fromMember=%5B%22ACoAAACLh-UBAabHGjZ6tXgzeFeDFY3RKkQxljI%22%5D&heroEntityKey=urn%3Ali%3Afsd_profile%3AACoAAACLh-UBAabHGjZ6tXgzeFeDFY3RKkQxljI&keywords=ira%20zlotowitz&origin=CLUSTER_EXPANSION&position=0&searchId=5b92b410-b505-477f-a2c0-4c74dbd5b9b1&sid=BOL&sortBy=%22date_posted%22
Ira Zlotowitz,Male,2023-10-27,"Commercial Real Estate Market PredictionBased on history and conversations with senior banking and CRE professionals, I believe the following actions and timing will trigger an uptick in commercial real estate transactions:*Banks will offset some of their massive Q3 earnings by taking paper losses in Q4 on their CRE portfolios by writing down valuations.*Since revenue is up at the banks, they will be hailed as being prudent and doing the right thing by marking to market, and they won't get penalized for showing these paper losses.*Then, sometime between Q2 and Q4 of next year, they will start selling the paper at slightly higher prices than their current write-down valuations, so that the sale will be an actual realization of profits.Once this happens, the floodgates of dealmaking will open up.Please like and comment with what do you think?",63,22,4,https://www.linkedin.com/search/results/content/?fromMember=%5B%22ACoAAACLh-UBAabHGjZ6tXgzeFeDFY3RKkQxljI%22%5D&heroEntityKey=urn%3Ali%3Afsd_profile%3AACoAAACLh-UBAabHGjZ6tXgzeFeDFY3RKkQxljI&keywords=ira%20zlotowitz&origin=CLUSTER_EXPANSION&position=0&searchId=5b92b410-b505-477f-a2c0-4c74dbd5b9b1&sid=BOL&sortBy=%22date_posted%22
Ira Zlotowitz,Male,2023-07-27,"Thank you, God! I am thrilled beyond words to announce that our incredible GPARENCY community has reached a significant milestone: 10,000 users!In celebrating this achievement, I can't help but reflect on the personal journey I've undergone since launching GPARENCY in 2021.Since then, with God's help, we've eliminated the barrier to entry in commercial real estate and empowered people to find, finance, underwrite, and track their deals for free.While some may see 10,000 users as ""small,"" I see it as a powerful stepping stone on the path to 100,000 users—and it reminds me of a story my father used to tell.Whenever someone told him that things were ""so far, so good,"" my father would recount this story about a man who jumped off the top of the Empire State Building. As he passed the 70th floor on his way down, a window washer asked him how he was doing, and he replied, ""So far, so good!""It was always a powerful reminder that appearances can be deceiving, and we can't take our current progress for granted or assume that success will come effortlessly. Instead, we must remain vigilant, adaptable, and committed to continuously improving our product or service.Every single user represents an integral part of our success story—a connection, a story, and a positive impact on their lives. And to me, that is priceless.This milestone was only possible because of the unwavering dedication of our team and the overwhelming support from all of you. I know that together, everyone that wants to grow and break into the CRE space with full transparency will be able to do just that.Please try out the marketplace (link in comments) and let me know how I can make it even more valuable for you!#GPARENCY #realestate #mortgage #mortgagetips #financingavailable #CREF #commercialrealestate",63,20,1,https://www.linkedin.com/search/results/content/?fromMember=%5B%22ACoAAACLh-UBAabHGjZ6tXgzeFeDFY3RKkQxljI%22%5D&heroEntityKey=urn%3Ali%3Afsd_profile%3AACoAAACLh-UBAabHGjZ6tXgzeFeDFY3RKkQxljI&keywords=ira%20zlotowitz&origin=CLUSTER_EXPANSION&position=0&searchId=5b92b410-b505-477f-a2c0-4c74dbd5b9b1&sid=BOL&sortBy=%22date_posted%22
Ira Zlotowitz,Male,2023-07-27,"I would appreciate your feedback and tagging of LPs so I can help others..I am thrilled to share with you our latest initiative at GPARENCY - a brand-new, free feature designed exclusively to help LPs stay informed about their investments and track their returns in real-time overlaid on a map. We understand the challenges faced by LPs in the commercial real estate industry when it comes to transparency and access to reliable tools, and we're committed to providing equitable solutions for all our users.Background:Many LPs have expressed their concerns that while there are exceptional investment portals (such as Agora RE Juniper Square AppFolio, Inc.) available for GPs and syndicators, there is a clear void in the market for LP-centric “commercial real estate exclusive” investment software.GPARENCY's Mission:At GPARENCY, our mission is to empower all commercial real estate players with the tools they need for success. With this new feature, we're taking a significant step forward in achieving that mission by offering LPs a comprehensive platform to manage their investments efficiently and confidently.Key Features:Our new feature will provide a user-friendly, interactive ledger where LPs can effortlessly input their investment amounts and track their returns as they happen. You'll also have the option to set up custom alerts, ensuring you're promptly notified if there are any deviations from your expected returns.Feedback and Development:Before we proceed with the production phase, we value your feedback immensely. We want to hear from you and understand your thoughts on the mock-up we've prepared. Your input will help us fine-tune this feature to make it truly remarkable and catered to your needs.🚀 Launch Date:Upon finalizing the mock-up, our dedicated development team will work tirelessly to bring this feature to life. We're aiming for a launch date on September 7th, providing you with a seamless experience for managing your investments.Let's Make it Happen Together:We firmly believe this feature will revolutionize how LPs engage with their real estate investments, and we're excited to embark on this journey with you. Leave your valuable comments below, and if you know any LPs who would find this feature beneficial, don't hesitate to tag them so they can join in on the conversation!Thank you for being a part of the GPARENCY community. Together, we can shape the future of commercial real estate investment tracking. 🏢📈",63,29,3,https://www.linkedin.com/search/results/content/?fromMember=%5B%22ACoAAACLh-UBAabHGjZ6tXgzeFeDFY3RKkQxljI%22%5D&heroEntityKey=urn%3Ali%3Afsd_profile%3AACoAAACLh-UBAabHGjZ6tXgzeFeDFY3RKkQxljI&keywords=ira%20zlotowitz&origin=CLUSTER_EXPANSION&position=0&searchId=5b92b410-b505-477f-a2c0-4c74dbd5b9b1&sid=BOL&sortBy=%22date_posted%22
Ira Zlotowitz,Male,2023-07-27,A little something before Tisha Baav,62,8,5,https://www.linkedin.com/search/results/content/?fromMember=%5B%22ACoAAACLh-UBAabHGjZ6tXgzeFeDFY3RKkQxljI%22%5D&heroEntityKey=urn%3Ali%3Afsd_profile%3AACoAAACLh-UBAabHGjZ6tXgzeFeDFY3RKkQxljI&keywords=ira%20zlotowitz&origin=CLUSTER_EXPANSION&position=0&searchId=5b92b410-b505-477f-a2c0-4c74dbd5b9b1&sid=BOL&sortBy=%22date_posted%22
Ira Zlotowitz,Male,2023-05-27,"This is the first time publicizing the prayer my Dad told me to say with extra concentration each day!For those in my network that aren’t Jewish or affiliated, the best way (I know I will get flack from some) to describe this is similar to prompting with #chatgpt.Just as “the better the prompt, the better the result,” the same thing is when praying and asking God, one can pray very broad and very specific. One can pray and only mention spiritual things and others can pray and mention all of the mundane. As I say in my yearly Yom Kippur message, my Dad would point out that on Yom Kippur, the holiest day of the year, in the holy place of the Beit Hamikdash (temple), in the holy of holies, one would think that his prayer would only be about spiritual things. Yet, not only was it about livelihood (parnassah) but it went into detail asking that God not listen to the tourists that pray for no rain, but rather give rain since the farmers need it for sustenance. God willing, may everyone in business only see success in everything they do!!",62,9,0,https://www.linkedin.com/search/results/content/?fromMember=%5B%22ACoAAACLh-UBAabHGjZ6tXgzeFeDFY3RKkQxljI%22%5D&heroEntityKey=urn%3Ali%3Afsd_profile%3AACoAAACLh-UBAabHGjZ6tXgzeFeDFY3RKkQxljI&keywords=ira%20zlotowitz&origin=CLUSTER_EXPANSION&position=0&searchId=5b92b410-b505-477f-a2c0-4c74dbd5b9b1&sid=BOL&sortBy=%22date_posted%22
Ira Zlotowitz,Male,2023-06-27,"I'm thrilled to announce that I'll be attending the JCON Real Estate Summit tomorrow, where I'll have the honor of discussing the intersection of commercial real estate and technology!If you're attending, I'd love it if you joined me, Arthur Attal, and Eric Brody at 5 PM in Room 3 for our presentation on Real Estate Technology Platforms. It'll be an excellent opportunity to exchange ideas and discuss how we can harness the power of technology to create a more inclusive, efficient, and sustainable commercial real estate industry.If you haven't registered yet, you can use promo code GPARENCY at checkout to save 15%. Link to register in comments.I look forward to seeing you tomorrow!#GPARENCY #realestate #mortgage #mortgagetips #financingavailable #CREF #commercialrealestate #JCON2023 #JCON #realestateconference",62,29,3,https://www.linkedin.com/search/results/content/?fromMember=%5B%22ACoAAACLh-UBAabHGjZ6tXgzeFeDFY3RKkQxljI%22%5D&heroEntityKey=urn%3Ali%3Afsd_profile%3AACoAAACLh-UBAabHGjZ6tXgzeFeDFY3RKkQxljI&keywords=ira%20zlotowitz&origin=CLUSTER_EXPANSION&position=0&searchId=5b92b410-b505-477f-a2c0-4c74dbd5b9b1&sid=BOL&sortBy=%22date_posted%22
Ira Zlotowitz,Male,2023-08-27,"A copy of the email I sent to all of GPARENCY's investors this week. If you're in real estate, please let me know how I can make this product even better!",62,25,0,https://www.linkedin.com/search/results/content/?fromMember=%5B%22ACoAAACLh-UBAabHGjZ6tXgzeFeDFY3RKkQxljI%22%5D&heroEntityKey=urn%3Ali%3Afsd_profile%3AACoAAACLh-UBAabHGjZ6tXgzeFeDFY3RKkQxljI&keywords=ira%20zlotowitz&origin=CLUSTER_EXPANSION&position=0&searchId=5b92b410-b505-477f-a2c0-4c74dbd5b9b1&sid=BOL&sortBy=%22date_posted%22
Ira Zlotowitz,Male,2023-07-27,"🚀 Exciting News! GPARENCY Revolutionizes the Acquisition Calculator with AI-Powered Summaries!We are thrilled to announce the latest addition to our industry-leading acquisition calculator! Introducing the brand new AI summary feature, powered by #chatgpt, which takes our platform to a whole new level of efficiency and convenience.Now, not only can you underwrite property deals on-the-go, straight from your phone, but you can also receive a comprehensive summary of the results for your neighborhood analysis. Within minutes, you'll have access to crucial metrics such as Cap rate, IRR, DSCR, Cash-on-Cash, future cash flow projections, and even waterfall splits.Sharing your investment analyses with investors and partners has never been easier. The AI summary condenses all the vital information, making it a breeze to communicate the potential of each opportunity effectively.This is just the initial phase of our AI integration, and we're committed to continuous improvement. We encourage you to check out the snapshot or visit the static page through the provided link to experience the power of AI in action.As always, our commitment to accessibility remains unchanged – this incredible feature, like everything else on our marketplace, comes at absolutely no cost!Help us spread the word by liking, commenting, and tagging anyone who could benefit from this game-changing enhancement.At GPARENCY, we're dedicated to empowering real estate professionals with cutting-edge tools, and this AI summary is just the beginning. Stay tuned for even more exciting updates and features in the future!#AIpowered #realestate #calculator #innovation #propertyinvestments #irr",62,16,4,https://www.linkedin.com/search/results/content/?fromMember=%5B%22ACoAAACLh-UBAabHGjZ6tXgzeFeDFY3RKkQxljI%22%5D&heroEntityKey=urn%3Ali%3Afsd_profile%3AACoAAACLh-UBAabHGjZ6tXgzeFeDFY3RKkQxljI&keywords=ira%20zlotowitz&origin=CLUSTER_EXPANSION&position=0&searchId=5b92b410-b505-477f-a2c0-4c74dbd5b9b1&sid=BOL&sortBy=%22date_posted%22
Ira Zlotowitz,Male,2024-01-27,I posted this 30 minutes ago on the famous Real Deal chat:Please like and comment to spread the positivity.,61,7,0,https://www.linkedin.com/search/results/content/?fromMember=%5B%22ACoAAACLh-UBAabHGjZ6tXgzeFeDFY3RKkQxljI%22%5D&heroEntityKey=urn%3Ali%3Afsd_profile%3AACoAAACLh-UBAabHGjZ6tXgzeFeDFY3RKkQxljI&keywords=ira%20zlotowitz&origin=CLUSTER_EXPANSION&position=0&searchId=5b92b410-b505-477f-a2c0-4c74dbd5b9b1&sid=BOL&sortBy=%22date_posted%22
Ira Zlotowitz,Male,2023-05-27,"If you are on LinkedIn you must care enough to watch this video so you can at least see the direction of the future. Let’s not debate how much of this will happen by when, let’s just take in the direction where we are heading. Cool?",61,22,0,https://www.linkedin.com/search/results/content/?fromMember=%5B%22ACoAAACLh-UBAabHGjZ6tXgzeFeDFY3RKkQxljI%22%5D&heroEntityKey=urn%3Ali%3Afsd_profile%3AACoAAACLh-UBAabHGjZ6tXgzeFeDFY3RKkQxljI&keywords=ira%20zlotowitz&origin=CLUSTER_EXPANSION&position=0&searchId=5b92b410-b505-477f-a2c0-4c74dbd5b9b1&sid=BOL&sortBy=%22date_posted%22
Ira Zlotowitz,Male,2023-08-27,"Free!!!Thanks to your continued enthusiasm, engagement, and support, GPARENCY’s digital marketplace now has the fourth most listings of any public commercial real estate platform from over 10,000 contributing listing brokers!This includes new opportunities across:-Multifamily -Industrial -Mixed-use -Hotels -Office -And many more!Start exploring listings to connect directly with brokers, match to lenders, and access our underwriting calculator to underwrite deals in minutes!Explore 100K listings and counting - click on the link in the comments below to get started.#GPARENCY #realestatelistings #commercialrealestate #listings",60,6,3,https://www.linkedin.com/search/results/content/?fromMember=%5B%22ACoAAACLh-UBAabHGjZ6tXgzeFeDFY3RKkQxljI%22%5D&heroEntityKey=urn%3Ali%3Afsd_profile%3AACoAAACLh-UBAabHGjZ6tXgzeFeDFY3RKkQxljI&keywords=ira%20zlotowitz&origin=CLUSTER_EXPANSION&position=0&searchId=5b92b410-b505-477f-a2c0-4c74dbd5b9b1&sid=BOL&sortBy=%22date_posted%22
Ira Zlotowitz,Male,2023-06-27,"Giving back the keys 🔑 is taking on a whole new meaning!For my whole real estate career, when the market turned sour, the common next step was that the GP’s that were hurting would be giving back their keys to the lender. I am hearing more and more that GP’s are turning to their investors - LP’s - and saying I have no more skin and upside in this deal, here are the keys. What are your thoughts? And, how do you think this will be playing out. Joseph Kahn Shlomo Chopp",59,43,1,https://www.linkedin.com/search/results/content/?fromMember=%5B%22ACoAAACLh-UBAabHGjZ6tXgzeFeDFY3RKkQxljI%22%5D&heroEntityKey=urn%3Ali%3Afsd_profile%3AACoAAACLh-UBAabHGjZ6tXgzeFeDFY3RKkQxljI&keywords=ira%20zlotowitz&origin=CLUSTER_EXPANSION&position=0&searchId=5b92b410-b505-477f-a2c0-4c74dbd5b9b1&sid=BOL&sortBy=%22date_posted%22
Ira Zlotowitz,Male,2023-11-27,"I am personally training all new hires!With everything going on in the market, NOW is the best time to break into commercial real estate!Please tag a great salesperson that is looking to start a career in commercial real estate or switch careers into commercial real estate!https://lnkd.in/efy_DJP7",59,10,3,https://www.linkedin.com/search/results/content/?fromMember=%5B%22ACoAAACLh-UBAabHGjZ6tXgzeFeDFY3RKkQxljI%22%5D&heroEntityKey=urn%3Ali%3Afsd_profile%3AACoAAACLh-UBAabHGjZ6tXgzeFeDFY3RKkQxljI&keywords=ira%20zlotowitz&origin=CLUSTER_EXPANSION&position=0&searchId=5b92b410-b505-477f-a2c0-4c74dbd5b9b1&sid=BOL&sortBy=%22date_posted%22
Ira Zlotowitz,Male,2023-12-27,Best comeback when a potential client tells you that you are too PERSISTENT!Agree? What would your comeback be?,58,19,0,https://www.linkedin.com/search/results/content/?fromMember=%5B%22ACoAAACLh-UBAabHGjZ6tXgzeFeDFY3RKkQxljI%22%5D&heroEntityKey=urn%3Ali%3Afsd_profile%3AACoAAACLh-UBAabHGjZ6tXgzeFeDFY3RKkQxljI&keywords=ira%20zlotowitz&origin=CLUSTER_EXPANSION&position=0&searchId=5b92b410-b505-477f-a2c0-4c74dbd5b9b1&sid=BOL&sortBy=%22date_posted%22
Ira Zlotowitz,Male,2023-05-27,Have any ideas or constructive criticism?Now that we launched our FREE industry changing feature - $15mm in the making - we are about to do a major marketing campaign.  Up next… the acquisition calculator and then the ability for GP’s to share notes and documents with their LP’s. GPARENCY #gparency,58,15,4,https://www.linkedin.com/search/results/content/?fromMember=%5B%22ACoAAACLh-UBAabHGjZ6tXgzeFeDFY3RKkQxljI%22%5D&heroEntityKey=urn%3Ali%3Afsd_profile%3AACoAAACLh-UBAabHGjZ6tXgzeFeDFY3RKkQxljI&keywords=ira%20zlotowitz&origin=CLUSTER_EXPANSION&position=0&searchId=5b92b410-b505-477f-a2c0-4c74dbd5b9b1&sid=BOL&sortBy=%22date_posted%22
Ira Zlotowitz,Male,2023-11-27,Last week was the turning point in CRE!Agree?Please comment with your thoughts.,58,16,1,https://www.linkedin.com/search/results/content/?fromMember=%5B%22ACoAAACLh-UBAabHGjZ6tXgzeFeDFY3RKkQxljI%22%5D&heroEntityKey=urn%3Ali%3Afsd_profile%3AACoAAACLh-UBAabHGjZ6tXgzeFeDFY3RKkQxljI&keywords=ira%20zlotowitz&origin=CLUSTER_EXPANSION&position=0&searchId=5b92b410-b505-477f-a2c0-4c74dbd5b9b1&sid=BOL&sortBy=%22date_posted%22
Ira Zlotowitz,Male,2023-07-27,"You must adapt!!!!As the eternal optimist, I was holding back from posting this article and recent similar ones appearing in The Wall Street Journal, Yahoo Finance, Bloomberg, and others. I was forwarded this New York Post article (link in comments) from a very prominent commercial real estate professional and I felt the need to share this. There is a famous top selling book called Who Moved My Cheese. The book describes two executives, one that stayed in the loop of all the changes in the world and the other that felt safe in the company he was at. After 25 years they both got laid off. The first person had no issue getting a new job and the second is stilll looking. I keep talking about technology and AI. I will repeat what I posted almost a year ago, AI WILL NOT REPLACE ANYONE! HOWEVER, THOSE USING AI WILL REPLACE THOSE THAT ARE NOT! My advice to my network is to start embracing every technology. The less experienced employee using AI is more advanced than the senior executive who is not - no question!!!What is exasperating the situation even more is that with remote work, the gig economy is taking off even more to the point that companies can hire consultants and vendors for many targeted skillsets vs keeping a top tier person on house that is a Jack of all trades. For example, at GPARENCY, we have the most amazing marketing coordinator and every other marketing role is outsourced to people and firms with specific talents and the team is working out amazingly with incredible results. Take this as a positive wake up call to adapt, then with God’s help each of you will be better off than you were before. Thoughts?",57,14,0,https://www.linkedin.com/search/results/content/?fromMember=%5B%22ACoAAACLh-UBAabHGjZ6tXgzeFeDFY3RKkQxljI%22%5D&heroEntityKey=urn%3Ali%3Afsd_profile%3AACoAAACLh-UBAabHGjZ6tXgzeFeDFY3RKkQxljI&keywords=ira%20zlotowitz&origin=CLUSTER_EXPANSION&position=0&searchId=5b92b410-b505-477f-a2c0-4c74dbd5b9b1&sid=BOL&sortBy=%22date_posted%22
Ira Zlotowitz,Male,2024-02-27,"Thank God we just closed - $10.75mm today and the client only paid a 1/2 a point fee!!Congrats to the client, bank and team!This client chose to get the same top brokerage services of GPARENCY but instead of paying - much lower fees upfront, chose the option to pay 1/2 a point at closing instead. GPARENCY is the only premier commercial mortgage broker that gives a client options.  These our main 5 products:1. Full service brokerage paying only 1/2 a point at closing capped at $100k2. Full service brokerage only $11k upfront and nothing at closing. 3. Full service brokerage until the term sheet is signed $4,500 upfront and nothing at closing. 4. Agency direct for $4,500 where you get the benefits of direct while we do the initial package for you to send, we create the competition, we advise behind the scenes and you pay zero at closing. 5. Go direct with our curated lender list $495!Our 100 nationwide mortgage brokers are waiting to service you!",57,11,3,https://www.linkedin.com/search/results/content/?fromMember=%5B%22ACoAAACLh-UBAabHGjZ6tXgzeFeDFY3RKkQxljI%22%5D&heroEntityKey=urn%3Ali%3Afsd_profile%3AACoAAACLh-UBAabHGjZ6tXgzeFeDFY3RKkQxljI&keywords=ira%20zlotowitz&origin=CLUSTER_EXPANSION&position=0&searchId=5b92b410-b505-477f-a2c0-4c74dbd5b9b1&sid=BOL&sortBy=%22date_posted%22
Ira Zlotowitz,Male,2023-12-27,"“A good name is better than precious oil”The only thing you can control in this world is your good name!Especially with everything going on now, there is nothing more important than the people you do business with and on your personal relationships know that your word is your bond and that you never get involved in doing anything that is less than kosher!Honesty isn’t the best policy, it is the only policy!And as I explain in the video, with this approach you now know why a new salesperson can hit the phones from day one!",57,13,1,https://www.linkedin.com/search/results/content/?fromMember=%5B%22ACoAAACLh-UBAabHGjZ6tXgzeFeDFY3RKkQxljI%22%5D&heroEntityKey=urn%3Ali%3Afsd_profile%3AACoAAACLh-UBAabHGjZ6tXgzeFeDFY3RKkQxljI&keywords=ira%20zlotowitz&origin=CLUSTER_EXPANSION&position=0&searchId=5b92b410-b505-477f-a2c0-4c74dbd5b9b1&sid=BOL&sortBy=%22date_posted%22
Ira Zlotowitz,Male,2023-05-27,"Taking risks and making necessary pivots in business can lead to unforeseen opportunities and growth. Even in moments of failure, there are lessons to be learned and chances to improve that can help your business thrive.",57,8,2,https://www.linkedin.com/search/results/content/?fromMember=%5B%22ACoAAACLh-UBAabHGjZ6tXgzeFeDFY3RKkQxljI%22%5D&heroEntityKey=urn%3Ali%3Afsd_profile%3AACoAAACLh-UBAabHGjZ6tXgzeFeDFY3RKkQxljI&keywords=ira%20zlotowitz&origin=CLUSTER_EXPANSION&position=0&searchId=5b92b410-b505-477f-a2c0-4c74dbd5b9b1&sid=BOL&sortBy=%22date_posted%22
Ira Zlotowitz,Male,2024-02-27,Thank you to my LinkedIn audience For your confidence and support.,56,12,0,https://www.linkedin.com/search/results/content/?fromMember=%5B%22ACoAAACLh-UBAabHGjZ6tXgzeFeDFY3RKkQxljI%22%5D&heroEntityKey=urn%3Ali%3Afsd_profile%3AACoAAACLh-UBAabHGjZ6tXgzeFeDFY3RKkQxljI&keywords=ira%20zlotowitz&origin=CLUSTER_EXPANSION&position=0&searchId=5b92b410-b505-477f-a2c0-4c74dbd5b9b1&sid=BOL&sortBy=%22date_posted%22
Ira Zlotowitz,Male,2023-11-27,"Happy Chanukah from GPARENCY!May the celebration of the miracle of Chanukah during this Festival of Lights bring you warmth, joy, and many blessings.#GPARENCY #realestate #chanukah #hanukkah",56,6,1,https://www.linkedin.com/search/results/content/?fromMember=%5B%22ACoAAACLh-UBAabHGjZ6tXgzeFeDFY3RKkQxljI%22%5D&heroEntityKey=urn%3Ali%3Afsd_profile%3AACoAAACLh-UBAabHGjZ6tXgzeFeDFY3RKkQxljI&keywords=ira%20zlotowitz&origin=CLUSTER_EXPANSION&position=0&searchId=5b92b410-b505-477f-a2c0-4c74dbd5b9b1&sid=BOL&sortBy=%22date_posted%22
Ira Zlotowitz,Male,2023-05-27,"My father’s Yahrzeit (6th anniversary of his passing) is tomorrow. The attached was put together and distributed in shuls this past Shabbos by ArtScroll Mesorah Publications. He was my role model and I miss him dearly. He instilled in all his kids was that the drive in life is not the money but rather what good can be done with the money. God willing as GPARENCY continues to take off and go public IYH, I will be able to make an even greater impact on the world. As my LinkedIn family knows, I was fortunate to go every year to his Kever (burial spot) in Israel on his Yahrtzeit, even during covid. This is the first year that I won’t be going - but for good reason - as I was blessed with a grandson last week and the bris is on the Yahrzeit.If you knew or benefited from my dads work, please share your greatest memory or takeaway.",55,19,0,https://www.linkedin.com/search/results/content/?fromMember=%5B%22ACoAAACLh-UBAabHGjZ6tXgzeFeDFY3RKkQxljI%22%5D&heroEntityKey=urn%3Ali%3Afsd_profile%3AACoAAACLh-UBAabHGjZ6tXgzeFeDFY3RKkQxljI&keywords=ira%20zlotowitz&origin=CLUSTER_EXPANSION&position=0&searchId=5b92b410-b505-477f-a2c0-4c74dbd5b9b1&sid=BOL&sortBy=%22date_posted%22
