Author,Gender,Date,Post Text,Likes,Comments,Shares,Page Link
Jared Robin,Male,2024-03-27,"I want to find the top new SaaS GTM Startups on LinkedIn:Early-stage startups are being overshadowed by larger ones.And I’m not seeing all the new tech.So I'm looking to connect with more up-and-coming Startups on LinkedIn.So, if you're a startup that is at Seed or Series A, drop 2 lines below:→ What's your business?→ Who is 1 other startup worth following?Who are the Next Sales Tech, Martech, RevOps tech, CS tech, and AI GTM tech brands should we all should be following?Tag ‘em. Tag their founders. And submit them here -> https://lnkd.in/e2Y5y3W7We are working on building this out even more to showcase a bunch of incredible emerging brands.Let's help emerging startup brands grow.Out with the old. In with the Next.⏭️",86,60,2,https://www.linkedin.com/search/results/content/?fromMember=%5B%22ACoAAAEIWl4BLcwZ2LsfQPuZwbC59c4qsXYnBBE%22%5D&heroEntityKey=urn%3Ali%3Afsd_profile%3AACoAAAEIWl4BLcwZ2LsfQPuZwbC59c4qsXYnBBE&keywords=jared%20robin%20%E2%8F%AD&position=0&searchId=22273820-2f65-493d-b052-8a269b29ddb1&sid=%3BOA&sortBy=%22date_posted%22&update=urn%3Ali%3Afs_updateV2%3A(urn%3Ali%3Aactivity%3A7189280176948617216%2CBLENDED_SEARCH_FEED%2CEMPTY%2CDEFAULT%2Cfalse)
Jared Robin,Male,2023-11-27,"I created a side hustle with:- no logo- basic name- basic layout - tons of passionIn under 2 months passed 1,100 subscribers.The movement The Community is creating is real.Tired of seeing folks going to the new shiny thing.Time to show the world the power of collaboration.New issue drops today.👇🏼",86,26,0,https://www.linkedin.com/search/results/content/?fromMember=%5B%22ACoAAAEIWl4BLcwZ2LsfQPuZwbC59c4qsXYnBBE%22%5D&heroEntityKey=urn%3Ali%3Afsd_profile%3AACoAAAEIWl4BLcwZ2LsfQPuZwbC59c4qsXYnBBE&keywords=jared%20robin%20%E2%8F%AD&position=0&searchId=22273820-2f65-493d-b052-8a269b29ddb1&sid=%3BOA&sortBy=%22date_posted%22&update=urn%3Ali%3Afs_updateV2%3A(urn%3Ali%3Aactivity%3A7189280176948617216%2CBLENDED_SEARCH_FEED%2CEMPTY%2CDEFAULT%2Cfalse)
Jared Robin,Male,2023-07-27,Category Designers talking about category creation 🤯What a night of great food and drinks and incredible minds with Category Design Advisors & Category Thinkers.Meeting Pablo Gonzalez 🏴‍☠️🧠 (in pic) & John Rougeux 🏴‍☠️ was a highlight of my night. Kevin Maney x Mike Damphousse were also exceptional hosts. Add in all the others that are 1000x smarter than me and I knew I was in the right room. Grateful to learn and grow from folks changing the game. Have you ever thought about building a category? 🙏🏼,86,20,0,https://www.linkedin.com/search/results/content/?fromMember=%5B%22ACoAAAEIWl4BLcwZ2LsfQPuZwbC59c4qsXYnBBE%22%5D&heroEntityKey=urn%3Ali%3Afsd_profile%3AACoAAAEIWl4BLcwZ2LsfQPuZwbC59c4qsXYnBBE&keywords=jared%20robin%20%E2%8F%AD&position=0&searchId=22273820-2f65-493d-b052-8a269b29ddb1&sid=%3BOA&sortBy=%22date_posted%22&update=urn%3Ali%3Afs_updateV2%3A(urn%3Ali%3Aactivity%3A7189280176948617216%2CBLENDED_SEARCH_FEED%2CEMPTY%2CDEFAULT%2Cfalse)
Jared Robin,Male,2024-04-13,"Pitch Your SaaS startup 🏆 Or product, or whatever you got 💪 Just make sure to tell us how it will help us make or save money 💰 Let’s discover the Next rocketship 🚀PS: Thousands of people will see this 👀",85,42,3,https://www.linkedin.com/search/results/content/?fromMember=%5B%22ACoAAAEIWl4BLcwZ2LsfQPuZwbC59c4qsXYnBBE%22%5D&heroEntityKey=urn%3Ali%3Afsd_profile%3AACoAAAEIWl4BLcwZ2LsfQPuZwbC59c4qsXYnBBE&keywords=jared%20robin%20%E2%8F%AD&position=0&searchId=22273820-2f65-493d-b052-8a269b29ddb1&sid=%3BOA&sortBy=%22date_posted%22&update=urn%3Ali%3Afs_updateV2%3A(urn%3Ali%3Aactivity%3A7189280176948617216%2CBLENDED_SEARCH_FEED%2CEMPTY%2CDEFAULT%2Cfalse)
Jared Robin,Male,2024-04-13,"In this week’s Collab, I unpacked Clay’s Creator GTM Playbook with Thomas Colitsas , Growth at Clay:Three big things right now that they’re focusing on the community and PLG front:1. Creators Program:Which is effectively a UGC engine is the goal. So their goal is to empower people that are thought leaders in the outbound and inbound sales automation space to create better content. So they build a ton of tools and infrastructure to make that process easier for them, kind of allowing them to grow alongside Clay. 2. Experts Program:Which the goal is to create the premier marketplace for agencies and freelancers also in the sales automation space. So kind of a very high bar for people that really, really know how to build these motions at companies. And then people that are other businesses that are trying to incorporate these practices know to come to us to kind of find the best. 3. Templates Infrastructure:So effectively building a way for people to quickly find workflows that have been built by others and reproduce them for their specific use case. And you can go to clay.com templates to learn more. And it makes a lot of sense in the context of Clay’s product.He shouted out Figma ‘s community growth strategies as Inspo.Clay is building something I believe will be as potent as Figma if not more. Read the full interview: https://lnkd.in/eNf9pK-iWhat other companies do you love with killer community & creator growth strategies?",85,11,2,https://www.linkedin.com/search/results/content/?fromMember=%5B%22ACoAAAEIWl4BLcwZ2LsfQPuZwbC59c4qsXYnBBE%22%5D&heroEntityKey=urn%3Ali%3Afsd_profile%3AACoAAAEIWl4BLcwZ2LsfQPuZwbC59c4qsXYnBBE&keywords=jared%20robin%20%E2%8F%AD&position=0&searchId=22273820-2f65-493d-b052-8a269b29ddb1&sid=%3BOA&sortBy=%22date_posted%22&update=urn%3Ali%3Afs_updateV2%3A(urn%3Ali%3Aactivity%3A7189280176948617216%2CBLENDED_SEARCH_FEED%2CEMPTY%2CDEFAULT%2Cfalse)
Jared Robin,Male,2024-04-26,"Who's Next? ⏭️We are curating the Next 50 Series A startups who are shaking things up. Criteria: Series A or earlier in go-to-market tech (supporting revenue functions)Do you know any? Submit here-> https://lnkd.in/eG_vRviK!🌟 Meet the Next GTM Creators 🌟We are introducing you to three new creators.You can check out the entire list https://hubs.li/Q02lLYgS0.1. 🎁 Katie Penner  - Head of Sender Relations at Sendoso  🚀Katie brings her sales background to run social, content, and direct marketing programs. Passionate, driven, and super creative—high five!2. Jc Pollard  - Senior Account Executive at Gong  🚀Jc is a master of creative outreach. He shares his insights and lessons on sales and he’s also the host of “The Up and UP” podcast, where he chats with top sellers.3. Katrine Reddin 🦕  - Head of Sales & Partnerships at Commsor 🦕  and Co-host of Ashley & Katrine's Infinite Revenue Playlist  🚀Katrine is our go-to girl in sales! A pro at her job, she’s also dedicated to empowering women in tech. Super cool!If you don't follow them on LinkedIn, do it right away! 💯",85,13,3,https://www.linkedin.com/search/results/content/?fromMember=%5B%22ACoAAAEIWl4BLcwZ2LsfQPuZwbC59c4qsXYnBBE%22%5D&heroEntityKey=urn%3Ali%3Afsd_profile%3AACoAAAEIWl4BLcwZ2LsfQPuZwbC59c4qsXYnBBE&keywords=jared%20robin%20%E2%8F%AD&position=0&searchId=22273820-2f65-493d-b052-8a269b29ddb1&sid=%3BOA&sortBy=%22date_posted%22&update=urn%3Ali%3Afs_updateV2%3A(urn%3Ali%3Aactivity%3A7189280176948617216%2CBLENDED_SEARCH_FEED%2CEMPTY%2CDEFAULT%2Cfalse)
Jared Robin,Male,2024-04-06,"I got to sit down with Morgan J Ingram  and break down his B2B Influencer Marketing Playbook:Morgan is the founder and CEO of Amp. They enable B2B organizations to leverage B2B influencers, subject matter experts to produce pipeline generating content. There's three tiers to influencer marketing that he’s now identified and distinguished.Brand ambassador:This is someone who typically would act as, like, an affiliate. So, like, you may have someone who's starting out, but they just don't have a bigger follower count, but they have a really niche and engaged audience. Test it out and use, like, affiliates and things of that nature, affiliate links, et cetera.The Influencer:What everyone's doing right now. You pay someone x amount for them to post about your brands, and then you may have some other things that you do with them, some videos, some activations, cool things that we've seen on LinkedIn.The SME (Subject Matter Expert):Morgan believes this is the true north star of B2B influencer marketing. People who have expertise are credible in their field and in their craft, so they're able to develop and create credible content that people actually want to consume and the buyers want to hear from, which leads to you getting more pipeline.  They are able to integrate into the companies day to day GTM motion.Companies he thinks are doing content well (follow them): Cognism , Kaspr , Champify , HockeyStack , AudiencePlus He breaks this down fully in this week’s collab ->  https://lnkd.in/evPXrPGK🐝",84,34,1,https://www.linkedin.com/search/results/content/?fromMember=%5B%22ACoAAAEIWl4BLcwZ2LsfQPuZwbC59c4qsXYnBBE%22%5D&heroEntityKey=urn%3Ali%3Afsd_profile%3AACoAAAEIWl4BLcwZ2LsfQPuZwbC59c4qsXYnBBE&keywords=jared%20robin%20%E2%8F%AD&position=0&searchId=22273820-2f65-493d-b052-8a269b29ddb1&sid=%3BOA&sortBy=%22date_posted%22&update=urn%3Ali%3Afs_updateV2%3A(urn%3Ali%3Aactivity%3A7189280176948617216%2CBLENDED_SEARCH_FEED%2CEMPTY%2CDEFAULT%2Cfalse)
Jared Robin,Male,2023-12-27,"I spent the last couple of years asking the biggest GTM leaders in space to debunk their top GTM myth.Here's the top 10:Myth 1: You need venture capital to build a company. (Andrew Gazdecki)Myth 2: You can only do one thing well. (Eden Gorcey, CRO)Myth 3: The most critical North Star metric for sales is revenue. (Mark Roberge)Myth 4: Sales reps close deals. (Nate Nasralla)Myth 5: Sales is just a numbers game. (Paul Rosen, CRO ShipBob)Myth 6: Salespeople are the best salespeople. (Stevie Case, CRO Vanta)Myth 7: Email delivery is dead. (Jesse Ouellette)Myth 8: If you have a good product and a really good sales team, you don’t need marketing.  (Olivier Labbé)Myth 9: Social doesn’t work for me. (🎙️ Darryl Praill)Myth 10: You must lead with ROI. (Jen Allen-Knuth)Link to the full pods in the comments. 👇Which do you agree with most?Any you'd like to add?",84,34,0,https://www.linkedin.com/search/results/content/?fromMember=%5B%22ACoAAAEIWl4BLcwZ2LsfQPuZwbC59c4qsXYnBBE%22%5D&heroEntityKey=urn%3Ali%3Afsd_profile%3AACoAAAEIWl4BLcwZ2LsfQPuZwbC59c4qsXYnBBE&keywords=jared%20robin%20%E2%8F%AD&position=0&searchId=22273820-2f65-493d-b052-8a269b29ddb1&sid=%3BOA&sortBy=%22date_posted%22&update=urn%3Ali%3Afs_updateV2%3A(urn%3Ali%3Aactivity%3A7189280176948617216%2CBLENDED_SEARCH_FEED%2CEMPTY%2CDEFAULT%2Cfalse)
Jared Robin,Male,2023-06-27,Open Call:500+ Revenue Leaders joined us on our first episode of Unf*ck My Funnel with our partner Reveal.Marc Mac  ☎️ was the first seller up and got some insightful tips on how to fix his funnel leveraging some Nearbound ideas.This is the Reality TV show SaaS has been waiting for!We are looking for sellers and sales leaders who want to be a part of a future episode!Jared Fuller and I (Jared & Jared) are helping sellers leverage Nearbound motions to help them hit their pipeline goals.Comment below or send me a DM if you want in!,83,30,1,https://www.linkedin.com/search/results/content/?fromMember=%5B%22ACoAAAEIWl4BLcwZ2LsfQPuZwbC59c4qsXYnBBE%22%5D&heroEntityKey=urn%3Ali%3Afsd_profile%3AACoAAAEIWl4BLcwZ2LsfQPuZwbC59c4qsXYnBBE&keywords=jared%20robin%20%E2%8F%AD&position=0&searchId=22273820-2f65-493d-b052-8a269b29ddb1&sid=%3BOA&sortBy=%22date_posted%22&update=urn%3Ali%3Afs_updateV2%3A(urn%3Ali%3Aactivity%3A7189280176948617216%2CBLENDED_SEARCH_FEED%2CEMPTY%2CDEFAULT%2Cfalse)
Jared Robin,Male,2024-04-20,"Who’s in NYC this week?Filming in Brooklyn w the homie Jorge Soto…Full clips dropping soon.But first - AMP today at LinkedIn w Morgan J Ingram , Aneesh Lal and so many more.Who am I seeing there?",82,39,2,https://www.linkedin.com/search/results/content/?fromMember=%5B%22ACoAAAEIWl4BLcwZ2LsfQPuZwbC59c4qsXYnBBE%22%5D&heroEntityKey=urn%3Ali%3Afsd_profile%3AACoAAAEIWl4BLcwZ2LsfQPuZwbC59c4qsXYnBBE&keywords=jared%20robin%20%E2%8F%AD&position=0&searchId=22273820-2f65-493d-b052-8a269b29ddb1&sid=%3BOA&sortBy=%22date_posted%22&update=urn%3Ali%3Afs_updateV2%3A(urn%3Ali%3Aactivity%3A7189280176948617216%2CBLENDED_SEARCH_FEED%2CEMPTY%2CDEFAULT%2Cfalse)
Jared Robin,Male,2024-01-27,"If you're the smartest person in the room, you're in the wrong room.We stood up RevRoom in 2023 and had insane demand-It solved a need many senior leaders had: An intimated and vetted space of trusted executives to help solve their GTM challenges.We’ve got some big plans to double down this year:- Closed AMA sessions with some industry leaders- 1:1 networking and masterminding- Cohorts are capped at 150 members to be intimate- Slack - Members asking questions, sharing wins, venting, laughing, and even occasionally shedding a tear.A few of the GTM VPs & C-Level executives that make up our community include:Sid Kumar (SVP RevOps, Hubspot), Jenn Steele (CEO), Adam Jay (Founder, Revenue Reimagined), Mollie Bodensteiner (RevOps Leader, Sound), Shannon (Sweeny) Curran (VP Marketing, MadKudu), Elizabeth Blass 🌻 (CCO, Karbon), Jan Young, MBA, CSPO, CSM (Founder & CCO, Jan Young CX), Ralphie (Ralphette) English (VP of CS, Deepgram), Chris Eldridge (EVP Operations, Influencer Logic), Dale Zwizinski (Founder, Revenue Reimagined)  and many others from Series A high-growth startups to Public Companies.  They’re talking about big audacious GTM challenges along with personal ones. The leaders in RevRoom are some of the most forward-thinking executives in the space, working at companies ranging in size (Series A to Public) that are collaborating on the future of GTM.If that sounds interesting to you, let us know.Link to join  👇Wanna apply to join? https://lnkd.in/dRK5nqTu",82,23,1,https://www.linkedin.com/search/results/content/?fromMember=%5B%22ACoAAAEIWl4BLcwZ2LsfQPuZwbC59c4qsXYnBBE%22%5D&heroEntityKey=urn%3Ali%3Afsd_profile%3AACoAAAEIWl4BLcwZ2LsfQPuZwbC59c4qsXYnBBE&keywords=jared%20robin%20%E2%8F%AD&position=0&searchId=22273820-2f65-493d-b052-8a269b29ddb1&sid=%3BOA&sortBy=%22date_posted%22&update=urn%3Ali%3Afs_updateV2%3A(urn%3Ali%3Aactivity%3A7189280176948617216%2CBLENDED_SEARCH_FEED%2CEMPTY%2CDEFAULT%2Cfalse)
Jared Robin,Male,2023-12-27,Look at these absolute all-stars I got to lunch with today 🔥,82,24,0,https://www.linkedin.com/search/results/content/?fromMember=%5B%22ACoAAAEIWl4BLcwZ2LsfQPuZwbC59c4qsXYnBBE%22%5D&heroEntityKey=urn%3Ali%3Afsd_profile%3AACoAAAEIWl4BLcwZ2LsfQPuZwbC59c4qsXYnBBE&keywords=jared%20robin%20%E2%8F%AD&position=0&searchId=22273820-2f65-493d-b052-8a269b29ddb1&sid=%3BOA&sortBy=%22date_posted%22&update=urn%3Ali%3Afs_updateV2%3A(urn%3Ali%3Aactivity%3A7189280176948617216%2CBLENDED_SEARCH_FEED%2CEMPTY%2CDEFAULT%2Cfalse)
Jared Robin,Male,2024-03-27,"The grass isn’t always greener…Within 48 hrs of moving into my new office I realized something just wasn’t right.Sure, the space was slightly bigger with more natural light.But, the energy was off. I felt lost and sorta uncomfortable. So here I am, grateful to be back in my old office and loving life. Loved the reminder that the grass isn’t always greener…Happy Monday everyone!",81,25,0,https://www.linkedin.com/search/results/content/?fromMember=%5B%22ACoAAAEIWl4BLcwZ2LsfQPuZwbC59c4qsXYnBBE%22%5D&heroEntityKey=urn%3Ali%3Afsd_profile%3AACoAAAEIWl4BLcwZ2LsfQPuZwbC59c4qsXYnBBE&keywords=jared%20robin%20%E2%8F%AD&position=0&searchId=22273820-2f65-493d-b052-8a269b29ddb1&sid=%3BOA&sortBy=%22date_posted%22&update=urn%3Ali%3Afs_updateV2%3A(urn%3Ali%3Aactivity%3A7189280176948617216%2CBLENDED_SEARCH_FEED%2CEMPTY%2CDEFAULT%2Cfalse)
Jared Robin,Male,2024-04-13,"Showing up is the most important thing you can do, because…It is not the critic who counts; not the man who points out how the strong man stumbles, or where the doer of deeds could have done them better. The credit belongs to the man who is actually in the arena, whose face is marred by dust and sweat and blood; who strives valiantly; who errs, who comes short again and again, because there is no effort without error and shortcoming; but who does actually strive to do the deeds; who knows great enthusiasms, the great devotions; who spends himself in a worthy cause; who at the best knows in the end the triumph of high achievement, and who at the worst, if he fails, at least fails while daring greatly, so that his place shall never be with those cold and timid souls who neither know victory nor defeat.Stick with it. Be the (wo)man in the arena.🙏🏼",81,18,0,https://www.linkedin.com/search/results/content/?fromMember=%5B%22ACoAAAEIWl4BLcwZ2LsfQPuZwbC59c4qsXYnBBE%22%5D&heroEntityKey=urn%3Ali%3Afsd_profile%3AACoAAAEIWl4BLcwZ2LsfQPuZwbC59c4qsXYnBBE&keywords=jared%20robin%20%E2%8F%AD&position=0&searchId=22273820-2f65-493d-b052-8a269b29ddb1&sid=%3BOA&sortBy=%22date_posted%22&update=urn%3Ali%3Afs_updateV2%3A(urn%3Ali%3Aactivity%3A7189280176948617216%2CBLENDED_SEARCH_FEED%2CEMPTY%2CDEFAULT%2Cfalse)
Jared Robin,Male,2024-04-25,"Hey WalkingPad  📣 wanna sponsor my walking pad for my new office?Step 1: Upgrade my office ✅Step 2: Add a standing desk ✅Step 3: Add a walking pad (coming soon)Thank you to Joshua for helping set up this standing desk.Shout out to Stevie Nicks who chilled like a good doggie through all this. Following: walking meetings Shout out FlexiSpot who I got a desk from. Right mix of price and function. 44 sq ft looks roomie af.Humbled by the journey. If y’all want my fitness routine, diet, or office set up, shoot questions in comments.Here for it.PS how dope would a WalkingPad brand walking bad look - hmu! I’m down for a small campaign.",81,45,1,https://www.linkedin.com/search/results/content/?fromMember=%5B%22ACoAAAEIWl4BLcwZ2LsfQPuZwbC59c4qsXYnBBE%22%5D&heroEntityKey=urn%3Ali%3Afsd_profile%3AACoAAAEIWl4BLcwZ2LsfQPuZwbC59c4qsXYnBBE&keywords=jared%20robin%20%E2%8F%AD&position=0&searchId=22273820-2f65-493d-b052-8a269b29ddb1&sid=%3BOA&sortBy=%22date_posted%22&update=urn%3Ali%3Afs_updateV2%3A(urn%3Ali%3Aactivity%3A7189280176948617216%2CBLENDED_SEARCH_FEED%2CEMPTY%2CDEFAULT%2Cfalse)
Jared Robin,Male,2023-09-27,"Going to market without community is like selling without automation.Manual, tedious, and not as easy to scale.Here's how Syncari used community to grow its pipeline over $1M. 👇1. Crash test for their productChallenge: Refine positioning to make it problem- and customer-centric.Solution: Community is the place to listen and field test.2. Cut through the noiseChallenge: Social media platforms are saturated.Solution: Community offers a stable, conversational environment.3. Amplification across targeted persona / ICPChallenge: content wasn't being seen by enough prospects.Solution: Community provided a highly targeted audience.Breakdown:1. Crash test product2. Cut through noise3. AmplificationResults:50+ new opportunities20% increase in pipeline$1M in net new pipeline generatedSyncari’s brand awareness and new partnerships also went 📈.Give yourself every advantage, and add a community plan into your GTM.🌊",81,37,1,https://www.linkedin.com/search/results/content/?fromMember=%5B%22ACoAAAEIWl4BLcwZ2LsfQPuZwbC59c4qsXYnBBE%22%5D&heroEntityKey=urn%3Ali%3Afsd_profile%3AACoAAAEIWl4BLcwZ2LsfQPuZwbC59c4qsXYnBBE&keywords=jared%20robin%20%E2%8F%AD&position=0&searchId=22273820-2f65-493d-b052-8a269b29ddb1&sid=%3BOA&sortBy=%22date_posted%22&update=urn%3Ali%3Afs_updateV2%3A(urn%3Ali%3Aactivity%3A7189280176948617216%2CBLENDED_SEARCH_FEED%2CEMPTY%2CDEFAULT%2Cfalse)
Jared Robin,Male,2024-01-27,Got nominated for Rev_Tech Thought_Leader by Signals Some tremendous leaders are also nominated; I'm humbled.I'd be super grateful if you could vote for me: https://lnkd.in/eRFhfDVdSuper humbled to be sharing the stage with the best of the best in SaaS.Thank you all for your support!🐝,81,29,1,https://www.linkedin.com/search/results/content/?fromMember=%5B%22ACoAAAEIWl4BLcwZ2LsfQPuZwbC59c4qsXYnBBE%22%5D&heroEntityKey=urn%3Ali%3Afsd_profile%3AACoAAAEIWl4BLcwZ2LsfQPuZwbC59c4qsXYnBBE&keywords=jared%20robin%20%E2%8F%AD&position=0&searchId=22273820-2f65-493d-b052-8a269b29ddb1&sid=%3BOA&sortBy=%22date_posted%22&update=urn%3Ali%3Afs_updateV2%3A(urn%3Ali%3Aactivity%3A7189280176948617216%2CBLENDED_SEARCH_FEED%2CEMPTY%2CDEFAULT%2Cfalse)
Jared Robin,Male,2023-10-27,"Proof.Game 2 was closer.I beat 🔥 Tom Slocum by 1.I can’t remember when I had more fun than when Travis joined Tom and I rolling balls down lane after lane after lane. Getting a ton of strikes and spares that there are no records of.🙄Thank you Ambition for allowing me to feel 16 again. My gratitude is overflowing for Mari Klotzbach and Mary Foster and team. As good as the conference was (I loved it), this team is one of the kindest, hardest working, and hustling teams in SaaS.Buy Ambition Eat Hattie B's Hot Chicken Hang with Darren, 💜, Jen, Chelsea (and others)Build CommunityWin at life❤️",80,42,0,https://www.linkedin.com/search/results/content/?fromMember=%5B%22ACoAAAEIWl4BLcwZ2LsfQPuZwbC59c4qsXYnBBE%22%5D&heroEntityKey=urn%3Ali%3Afsd_profile%3AACoAAAEIWl4BLcwZ2LsfQPuZwbC59c4qsXYnBBE&keywords=jared%20robin%20%E2%8F%AD&position=0&searchId=22273820-2f65-493d-b052-8a269b29ddb1&sid=%3BOA&sortBy=%22date_posted%22&update=urn%3Ali%3Afs_updateV2%3A(urn%3Ali%3Aactivity%3A7189280176948617216%2CBLENDED_SEARCH_FEED%2CEMPTY%2CDEFAULT%2Cfalse)
Jared Robin,Male,2024-01-27,"Open to collaborations this weekend?It’s the #collabsaturday connections post for collaborative growth.Let's set our intentions to start 2024 with a bang and meet some new people to grow with!People have gotten 100s of new connections.Want to see if we can get some folks some collaborations ($$$) too.If you’re open to work, hiring, or collaborating, this is the post for you.Here’s the format:👋 Connect with me!🔗 Link me in because ...🚀 I can help with ...🥳 Tagging these people to join this collaboration party…Featured zoë hartsfield Amelia Taylor Vin Matano Jacki Leahy ✨ Jodie Pait Wayne Morris David M. ☑️Lisa K. Nick Bennett Neil W. Lee Moskowitz 🌈 Mike Simmons Kevin Gaither Tenisha Griggs Brianna Doe Alexis Rivera Scott Melissa Gaglione✨ This week’s newsletter sponsor: Common Room -> https://lnkd.in/eiQvsXwhDropped the 'Mastering the 'How' in Collaboration' issue today in my newsletter (comments to read/ sign up). 🐝👇Sign up 👉 https://lnkd.in/eNRH4V5q",80,98,1,https://www.linkedin.com/search/results/content/?fromMember=%5B%22ACoAAAEIWl4BLcwZ2LsfQPuZwbC59c4qsXYnBBE%22%5D&heroEntityKey=urn%3Ali%3Afsd_profile%3AACoAAAEIWl4BLcwZ2LsfQPuZwbC59c4qsXYnBBE&keywords=jared%20robin%20%E2%8F%AD&position=0&searchId=22273820-2f65-493d-b052-8a269b29ddb1&sid=%3BOA&sortBy=%22date_posted%22&update=urn%3Ali%3Afs_updateV2%3A(urn%3Ali%3Aactivity%3A7189280176948617216%2CBLENDED_SEARCH_FEED%2CEMPTY%2CDEFAULT%2Cfalse)
Jared Robin,Male,2023-09-27,Perspective is everything 👀,80,23,1,https://www.linkedin.com/search/results/content/?fromMember=%5B%22ACoAAAEIWl4BLcwZ2LsfQPuZwbC59c4qsXYnBBE%22%5D&heroEntityKey=urn%3Ali%3Afsd_profile%3AACoAAAEIWl4BLcwZ2LsfQPuZwbC59c4qsXYnBBE&keywords=jared%20robin%20%E2%8F%AD&position=0&searchId=22273820-2f65-493d-b052-8a269b29ddb1&sid=%3BOA&sortBy=%22date_posted%22&update=urn%3Ali%3Afs_updateV2%3A(urn%3Ali%3Aactivity%3A7189280176948617216%2CBLENDED_SEARCH_FEED%2CEMPTY%2CDEFAULT%2Cfalse)
Jared Robin,Male,2023-09-27,"I'm pretty damn excited to announce this:- Ambition has been homies since go- First time in Nashville, TN- Nashville Hot Chicken- Moderating AI Panel - IRL EventI'm amped to be chatting about how to champion ai-led digital transformation.Will you be there?",79,53,1,https://www.linkedin.com/search/results/content/?fromMember=%5B%22ACoAAAEIWl4BLcwZ2LsfQPuZwbC59c4qsXYnBBE%22%5D&heroEntityKey=urn%3Ali%3Afsd_profile%3AACoAAAEIWl4BLcwZ2LsfQPuZwbC59c4qsXYnBBE&keywords=jared%20robin%20%E2%8F%AD&position=0&searchId=22273820-2f65-493d-b052-8a269b29ddb1&sid=%3BOA&sortBy=%22date_posted%22&update=urn%3Ali%3Afs_updateV2%3A(urn%3Ali%3Aactivity%3A7189280176948617216%2CBLENDED_SEARCH_FEED%2CEMPTY%2CDEFAULT%2Cfalse)
