Author,Gender,Date,Post Text,Likes,Comments,Shares,Page Link
Jared Robin,Male,2023-09-27,"Notion is famous for building a community-led growth powerhouse.Steal this community-building gameplan from Notion:- Notion built its first community on Reddit- Users could share tips, ask questions,  use cases- Notion's team actively participated in the subreddit- Held AMAs to help - Encouraged users to share templates & workflows - Fostered collaboration- Rolled out localized communities for IRL meetups- Rolled out a 'become an ambassador' programThis added so much fuel to their PLG growth loops.Particularly their templates one (powerful). Users submitted templates and Notion displayed them to folks looking for them. More importantly, they gave relevant suggestions.This connected members with quick and easy paths to success. They discovered templates that helped them do their main thing better.Folks even made businesses out of template creation!Community x template growth loop = billion dollar valuationTakeaways:- Community drives rapid adoption for PLG to scale.- Align the product with community members' personal goals.- Empower community members to serve your customers.Can't promise community will make you the next unicorn.Can promise it will make it easier.🌊",61,29,1,https://www.linkedin.com/search/results/content/?fromMember=%5B%22ACoAAAEIWl4BLcwZ2LsfQPuZwbC59c4qsXYnBBE%22%5D&heroEntityKey=urn%3Ali%3Afsd_profile%3AACoAAAEIWl4BLcwZ2LsfQPuZwbC59c4qsXYnBBE&keywords=jared%20robin%20%E2%8F%AD&position=0&searchId=22273820-2f65-493d-b052-8a269b29ddb1&sid=%3BOA&sortBy=%22date_posted%22&update=urn%3Ali%3Afs_updateV2%3A(urn%3Ali%3Aactivity%3A7189280176948617216%2CBLENDED_SEARCH_FEED%2CEMPTY%2CDEFAULT%2Cfalse)
Jared Robin,Male,2024-03-27,"I get asked about this car behind me all the time, so I’ll clear the air:- It’s a Delorean- It’s not my Delorean- This is a pic of the full car - It’s from an art exhibit “3018”Even more 🔥 right?",61,39,0,https://www.linkedin.com/search/results/content/?fromMember=%5B%22ACoAAAEIWl4BLcwZ2LsfQPuZwbC59c4qsXYnBBE%22%5D&heroEntityKey=urn%3Ali%3Afsd_profile%3AACoAAAEIWl4BLcwZ2LsfQPuZwbC59c4qsXYnBBE&keywords=jared%20robin%20%E2%8F%AD&position=0&searchId=22273820-2f65-493d-b052-8a269b29ddb1&sid=%3BOA&sortBy=%22date_posted%22&update=urn%3Ali%3Afs_updateV2%3A(urn%3Ali%3Aactivity%3A7189280176948617216%2CBLENDED_SEARCH_FEED%2CEMPTY%2CDEFAULT%2Cfalse)
Jared Robin,Male,2023-09-27,"Here are 'some of' my favorite sessions at RevCon 2023:John BarrowsJan Young, MBA, CSPO, CSMRalphie (Ralphette) EnglishRebecca MarshburnBridget HeatonJen Allen-KnuthAdam JayDale ZwizinskiJess CookAditya KothadiyaJahira MartinsDaniel HelfmanChristopher NaultAlexis Rivera ScottAlex GarciaJillian BejtlichEvan HamiltonPhoebe Shin Venkat ☮️Kayla GreenTrick question. They're all my faves. More to share come tomorrow.See you there?",61,18,1,https://www.linkedin.com/search/results/content/?fromMember=%5B%22ACoAAAEIWl4BLcwZ2LsfQPuZwbC59c4qsXYnBBE%22%5D&heroEntityKey=urn%3Ali%3Afsd_profile%3AACoAAAEIWl4BLcwZ2LsfQPuZwbC59c4qsXYnBBE&keywords=jared%20robin%20%E2%8F%AD&position=0&searchId=22273820-2f65-493d-b052-8a269b29ddb1&sid=%3BOA&sortBy=%22date_posted%22&update=urn%3Ali%3Afs_updateV2%3A(urn%3Ali%3Aactivity%3A7189280176948617216%2CBLENDED_SEARCH_FEED%2CEMPTY%2CDEFAULT%2Cfalse)
Jared Robin,Male,2023-10-27,"What do Andrew Huberman x Apollo.io x RevGenius have in common?Excited to announce that RevGenius is....Climbing Olympus (digital sales event) with these heavyweights as a community partner!Daniel has been an OG homie since RG first started, supporting us from the very beginning.So when he asked us if we wanted to support this awesome event, I was so excited to help!We've literally been pushing one another, leveling up one another's community plays since the jump, and pushing the envelope for what community means in b2b SaaS.He's taught me so much. I looked at the lineup of speakers being headlined by Andrew Huberman (big Lex Fridman fan here!) and I was blown away.If you're not signed up yet (it's digital), do it.Link in comments. TGIF - enjoy this treat!!👇",60,22,2,https://www.linkedin.com/search/results/content/?fromMember=%5B%22ACoAAAEIWl4BLcwZ2LsfQPuZwbC59c4qsXYnBBE%22%5D&heroEntityKey=urn%3Ali%3Afsd_profile%3AACoAAAEIWl4BLcwZ2LsfQPuZwbC59c4qsXYnBBE&keywords=jared%20robin%20%E2%8F%AD&position=0&searchId=22273820-2f65-493d-b052-8a269b29ddb1&sid=%3BOA&sortBy=%22date_posted%22&update=urn%3Ali%3Afs_updateV2%3A(urn%3Ali%3Aactivity%3A7189280176948617216%2CBLENDED_SEARCH_FEED%2CEMPTY%2CDEFAULT%2Cfalse)
Jared Robin,Male,2024-02-27,"This dude I have so much respect for:Obaid Durrani is a content pioneer.What he’s done with HockeyStack (and many others) is incredible. I caught a rap video of him a couple years ago and knew he had “it”, a magic about him. Follow him y’all. Out with the old. In with the Next.🐝",60,26,2,https://www.linkedin.com/search/results/content/?fromMember=%5B%22ACoAAAEIWl4BLcwZ2LsfQPuZwbC59c4qsXYnBBE%22%5D&heroEntityKey=urn%3Ali%3Afsd_profile%3AACoAAAEIWl4BLcwZ2LsfQPuZwbC59c4qsXYnBBE&keywords=jared%20robin%20%E2%8F%AD&position=0&searchId=22273820-2f65-493d-b052-8a269b29ddb1&sid=%3BOA&sortBy=%22date_posted%22&update=urn%3Ali%3Afs_updateV2%3A(urn%3Ali%3Aactivity%3A7189280176948617216%2CBLENDED_SEARCH_FEED%2CEMPTY%2CDEFAULT%2Cfalse)
Jared Robin,Male,2023-12-27,This.As you go into 2024think about the impact you want to have.Happy holidays 🐝,60,20,1,https://www.linkedin.com/search/results/content/?fromMember=%5B%22ACoAAAEIWl4BLcwZ2LsfQPuZwbC59c4qsXYnBBE%22%5D&heroEntityKey=urn%3Ali%3Afsd_profile%3AACoAAAEIWl4BLcwZ2LsfQPuZwbC59c4qsXYnBBE&keywords=jared%20robin%20%E2%8F%AD&position=0&searchId=22273820-2f65-493d-b052-8a269b29ddb1&sid=%3BOA&sortBy=%22date_posted%22&update=urn%3Ali%3Afs_updateV2%3A(urn%3Ali%3Aactivity%3A7189280176948617216%2CBLENDED_SEARCH_FEED%2CEMPTY%2CDEFAULT%2Cfalse)
Jared Robin,Male,2024-04-06,"Hot take: A large % of 'Strategic Advisors' are just Brand Ambassadors with a more important sounding title. But, why?Sat down with Morgan J Ingram for the Collab's Saturday issue. The Brand Ambassador is the first of 3 tiers in Morgan's B2B Influencer playbook.He's starting to not like the term Strategic Advisor because a lot of people position Strategic Advisors as what we're calling a brand ambassador. He thinks a lot of people label people as strategic advisors to get pushed by the algorithm when you post the announcement. It does that.So he understand why people do that. Fair play. At the same time, that person really probably isn't actually doing any strategic advising. They're just posting. It's really just an ambassador. But no one likes that word [ambassador] in B2B.A lot of creators don't want to be called 'brand ambassadors'. But the thing is, that is effectively what you are at this moment. You are a brand ambassador for this brand. You're an affiliate right now. You have an affiliate link. You may be getting paid, you know, a thousand, $2,000 a month, which is great. But that's the realm you're playing in, is the brand ambassador. So how you monitor that is you typically are probably going to get five to eight brand ambassadors:- And you're just seeing are you getting more uptick in your traffic on your website? - Are you getting more uptick in your LinkedIn followers as people start to talk about you a little bit more.That's how you're going to gauge success. - And then obviously the affiliate is how people are clicking the affiliate link that converts to actual opportunities. So these are things that he thinks about the brand ambassador level.I personally refuse to take advisor roles where equity and/or up front pay is not included, nor tied to requirements for me to post on social.I agree with Morgan and think it 'cheapens' what advising a company means.Still, there's an important place for Ambassadors in driving demand.Read Morgan's full playbook -> https://lnkd.in/evPXrPGKShould we change the name of 'strategic advisors' to 'brand ambassadors' and align more with their goals?What do you think?",60,19,1,https://www.linkedin.com/search/results/content/?fromMember=%5B%22ACoAAAEIWl4BLcwZ2LsfQPuZwbC59c4qsXYnBBE%22%5D&heroEntityKey=urn%3Ali%3Afsd_profile%3AACoAAAEIWl4BLcwZ2LsfQPuZwbC59c4qsXYnBBE&keywords=jared%20robin%20%E2%8F%AD&position=0&searchId=22273820-2f65-493d-b052-8a269b29ddb1&sid=%3BOA&sortBy=%22date_posted%22&update=urn%3Ali%3Afs_updateV2%3A(urn%3Ali%3Aactivity%3A7189280176948617216%2CBLENDED_SEARCH_FEED%2CEMPTY%2CDEFAULT%2Cfalse)
Jared Robin,Male,2023-11-27,Season finale of Silicon Valley Season 7 will be epic…,59,20,0,https://www.linkedin.com/search/results/content/?fromMember=%5B%22ACoAAAEIWl4BLcwZ2LsfQPuZwbC59c4qsXYnBBE%22%5D&heroEntityKey=urn%3Ali%3Afsd_profile%3AACoAAAEIWl4BLcwZ2LsfQPuZwbC59c4qsXYnBBE&keywords=jared%20robin%20%E2%8F%AD&position=0&searchId=22273820-2f65-493d-b052-8a269b29ddb1&sid=%3BOA&sortBy=%22date_posted%22&update=urn%3Ali%3Afs_updateV2%3A(urn%3Ali%3Aactivity%3A7189280176948617216%2CBLENDED_SEARCH_FEED%2CEMPTY%2CDEFAULT%2Cfalse)
Jared Robin,Male,2024-04-06,"As I go through unread messages in my LinkedIn inbox this AM…I have a hot take:If you’re asking somebody you’ve never met before for their time (especially if you’re not selling them anything), you are indeed selling them.Hopping on a Zoom call or meeting up IRL costs time. Make sure there’s value for them in spending that time that goes beyond “talking sales strategies” or “getting to know my network”.Nobody really wants to turn down or not respond to a human to human connection. But so few people make an effort to give equal value (or more) back to the person you’re asking for time from.It’s a “taking” ask vs a “giving” one.It’s more than offering help.It’s understanding what they may need help with.Just like when you outbound a prospect.Try it, report back.Here’s to more valuable networking and more responses to cold DMs to meet your network.What’s your fave LinkedIn networking tip?❤️",59,37,0,https://www.linkedin.com/search/results/content/?fromMember=%5B%22ACoAAAEIWl4BLcwZ2LsfQPuZwbC59c4qsXYnBBE%22%5D&heroEntityKey=urn%3Ali%3Afsd_profile%3AACoAAAEIWl4BLcwZ2LsfQPuZwbC59c4qsXYnBBE&keywords=jared%20robin%20%E2%8F%AD&position=0&searchId=22273820-2f65-493d-b052-8a269b29ddb1&sid=%3BOA&sortBy=%22date_posted%22&update=urn%3Ali%3Afs_updateV2%3A(urn%3Ali%3Aactivity%3A7189280176948617216%2CBLENDED_SEARCH_FEED%2CEMPTY%2CDEFAULT%2Cfalse)
Jared Robin,Male,2024-02-27,"We are going to launch a 'Next 50' list of emerging revenue tech brands...Love supporting the emerging ones - Built a fashion publication on the back of supporting folks with only a couple years experience, why not do it in SaaS?Here's a cool pic of me as an ai borg from my homies at WINN.AIDefinitely check out their new platform to help sellers learn how to sell with AIWhat are some emerging brands you LOVE?Pre-seed, Seed, Series ATag 'em - will be reaching out to all those you love.👇",59,35,0,https://www.linkedin.com/search/results/content/?fromMember=%5B%22ACoAAAEIWl4BLcwZ2LsfQPuZwbC59c4qsXYnBBE%22%5D&heroEntityKey=urn%3Ali%3Afsd_profile%3AACoAAAEIWl4BLcwZ2LsfQPuZwbC59c4qsXYnBBE&keywords=jared%20robin%20%E2%8F%AD&position=0&searchId=22273820-2f65-493d-b052-8a269b29ddb1&sid=%3BOA&sortBy=%22date_posted%22&update=urn%3Ali%3Afs_updateV2%3A(urn%3Ali%3Aactivity%3A7189280176948617216%2CBLENDED_SEARCH_FEED%2CEMPTY%2CDEFAULT%2Cfalse)
Jared Robin,Male,2024-04-22,"Fun facts:Ran a fashion mag for 4 yearsUshered in emerging brands to limelight Won international fashion film awardsMajor trend forecasters collabed w usStreetstyle for Vogue, NY Times, othersStarted a movement in fashionHad zero experience when I started.If you think you can do it, you’re right If you think you can’t do it, you’re also rightInspired by Mike Gallardo post 🙏🏼",58,30,1,https://www.linkedin.com/search/results/content/?fromMember=%5B%22ACoAAAEIWl4BLcwZ2LsfQPuZwbC59c4qsXYnBBE%22%5D&heroEntityKey=urn%3Ali%3Afsd_profile%3AACoAAAEIWl4BLcwZ2LsfQPuZwbC59c4qsXYnBBE&keywords=jared%20robin%20%E2%8F%AD&position=0&searchId=22273820-2f65-493d-b052-8a269b29ddb1&sid=%3BOA&sortBy=%22date_posted%22&update=urn%3Ali%3Afs_updateV2%3A(urn%3Ali%3Aactivity%3A7189280176948617216%2CBLENDED_SEARCH_FEED%2CEMPTY%2CDEFAULT%2Cfalse)
Jared Robin,Male,2023-07-27,"For the next 2+ days & nights, I'll be road-tripping to South Carolina.About 16 hours of driving spread out over 3 days.NYC --> Hilton HeadI haven't done this type of drive in YEARS, and even then only 1 time.Seeing a small area of this country in this way is going to be so cool.And allow me to finish the summer strongly.Excited for this journey and to push myself to have new experiences.Where do I need to stop along the way?Planning on driving to Cape May, NJ -> ferry to Delaware, night in Virginia Beach, then taking a route to the Pinehurst area in NC.What am I missing? What are you doing to finish the summer strongly?Let's normalize taking time off and going on adventures.",58,48,0,https://www.linkedin.com/search/results/content/?fromMember=%5B%22ACoAAAEIWl4BLcwZ2LsfQPuZwbC59c4qsXYnBBE%22%5D&heroEntityKey=urn%3Ali%3Afsd_profile%3AACoAAAEIWl4BLcwZ2LsfQPuZwbC59c4qsXYnBBE&keywords=jared%20robin%20%E2%8F%AD&position=0&searchId=22273820-2f65-493d-b052-8a269b29ddb1&sid=%3BOA&sortBy=%22date_posted%22&update=urn%3Ali%3Afs_updateV2%3A(urn%3Ali%3Aactivity%3A7189280176948617216%2CBLENDED_SEARCH_FEED%2CEMPTY%2CDEFAULT%2Cfalse)
Jared Robin,Male,2024-03-27,Your Tuesday reminder that the RevGenius movement is real. ⏭️Event I'm most hype on this week:Sweep March Madness IRL RevOps event in NYC: https://lnkd.in/eCNNzCPxWho's in NYC this week?(Photo cred: 🔥 Tom Slocum finger),58,20,2,https://www.linkedin.com/search/results/content/?fromMember=%5B%22ACoAAAEIWl4BLcwZ2LsfQPuZwbC59c4qsXYnBBE%22%5D&heroEntityKey=urn%3Ali%3Afsd_profile%3AACoAAAEIWl4BLcwZ2LsfQPuZwbC59c4qsXYnBBE&keywords=jared%20robin%20%E2%8F%AD&position=0&searchId=22273820-2f65-493d-b052-8a269b29ddb1&sid=%3BOA&sortBy=%22date_posted%22&update=urn%3Ali%3Afs_updateV2%3A(urn%3Ali%3Aactivity%3A7189280176948617216%2CBLENDED_SEARCH_FEED%2CEMPTY%2CDEFAULT%2Cfalse)
Jared Robin,Male,2023-11-27,'Privately I've been sharing that we'll see +25% of partners at VC funds exit the business in the next few years and a similar shrinkage of funds.'The OpenView news is only the tip of the iceberg.Alexander Niehenke on X.We are in the era of Growth at the Lowest Costs.Everything is changing.Even the VC world isn't immune. 2020 -> Growth at all costs2022 -> Sustainable growth2024 -> Growth at the lowest costsThe risks to top and bottom-line growth are too high to take big risks.Collaborative growth is coming...,58,31,1,https://www.linkedin.com/search/results/content/?fromMember=%5B%22ACoAAAEIWl4BLcwZ2LsfQPuZwbC59c4qsXYnBBE%22%5D&heroEntityKey=urn%3Ali%3Afsd_profile%3AACoAAAEIWl4BLcwZ2LsfQPuZwbC59c4qsXYnBBE&keywords=jared%20robin%20%E2%8F%AD&position=0&searchId=22273820-2f65-493d-b052-8a269b29ddb1&sid=%3BOA&sortBy=%22date_posted%22&update=urn%3Ali%3Afs_updateV2%3A(urn%3Ali%3Aactivity%3A7189280176948617216%2CBLENDED_SEARCH_FEED%2CEMPTY%2CDEFAULT%2Cfalse)
Jared Robin,Male,2023-08-27,Is this thing on?Throwing the closing party for Day 1 of SaaStr Hubilo x RevGenius A Comedy Roast for Marketing LeadersTonight 7:30 pmSo hype - See you there?Comment for deets 🌊,58,7,0,https://www.linkedin.com/search/results/content/?fromMember=%5B%22ACoAAAEIWl4BLcwZ2LsfQPuZwbC59c4qsXYnBBE%22%5D&heroEntityKey=urn%3Ali%3Afsd_profile%3AACoAAAEIWl4BLcwZ2LsfQPuZwbC59c4qsXYnBBE&keywords=jared%20robin%20%E2%8F%AD&position=0&searchId=22273820-2f65-493d-b052-8a269b29ddb1&sid=%3BOA&sortBy=%22date_posted%22&update=urn%3Ali%3Afs_updateV2%3A(urn%3Ali%3Aactivity%3A7189280176948617216%2CBLENDED_SEARCH_FEED%2CEMPTY%2CDEFAULT%2Cfalse)
Jared Robin,Male,2024-01-27,2024 energy…,58,17,1,https://www.linkedin.com/search/results/content/?fromMember=%5B%22ACoAAAEIWl4BLcwZ2LsfQPuZwbC59c4qsXYnBBE%22%5D&heroEntityKey=urn%3Ali%3Afsd_profile%3AACoAAAEIWl4BLcwZ2LsfQPuZwbC59c4qsXYnBBE&keywords=jared%20robin%20%E2%8F%AD&position=0&searchId=22273820-2f65-493d-b052-8a269b29ddb1&sid=%3BOA&sortBy=%22date_posted%22&update=urn%3Ali%3Afs_updateV2%3A(urn%3Ali%3Aactivity%3A7189280176948617216%2CBLENDED_SEARCH_FEED%2CEMPTY%2CDEFAULT%2Cfalse)
Jared Robin,Male,2023-05-27,You’ve been an AE or BDR for some time now; you’ve been brainwashed your entire career to think the next step is naturally becoming the manager.Not necessarily.Going from sales pro to leader is something many struggle with. I know Adam Jay 📈 had.Adam’s key considerations:- Adopt a leadership mindset from start- Embrace the Change from IC to Leader - Get Ready for Difficult Conversations - Connect with the Community of Leaders- Build Cross-Functional RelationshipsHe unpacks each and more in his newest ATM Unplugged Mag drop!👇🏼,57,39,0,https://www.linkedin.com/search/results/content/?fromMember=%5B%22ACoAAAEIWl4BLcwZ2LsfQPuZwbC59c4qsXYnBBE%22%5D&heroEntityKey=urn%3Ali%3Afsd_profile%3AACoAAAEIWl4BLcwZ2LsfQPuZwbC59c4qsXYnBBE&keywords=jared%20robin%20%E2%8F%AD&position=0&searchId=22273820-2f65-493d-b052-8a269b29ddb1&sid=%3BOA&sortBy=%22date_posted%22&update=urn%3Ali%3Afs_updateV2%3A(urn%3Ali%3Aactivity%3A7189280176948617216%2CBLENDED_SEARCH_FEED%2CEMPTY%2CDEFAULT%2Cfalse)
Jared Robin,Male,2024-01-27,"'The most important thing you can do in sales and life is to be a homie.'Sat down with Lee Moskowitz 🌈 recently to discuss community, growth, and being a homie.Quick story:Met Lee while he was at his prior company and instantly connected.His kindness and smarts was palpable.As he's transitioning to Lee2B, when he asked me to come onto his podcast, I was quick to say yes!This episode is so much more than being a homie - it's also learning some nuance to building community and more.There's a warmth about Lee that makes you feel like family quickly. Grateful to have been invited on.This episode crushes!🔥",57,15,0,https://www.linkedin.com/search/results/content/?fromMember=%5B%22ACoAAAEIWl4BLcwZ2LsfQPuZwbC59c4qsXYnBBE%22%5D&heroEntityKey=urn%3Ali%3Afsd_profile%3AACoAAAEIWl4BLcwZ2LsfQPuZwbC59c4qsXYnBBE&keywords=jared%20robin%20%E2%8F%AD&position=0&searchId=22273820-2f65-493d-b052-8a269b29ddb1&sid=%3BOA&sortBy=%22date_posted%22&update=urn%3Ali%3Afs_updateV2%3A(urn%3Ali%3Aactivity%3A7189280176948617216%2CBLENDED_SEARCH_FEED%2CEMPTY%2CDEFAULT%2Cfalse)
Jared Robin,Male,2023-10-27,This gets me really excited - the power of Community-led Growth:50+ new opportunities created20% increase in pipeline$1M in pipeline generatedWe've worked with Syncari for some time and have helped them see some incredible results.We have another case study with Nooks as well (remember all those LinkedIn lives?)657% increase in opportunities with them and some incredible other results too.Grateful to be able to put some numbers behind the community's impact on brands.And we are only scratching the surface...,57,23,1,https://www.linkedin.com/search/results/content/?fromMember=%5B%22ACoAAAEIWl4BLcwZ2LsfQPuZwbC59c4qsXYnBBE%22%5D&heroEntityKey=urn%3Ali%3Afsd_profile%3AACoAAAEIWl4BLcwZ2LsfQPuZwbC59c4qsXYnBBE&keywords=jared%20robin%20%E2%8F%AD&position=0&searchId=22273820-2f65-493d-b052-8a269b29ddb1&sid=%3BOA&sortBy=%22date_posted%22&update=urn%3Ali%3Afs_updateV2%3A(urn%3Ali%3Aactivity%3A7189280176948617216%2CBLENDED_SEARCH_FEED%2CEMPTY%2CDEFAULT%2Cfalse)
Jared Robin,Male,2024-03-27,"1.8 million impressions across 3 channels6M+ audience (gtm leadership) 260 posts across LinkedInNext 50 Creators drove a big impact ⏭Next 50 Startups is next, let's drive even more!We are now taking sponsorships of brands that want to be a part of this movement. And go for 2 million+ impressions 🚀Can we drive this kind of impact for the Next startups?Out with the old. In with the Next!Comment below or reach out and I'll share the prospectus.⏭",56,25,1,https://www.linkedin.com/search/results/content/?fromMember=%5B%22ACoAAAEIWl4BLcwZ2LsfQPuZwbC59c4qsXYnBBE%22%5D&heroEntityKey=urn%3Ali%3Afsd_profile%3AACoAAAEIWl4BLcwZ2LsfQPuZwbC59c4qsXYnBBE&keywords=jared%20robin%20%E2%8F%AD&position=0&searchId=22273820-2f65-493d-b052-8a269b29ddb1&sid=%3BOA&sortBy=%22date_posted%22&update=urn%3Ali%3Afs_updateV2%3A(urn%3Ali%3Aactivity%3A7189280176948617216%2CBLENDED_SEARCH_FEED%2CEMPTY%2CDEFAULT%2Cfalse)
Jared Robin,Male,2024-04-23,"The Golden Hour pic you don’t see:Here Joshua Bailey 🦕⛵️ and I are at Golden Hour eating lunch. While everyone else is crushing an incredible conference spread, We are crushing egg white or chicken wraps we packed in our bags. It’s been a journey losing 24 lbs in 2 months. Consistency has been the key.I’ve stuck to the plan and the process and have faith. Josh is in it with me. My routine:10k steps a day1850 cals a day170 G protein daily Weights 5x a weeksHis results are already being seen as well. We created the first fully fitness SaaS text chain. All working w our coach to get to the next level.DM me if you want in -If this post gets 20k impressions maybe we can convince him to join here.Excited for what’s the come. 💪🏻",56,36,0,https://www.linkedin.com/search/results/content/?fromMember=%5B%22ACoAAAEIWl4BLcwZ2LsfQPuZwbC59c4qsXYnBBE%22%5D&heroEntityKey=urn%3Ali%3Afsd_profile%3AACoAAAEIWl4BLcwZ2LsfQPuZwbC59c4qsXYnBBE&keywords=jared%20robin%20%E2%8F%AD&position=0&searchId=22273820-2f65-493d-b052-8a269b29ddb1&sid=%3BOA&sortBy=%22date_posted%22&update=urn%3Ali%3Afs_updateV2%3A(urn%3Ali%3Aactivity%3A7189280176948617216%2CBLENDED_SEARCH_FEED%2CEMPTY%2CDEFAULT%2Cfalse)
Jared Robin,Male,2024-04-26,Playoff energyTeam energy2024 energyStartup energyCollaborative energyGo Knicks!🏀,56,5,2,https://www.linkedin.com/search/results/content/?fromMember=%5B%22ACoAAAEIWl4BLcwZ2LsfQPuZwbC59c4qsXYnBBE%22%5D&heroEntityKey=urn%3Ali%3Afsd_profile%3AACoAAAEIWl4BLcwZ2LsfQPuZwbC59c4qsXYnBBE&keywords=jared%20robin%20%E2%8F%AD&position=0&searchId=22273820-2f65-493d-b052-8a269b29ddb1&sid=%3BOA&sortBy=%22date_posted%22&update=urn%3Ali%3Afs_updateV2%3A(urn%3Ali%3Aactivity%3A7189280176948617216%2CBLENDED_SEARCH_FEED%2CEMPTY%2CDEFAULT%2Cfalse)
Jared Robin,Male,2024-01-27,"I’m excited to announce that I’ll be a guest on The Sour GTM SaaS Takes Podcast hosted by Jason Hasenberg.In this podcast, I will taste the 5 most sour candies in the U.S. (Note: I have not opened the box yet to see what the candies are)After every candy, I will share a sour 2024 take. What’s a sour take? It’s an insight/tactic that goes against the grain and challenges the way you have been thinking. Ultimately, the insight leaves you with a sour taste in your mouth. You are happy you found out the truth now but disturbed you didn’t find out sooner.Like the show, “Hot Ones”, the candies will progressively get more sour. And so will my takes!This will be a fun environment curated in a unique way for us to have a good time full of laughs, smiles, funny faces (due to the sour candies), and actionable GTM insights.What should my sour takes be? (I have some in mind)...Here’s a few of my homies joining the 1st season of the podcast:Jill RowleyMorgan J IngramWill AitkenLeslie VenetzRobin Izsak-TsengMelissa Gaglione✨🦕🎁 Katie Penner 🦕 (FYI: sendoso event last night was 🔥)Recording my episode tomorrow.Releases February 1 (First one!!!!!)Support the homie and like and comment on the post :P (I'm sure we can convince him to send you candy in the mail too if your comment has the most likes).LFG!",55,27,1,https://www.linkedin.com/search/results/content/?fromMember=%5B%22ACoAAAEIWl4BLcwZ2LsfQPuZwbC59c4qsXYnBBE%22%5D&heroEntityKey=urn%3Ali%3Afsd_profile%3AACoAAAEIWl4BLcwZ2LsfQPuZwbC59c4qsXYnBBE&keywords=jared%20robin%20%E2%8F%AD&position=0&searchId=22273820-2f65-493d-b052-8a269b29ddb1&sid=%3BOA&sortBy=%22date_posted%22&update=urn%3Ali%3Afs_updateV2%3A(urn%3Ali%3Aactivity%3A7189280176948617216%2CBLENDED_SEARCH_FEED%2CEMPTY%2CDEFAULT%2Cfalse)
