Author,Gender,Date,Post Text,Likes,Comments,Shares,Page Link
Jared Robin,Male,2023-06-27,"This.Let's strengthen your networks:GTM Professionals, join RevGenius -> revgenius.com/sign-upGTM Leaders, join RevRoom -> revgenius.com/revroom",34218,489,"2,403",https://www.linkedin.com/search/results/content/?fromMember=%5B%22ACoAAAEIWl4BLcwZ2LsfQPuZwbC59c4qsXYnBBE%22%5D&heroEntityKey=urn%3Ali%3Afsd_profile%3AACoAAAEIWl4BLcwZ2LsfQPuZwbC59c4qsXYnBBE&keywords=jared%20robin%20%E2%8F%AD&position=0&searchId=22273820-2f65-493d-b052-8a269b29ddb1&sid=%3BOA&sortBy=%22date_posted%22&update=urn%3Ali%3Afs_updateV2%3A(urn%3Ali%3Aactivity%3A7189280176948617216%2CBLENDED_SEARCH_FEED%2CEMPTY%2CDEFAULT%2Cfalse)
Jared Robin,Male,2023-12-27,Founder = SalesCEO = SalesCTO = SalesCIO = SalesSales Engineering = SalesCustomer Success = SalesProduct Manager = SalesMarketing = SalesProduct Marketing = SalesCFO = SalesRecruiting = SalesBDRs = SalesSupport = SalesCX = SalesFractionals = Salesoh and Sales = Salesfollow Howard LermanGrowth at the lowest costs requires us to focus!Join RevGenius --> revgenius.com/sign-up,553,107,21,https://www.linkedin.com/search/results/content/?fromMember=%5B%22ACoAAAEIWl4BLcwZ2LsfQPuZwbC59c4qsXYnBBE%22%5D&heroEntityKey=urn%3Ali%3Afsd_profile%3AACoAAAEIWl4BLcwZ2LsfQPuZwbC59c4qsXYnBBE&keywords=jared%20robin%20%E2%8F%AD&position=0&searchId=22273820-2f65-493d-b052-8a269b29ddb1&sid=%3BOA&sortBy=%22date_posted%22&update=urn%3Ali%3Afs_updateV2%3A(urn%3Ali%3Aactivity%3A7189280176948617216%2CBLENDED_SEARCH_FEED%2CEMPTY%2CDEFAULT%2Cfalse)
Jared Robin,Male,2023-09-27,"This…Up to $220k + equity, to be an SDR.C/o James Weitzman 🔥",448,131,12,https://www.linkedin.com/search/results/content/?fromMember=%5B%22ACoAAAEIWl4BLcwZ2LsfQPuZwbC59c4qsXYnBBE%22%5D&heroEntityKey=urn%3Ali%3Afsd_profile%3AACoAAAEIWl4BLcwZ2LsfQPuZwbC59c4qsXYnBBE&keywords=jared%20robin%20%E2%8F%AD&position=0&searchId=22273820-2f65-493d-b052-8a269b29ddb1&sid=%3BOA&sortBy=%22date_posted%22&update=urn%3Ali%3Afs_updateV2%3A(urn%3Ali%3Aactivity%3A7189280176948617216%2CBLENDED_SEARCH_FEED%2CEMPTY%2CDEFAULT%2Cfalse)
Jared Robin,Male,2023-11-27,I’m happy to share that I’m starting a new position as Founder at The Community!,414,122,0,https://www.linkedin.com/search/results/content/?fromMember=%5B%22ACoAAAEIWl4BLcwZ2LsfQPuZwbC59c4qsXYnBBE%22%5D&heroEntityKey=urn%3Ali%3Afsd_profile%3AACoAAAEIWl4BLcwZ2LsfQPuZwbC59c4qsXYnBBE&keywords=jared%20robin%20%E2%8F%AD&position=0&searchId=22273820-2f65-493d-b052-8a269b29ddb1&sid=%3BOA&sortBy=%22date_posted%22&update=urn%3Ali%3Afs_updateV2%3A(urn%3Ali%3Aactivity%3A7189280176948617216%2CBLENDED_SEARCH_FEED%2CEMPTY%2CDEFAULT%2Cfalse)
Jared Robin,Male,2023-12-27,I’m happy to share that I’m starting a new position as Founder at The Collab!Rebranded newsletter from The Community --> The CollabHelping Founders & Fractionals go-to-market collaboratively.Come sign-up to join the collaborative growth movement.👉 jaredrobin.com/subscribe,392,100,0,https://www.linkedin.com/search/results/content/?fromMember=%5B%22ACoAAAEIWl4BLcwZ2LsfQPuZwbC59c4qsXYnBBE%22%5D&heroEntityKey=urn%3Ali%3Afsd_profile%3AACoAAAEIWl4BLcwZ2LsfQPuZwbC59c4qsXYnBBE&keywords=jared%20robin%20%E2%8F%AD&position=0&searchId=22273820-2f65-493d-b052-8a269b29ddb1&sid=%3BOA&sortBy=%22date_posted%22&update=urn%3Ali%3Afs_updateV2%3A(urn%3Ali%3Aactivity%3A7189280176948617216%2CBLENDED_SEARCH_FEED%2CEMPTY%2CDEFAULT%2Cfalse)
Jared Robin,Male,2023-07-27,Simple advice to not be a jerk to SDRs:- don't forward emails to their managers- don't call them out on Linkedin- don't yell at them when they cold call- do tell them if it's not a fit- don't disrespect them- give constructive feedbackOutbound is harder than ever.I've heard too many stories of reps that get massively disrespected.Let’s stop it.❤️#sdrsmatter,385,95,3,https://www.linkedin.com/search/results/content/?fromMember=%5B%22ACoAAAEIWl4BLcwZ2LsfQPuZwbC59c4qsXYnBBE%22%5D&heroEntityKey=urn%3Ali%3Afsd_profile%3AACoAAAEIWl4BLcwZ2LsfQPuZwbC59c4qsXYnBBE&keywords=jared%20robin%20%E2%8F%AD&position=0&searchId=22273820-2f65-493d-b052-8a269b29ddb1&sid=%3BOA&sortBy=%22date_posted%22&update=urn%3Ali%3Afs_updateV2%3A(urn%3Ali%3Aactivity%3A7189280176948617216%2CBLENDED_SEARCH_FEED%2CEMPTY%2CDEFAULT%2Cfalse)
Jared Robin,Male,2023-09-27,"I've been asked how I survived on $0 income starting RevGenius....This pic says so much:- My dad let me live with him for 5 weeks- His deck became my office (not bad!)- Notice the deck needing repairs 👀- I helped him rebuild it as thanks for it all- The love he must have to support meWhat this pic doesn’t say:- He covered my meals because I couldn’t- I lived on unemployment to cover rent- It was Covid and I was scared of a lot- No idea if RevGenius would work- No interest in other job prospectsThank you, Steve (dad).Without your unwavering support, I don’t know what I’d be doing.It took a while before you fully grasped what I was building,You must’ve thought I was nutsBut you still supported me.My personal community.I love you!❤️",381,73,0,https://www.linkedin.com/search/results/content/?fromMember=%5B%22ACoAAAEIWl4BLcwZ2LsfQPuZwbC59c4qsXYnBBE%22%5D&heroEntityKey=urn%3Ali%3Afsd_profile%3AACoAAAEIWl4BLcwZ2LsfQPuZwbC59c4qsXYnBBE&keywords=jared%20robin%20%E2%8F%AD&position=0&searchId=22273820-2f65-493d-b052-8a269b29ddb1&sid=%3BOA&sortBy=%22date_posted%22&update=urn%3Ali%3Afs_updateV2%3A(urn%3Ali%3Aactivity%3A7189280176948617216%2CBLENDED_SEARCH_FEED%2CEMPTY%2CDEFAULT%2Cfalse)
Jared Robin,Male,2024-04-06,"I’m happy to share that I’m starting a new position as Collaborator (Creator) at Clay!I've known Nicolae Rusan since 2020 at the height of the pandemic. I'm pretty sure I was one of the first non-Clay team members in their company slack.Jesse Ouellette can confirm.Varun Anand and I have been close the last couple of years as well. Watching the problems I didn't know I had be solved in an instant is why I personally reached out to ask for this role. I got it!This product is exceptional - think live spreadsheets allowing you to plug in whatever data sources to create whatever workflows you need.Creator means I'm going to be sharing some of 'plays' I use Clay for. I'm also getting super creative and building some incredible things pushing Clay's limits, and I get to show you! I want to build some products everyone can use with Clay to solve niche problems some folks have. This is an ambassador-like role (I'm making an affiliate % only). Between this and GTM Partners those are the only roles like this I've taken - and it's because of how much I believe in the products and teams.Want to play around with Clay?Here's my link to get 3k credits when you sign up: https://lnkd.in/ePKcYNCmLFG!",350,97,2,https://www.linkedin.com/search/results/content/?fromMember=%5B%22ACoAAAEIWl4BLcwZ2LsfQPuZwbC59c4qsXYnBBE%22%5D&heroEntityKey=urn%3Ali%3Afsd_profile%3AACoAAAEIWl4BLcwZ2LsfQPuZwbC59c4qsXYnBBE&keywords=jared%20robin%20%E2%8F%AD&position=0&searchId=22273820-2f65-493d-b052-8a269b29ddb1&sid=%3BOA&sortBy=%22date_posted%22&update=urn%3Ali%3Afs_updateV2%3A(urn%3Ali%3Aactivity%3A7189280176948617216%2CBLENDED_SEARCH_FEED%2CEMPTY%2CDEFAULT%2Cfalse)
Jared Robin,Male,2023-07-27,"This.Give more than you take is our first value in RevGenius.Join our community of sales, marketing, revops and customer success leaders -> revgenius.com/sign-up",349,21,26,https://www.linkedin.com/search/results/content/?fromMember=%5B%22ACoAAAEIWl4BLcwZ2LsfQPuZwbC59c4qsXYnBBE%22%5D&heroEntityKey=urn%3Ali%3Afsd_profile%3AACoAAAEIWl4BLcwZ2LsfQPuZwbC59c4qsXYnBBE&keywords=jared%20robin%20%E2%8F%AD&position=0&searchId=22273820-2f65-493d-b052-8a269b29ddb1&sid=%3BOA&sortBy=%22date_posted%22&update=urn%3Ali%3Afs_updateV2%3A(urn%3Ali%3Aactivity%3A7189280176948617216%2CBLENDED_SEARCH_FEED%2CEMPTY%2CDEFAULT%2Cfalse)
Jared Robin,Male,2024-03-27,"I’m happy to share that I’m starting a new position as GTM Collaborator at Common Room!Common Room has worked with RevGenius the past few months and are going to continue to (announcement coming soon...)When they asked me if I wanted to advise them I couldn't run quick enough. I've watched this company grow quite a bit and reposition their messaging to really tell the story of all that they do. Common Room is your rep's go-to source for understanding your buyers on a deeper level. They aggregate and analyze buyer data from over 30 different channels, covering everything from product usage in your data warehouse to social interactions on Linkedin to community engagement on Slack, and much more.I got hip to them as a community tool to better manage RevGenius - they were the best at that. I watched them evolve into so so so much more.Linkedin + Community + Product Usage and more. I've never seen any tool go this deep and help you deeply contextualize your messaging.Let's go!",340,98,2,https://www.linkedin.com/search/results/content/?fromMember=%5B%22ACoAAAEIWl4BLcwZ2LsfQPuZwbC59c4qsXYnBBE%22%5D&heroEntityKey=urn%3Ali%3Afsd_profile%3AACoAAAEIWl4BLcwZ2LsfQPuZwbC59c4qsXYnBBE&keywords=jared%20robin%20%E2%8F%AD&position=0&searchId=22273820-2f65-493d-b052-8a269b29ddb1&sid=%3BOA&sortBy=%22date_posted%22&update=urn%3Ali%3Afs_updateV2%3A(urn%3Ali%3Aactivity%3A7189280176948617216%2CBLENDED_SEARCH_FEED%2CEMPTY%2CDEFAULT%2Cfalse)
Jared Robin,Male,2023-09-27,"I'm trying my hardest to write a killer post on Community today.But, I can't. My mind is preoccupied...I just got my offer accepted on buying my first house y'all.Dreams do come true. :)🎉PS I launched a newsletter on helping SaaS startups build community-led motionssign up -> jaredrobin.com/subscribe",329,113,0,https://www.linkedin.com/search/results/content/?fromMember=%5B%22ACoAAAEIWl4BLcwZ2LsfQPuZwbC59c4qsXYnBBE%22%5D&heroEntityKey=urn%3Ali%3Afsd_profile%3AACoAAAEIWl4BLcwZ2LsfQPuZwbC59c4qsXYnBBE&keywords=jared%20robin%20%E2%8F%AD&position=0&searchId=22273820-2f65-493d-b052-8a269b29ddb1&sid=%3BOA&sortBy=%22date_posted%22&update=urn%3Ali%3Afs_updateV2%3A(urn%3Ali%3Aactivity%3A7189280176948617216%2CBLENDED_SEARCH_FEED%2CEMPTY%2CDEFAULT%2Cfalse)
Jared Robin,Male,2023-06-27,35 Sq ft is all that I need.Humbled by what’s been accomplished here:- hq for a distributed team of 7- 15k + of our 37k member growth- 100s of webinars & podcasts- 1000s of client and prospect calls- 1000s of calls with community members- 2 (going to be 3) RevCons- Countless GTM improvements- Launch of RevRoom & RevGenius Mag - and so much moreGrateful for the little things.Appreciative of the process.🌊,311,66,0,https://www.linkedin.com/search/results/content/?fromMember=%5B%22ACoAAAEIWl4BLcwZ2LsfQPuZwbC59c4qsXYnBBE%22%5D&heroEntityKey=urn%3Ali%3Afsd_profile%3AACoAAAEIWl4BLcwZ2LsfQPuZwbC59c4qsXYnBBE&keywords=jared%20robin%20%E2%8F%AD&position=0&searchId=22273820-2f65-493d-b052-8a269b29ddb1&sid=%3BOA&sortBy=%22date_posted%22&update=urn%3Ali%3Afs_updateV2%3A(urn%3Ali%3Aactivity%3A7189280176948617216%2CBLENDED_SEARCH_FEED%2CEMPTY%2CDEFAULT%2Cfalse)
Jared Robin,Male,2023-07-27,"I want to find the top new creators on LinkedIn:Smaller accounts are being overshadowed by larger ones.And I’m not seeing all the talent.So I'm looking to connect with more up-and-coming creators on LinkedIn.So, if you're less than 10k followers, drop 3 lines below:→ What's your business?→ What’s your favorite creator tip?→ Who is 1 other creator worth following?Let's upgrade my network.",293,327,3,https://www.linkedin.com/search/results/content/?fromMember=%5B%22ACoAAAEIWl4BLcwZ2LsfQPuZwbC59c4qsXYnBBE%22%5D&heroEntityKey=urn%3Ali%3Afsd_profile%3AACoAAAEIWl4BLcwZ2LsfQPuZwbC59c4qsXYnBBE&keywords=jared%20robin%20%E2%8F%AD&position=0&searchId=22273820-2f65-493d-b052-8a269b29ddb1&sid=%3BOA&sortBy=%22date_posted%22&update=urn%3Ali%3Afs_updateV2%3A(urn%3Ali%3Aactivity%3A7189280176948617216%2CBLENDED_SEARCH_FEED%2CEMPTY%2CDEFAULT%2Cfalse)
Jared Robin,Male,2023-10-27,I’m happy to share that I’m starting a new position as Ambassador at GTM Partners!,282,68,1,https://www.linkedin.com/search/results/content/?fromMember=%5B%22ACoAAAEIWl4BLcwZ2LsfQPuZwbC59c4qsXYnBBE%22%5D&heroEntityKey=urn%3Ali%3Afsd_profile%3AACoAAAEIWl4BLcwZ2LsfQPuZwbC59c4qsXYnBBE&keywords=jared%20robin%20%E2%8F%AD&position=0&searchId=22273820-2f65-493d-b052-8a269b29ddb1&sid=%3BOA&sortBy=%22date_posted%22&update=urn%3Ali%3Afs_updateV2%3A(urn%3Ali%3Aactivity%3A7189280176948617216%2CBLENDED_SEARCH_FEED%2CEMPTY%2CDEFAULT%2Cfalse)
Jared Robin,Male,2023-05-27,"I’m happy to share that I’m starting a new position as Strategic Advisor at Sweep!Running a community that has a significant amount of RevOps Professionals in it, I empathized with time and headaches around Salesforce configurations.Happy to advise a company that enables you to customize and scale any Salesforce configuration, without the dev time.Awesome dinner last night with Ido Gaver & Ronen Idrisov. Their % of happy & satisfied clients couldn't get any higher as they're able to do things in-house that were complicated and difficult (and sometimes impossible) prior.Their belief in community is second to none, and we jammed on some ideas of how they can lean in to help.Team that with a team of all-stars who's done it before (some of them together!) and this has the recipe for incredible success.🌊",281,83,1,https://www.linkedin.com/search/results/content/?fromMember=%5B%22ACoAAAEIWl4BLcwZ2LsfQPuZwbC59c4qsXYnBBE%22%5D&heroEntityKey=urn%3Ali%3Afsd_profile%3AACoAAAEIWl4BLcwZ2LsfQPuZwbC59c4qsXYnBBE&keywords=jared%20robin%20%E2%8F%AD&position=0&searchId=22273820-2f65-493d-b052-8a269b29ddb1&sid=%3BOA&sortBy=%22date_posted%22&update=urn%3Ali%3Afs_updateV2%3A(urn%3Ali%3Aactivity%3A7189280176948617216%2CBLENDED_SEARCH_FEED%2CEMPTY%2CDEFAULT%2Cfalse)
Jared Robin,Male,2023-09-27,"I stand with Israel. 🇮🇱I've internalized this all week and tried to be business as usual. But it's not business as usual.Before leaving the office yesterday, an Israeli founder in my co-working space explained that 'everyone in Israel knows a few people that have passed'.This is the worst thing we've seen in our lifetimes with the lack of abandon for human lives.He runs a hedge fund. He's readying for getting called back to duty. My partner called me last night and told me not to hang out outside after work.There were hate crimes in Queens and The Day of Rage (today) was coming.My personal need to internalize was outweighed by the necessity to speak up.I'm Jewish. I've traveled to Israel.I have so many Israeli and Jewish friends, clients, networks, etc.I'm not sure the world truly understands how bad it is. Past the war, also in many's responses to what's happening. I stand proudly with Israel. We will get through this.Am Yisrael chai 🇮🇱",279,57,3,https://www.linkedin.com/search/results/content/?fromMember=%5B%22ACoAAAEIWl4BLcwZ2LsfQPuZwbC59c4qsXYnBBE%22%5D&heroEntityKey=urn%3Ali%3Afsd_profile%3AACoAAAEIWl4BLcwZ2LsfQPuZwbC59c4qsXYnBBE&keywords=jared%20robin%20%E2%8F%AD&position=0&searchId=22273820-2f65-493d-b052-8a269b29ddb1&sid=%3BOA&sortBy=%22date_posted%22&update=urn%3Ali%3Afs_updateV2%3A(urn%3Ali%3Aactivity%3A7189280176948617216%2CBLENDED_SEARCH_FEED%2CEMPTY%2CDEFAULT%2Cfalse)
Jared Robin,Male,2023-06-27,"This pic is now 3 years old, but hits home like it was yesterday….This pic says so much:- My dad let me live with him for 5 weeks- His deck became my office (not bad!)- Notice the deck needing repairs 👀- I helped him rebuild it as thanks for it all- The love he must have to support meWhat this pic doesn’t say:- He covered my meals because I couldn’t - I lived on unemployment to cover rent- It was Covid and I was scared of a lot- No idea if RevGenius would work- No interest in other job prospectsThank you Steve (dad).Without your unwavering support, I don’t know what I’d be doing.It took a while before you fully grasped what I was building, You must’ve thought I was nutsBut you still supported me. I love you!Not everyone has a close support system like I’ve had.If you need help, motivation, or guidance, we’ve built a community for you. Nobody needs to be alone.And yes, my dad is part of it!Happy 4th :)❤️",262,48,7,https://www.linkedin.com/search/results/content/?fromMember=%5B%22ACoAAAEIWl4BLcwZ2LsfQPuZwbC59c4qsXYnBBE%22%5D&heroEntityKey=urn%3Ali%3Afsd_profile%3AACoAAAEIWl4BLcwZ2LsfQPuZwbC59c4qsXYnBBE&keywords=jared%20robin%20%E2%8F%AD&position=0&searchId=22273820-2f65-493d-b052-8a269b29ddb1&sid=%3BOA&sortBy=%22date_posted%22&update=urn%3Ali%3Afs_updateV2%3A(urn%3Ali%3Aactivity%3A7189280176948617216%2CBLENDED_SEARCH_FEED%2CEMPTY%2CDEFAULT%2Cfalse)
Jared Robin,Male,2023-05-27,"Anyone hiring AEs? I have a great one.Full cycle rep breaking into SaaS:- Sells FedEx services to VP of Ops, Logistics- 1 of 500 in his division- 175% of annual quota on a $4 mill goal- President’s Club (top 1% worldwide attainment)- Clients included Gilt Groupe, Joe Fresh, Karla Otto, Inked and Nylon Magazines ($80k closed-won), Little Miss Matched ($300k closed won), Assouline Publishing, Bravado ($150k closed won), Nest Fragrances, Strivectin, Bodum, John Hardy Jewelry, Luggage Free ($200k closed won), and Skip Hop.- ACV in my tty $50k- $250kComp requirement?He just wants to make a lateral move to SaaS as an AE. OK with base pay cut as long as OTE > $120k.What a throwback!I actually took a pay cut to break in.Ultimately the best decision of my life.That lead to so much discomfort but also so much growth.It didn’t matter what I accomplished - SaaS didn’t gaf until I accomplished it in SaaS.Cold truth. But the lessons learned are why I’m trying to make it easier for the next generations to succeed in this space.Because I had nobody helping me then, I created a community to help everyone now.Let’s win together.🌊",260,51,1,https://www.linkedin.com/search/results/content/?fromMember=%5B%22ACoAAAEIWl4BLcwZ2LsfQPuZwbC59c4qsXYnBBE%22%5D&heroEntityKey=urn%3Ali%3Afsd_profile%3AACoAAAEIWl4BLcwZ2LsfQPuZwbC59c4qsXYnBBE&keywords=jared%20robin%20%E2%8F%AD&position=0&searchId=22273820-2f65-493d-b052-8a269b29ddb1&sid=%3BOA&sortBy=%22date_posted%22&update=urn%3Ali%3Afs_updateV2%3A(urn%3Ali%3Aactivity%3A7189280176948617216%2CBLENDED_SEARCH_FEED%2CEMPTY%2CDEFAULT%2Cfalse)
Jared Robin,Male,2023-08-27,This.,254,36,19,https://www.linkedin.com/search/results/content/?fromMember=%5B%22ACoAAAEIWl4BLcwZ2LsfQPuZwbC59c4qsXYnBBE%22%5D&heroEntityKey=urn%3Ali%3Afsd_profile%3AACoAAAEIWl4BLcwZ2LsfQPuZwbC59c4qsXYnBBE&keywords=jared%20robin%20%E2%8F%AD&position=0&searchId=22273820-2f65-493d-b052-8a269b29ddb1&sid=%3BOA&sortBy=%22date_posted%22&update=urn%3Ali%3Afs_updateV2%3A(urn%3Ali%3Aactivity%3A7189280176948617216%2CBLENDED_SEARCH_FEED%2CEMPTY%2CDEFAULT%2Cfalse)
Jared Robin,Male,2023-07-27,"I want to add some good karma on LinkedIn.There are a lot of folks looking for new jobs right now.And I’m not always seeing them on my feed to help.So I'm looking to help lift up more folks on LinkedIn.So, if you could use a new job, drop 3 lines below:→ What type of role are you looking for?→ What’s your favorite job seeker tip?→ Who is 1 other person who also could use help?Let's get more folks working.",250,186,8,https://www.linkedin.com/search/results/content/?fromMember=%5B%22ACoAAAEIWl4BLcwZ2LsfQPuZwbC59c4qsXYnBBE%22%5D&heroEntityKey=urn%3Ali%3Afsd_profile%3AACoAAAEIWl4BLcwZ2LsfQPuZwbC59c4qsXYnBBE&keywords=jared%20robin%20%E2%8F%AD&position=0&searchId=22273820-2f65-493d-b052-8a269b29ddb1&sid=%3BOA&sortBy=%22date_posted%22&update=urn%3Ali%3Afs_updateV2%3A(urn%3Ali%3Aactivity%3A7189280176948617216%2CBLENDED_SEARCH_FEED%2CEMPTY%2CDEFAULT%2Cfalse)
Jared Robin,Male,2023-07-27,"I turned down an opportunity to interview with a company that exited for over $1 billion a year later.I had no job. It was the perfect role. But it wasn't a fit.Honestly, the role should've been perfect for me.But, like 3 years earlier.I was only 3 months into building RevGenius.I didn't have any money in my bank account, outside of unemployment.I was 1 month in since incorporating this 'company'. We had no clients, but after all I'd been through, I had no choice.I had to listen to my heart. This was the biggest risk, I'd ever taken. No jobs were available (it was Covid) and this was an awesome job opportunity to turn down.If I didn't give it a go now, when would I? 38 year old entrepreneurVery low/no bank account after rent was paidMoved in with my dad to have him pay for food for a few weeksBuilt up credit card debt to stay afloatI told myself to test having faith. In higher energy.If I just gave as much as I ever have given in my life, would it come back to me?If I didn't test it now, when would I? So I did.I helped folks get introduced to others. To have a space that heard them. Built a community of folks giving to one another.I lost my mother 3 years earlier and I owed it to her to give me the opportunity to break the fear of practicality. I'd been homeless before, and that no longer scared me.Now I was cool living with Dad. So that was even easier. But, I was approaching 40 and needed to figure it out.Put respect on folks figuring it out. So many folks have fear disguised as practicality. Taking SDR and AE jobs to get money in.I was like that. Once you put yourself in a situation to make it happen, you will. Find the place you dig into to make anything happen.Nomatter what.Find that place and watch yourself run the show one day.🌊",250,48,2,https://www.linkedin.com/search/results/content/?fromMember=%5B%22ACoAAAEIWl4BLcwZ2LsfQPuZwbC59c4qsXYnBBE%22%5D&heroEntityKey=urn%3Ali%3Afsd_profile%3AACoAAAEIWl4BLcwZ2LsfQPuZwbC59c4qsXYnBBE&keywords=jared%20robin%20%E2%8F%AD&position=0&searchId=22273820-2f65-493d-b052-8a269b29ddb1&sid=%3BOA&sortBy=%22date_posted%22&update=urn%3Ali%3Afs_updateV2%3A(urn%3Ali%3Aactivity%3A7189280176948617216%2CBLENDED_SEARCH_FEED%2CEMPTY%2CDEFAULT%2Cfalse)
Jared Robin,Male,2023-04-27,Too good not to share…Amirite?Catalyst Software & Jordan Greene FTW!,248,34,6,https://www.linkedin.com/search/results/content/?fromMember=%5B%22ACoAAAEIWl4BLcwZ2LsfQPuZwbC59c4qsXYnBBE%22%5D&heroEntityKey=urn%3Ali%3Afsd_profile%3AACoAAAEIWl4BLcwZ2LsfQPuZwbC59c4qsXYnBBE&keywords=jared%20robin%20%E2%8F%AD&position=0&searchId=22273820-2f65-493d-b052-8a269b29ddb1&sid=%3BOA&sortBy=%22date_posted%22&update=urn%3Ali%3Afs_updateV2%3A(urn%3Ali%3Aactivity%3A7189280176948617216%2CBLENDED_SEARCH_FEED%2CEMPTY%2CDEFAULT%2Cfalse)
Jared Robin,Male,2023-08-27,"Hot take: I'm removing LinkedIn connections from before I went into SaaS.Including kids I went to high school with or worked with at FedEx (but haven't spoken to in a while).The logic?I'm not 'speaking to them' literally or figuratively on this platform.I want to build a community of like-minded folks.And unfortunately, they're no longer it.I also hit 30k connections and need to trim, so need to prioritize.If you're curious, I'm using LeadDelta to do this in bulk (they're not paying me).Looking forward to being more relevant to more people and vice versa.✌️",238,77,3,https://www.linkedin.com/search/results/content/?fromMember=%5B%22ACoAAAEIWl4BLcwZ2LsfQPuZwbC59c4qsXYnBBE%22%5D&heroEntityKey=urn%3Ali%3Afsd_profile%3AACoAAAEIWl4BLcwZ2LsfQPuZwbC59c4qsXYnBBE&keywords=jared%20robin%20%E2%8F%AD&position=0&searchId=22273820-2f65-493d-b052-8a269b29ddb1&sid=%3BOA&sortBy=%22date_posted%22&update=urn%3Ali%3Afs_updateV2%3A(urn%3Ali%3Aactivity%3A7189280176948617216%2CBLENDED_SEARCH_FEED%2CEMPTY%2CDEFAULT%2Cfalse)
Jared Robin,Male,2023-07-27,OOO: My baby bro and I ❤️I have always been go go go.It’s probably caused me to miss out on some life experiences.This summer I’ve shown up for family holidays more than in recent memory. I couldn’t be more grateful. ❤️,234,76,0,https://www.linkedin.com/search/results/content/?fromMember=%5B%22ACoAAAEIWl4BLcwZ2LsfQPuZwbC59c4qsXYnBBE%22%5D&heroEntityKey=urn%3Ali%3Afsd_profile%3AACoAAAEIWl4BLcwZ2LsfQPuZwbC59c4qsXYnBBE&keywords=jared%20robin%20%E2%8F%AD&position=0&searchId=22273820-2f65-493d-b052-8a269b29ddb1&sid=%3BOA&sortBy=%22date_posted%22&update=urn%3Ali%3Afs_updateV2%3A(urn%3Ali%3Aactivity%3A7189280176948617216%2CBLENDED_SEARCH_FEED%2CEMPTY%2CDEFAULT%2Cfalse)
Jared Robin,Male,2024-03-27,This.Join RevGenius to network and learn with the top GTM leaders —> https://lnkd.in/efzGvnde,230,45,3,https://www.linkedin.com/search/results/content/?fromMember=%5B%22ACoAAAEIWl4BLcwZ2LsfQPuZwbC59c4qsXYnBBE%22%5D&heroEntityKey=urn%3Ali%3Afsd_profile%3AACoAAAEIWl4BLcwZ2LsfQPuZwbC59c4qsXYnBBE&keywords=jared%20robin%20%E2%8F%AD&position=0&searchId=22273820-2f65-493d-b052-8a269b29ddb1&sid=%3BOA&sortBy=%22date_posted%22&update=urn%3Ali%3Afs_updateV2%3A(urn%3Ali%3Aactivity%3A7189280176948617216%2CBLENDED_SEARCH_FEED%2CEMPTY%2CDEFAULT%2Cfalse)
Jared Robin,Male,2024-02-27,"I want to find the top new SaaS GTM Startups on LinkedIn:Early-stage startups are being overshadowed by larger ones.And I’m not seeing all the new tech.So I'm looking to connect with more up-and-coming Startups on LinkedIn.So, if you're a startup that is at Seed or Series A, drop 3 lines below:→ What's your business?→ What’s your favorite growth tip?→ Who is 1 other startup worth following?Who are the Next Sales Tech, Martech, RevOps tech, CS tech, and AI GTM tech brands should we all should be following?Tag ‘em. Tag their founders. And submit them here -> https://lnkd.in/e2Y5y3W7Let's help emerging startup brands grow.Out with the old. In with the Next.⏭️",225,270,7,https://www.linkedin.com/search/results/content/?fromMember=%5B%22ACoAAAEIWl4BLcwZ2LsfQPuZwbC59c4qsXYnBBE%22%5D&heroEntityKey=urn%3Ali%3Afsd_profile%3AACoAAAEIWl4BLcwZ2LsfQPuZwbC59c4qsXYnBBE&keywords=jared%20robin%20%E2%8F%AD&position=0&searchId=22273820-2f65-493d-b052-8a269b29ddb1&sid=%3BOA&sortBy=%22date_posted%22&update=urn%3Ali%3Afs_updateV2%3A(urn%3Ali%3Aactivity%3A7189280176948617216%2CBLENDED_SEARCH_FEED%2CEMPTY%2CDEFAULT%2Cfalse)
