Author,Gender,Date,Post Text,Likes,Comments,Shares,Page Link
Jared Robin,Male,2023-12-27,The most important thing you can do in sales and life is to be a “homie”.Here’s how:- Help people find mentors.- Help people by being kind.- Help people get promoted.- Help people find new jobs.- Help people by being a friend.- Help people overcome obstacles.- Help people learn how to improve.- Help people with tasks to get done.- Help people by showing up for them.- Help people with a current challenge.- Help people without asking for it back.- Help people by listening & empathizing.Notice a trend?When you’re helping others and acting like a “homie” magical things happen and people open up.Everyone wants to be around that person.✌🏻,121,46,3,https://www.linkedin.com/search/results/content/?fromMember=%5B%22ACoAAAEIWl4BLcwZ2LsfQPuZwbC59c4qsXYnBBE%22%5D&heroEntityKey=urn%3Ali%3Afsd_profile%3AACoAAAEIWl4BLcwZ2LsfQPuZwbC59c4qsXYnBBE&keywords=jared%20robin%20%E2%8F%AD&position=0&searchId=22273820-2f65-493d-b052-8a269b29ddb1&sid=%3BOA&sortBy=%22date_posted%22&update=urn%3Ali%3Afs_updateV2%3A(urn%3Ali%3Aactivity%3A7189280176948617216%2CBLENDED_SEARCH_FEED%2CEMPTY%2CDEFAULT%2Cfalse)
Jared Robin,Male,2023-04-27,Our RevGenius Community-Led Happy Hour was 🔥🔥🔥Thank you everyone for showing up!Some of the best GTM and life convos I’ve had.Grateful to have such a strong group of folks showing up for one another and themselves.What a vibe!🌊,120,45,2,https://www.linkedin.com/search/results/content/?fromMember=%5B%22ACoAAAEIWl4BLcwZ2LsfQPuZwbC59c4qsXYnBBE%22%5D&heroEntityKey=urn%3Ali%3Afsd_profile%3AACoAAAEIWl4BLcwZ2LsfQPuZwbC59c4qsXYnBBE&keywords=jared%20robin%20%E2%8F%AD&position=0&searchId=22273820-2f65-493d-b052-8a269b29ddb1&sid=%3BOA&sortBy=%22date_posted%22&update=urn%3Ali%3Afs_updateV2%3A(urn%3Ali%3Aactivity%3A7189280176948617216%2CBLENDED_SEARCH_FEED%2CEMPTY%2CDEFAULT%2Cfalse)
Jared Robin,Male,2023-10-27,"My last birthday with my momMy current one yesterdayTime moves onI’m grateful to have been able to celebrate my dad’s 70th on SaturdayAnd my birthday on Sunday.I’m grateful for my family, for my partner Mallory, and for my mother. Every birthday I listen to the 2 voicemails my mom left me for my 35th birthday 6 years ago.It’s one phone call I’m glad I didn’t pick up (I called her back later!)Time moves on but memories and lessons last a lifetime. ❤️",120,39,0,https://www.linkedin.com/search/results/content/?fromMember=%5B%22ACoAAAEIWl4BLcwZ2LsfQPuZwbC59c4qsXYnBBE%22%5D&heroEntityKey=urn%3Ali%3Afsd_profile%3AACoAAAEIWl4BLcwZ2LsfQPuZwbC59c4qsXYnBBE&keywords=jared%20robin%20%E2%8F%AD&position=0&searchId=22273820-2f65-493d-b052-8a269b29ddb1&sid=%3BOA&sortBy=%22date_posted%22&update=urn%3Ali%3Afs_updateV2%3A(urn%3Ali%3Aactivity%3A7189280176948617216%2CBLENDED_SEARCH_FEED%2CEMPTY%2CDEFAULT%2Cfalse)
Jared Robin,Male,2023-09-27,"I don't know about you, but I call BS on AI taking over.We can build technology with AI & write endless content.Here's what AI can't replace:Building authentic relationshipsCollaborating with humansCreating a movementCommunityCoincidentally, leveraging what AI can't replace is a massive strategic advantage for growing your startup.Just sayin.🌊",119,82,0,https://www.linkedin.com/search/results/content/?fromMember=%5B%22ACoAAAEIWl4BLcwZ2LsfQPuZwbC59c4qsXYnBBE%22%5D&heroEntityKey=urn%3Ali%3Afsd_profile%3AACoAAAEIWl4BLcwZ2LsfQPuZwbC59c4qsXYnBBE&keywords=jared%20robin%20%E2%8F%AD&position=0&searchId=22273820-2f65-493d-b052-8a269b29ddb1&sid=%3BOA&sortBy=%22date_posted%22&update=urn%3Ali%3Afs_updateV2%3A(urn%3Ali%3Aactivity%3A7189280176948617216%2CBLENDED_SEARCH_FEED%2CEMPTY%2CDEFAULT%2Cfalse)
Jared Robin,Male,2023-05-27,"Photo dump from GTM Partners Why I loved this event:- thinking more strategically about GTM- networking w revenue leaders- impromptu brainstorming w peersDale Zwizinski , Jason Hubbard , Shannon (Sweeny) Curran , Jody Spencer , Mark Kilens , Hamish Stephenson 🦘 , 🎙️ Darryl Praill , Sangram Vajre , Lindsay Cordell , Adam Jay 📈 , Krystal Jay , Nick Bennett , Dan Goodman , Jonathan Gandolf Incredible RevRoom meetup and I’m so appreciative to learn from you all.I’m (significantly) smarter because of you. Thank you!🚀",119,44,0,https://www.linkedin.com/search/results/content/?fromMember=%5B%22ACoAAAEIWl4BLcwZ2LsfQPuZwbC59c4qsXYnBBE%22%5D&heroEntityKey=urn%3Ali%3Afsd_profile%3AACoAAAEIWl4BLcwZ2LsfQPuZwbC59c4qsXYnBBE&keywords=jared%20robin%20%E2%8F%AD&position=0&searchId=22273820-2f65-493d-b052-8a269b29ddb1&sid=%3BOA&sortBy=%22date_posted%22&update=urn%3Ali%3Afs_updateV2%3A(urn%3Ali%3Aactivity%3A7189280176948617216%2CBLENDED_SEARCH_FEED%2CEMPTY%2CDEFAULT%2Cfalse)
Jared Robin,Male,2023-08-27,"5,000+ GTM leaders are coming to RevCon. Are you?Excited to share some of the speakers and sessions (save this):Sangram Vajre - Redefining ROI for B2B marketersLeslie Greenwood - From Customer to EvangelistsJohn Barrows - The Age of the Agile Sales OrgDale / Adam - Transitioning from Founder-LedJen Allen-Knuth - How to Break Through Your Buyers’ Mental Spam FilterAustin Distel, Growth Hacker at Jasper - AI Playbooks for GTM teamsKevin White - Dark FunnelJustin Simon - Distribution-first content masterclassJess Cook - Creating Next-Level Case StudiesTessa Whittaker, ☑️Lisa K., Jessica (JP) Zangre -RevopsJan Young, MBA, CSPO, CSM -  Interactive workshop on increasing revenue through GTM alignment & collaborative growthSonam Dabholkar - Redefining CSRalphette Murphy English - Customer Success🎙️ Darryl Praill - B2B Social MediaBridget Heaton - Customer MarketingSid Kumar - Fireside chat: Leveraging RevOps to align GTMAlex Garcia - Unlocking Newsletters as a Growth ChannelThere's a few more being finalized too (including yours truly).Are you registered (free)?",119,34,1,https://www.linkedin.com/search/results/content/?fromMember=%5B%22ACoAAAEIWl4BLcwZ2LsfQPuZwbC59c4qsXYnBBE%22%5D&heroEntityKey=urn%3Ali%3Afsd_profile%3AACoAAAEIWl4BLcwZ2LsfQPuZwbC59c4qsXYnBBE&keywords=jared%20robin%20%E2%8F%AD&position=0&searchId=22273820-2f65-493d-b052-8a269b29ddb1&sid=%3BOA&sortBy=%22date_posted%22&update=urn%3Ali%3Afs_updateV2%3A(urn%3Ali%3Aactivity%3A7189280176948617216%2CBLENDED_SEARCH_FEED%2CEMPTY%2CDEFAULT%2Cfalse)
Jared Robin,Male,2023-05-27,I’ve known Nick for 3 years and never met IRL.In that time Nick’s become:- A first 25 member of RevGenius - Host of OG Revenue RG Podcast- Our top ambassador & advocate- An incredible creator- A second turn dad- A friendAnd yesterday we finally met.And it was glorious.🙏🏼,118,24,0,https://www.linkedin.com/search/results/content/?fromMember=%5B%22ACoAAAEIWl4BLcwZ2LsfQPuZwbC59c4qsXYnBBE%22%5D&heroEntityKey=urn%3Ali%3Afsd_profile%3AACoAAAEIWl4BLcwZ2LsfQPuZwbC59c4qsXYnBBE&keywords=jared%20robin%20%E2%8F%AD&position=0&searchId=22273820-2f65-493d-b052-8a269b29ddb1&sid=%3BOA&sortBy=%22date_posted%22&update=urn%3Ali%3Afs_updateV2%3A(urn%3Ali%3Aactivity%3A7189280176948617216%2CBLENDED_SEARCH_FEED%2CEMPTY%2CDEFAULT%2Cfalse)
Jared Robin,Male,2023-12-27,"Just hit 2,100 subscribers for The Collab 🎉Folks ask me all the time for my tech stack that helped us grow so quickly:- beehiiv is my ESP (email service provider) & CMS- LeadMagic is my data partner for enrichment- folk is my lightweight CRM- Scheduler AI is my sponsorship scheduling tool - Canva is my design tool- Surfe for templated LinkedIn messaging- LeadDelta for LinkedIn network pruning and pullingThe number 1 thing that has helped growth is aligning the brand around a unique POV rallying around a big challenge so many have.These tools are exceptional complements to getting the message out and building the brand around it.If you'd like intros to any of these awesome companies, or have any questions about connecting tools, comment below. But, make no mistake, building a movement is the most potent thing you can do.Collaborative Growth is here to save SaaS.🐝",117,74,2,https://www.linkedin.com/search/results/content/?fromMember=%5B%22ACoAAAEIWl4BLcwZ2LsfQPuZwbC59c4qsXYnBBE%22%5D&heroEntityKey=urn%3Ali%3Afsd_profile%3AACoAAAEIWl4BLcwZ2LsfQPuZwbC59c4qsXYnBBE&keywords=jared%20robin%20%E2%8F%AD&position=0&searchId=22273820-2f65-493d-b052-8a269b29ddb1&sid=%3BOA&sortBy=%22date_posted%22&update=urn%3Ali%3Afs_updateV2%3A(urn%3Ali%3Aactivity%3A7189280176948617216%2CBLENDED_SEARCH_FEED%2CEMPTY%2CDEFAULT%2Cfalse)
Jared Robin,Male,2023-12-27,2024 energy.,117,47,3,https://www.linkedin.com/search/results/content/?fromMember=%5B%22ACoAAAEIWl4BLcwZ2LsfQPuZwbC59c4qsXYnBBE%22%5D&heroEntityKey=urn%3Ali%3Afsd_profile%3AACoAAAEIWl4BLcwZ2LsfQPuZwbC59c4qsXYnBBE&keywords=jared%20robin%20%E2%8F%AD&position=0&searchId=22273820-2f65-493d-b052-8a269b29ddb1&sid=%3BOA&sortBy=%22date_posted%22&update=urn%3Ali%3Afs_updateV2%3A(urn%3Ali%3Aactivity%3A7189280176948617216%2CBLENDED_SEARCH_FEED%2CEMPTY%2CDEFAULT%2Cfalse)
Jared Robin,Male,2024-03-27,"This highly targeted play helped me land tons of qualified meetings, new community members, and more. Shout out to the Amplemarket team for building what I called the first 'growth hacker' sales engagement tool for LinkedIn.I'm going to periodically share some of the plays I use as a 1-person sales team to generate qualified meetings. I need to be efficient AF. These same plays do well for sales teams, founders, and others that want to target the right person at the right time with the right message.I'm only scratching the surface but having a heck of a time learning how to do even crazier things in this tool.If you have any questions, ask in the comments - Micael Oliveira and team can come and build even more intricate additions on top of what I'm already doing.AMA style - let's go!",117,38,2,https://www.linkedin.com/search/results/content/?fromMember=%5B%22ACoAAAEIWl4BLcwZ2LsfQPuZwbC59c4qsXYnBBE%22%5D&heroEntityKey=urn%3Ali%3Afsd_profile%3AACoAAAEIWl4BLcwZ2LsfQPuZwbC59c4qsXYnBBE&keywords=jared%20robin%20%E2%8F%AD&position=0&searchId=22273820-2f65-493d-b052-8a269b29ddb1&sid=%3BOA&sortBy=%22date_posted%22&update=urn%3Ali%3Afs_updateV2%3A(urn%3Ali%3Aactivity%3A7189280176948617216%2CBLENDED_SEARCH_FEED%2CEMPTY%2CDEFAULT%2Cfalse)
Jared Robin,Male,2024-02-27,"Anyone hiring AEs? I have a great one.Full cycle rep breaking into SaaS:- Sells FedEx services to VP of Ops, Logistics- 1 of 500 in his division- 175% of annual quota on a $4 mill goal- President’s Club (top 1% worldwide attainment)- Clients include Gilt Groupe, Joe Fresh, Karla Otto, Inked and Nylon Magazines ($80k closed-won), Little Miss Matched ($300k closed won), Assouline Publishing, Bravado ($150k closed won), Nest Fragrances, Strivectin, Bodum, John Hardy Jewelry, Luggage Free ($200k closed won), and Skip Hop.- ACV in tty $50k- $250kComp requirement?He just wants to make a lateral move to SaaS as an AE.OK with base pay cut as long as OTE > $120k.(this is me, in case you're wondering)What a throwback!I actually took a pay cut to break into SaaS.Ultimately the most important decision of my career.That lead to so much discomfort but also so much growth.It didn’t matter what I accomplished -SaaS didn’t gaf until I accomplished it in SaaS.Cold truth.But the lessons learned are why I’m trying to make it easier for the next generations to succeed in this space.Because I had nobody helping me then, I created a community to help everyone now.Also, apparently had some interesting ideas to help evolve the future.Out with the old. In with the Next. ⏭",116,28,0,https://www.linkedin.com/search/results/content/?fromMember=%5B%22ACoAAAEIWl4BLcwZ2LsfQPuZwbC59c4qsXYnBBE%22%5D&heroEntityKey=urn%3Ali%3Afsd_profile%3AACoAAAEIWl4BLcwZ2LsfQPuZwbC59c4qsXYnBBE&keywords=jared%20robin%20%E2%8F%AD&position=0&searchId=22273820-2f65-493d-b052-8a269b29ddb1&sid=%3BOA&sortBy=%22date_posted%22&update=urn%3Ali%3Afs_updateV2%3A(urn%3Ali%3Aactivity%3A7189280176948617216%2CBLENDED_SEARCH_FEED%2CEMPTY%2CDEFAULT%2Cfalse)
Jared Robin,Male,2024-03-27,"It’s Startup Saturday ⏭️I want to find the top new SaaS GTM Startups on LinkedIn:Early-stage startups are being overshadowed by larger ones.And I’m not seeing all the new tech.So I'm looking to connect with more up-and-coming Startups on LinkedIn.So, if you're a startup that is at Seed or Series A, drop 3 lines below:→ What's your business?→ What’s your favorite growth tip?→ Who is 1 other startup worth following?Who are the Next Sales Tech, Martech, RevOps tech, CS tech, and AI GTM tech brands should we all should be following?Tag ‘em. Tag their founders. Make sure to tag diverse founders and startups with diverse leadership.And submit them here -> https://lnkd.in/e2Y5y3W7Next 50 GTM Startups list is being curated…*The Next movement has delivered > 1.2 million impressions for emerging talent so far *Let’s make that even higher for startups finding their footing.Let's help emerging startup brands grow.Out with the old. In with the Next.⏭️",116,130,6,https://www.linkedin.com/search/results/content/?fromMember=%5B%22ACoAAAEIWl4BLcwZ2LsfQPuZwbC59c4qsXYnBBE%22%5D&heroEntityKey=urn%3Ali%3Afsd_profile%3AACoAAAEIWl4BLcwZ2LsfQPuZwbC59c4qsXYnBBE&keywords=jared%20robin%20%E2%8F%AD&position=0&searchId=22273820-2f65-493d-b052-8a269b29ddb1&sid=%3BOA&sortBy=%22date_posted%22&update=urn%3Ali%3Afs_updateV2%3A(urn%3Ali%3Aactivity%3A7189280176948617216%2CBLENDED_SEARCH_FEED%2CEMPTY%2CDEFAULT%2Cfalse)
Jared Robin,Male,2024-01-27,"Meet Mollie Bodensteiner.Mollie is a powerhouse.- She's one of the most exciting voices in SaaS.- She's led revenue operations at Corteva Agriscience, Syncari, Deel, Sound and now advises growing companies.- And she's the star of our RevRoom Member Spotlight for January! + Mollie gives back to the RevOps community+ She hosts webinars, shares her knowledge freely and steps in to help whenever someone needs it.+ Check out her spotlight interview 🌟 - https://lnkd.in/d6sZec6DWhat we're diving into: - Mollie's career path in SaaS - Insights into RevOps - Her approach to leadership - Lessons she's learned along the wayThanks, Mollie for your inspiring insights! 💙 VPs & C-Suite Execs, join Mollie in RevRoom: (https://lnkd.in/gbQ7Vwgn)",116,27,1,https://www.linkedin.com/search/results/content/?fromMember=%5B%22ACoAAAEIWl4BLcwZ2LsfQPuZwbC59c4qsXYnBBE%22%5D&heroEntityKey=urn%3Ali%3Afsd_profile%3AACoAAAEIWl4BLcwZ2LsfQPuZwbC59c4qsXYnBBE&keywords=jared%20robin%20%E2%8F%AD&position=0&searchId=22273820-2f65-493d-b052-8a269b29ddb1&sid=%3BOA&sortBy=%22date_posted%22&update=urn%3Ali%3Afs_updateV2%3A(urn%3Ali%3Aactivity%3A7189280176948617216%2CBLENDED_SEARCH_FEED%2CEMPTY%2CDEFAULT%2Cfalse)
Jared Robin,Male,2023-10-27,"I'm SO amped to announce I'm officially an ambassador of GTM Partners!!Supporting an organization that has supported RevGenius and me is easy:Karthiga Ratnam has taught me so much about marketing, category design, and community. Sangram Vajre has keynoted RevCon, been a huge supporter and advocate of myself and RG, and always hops on Zoom with the kindest and biggest smile.Lindsay Cordell came on my podcast and planted the seed of why Chief GTM Officer (not CRO) was needed to help align GTM.Bryan Brown always greets me with the kindest smile and humility for the collaboration between our orgs. He's far too humble for how much I've learned from him.Not to mention EVERY SINGLE ambassador I feel like I'm already BFFs with or soon-to-be. They're both thought leaders and operators that I've learned so much from.So this is my announcement that I'm joining the second Cohort of GTM Partners ambassador program. I may have to figure out how to mix with cohort 1 folks too (Dale Zwizinski & Adam Jay, Nick Bennett etc 👀)Being asked to be an ambassador for an organization that's teaching me loads and supporting me already in so many ways, (not to mention having a bunch of industry colleagues and friends to learn with) just hits differently.(if you're thinking of starting an ambassador program re-read that line above)Let's go!",116,31,0,https://www.linkedin.com/search/results/content/?fromMember=%5B%22ACoAAAEIWl4BLcwZ2LsfQPuZwbC59c4qsXYnBBE%22%5D&heroEntityKey=urn%3Ali%3Afsd_profile%3AACoAAAEIWl4BLcwZ2LsfQPuZwbC59c4qsXYnBBE&keywords=jared%20robin%20%E2%8F%AD&position=0&searchId=22273820-2f65-493d-b052-8a269b29ddb1&sid=%3BOA&sortBy=%22date_posted%22&update=urn%3Ali%3Afs_updateV2%3A(urn%3Ali%3Aactivity%3A7189280176948617216%2CBLENDED_SEARCH_FEED%2CEMPTY%2CDEFAULT%2Cfalse)
Jared Robin,Male,2024-02-27,"I want to find the top new creators on LinkedIn:Smaller accounts are being overshadowed by larger ones.And I’m not seeing all the talent.So I'm looking to connect with more up-and-coming creators on LinkedIn.Every Saturday we collaborate. Connect brands with emerging creators and fractionals.So, if you're less than 2 years active here, drop 3 lines below:→ What's your business?→ What’s your favorite creator tip?→ Who is 1 other creator worth following?Let's upgrade our networks.“How HockeyStack built the Netflix for B2B Marketing” - by leveraging collaborators DROPPED on The Collab today ⚡️Check out our sponsor HockeyStack Sign up to join the movement -> https://lnkd.in/exiu8EnF",116,109,3,https://www.linkedin.com/search/results/content/?fromMember=%5B%22ACoAAAEIWl4BLcwZ2LsfQPuZwbC59c4qsXYnBBE%22%5D&heroEntityKey=urn%3Ali%3Afsd_profile%3AACoAAAEIWl4BLcwZ2LsfQPuZwbC59c4qsXYnBBE&keywords=jared%20robin%20%E2%8F%AD&position=0&searchId=22273820-2f65-493d-b052-8a269b29ddb1&sid=%3BOA&sortBy=%22date_posted%22&update=urn%3Ali%3Afs_updateV2%3A(urn%3Ali%3Aactivity%3A7189280176948617216%2CBLENDED_SEARCH_FEED%2CEMPTY%2CDEFAULT%2Cfalse)
Jared Robin,Male,2023-09-27,Spoke to the CEO of a SaaS Company.One of their big clients is reducing tech spend:$6 mill 2022$4.5 mill 2023$3.5 mill 2024Being a need-to-have has never been more important. Starts with a problem. Amplified by evangelizing the importance of solving it.By a community of people.🌊,115,14,0,https://www.linkedin.com/search/results/content/?fromMember=%5B%22ACoAAAEIWl4BLcwZ2LsfQPuZwbC59c4qsXYnBBE%22%5D&heroEntityKey=urn%3Ali%3Afsd_profile%3AACoAAAEIWl4BLcwZ2LsfQPuZwbC59c4qsXYnBBE&keywords=jared%20robin%20%E2%8F%AD&position=0&searchId=22273820-2f65-493d-b052-8a269b29ddb1&sid=%3BOA&sortBy=%22date_posted%22&update=urn%3Ali%3Afs_updateV2%3A(urn%3Ali%3Aactivity%3A7189280176948617216%2CBLENDED_SEARCH_FEED%2CEMPTY%2CDEFAULT%2Cfalse)
Jared Robin,Male,2023-05-27,"Hot take: the Chief GTM Officer will be the most important role in the GTM org. And it doesn't really exist, yet...This role will serve three primary functions: 1. Live and breathe the customer experience & the market expectations2. It will keep the GTM teams focused and aligned on the strategy – they will be ruthless in their prioritization and their utilization of the GTM resources3. It will collaborate with the CEO and COO/CFO to ensure complete alignment with the overall goals of the organizationKey KPIs - Cost of Acquisition (CAC)- Net Revenue Retention (NRR)- Cost of Retention (COR)- GTM Motion Delivery (Outbound/Partnership/Ecosystem) - Net New Logo/New Business Goals- Product usage- Share of Voice in the Market (share of intent)- Clase Rates by stage- Actual Contract Value (ACV)Key Responsibilities- Oversight of the GTM Organization- Oversight of the GTM Strategy- Oversight of the GTM Budget (spending, staffing, compensation, incentivization) - Own the key aspects of GTM strategy planning including: - Market Approach: Ideal Customer Profile & Total Relevant Market- Product and Market strategies- POV of the organization- Leadership Management- Revenue operations tracking and forecasting- Executive Approver of the follow key GTM programs- Product roadmap - Brand, market and product messaging- Sales structure and compensation- Customer management programs- Revenue operations priorities and projectsLindsay Cordell wrote an incredible article on this for RG Mag. What are your thoughts?",115,62,4,https://www.linkedin.com/search/results/content/?fromMember=%5B%22ACoAAAEIWl4BLcwZ2LsfQPuZwbC59c4qsXYnBBE%22%5D&heroEntityKey=urn%3Ali%3Afsd_profile%3AACoAAAEIWl4BLcwZ2LsfQPuZwbC59c4qsXYnBBE&keywords=jared%20robin%20%E2%8F%AD&position=0&searchId=22273820-2f65-493d-b052-8a269b29ddb1&sid=%3BOA&sortBy=%22date_posted%22&update=urn%3Ali%3Afs_updateV2%3A(urn%3Ali%3Aactivity%3A7189280176948617216%2CBLENDED_SEARCH_FEED%2CEMPTY%2CDEFAULT%2Cfalse)
Jared Robin,Male,2023-11-27,"Thank you, Chicago!Some of the top GTM leaders in Chi-Town joined our ZoomInfo x RevGenius dinner Wednesday night.Maple & Ash is 🔥What an incredible event with such an amazing conversation about GTM. Should we do this again?",115,31,0,https://www.linkedin.com/search/results/content/?fromMember=%5B%22ACoAAAEIWl4BLcwZ2LsfQPuZwbC59c4qsXYnBBE%22%5D&heroEntityKey=urn%3Ali%3Afsd_profile%3AACoAAAEIWl4BLcwZ2LsfQPuZwbC59c4qsXYnBBE&keywords=jared%20robin%20%E2%8F%AD&position=0&searchId=22273820-2f65-493d-b052-8a269b29ddb1&sid=%3BOA&sortBy=%22date_posted%22&update=urn%3Ali%3Afs_updateV2%3A(urn%3Ali%3Aactivity%3A7189280176948617216%2CBLENDED_SEARCH_FEED%2CEMPTY%2CDEFAULT%2Cfalse)
Jared Robin,Male,2023-05-27,"Personal Brand vs Professional ReputationI was on a call today where we spoke of the differences:One is the white noise you add to by talking about yourself on social alongside others (myself included).The other is your reputation spoken about you when you're not in the room.Nobody is denying the benefits that come from building a personal brand.But more folks need to put weight on not just relying on personal brand, but building their professional reputations as well.A personal brand without a strong professional reputation = fluff and noise.",114,40,1,https://www.linkedin.com/search/results/content/?fromMember=%5B%22ACoAAAEIWl4BLcwZ2LsfQPuZwbC59c4qsXYnBBE%22%5D&heroEntityKey=urn%3Ali%3Afsd_profile%3AACoAAAEIWl4BLcwZ2LsfQPuZwbC59c4qsXYnBBE&keywords=jared%20robin%20%E2%8F%AD&position=0&searchId=22273820-2f65-493d-b052-8a269b29ddb1&sid=%3BOA&sortBy=%22date_posted%22&update=urn%3Ali%3Afs_updateV2%3A(urn%3Ali%3Aactivity%3A7189280176948617216%2CBLENDED_SEARCH_FEED%2CEMPTY%2CDEFAULT%2Cfalse)
Jared Robin,Male,2023-09-27,I'm not sure who needs to hear this...How people think growth happens: Make a post on LinkedIn and get 100s of subs/users.How growth really happens:DM 1000s of people to get 100s of subs/users.Do the work. Then figure out the scale.,114,42,1,https://www.linkedin.com/search/results/content/?fromMember=%5B%22ACoAAAEIWl4BLcwZ2LsfQPuZwbC59c4qsXYnBBE%22%5D&heroEntityKey=urn%3Ali%3Afsd_profile%3AACoAAAEIWl4BLcwZ2LsfQPuZwbC59c4qsXYnBBE&keywords=jared%20robin%20%E2%8F%AD&position=0&searchId=22273820-2f65-493d-b052-8a269b29ddb1&sid=%3BOA&sortBy=%22date_posted%22&update=urn%3Ali%3Afs_updateV2%3A(urn%3Ali%3Aactivity%3A7189280176948617216%2CBLENDED_SEARCH_FEED%2CEMPTY%2CDEFAULT%2Cfalse)
Jared Robin,Male,2023-11-27,"Fractionals are some of the most important hires a company can make.I spotlight 3 weekly for The Community. This week's picks:I. Leslie GreenwoodLeslie works with founders, start-ups, and community builders to bring an Evangelist-led growth strategy into their businesses. Previously she held the role of VP of Member Advocacy at Pavilion where she worked closely with their Global Chapter Heads to create elevated local experiences and support. II. Jim Soss⚡️Jim is a proven revenue executive with a unique combination of sales dna, customer success fabric, and GTM acumen. $1B+ career bookings with proven growth: he’s taken a startup from $0 to $5M (successful exit), turn-around from $20M to $40M (valuation multiplier), scale-up from $20M to $70M (successful exit), and growth business to $200M (successful exit). III. Mollie BodensteinerMollie has a diverse set of experiences from leading marketing to operations. She’s passionate about utilizing technology and leveraging data to drive performance and innovation. Well-versed in both B2B and B2C strategy and execution. Building the first newsletter that is also a community and teaches you how to build community.Meta.Follow these folks. Who are the best fractionals you know that we should follow?If that’s you:- what do you do fractionally?- what companies have you helped?- who are some other fractionals you love?Together we will raise this space.Oh, ya. Subscribe to The Community.🐝",114,60,0,https://www.linkedin.com/search/results/content/?fromMember=%5B%22ACoAAAEIWl4BLcwZ2LsfQPuZwbC59c4qsXYnBBE%22%5D&heroEntityKey=urn%3Ali%3Afsd_profile%3AACoAAAEIWl4BLcwZ2LsfQPuZwbC59c4qsXYnBBE&keywords=jared%20robin%20%E2%8F%AD&position=0&searchId=22273820-2f65-493d-b052-8a269b29ddb1&sid=%3BOA&sortBy=%22date_posted%22&update=urn%3Ali%3Afs_updateV2%3A(urn%3Ali%3Aactivity%3A7189280176948617216%2CBLENDED_SEARCH_FEED%2CEMPTY%2CDEFAULT%2Cfalse)
