Author,Gender,Date,Post Text,Likes,Comments,Shares,Page Link
Maynard Webb,Male,2024-04-27,,4280,112,0,https://www.linkedin.com/search/results/content/?fromMember=%5B%22ACoAAAI4Aw4BS3TllsKr6E15v4CDckxNKmfQpTY%22%5D&heroEntityKey=urn%3Ali%3Afsd_profile%3AACoAAAI4Aw4BS3TllsKr6E15v4CDckxNKmfQpTY&keywords=maynard%20webb&origin=CLUSTER_EXPANSION&position=0&searchId=fdd4c72b-bd61-4019-a39f-42877ff2b81a&sid=KrU&sortBy=%22date_posted%22
Maynard Webb,Male,2024-04-27,We were lucky to have Jeff Weiner speak at the Webb Investment Network’s annual summit and our audience was rapt by his #story and #advice. I wrote a series of posts about what he shared and what I learned from Jeff and where we can find #inspiration.,4154,79,0,https://www.linkedin.com/search/results/content/?fromMember=%5B%22ACoAAAI4Aw4BS3TllsKr6E15v4CDckxNKmfQpTY%22%5D&heroEntityKey=urn%3Ali%3Afsd_profile%3AACoAAAI4Aw4BS3TllsKr6E15v4CDckxNKmfQpTY&keywords=maynard%20webb&origin=CLUSTER_EXPANSION&position=0&searchId=fdd4c72b-bd61-4019-a39f-42877ff2b81a&sid=KrU&sortBy=%22date_posted%22
Maynard Webb,Male,2024-04-27,We learned so much from Jeff Weiner when he came to speak at the Webb Investment Network’s annual summit. Here's my post about the top 6 things I learned from Jeff.,1068,63,0,https://www.linkedin.com/search/results/content/?fromMember=%5B%22ACoAAAI4Aw4BS3TllsKr6E15v4CDckxNKmfQpTY%22%5D&heroEntityKey=urn%3Ali%3Afsd_profile%3AACoAAAI4Aw4BS3TllsKr6E15v4CDckxNKmfQpTY&keywords=maynard%20webb&origin=CLUSTER_EXPANSION&position=0&searchId=fdd4c72b-bd61-4019-a39f-42877ff2b81a&sid=KrU&sortBy=%22date_posted%22
Maynard Webb,Male,2023-04-27,"An executive is stuck in the grind and has seen ""quiet quitting"" as the answer. This week in Dear Founder I caution against the dangers of this decision and trend, and help lay out a better path--one that can lead to greatness.",820,92,34,https://www.linkedin.com/search/results/content/?fromMember=%5B%22ACoAAAI4Aw4BS3TllsKr6E15v4CDckxNKmfQpTY%22%5D&heroEntityKey=urn%3Ali%3Afsd_profile%3AACoAAAI4Aw4BS3TllsKr6E15v4CDckxNKmfQpTY&keywords=maynard%20webb&origin=CLUSTER_EXPANSION&position=0&searchId=fdd4c72b-bd61-4019-a39f-42877ff2b81a&sid=KrU&sortBy=%22date_posted%22
Maynard Webb,Male,2024-04-27,"My book came out this week, #DearFounder, and the most heartfelt endorsement for the book came from somewhere completely unexpected.",763,40,0,https://www.linkedin.com/search/results/content/?fromMember=%5B%22ACoAAAI4Aw4BS3TllsKr6E15v4CDckxNKmfQpTY%22%5D&heroEntityKey=urn%3Ali%3Afsd_profile%3AACoAAAI4Aw4BS3TllsKr6E15v4CDckxNKmfQpTY&keywords=maynard%20webb&origin=CLUSTER_EXPANSION&position=0&searchId=fdd4c72b-bd61-4019-a39f-42877ff2b81a&sid=KrU&sortBy=%22date_posted%22
Maynard Webb,Male,2024-04-27,,631,96,0,https://www.linkedin.com/search/results/content/?fromMember=%5B%22ACoAAAI4Aw4BS3TllsKr6E15v4CDckxNKmfQpTY%22%5D&heroEntityKey=urn%3Ali%3Afsd_profile%3AACoAAAI4Aw4BS3TllsKr6E15v4CDckxNKmfQpTY&keywords=maynard%20webb&origin=CLUSTER_EXPANSION&position=0&searchId=fdd4c72b-bd61-4019-a39f-42877ff2b81a&sid=KrU&sortBy=%22date_posted%22
Maynard Webb,Male,2022-04-27,Thrilled to be launching the Dear Founder Newsletter on LinkedIn. Every week I will be answering new questions. Ask me your question in the comments section. #dearfounder #founders #startups #investors #boards #linkedin #wednesdaywisdom #webbwednesday,314,21,5,https://www.linkedin.com/search/results/content/?fromMember=%5B%22ACoAAAI4Aw4BS3TllsKr6E15v4CDckxNKmfQpTY%22%5D&heroEntityKey=urn%3Ali%3Afsd_profile%3AACoAAAI4Aw4BS3TllsKr6E15v4CDckxNKmfQpTY&keywords=maynard%20webb&origin=CLUSTER_EXPANSION&position=0&searchId=fdd4c72b-bd61-4019-a39f-42877ff2b81a&sid=KrU&sortBy=%22date_posted%22
Maynard Webb,Male,2024-04-27,#AsKMaynard tackles a great question from Laurie Morris about #worklifebalance. I share what I've learned including great advice from Brad Smith. #intuit,251,8,0,https://www.linkedin.com/search/results/content/?fromMember=%5B%22ACoAAAI4Aw4BS3TllsKr6E15v4CDckxNKmfQpTY%22%5D&heroEntityKey=urn%3Ali%3Afsd_profile%3AACoAAAI4Aw4BS3TllsKr6E15v4CDckxNKmfQpTY&keywords=maynard%20webb&origin=CLUSTER_EXPANSION&position=0&searchId=fdd4c72b-bd61-4019-a39f-42877ff2b81a&sid=KrU&sortBy=%22date_posted%22
Maynard Webb,Male,2022-04-27,My answer to this week's question on Dear Founder. Ask me your question in the comments. #publicspeaking #careeradvice #careerdevelopment #careerdevelopmentcoaching,251,24,24,https://www.linkedin.com/search/results/content/?fromMember=%5B%22ACoAAAI4Aw4BS3TllsKr6E15v4CDckxNKmfQpTY%22%5D&heroEntityKey=urn%3Ali%3Afsd_profile%3AACoAAAI4Aw4BS3TllsKr6E15v4CDckxNKmfQpTY&keywords=maynard%20webb&origin=CLUSTER_EXPANSION&position=0&searchId=fdd4c72b-bd61-4019-a39f-42877ff2b81a&sid=KrU&sortBy=%22date_posted%22
Maynard Webb,Male,2023-04-27,"This week a CEO asks me an interesting, and very timely question. Every week I respond to a new question. Ask me your question in the comments section on LinkedIn!",238,12,7,https://www.linkedin.com/search/results/content/?fromMember=%5B%22ACoAAAI4Aw4BS3TllsKr6E15v4CDckxNKmfQpTY%22%5D&heroEntityKey=urn%3Ali%3Afsd_profile%3AACoAAAI4Aw4BS3TllsKr6E15v4CDckxNKmfQpTY&keywords=maynard%20webb&origin=CLUSTER_EXPANSION&position=0&searchId=fdd4c72b-bd61-4019-a39f-42877ff2b81a&sid=KrU&sortBy=%22date_posted%22
Maynard Webb,Male,2024-04-27,"Even when you have setbacks, you can find enjoyable moments.",219,12,0,https://www.linkedin.com/search/results/content/?fromMember=%5B%22ACoAAAI4Aw4BS3TllsKr6E15v4CDckxNKmfQpTY%22%5D&heroEntityKey=urn%3Ali%3Afsd_profile%3AACoAAAI4Aw4BS3TllsKr6E15v4CDckxNKmfQpTY&keywords=maynard%20webb&origin=CLUSTER_EXPANSION&position=0&searchId=fdd4c72b-bd61-4019-a39f-42877ff2b81a&sid=KrU&sortBy=%22date_posted%22
Maynard Webb,Male,2023-04-27,"Scaling is always a hot topic. This week, a founder of a growing organization in Mexico City asks me how to balance promoting from within with bringing on new people with fresh ideas--and how to make sure everyone is going in the same direction.",161,6,8,https://www.linkedin.com/search/results/content/?fromMember=%5B%22ACoAAAI4Aw4BS3TllsKr6E15v4CDckxNKmfQpTY%22%5D&heroEntityKey=urn%3Ali%3Afsd_profile%3AACoAAAI4Aw4BS3TllsKr6E15v4CDckxNKmfQpTY&keywords=maynard%20webb&origin=CLUSTER_EXPANSION&position=0&searchId=fdd4c72b-bd61-4019-a39f-42877ff2b81a&sid=KrU&sortBy=%22date_posted%22
Maynard Webb,Male,2023-04-27,"In this week's Dear Founder, I tackle one of the most central questions for all of us: How do I pursue what matters?",148,16,21,https://www.linkedin.com/search/results/content/?fromMember=%5B%22ACoAAAI4Aw4BS3TllsKr6E15v4CDckxNKmfQpTY%22%5D&heroEntityKey=urn%3Ali%3Afsd_profile%3AACoAAAI4Aw4BS3TllsKr6E15v4CDckxNKmfQpTY&keywords=maynard%20webb&origin=CLUSTER_EXPANSION&position=0&searchId=fdd4c72b-bd61-4019-a39f-42877ff2b81a&sid=KrU&sortBy=%22date_posted%22
Maynard Webb,Male,2022-04-27,How do you build and sustain a culture when everyone is working remotely? My answer on this week's #dearfounder on #linkedin,144,11,8,https://www.linkedin.com/search/results/content/?fromMember=%5B%22ACoAAAI4Aw4BS3TllsKr6E15v4CDckxNKmfQpTY%22%5D&heroEntityKey=urn%3Ali%3Afsd_profile%3AACoAAAI4Aw4BS3TllsKr6E15v4CDckxNKmfQpTY&keywords=maynard%20webb&origin=CLUSTER_EXPANSION&position=0&searchId=fdd4c72b-bd61-4019-a39f-42877ff2b81a&sid=KrU&sortBy=%22date_posted%22
Maynard Webb,Male,2022-04-27,"This week's Dear Founder. A really interesting question from a pre-IPO founder, and perhaps an unexpected answer from me. Ask me your questions in the comments and I'll answer in another edition of #DearFounder on #LinkedIn",140,18,3,https://www.linkedin.com/search/results/content/?fromMember=%5B%22ACoAAAI4Aw4BS3TllsKr6E15v4CDckxNKmfQpTY%22%5D&heroEntityKey=urn%3Ali%3Afsd_profile%3AACoAAAI4Aw4BS3TllsKr6E15v4CDckxNKmfQpTY&keywords=maynard%20webb&origin=CLUSTER_EXPANSION&position=0&searchId=fdd4c72b-bd61-4019-a39f-42877ff2b81a&sid=KrU&sortBy=%22date_posted%22
Maynard Webb,Male,2023-04-27,A Dear Founder reader reached out to me looking for help with a challenging situation. Two teams that are supposed to be working together have locked horns. The power struggle has stymied productivity. Read my advice to this founder in this week's newsletter.,138,5,7,https://www.linkedin.com/search/results/content/?fromMember=%5B%22ACoAAAI4Aw4BS3TllsKr6E15v4CDckxNKmfQpTY%22%5D&heroEntityKey=urn%3Ali%3Afsd_profile%3AACoAAAI4Aw4BS3TllsKr6E15v4CDckxNKmfQpTY&keywords=maynard%20webb&origin=CLUSTER_EXPANSION&position=0&searchId=fdd4c72b-bd61-4019-a39f-42877ff2b81a&sid=KrU&sortBy=%22date_posted%22
Maynard Webb,Male,2024-04-27,We #admire Jeff Weiner and learned so much from him when he spoke at the Webb Investment Network’s annual summit. But who #inspires Jeff? His top three picks here:,128,Comment,0,https://www.linkedin.com/search/results/content/?fromMember=%5B%22ACoAAAI4Aw4BS3TllsKr6E15v4CDckxNKmfQpTY%22%5D&heroEntityKey=urn%3Ali%3Afsd_profile%3AACoAAAI4Aw4BS3TllsKr6E15v4CDckxNKmfQpTY&keywords=maynard%20webb&origin=CLUSTER_EXPANSION&position=0&searchId=fdd4c72b-bd61-4019-a39f-42877ff2b81a&sid=KrU&sortBy=%22date_posted%22
Maynard Webb,Male,2022-04-27,This week's LinkedIn Newsletter tackles a question I receive a lot: How do I position myself to get a board position? #dearfounder #linkedinposts #boardofdirectors #careeradvice,126,11,11,https://www.linkedin.com/search/results/content/?fromMember=%5B%22ACoAAAI4Aw4BS3TllsKr6E15v4CDckxNKmfQpTY%22%5D&heroEntityKey=urn%3Ali%3Afsd_profile%3AACoAAAI4Aw4BS3TllsKr6E15v4CDckxNKmfQpTY&keywords=maynard%20webb&origin=CLUSTER_EXPANSION&position=0&searchId=fdd4c72b-bd61-4019-a39f-42877ff2b81a&sid=KrU&sortBy=%22date_posted%22
Maynard Webb,Male,2024-04-27,I’m excited to kickstart 2018 by renewing the #AskMaynard column and discussing what you want to focus on this new year. [[link to long form article]] How can you achieve it in the midst of everyone else’s requests for your time and energy? Please send your thoughts and questions and I will respond.,121,11,0,https://www.linkedin.com/search/results/content/?fromMember=%5B%22ACoAAAI4Aw4BS3TllsKr6E15v4CDckxNKmfQpTY%22%5D&heroEntityKey=urn%3Ali%3Afsd_profile%3AACoAAAI4Aw4BS3TllsKr6E15v4CDckxNKmfQpTY&keywords=maynard%20webb&origin=CLUSTER_EXPANSION&position=0&searchId=fdd4c72b-bd61-4019-a39f-42877ff2b81a&sid=KrU&sortBy=%22date_posted%22
Maynard Webb,Male,2023-04-27,,93,36,7,https://www.linkedin.com/search/results/content/?fromMember=%5B%22ACoAAAI4Aw4BS3TllsKr6E15v4CDckxNKmfQpTY%22%5D&heroEntityKey=urn%3Ali%3Afsd_profile%3AACoAAAI4Aw4BS3TllsKr6E15v4CDckxNKmfQpTY&keywords=maynard%20webb&origin=CLUSTER_EXPANSION&position=0&searchId=fdd4c72b-bd61-4019-a39f-42877ff2b81a&sid=KrU&sortBy=%22date_posted%22
Maynard Webb,Male,2023-04-27,"How can you get funding for your great idea? In this installment of my LinkedIn newsletter, I share some of my best advice for those looking to realize their big picture idea.",93,7,4,https://www.linkedin.com/search/results/content/?fromMember=%5B%22ACoAAAI4Aw4BS3TllsKr6E15v4CDckxNKmfQpTY%22%5D&heroEntityKey=urn%3Ali%3Afsd_profile%3AACoAAAI4Aw4BS3TllsKr6E15v4CDckxNKmfQpTY&keywords=maynard%20webb&origin=CLUSTER_EXPANSION&position=0&searchId=fdd4c72b-bd61-4019-a39f-42877ff2b81a&sid=KrU&sortBy=%22date_posted%22
Maynard Webb,Male,2023-04-27,"Despite being successful, a general partner at a high-profile firm can't shake a feeling of anxiety and not belonging. In this week's Dear Founder, I share advice about how to deal with imposter syndrome.",85,13,11,https://www.linkedin.com/search/results/content/?fromMember=%5B%22ACoAAAI4Aw4BS3TllsKr6E15v4CDckxNKmfQpTY%22%5D&heroEntityKey=urn%3Ali%3Afsd_profile%3AACoAAAI4Aw4BS3TllsKr6E15v4CDckxNKmfQpTY&keywords=maynard%20webb&origin=CLUSTER_EXPANSION&position=0&searchId=fdd4c72b-bd61-4019-a39f-42877ff2b81a&sid=KrU&sortBy=%22date_posted%22
Maynard Webb,Male,2023-04-27,"Thank you for reading Dear Founder and thank you for all of your questions and comments. Being asked for advice is a gift. Have a wonderful holiday with your loved ones, have gratitude for what is going well, and be thankful for all that is to come. Happy Thanksgiving!",80,4,8,https://www.linkedin.com/search/results/content/?fromMember=%5B%22ACoAAAI4Aw4BS3TllsKr6E15v4CDckxNKmfQpTY%22%5D&heroEntityKey=urn%3Ali%3Afsd_profile%3AACoAAAI4Aw4BS3TllsKr6E15v4CDckxNKmfQpTY&keywords=maynard%20webb&origin=CLUSTER_EXPANSION&position=0&searchId=fdd4c72b-bd61-4019-a39f-42877ff2b81a&sid=KrU&sortBy=%22date_posted%22
Maynard Webb,Male,2023-04-27,"This week on Dear Founder, a company had a serious situation and did not communicate it appropriately. The press is highlighting what is going on and employees and vendors are concerned. What should they do to get back on track?",78,8,9,https://www.linkedin.com/search/results/content/?fromMember=%5B%22ACoAAAI4Aw4BS3TllsKr6E15v4CDckxNKmfQpTY%22%5D&heroEntityKey=urn%3Ali%3Afsd_profile%3AACoAAAI4Aw4BS3TllsKr6E15v4CDckxNKmfQpTY&keywords=maynard%20webb&origin=CLUSTER_EXPANSION&position=0&searchId=fdd4c72b-bd61-4019-a39f-42877ff2b81a&sid=KrU&sortBy=%22date_posted%22
Maynard Webb,Male,2022-04-27,"This week, a CEO asks me what do when employees say the company's diversity & inclusion effort is good, but not good enough. My answer on Dear Founder. Each week I respond to a new question. Ask me your question in the comments! #diversity #inclusion #ceo",73,8,5,https://www.linkedin.com/search/results/content/?fromMember=%5B%22ACoAAAI4Aw4BS3TllsKr6E15v4CDckxNKmfQpTY%22%5D&heroEntityKey=urn%3Ali%3Afsd_profile%3AACoAAAI4Aw4BS3TllsKr6E15v4CDckxNKmfQpTY&keywords=maynard%20webb&origin=CLUSTER_EXPANSION&position=0&searchId=fdd4c72b-bd61-4019-a39f-42877ff2b81a&sid=KrU&sortBy=%22date_posted%22
Maynard Webb,Male,2022-04-27,This week's Dear Founder--a question about how to best navigate going back to the office. Each week I answer a new question. Ask me your question in the comments! #dearfounder #returntooffice #ceotips #change,73,8,7,https://www.linkedin.com/search/results/content/?fromMember=%5B%22ACoAAAI4Aw4BS3TllsKr6E15v4CDckxNKmfQpTY%22%5D&heroEntityKey=urn%3Ali%3Afsd_profile%3AACoAAAI4Aw4BS3TllsKr6E15v4CDckxNKmfQpTY&keywords=maynard%20webb&origin=CLUSTER_EXPANSION&position=0&searchId=fdd4c72b-bd61-4019-a39f-42877ff2b81a&sid=KrU&sortBy=%22date_posted%22
Maynard Webb,Male,2022-04-27,This week a founder of a Series A company asks me about bringing on senior executives. Is this the right time or are there risks to consider? #dearfounder #seriesa #hiring #linkedinposts,72,4,8,https://www.linkedin.com/search/results/content/?fromMember=%5B%22ACoAAAI4Aw4BS3TllsKr6E15v4CDckxNKmfQpTY%22%5D&heroEntityKey=urn%3Ali%3Afsd_profile%3AACoAAAI4Aw4BS3TllsKr6E15v4CDckxNKmfQpTY&keywords=maynard%20webb&origin=CLUSTER_EXPANSION&position=0&searchId=fdd4c72b-bd61-4019-a39f-42877ff2b81a&sid=KrU&sortBy=%22date_posted%22
Maynard Webb,Male,2023-04-27,This week a Dear Founder reader asks me how to create a sustainable and effective hybrid work environment. I asked tech exec friends James Barrese at Chime and Jeremy King at Pinterest for help with this answer. They had a lot of great wisdom to share.,71,14,11,https://www.linkedin.com/search/results/content/?fromMember=%5B%22ACoAAAI4Aw4BS3TllsKr6E15v4CDckxNKmfQpTY%22%5D&heroEntityKey=urn%3Ali%3Afsd_profile%3AACoAAAI4Aw4BS3TllsKr6E15v4CDckxNKmfQpTY&keywords=maynard%20webb&origin=CLUSTER_EXPANSION&position=0&searchId=fdd4c72b-bd61-4019-a39f-42877ff2b81a&sid=KrU&sortBy=%22date_posted%22
Maynard Webb,Male,2022-04-27,A founder is incorporating their company and needs to know more about various ways to structure the stock. My answer and advice. #startup #founder,71,1,6,https://www.linkedin.com/search/results/content/?fromMember=%5B%22ACoAAAI4Aw4BS3TllsKr6E15v4CDckxNKmfQpTY%22%5D&heroEntityKey=urn%3Ali%3Afsd_profile%3AACoAAAI4Aw4BS3TllsKr6E15v4CDckxNKmfQpTY&keywords=maynard%20webb&origin=CLUSTER_EXPANSION&position=0&searchId=fdd4c72b-bd61-4019-a39f-42877ff2b81a&sid=KrU&sortBy=%22date_posted%22
Maynard Webb,Male,2023-04-27,"This week on Dear Founder, a startup was close to closing a big deal but hit a roadblock when asked to provide audited financials. I wanted to provide the most thorough answer, so I consulted with three CFOs who are affiliates in the Webb Investment Network. Thank you Cheryl Dalrymple, Michael Fleisher and Bill Ruehle for sharing your experience and advice. This letter reflects their incredible collective wisdom.",71,6,9,https://www.linkedin.com/search/results/content/?fromMember=%5B%22ACoAAAI4Aw4BS3TllsKr6E15v4CDckxNKmfQpTY%22%5D&heroEntityKey=urn%3Ali%3Afsd_profile%3AACoAAAI4Aw4BS3TllsKr6E15v4CDckxNKmfQpTY&keywords=maynard%20webb&origin=CLUSTER_EXPANSION&position=0&searchId=fdd4c72b-bd61-4019-a39f-42877ff2b81a&sid=KrU&sortBy=%22date_posted%22
Maynard Webb,Male,2023-04-27,"A CEO at a software startup is concerned about a direct report who hasn't delivered as expected.  ""Is it better to cut bait now, replace him, and start over fresh?"" he asks. ""Or should I keep investing and supporting him with hopes he’ll turn around?"" My answer and advice in this week's newsletter.",70,11,5,https://www.linkedin.com/search/results/content/?fromMember=%5B%22ACoAAAI4Aw4BS3TllsKr6E15v4CDckxNKmfQpTY%22%5D&heroEntityKey=urn%3Ali%3Afsd_profile%3AACoAAAI4Aw4BS3TllsKr6E15v4CDckxNKmfQpTY&keywords=maynard%20webb&origin=CLUSTER_EXPANSION&position=0&searchId=fdd4c72b-bd61-4019-a39f-42877ff2b81a&sid=KrU&sortBy=%22date_posted%22
Maynard Webb,Male,2023-04-27,A mother reaches out for advice for her two college age daughters starting their careers in this economic climate. My advice about how to navigate these times and land jobs in this week's Dear Founder.,69,5,3,https://www.linkedin.com/search/results/content/?fromMember=%5B%22ACoAAAI4Aw4BS3TllsKr6E15v4CDckxNKmfQpTY%22%5D&heroEntityKey=urn%3Ali%3Afsd_profile%3AACoAAAI4Aw4BS3TllsKr6E15v4CDckxNKmfQpTY&keywords=maynard%20webb&origin=CLUSTER_EXPANSION&position=0&searchId=fdd4c72b-bd61-4019-a39f-42877ff2b81a&sid=KrU&sortBy=%22date_posted%22
Maynard Webb,Male,2023-04-27,A worried father asked me about his son's predicament--he had two great job offers pulled. Is this a sign of the times? Or something else? #job #joboffers #career #careerconversations #downturn #economy,68,10,4,https://www.linkedin.com/search/results/content/?fromMember=%5B%22ACoAAAI4Aw4BS3TllsKr6E15v4CDckxNKmfQpTY%22%5D&heroEntityKey=urn%3Ali%3Afsd_profile%3AACoAAAI4Aw4BS3TllsKr6E15v4CDckxNKmfQpTY&keywords=maynard%20webb&origin=CLUSTER_EXPANSION&position=0&searchId=fdd4c72b-bd61-4019-a39f-42877ff2b81a&sid=KrU&sortBy=%22date_posted%22
Maynard Webb,Male,2021-04-27,"Bill Trenchard, the managing partner at First Round Capital and Robin Washington, a member of board of directors of Alphabet, Honeywell International and Salesforce, share their advice how to run an effective board meeting—basically this is a roadmap from the people who know best. #boards #corporateboards #leadership",68,1,0,https://www.linkedin.com/search/results/content/?fromMember=%5B%22ACoAAAI4Aw4BS3TllsKr6E15v4CDckxNKmfQpTY%22%5D&heroEntityKey=urn%3Ali%3Afsd_profile%3AACoAAAI4Aw4BS3TllsKr6E15v4CDckxNKmfQpTY&keywords=maynard%20webb&origin=CLUSTER_EXPANSION&position=0&searchId=fdd4c72b-bd61-4019-a39f-42877ff2b81a&sid=KrU&sortBy=%22date_posted%22
Maynard Webb,Male,2023-04-27,"What to do when a vendor asks for an advance in pay? In this installment of my LinkedIn newsletter, I share advice for how to navigate tricky situations.",64,8,6,https://www.linkedin.com/search/results/content/?fromMember=%5B%22ACoAAAI4Aw4BS3TllsKr6E15v4CDckxNKmfQpTY%22%5D&heroEntityKey=urn%3Ali%3Afsd_profile%3AACoAAAI4Aw4BS3TllsKr6E15v4CDckxNKmfQpTY&keywords=maynard%20webb&origin=CLUSTER_EXPANSION&position=0&searchId=fdd4c72b-bd61-4019-a39f-42877ff2b81a&sid=KrU&sortBy=%22date_posted%22
Maynard Webb,Male,2023-04-27,A founder of a fast-growing company who has an important initiative to pull off asks me how to set it up for success. My advice in this week's Dear Founder Newsletter.,62,8,6,https://www.linkedin.com/search/results/content/?fromMember=%5B%22ACoAAAI4Aw4BS3TllsKr6E15v4CDckxNKmfQpTY%22%5D&heroEntityKey=urn%3Ali%3Afsd_profile%3AACoAAAI4Aw4BS3TllsKr6E15v4CDckxNKmfQpTY&keywords=maynard%20webb&origin=CLUSTER_EXPANSION&position=0&searchId=fdd4c72b-bd61-4019-a39f-42877ff2b81a&sid=KrU&sortBy=%22date_posted%22
Maynard Webb,Male,2023-04-27,"This week a senior executive at a late-stage startup tells me, ""I’m going through a crisis and feeling overwhelmed but it’s possible I’m overreacting."" My advice on what to do in this issue of Dear Founder.",61,4,3,https://www.linkedin.com/search/results/content/?fromMember=%5B%22ACoAAAI4Aw4BS3TllsKr6E15v4CDckxNKmfQpTY%22%5D&heroEntityKey=urn%3Ali%3Afsd_profile%3AACoAAAI4Aw4BS3TllsKr6E15v4CDckxNKmfQpTY&keywords=maynard%20webb&origin=CLUSTER_EXPANSION&position=0&searchId=fdd4c72b-bd61-4019-a39f-42877ff2b81a&sid=KrU&sortBy=%22date_posted%22
Maynard Webb,Male,2023-04-27,"An executive leaving an operating role is looking to make a meaningful impact and asks, ""How can I tell if something I'm exploring will be  soul food?"" My answer in this week's edition of Dear Founder.",60,7,2,https://www.linkedin.com/search/results/content/?fromMember=%5B%22ACoAAAI4Aw4BS3TllsKr6E15v4CDckxNKmfQpTY%22%5D&heroEntityKey=urn%3Ali%3Afsd_profile%3AACoAAAI4Aw4BS3TllsKr6E15v4CDckxNKmfQpTY&keywords=maynard%20webb&origin=CLUSTER_EXPANSION&position=0&searchId=fdd4c72b-bd61-4019-a39f-42877ff2b81a&sid=KrU&sortBy=%22date_posted%22
Maynard Webb,Male,2023-04-27,"In this week's newsletter the CEO of a Series A company is trying to do the right thing by delegating, but is going about it wrong. My best advice on delegating in this edition of Dear Founder.",60,8,6,https://www.linkedin.com/search/results/content/?fromMember=%5B%22ACoAAAI4Aw4BS3TllsKr6E15v4CDckxNKmfQpTY%22%5D&heroEntityKey=urn%3Ali%3Afsd_profile%3AACoAAAI4Aw4BS3TllsKr6E15v4CDckxNKmfQpTY&keywords=maynard%20webb&origin=CLUSTER_EXPANSION&position=0&searchId=fdd4c72b-bd61-4019-a39f-42877ff2b81a&sid=KrU&sortBy=%22date_posted%22
Maynard Webb,Male,2023-04-27,"In this week's Dear Founder, a job candidate is uncertain about a new position only to realize later that it was the opportunity of a lifetime. My advice to this regretful prospect and how to land your dream job.",59,5,5,https://www.linkedin.com/search/results/content/?fromMember=%5B%22ACoAAAI4Aw4BS3TllsKr6E15v4CDckxNKmfQpTY%22%5D&heroEntityKey=urn%3Ali%3Afsd_profile%3AACoAAAI4Aw4BS3TllsKr6E15v4CDckxNKmfQpTY&keywords=maynard%20webb&origin=CLUSTER_EXPANSION&position=0&searchId=fdd4c72b-bd61-4019-a39f-42877ff2b81a&sid=KrU&sortBy=%22date_posted%22
Maynard Webb,Male,2023-04-27,"In this week's newsletter, a CEO is looking to fill the independent director seat on the company's board. How should they go about it? My answer in Dear Founder.",59,4,9,https://www.linkedin.com/search/results/content/?fromMember=%5B%22ACoAAAI4Aw4BS3TllsKr6E15v4CDckxNKmfQpTY%22%5D&heroEntityKey=urn%3Ali%3Afsd_profile%3AACoAAAI4Aw4BS3TllsKr6E15v4CDckxNKmfQpTY&keywords=maynard%20webb&origin=CLUSTER_EXPANSION&position=0&searchId=fdd4c72b-bd61-4019-a39f-42877ff2b81a&sid=KrU&sortBy=%22date_posted%22
Maynard Webb,Male,2023-04-27,"A mid-level manager reaches out to me upset about their company’s return to work plan. Like many employees, they don’t want to go back. My advice on how to handle this situation in this week’s Dear Founder Newsletter. (CliffsNotes version: you are more in control than you think.)",58,12,6,https://www.linkedin.com/search/results/content/?fromMember=%5B%22ACoAAAI4Aw4BS3TllsKr6E15v4CDckxNKmfQpTY%22%5D&heroEntityKey=urn%3Ali%3Afsd_profile%3AACoAAAI4Aw4BS3TllsKr6E15v4CDckxNKmfQpTY&keywords=maynard%20webb&origin=CLUSTER_EXPANSION&position=0&searchId=fdd4c72b-bd61-4019-a39f-42877ff2b81a&sid=KrU&sortBy=%22date_posted%22
Maynard Webb,Male,2023-04-27,"New Year, and we are all reflecting on new opportunities for fulfillment. This week, on Dear Founder, a senior manager at a fast-growing company is ready to move on--and asks me how to approach his exit. My advice:",57,3,4,https://www.linkedin.com/search/results/content/?fromMember=%5B%22ACoAAAI4Aw4BS3TllsKr6E15v4CDckxNKmfQpTY%22%5D&heroEntityKey=urn%3Ali%3Afsd_profile%3AACoAAAI4Aw4BS3TllsKr6E15v4CDckxNKmfQpTY&keywords=maynard%20webb&origin=CLUSTER_EXPANSION&position=0&searchId=fdd4c72b-bd61-4019-a39f-42877ff2b81a&sid=KrU&sortBy=%22date_posted%22
Maynard Webb,Male,2023-04-27,"On Penguins and PredatorsThis week's newsletter answers a question about the value of worrying.  I share my thoughts and advice, some of which I learned on a recent trip to Antarctica.",57,Comment,3,https://www.linkedin.com/search/results/content/?fromMember=%5B%22ACoAAAI4Aw4BS3TllsKr6E15v4CDckxNKmfQpTY%22%5D&heroEntityKey=urn%3Ali%3Afsd_profile%3AACoAAAI4Aw4BS3TllsKr6E15v4CDckxNKmfQpTY&keywords=maynard%20webb&origin=CLUSTER_EXPANSION&position=0&searchId=fdd4c72b-bd61-4019-a39f-42877ff2b81a&sid=KrU&sortBy=%22date_posted%22
Maynard Webb,Male,2023-04-27,"Ever find yourself careening from one urgent decision after another? As one CEO tells me, ""it’s exhilarating and exhausting at the same time."" But is it sustainable? My advice on how to operate at a world-class level and make the hard look easy. More swan dives, fewer belly flops. -",57,2,2,https://www.linkedin.com/search/results/content/?fromMember=%5B%22ACoAAAI4Aw4BS3TllsKr6E15v4CDckxNKmfQpTY%22%5D&heroEntityKey=urn%3Ali%3Afsd_profile%3AACoAAAI4Aw4BS3TllsKr6E15v4CDckxNKmfQpTY&keywords=maynard%20webb&origin=CLUSTER_EXPANSION&position=0&searchId=fdd4c72b-bd61-4019-a39f-42877ff2b81a&sid=KrU&sortBy=%22date_posted%22
Maynard Webb,Male,2023-04-27,A founder asks me how to create a high-performance culture. My answer on this week's Dear Founder.,56,3,1,https://www.linkedin.com/search/results/content/?fromMember=%5B%22ACoAAAI4Aw4BS3TllsKr6E15v4CDckxNKmfQpTY%22%5D&heroEntityKey=urn%3Ali%3Afsd_profile%3AACoAAAI4Aw4BS3TllsKr6E15v4CDckxNKmfQpTY&keywords=maynard%20webb&origin=CLUSTER_EXPANSION&position=0&searchId=fdd4c72b-bd61-4019-a39f-42877ff2b81a&sid=KrU&sortBy=%22date_posted%22
