Author,Gender,Date,Post Text,Likes,Comments,Shares,Page Link
Maynard Webb,Male,2023-11-27,"A Dear Founder reader tells me he's following his passion building a media content startup, but his friends have advised him to pursue a career first, make money, establish a network, and then return to his dream. He asks me what to do. My advice in this week's edition:",32,4,1,https://www.linkedin.com/search/results/content/?fromMember=%5B%22ACoAAAI4Aw4BS3TllsKr6E15v4CDckxNKmfQpTY%22%5D&heroEntityKey=urn%3Ali%3Afsd_profile%3AACoAAAI4Aw4BS3TllsKr6E15v4CDckxNKmfQpTY&keywords=maynard%20webb&origin=CLUSTER_EXPANSION&position=0&searchId=fdd4c72b-bd61-4019-a39f-42877ff2b81a&sid=KrU&sortBy=%22date_posted%22
Maynard Webb,Male,2023-04-27,"This week an ""overwhelmed human"" reaches out for guidance on how to deal with all the incoming. My advice in this edition of Dear Founder.",32,2,3,https://www.linkedin.com/search/results/content/?fromMember=%5B%22ACoAAAI4Aw4BS3TllsKr6E15v4CDckxNKmfQpTY%22%5D&heroEntityKey=urn%3Ali%3Afsd_profile%3AACoAAAI4Aw4BS3TllsKr6E15v4CDckxNKmfQpTY&keywords=maynard%20webb&origin=CLUSTER_EXPANSION&position=0&searchId=fdd4c72b-bd61-4019-a39f-42877ff2b81a&sid=KrU&sortBy=%22date_posted%22
Maynard Webb,Male,2023-12-27,"This week on Dear Founder, a senior executive is weighing great two options--continuing his career in a new role or going somewhere new. My advice on how to consider these opportunities, and my own personal story:",32,3,0,https://www.linkedin.com/search/results/content/?fromMember=%5B%22ACoAAAI4Aw4BS3TllsKr6E15v4CDckxNKmfQpTY%22%5D&heroEntityKey=urn%3Ali%3Afsd_profile%3AACoAAAI4Aw4BS3TllsKr6E15v4CDckxNKmfQpTY&keywords=maynard%20webb&origin=CLUSTER_EXPANSION&position=0&searchId=fdd4c72b-bd61-4019-a39f-42877ff2b81a&sid=KrU&sortBy=%22date_posted%22
Maynard Webb,Male,2024-01-27,"A senior executive is overwhelmed with requests that demand their time and not able to find the time for what they want to do. They asked me if I have a methodology to handle this. My advice, thoughts about trying to do it all, and a new mindset, in this week's edition of #DearFounder.",31,6,1,https://www.linkedin.com/search/results/content/?fromMember=%5B%22ACoAAAI4Aw4BS3TllsKr6E15v4CDckxNKmfQpTY%22%5D&heroEntityKey=urn%3Ali%3Afsd_profile%3AACoAAAI4Aw4BS3TllsKr6E15v4CDckxNKmfQpTY&keywords=maynard%20webb&origin=CLUSTER_EXPANSION&position=0&searchId=fdd4c72b-bd61-4019-a39f-42877ff2b81a&sid=KrU&sortBy=%22date_posted%22
Maynard Webb,Male,2023-11-27,"A founder is looking for a board member and to build the executive team. In this edition of Dear Founder, I offer advice about how to experts in areas outside one's scope of knowledge.",31,3,0,https://www.linkedin.com/search/results/content/?fromMember=%5B%22ACoAAAI4Aw4BS3TllsKr6E15v4CDckxNKmfQpTY%22%5D&heroEntityKey=urn%3Ali%3Afsd_profile%3AACoAAAI4Aw4BS3TllsKr6E15v4CDckxNKmfQpTY&keywords=maynard%20webb&origin=CLUSTER_EXPANSION&position=0&searchId=fdd4c72b-bd61-4019-a39f-42877ff2b81a&sid=KrU&sortBy=%22date_posted%22
Maynard Webb,Male,2024-02-27,An executive focused on international expansion tells me things are not going well in China and asks me what to do. My advice--and my own humbling experience--in this week's edition of #DearFounder.,31,Comment,0,https://www.linkedin.com/search/results/content/?fromMember=%5B%22ACoAAAI4Aw4BS3TllsKr6E15v4CDckxNKmfQpTY%22%5D&heroEntityKey=urn%3Ali%3Afsd_profile%3AACoAAAI4Aw4BS3TllsKr6E15v4CDckxNKmfQpTY&keywords=maynard%20webb&origin=CLUSTER_EXPANSION&position=0&searchId=fdd4c72b-bd61-4019-a39f-42877ff2b81a&sid=KrU&sortBy=%22date_posted%22
Maynard Webb,Male,2023-09-27,I often receive questions from people who want to serve on a board. My advice in this week's edition of Dear Founder.,30,5,0,https://www.linkedin.com/search/results/content/?fromMember=%5B%22ACoAAAI4Aw4BS3TllsKr6E15v4CDckxNKmfQpTY%22%5D&heroEntityKey=urn%3Ali%3Afsd_profile%3AACoAAAI4Aw4BS3TllsKr6E15v4CDckxNKmfQpTY&keywords=maynard%20webb&origin=CLUSTER_EXPANSION&position=0&searchId=fdd4c72b-bd61-4019-a39f-42877ff2b81a&sid=KrU&sortBy=%22date_posted%22
Maynard Webb,Male,2021-04-27,"We were fortunate to have Jeff Sanders, Vice Chairman and Co-Managing Partner of the Global CEO and Board Practice for Heidrick & Struggles, join the Webb Investment Network team for a virtual event to discuss how to recruit board members. I found his wisdom to be so compelling that I wanted to share it more broadly, with you.",28,Comment,0,https://www.linkedin.com/search/results/content/?fromMember=%5B%22ACoAAAI4Aw4BS3TllsKr6E15v4CDckxNKmfQpTY%22%5D&heroEntityKey=urn%3Ali%3Afsd_profile%3AACoAAAI4Aw4BS3TllsKr6E15v4CDckxNKmfQpTY&keywords=maynard%20webb&origin=CLUSTER_EXPANSION&position=0&searchId=fdd4c72b-bd61-4019-a39f-42877ff2b81a&sid=KrU&sortBy=%22date_posted%22
Maynard Webb,Male,2024-02-27,"This week, we tackle a complicated topic: how to share the truth someone might not see it. My advice, in this edition of #DearFounder.",28,4,0,https://www.linkedin.com/search/results/content/?fromMember=%5B%22ACoAAAI4Aw4BS3TllsKr6E15v4CDckxNKmfQpTY%22%5D&heroEntityKey=urn%3Ali%3Afsd_profile%3AACoAAAI4Aw4BS3TllsKr6E15v4CDckxNKmfQpTY&keywords=maynard%20webb&origin=CLUSTER_EXPANSION&position=0&searchId=fdd4c72b-bd61-4019-a39f-42877ff2b81a&sid=KrU&sortBy=%22date_posted%22
Maynard Webb,Male,2023-09-27,"A CEO has been advised to ""control the communication"" between board members and employees, but tells me that feels ""unnatural"" and asks me what to do. My advice, in this week's edition of Dear Founder.",28,2,0,https://www.linkedin.com/search/results/content/?fromMember=%5B%22ACoAAAI4Aw4BS3TllsKr6E15v4CDckxNKmfQpTY%22%5D&heroEntityKey=urn%3Ali%3Afsd_profile%3AACoAAAI4Aw4BS3TllsKr6E15v4CDckxNKmfQpTY&keywords=maynard%20webb&origin=CLUSTER_EXPANSION&position=0&searchId=fdd4c72b-bd61-4019-a39f-42877ff2b81a&sid=KrU&sortBy=%22date_posted%22
Maynard Webb,Male,2024-02-27,"A founder asks me a question that many founders need to know the answer to: ""How do I build a good relationship with top tier VC firms?"" My advice, in this week's edition of #DearFounder:",27,3,1,https://www.linkedin.com/search/results/content/?fromMember=%5B%22ACoAAAI4Aw4BS3TllsKr6E15v4CDckxNKmfQpTY%22%5D&heroEntityKey=urn%3Ali%3Afsd_profile%3AACoAAAI4Aw4BS3TllsKr6E15v4CDckxNKmfQpTY&keywords=maynard%20webb&origin=CLUSTER_EXPANSION&position=0&searchId=fdd4c72b-bd61-4019-a39f-42877ff2b81a&sid=KrU&sortBy=%22date_posted%22
Maynard Webb,Male,2024-04-06,"This week, a leadership coach with a big idea asks me how they will know when they're ready for venture capital. My answer, in this edition of #DearFounder:",27,3,0,https://www.linkedin.com/search/results/content/?fromMember=%5B%22ACoAAAI4Aw4BS3TllsKr6E15v4CDckxNKmfQpTY%22%5D&heroEntityKey=urn%3Ali%3Afsd_profile%3AACoAAAI4Aw4BS3TllsKr6E15v4CDckxNKmfQpTY&keywords=maynard%20webb&origin=CLUSTER_EXPANSION&position=0&searchId=fdd4c72b-bd61-4019-a39f-42877ff2b81a&sid=KrU&sortBy=%22date_posted%22
Maynard Webb,Male,2023-05-27,"It can be exciting to be consulted, but it’s exhausting to make every decision, and it doesn’t scale. In this week's edition of DearFounder I advise a manager on how to get everyone more aligned and independent. Read on for more on my ""swim lane"" approach.",26,7,1,https://www.linkedin.com/search/results/content/?fromMember=%5B%22ACoAAAI4Aw4BS3TllsKr6E15v4CDckxNKmfQpTY%22%5D&heroEntityKey=urn%3Ali%3Afsd_profile%3AACoAAAI4Aw4BS3TllsKr6E15v4CDckxNKmfQpTY&keywords=maynard%20webb&origin=CLUSTER_EXPANSION&position=0&searchId=fdd4c72b-bd61-4019-a39f-42877ff2b81a&sid=KrU&sortBy=%22date_posted%22
Maynard Webb,Male,2024-01-27,"The founder of a growing startup needs to hire a few key exec roles and reaches out for help on how to run the process and get a great outcome. My best advice about recruiting, hiring, and onboarding in this week's edition of #DearFounder:",25,2,1,https://www.linkedin.com/search/results/content/?fromMember=%5B%22ACoAAAI4Aw4BS3TllsKr6E15v4CDckxNKmfQpTY%22%5D&heroEntityKey=urn%3Ali%3Afsd_profile%3AACoAAAI4Aw4BS3TllsKr6E15v4CDckxNKmfQpTY&keywords=maynard%20webb&origin=CLUSTER_EXPANSION&position=0&searchId=fdd4c72b-bd61-4019-a39f-42877ff2b81a&sid=KrU&sortBy=%22date_posted%22
Maynard Webb,Male,2023-09-27,"In this edition of Dear Founder, I'm asked how to thank someone who offered invaluable wisdom and advice, and how to continue to get help without taking advantage of the situation.",25,1,0,https://www.linkedin.com/search/results/content/?fromMember=%5B%22ACoAAAI4Aw4BS3TllsKr6E15v4CDckxNKmfQpTY%22%5D&heroEntityKey=urn%3Ali%3Afsd_profile%3AACoAAAI4Aw4BS3TllsKr6E15v4CDckxNKmfQpTY&keywords=maynard%20webb&origin=CLUSTER_EXPANSION&position=0&searchId=fdd4c72b-bd61-4019-a39f-42877ff2b81a&sid=KrU&sortBy=%22date_posted%22
Maynard Webb,Male,2024-02-27,An employee who works in a creative industry worries about her job being replaced by AI.,25,12,1,https://www.linkedin.com/search/results/content/?fromMember=%5B%22ACoAAAI4Aw4BS3TllsKr6E15v4CDckxNKmfQpTY%22%5D&heroEntityKey=urn%3Ali%3Afsd_profile%3AACoAAAI4Aw4BS3TllsKr6E15v4CDckxNKmfQpTY&keywords=maynard%20webb&origin=CLUSTER_EXPANSION&position=0&searchId=fdd4c72b-bd61-4019-a39f-42877ff2b81a&sid=KrU&sortBy=%22date_posted%22
Maynard Webb,Male,2024-04-13,"This week, I hear from an employee supporting a growing family. Their company's benefits package is not competitive. What should they do? My advice, in this edition of #DearFounder:",25,Comment,0,https://www.linkedin.com/search/results/content/?fromMember=%5B%22ACoAAAI4Aw4BS3TllsKr6E15v4CDckxNKmfQpTY%22%5D&heroEntityKey=urn%3Ali%3Afsd_profile%3AACoAAAI4Aw4BS3TllsKr6E15v4CDckxNKmfQpTY&keywords=maynard%20webb&origin=CLUSTER_EXPANSION&position=0&searchId=fdd4c72b-bd61-4019-a39f-42877ff2b81a&sid=KrU&sortBy=%22date_posted%22
Maynard Webb,Male,2024-01-27,"This week, I heard from the founder of a company that had its best year ever in 2021, but the past two years haven’t been great. While they were gearing up for a great exit, closed markets have changed that trajectory. The founder asks me how to keep my enthusiasm high. My answer, and thoughts about what the best things to do during a slow period, in this edition of #DearFounder:",23,3,0,https://www.linkedin.com/search/results/content/?fromMember=%5B%22ACoAAAI4Aw4BS3TllsKr6E15v4CDckxNKmfQpTY%22%5D&heroEntityKey=urn%3Ali%3Afsd_profile%3AACoAAAI4Aw4BS3TllsKr6E15v4CDckxNKmfQpTY&keywords=maynard%20webb&origin=CLUSTER_EXPANSION&position=0&searchId=fdd4c72b-bd61-4019-a39f-42877ff2b81a&sid=KrU&sortBy=%22date_posted%22
Maynard Webb,Male,2023-10-27,A CEO tells me that the company is having major issues with long-time employees and newcomers getting along. The old timers are feeling unappreciated and unloved.,23,5,2,https://www.linkedin.com/search/results/content/?fromMember=%5B%22ACoAAAI4Aw4BS3TllsKr6E15v4CDckxNKmfQpTY%22%5D&heroEntityKey=urn%3Ali%3Afsd_profile%3AACoAAAI4Aw4BS3TllsKr6E15v4CDckxNKmfQpTY&keywords=maynard%20webb&origin=CLUSTER_EXPANSION&position=0&searchId=fdd4c72b-bd61-4019-a39f-42877ff2b81a&sid=KrU&sortBy=%22date_posted%22
Maynard Webb,Male,2024-04-25,"A manager tells me that the company they work for has a misogynistic culture and asks, ""Is it possible for me to change the culture even though I’m not in a leadership position?"" My advice, in this week's edition of #DearFounder:",23,6,1,https://www.linkedin.com/search/results/content/?fromMember=%5B%22ACoAAAI4Aw4BS3TllsKr6E15v4CDckxNKmfQpTY%22%5D&heroEntityKey=urn%3Ali%3Afsd_profile%3AACoAAAI4Aw4BS3TllsKr6E15v4CDckxNKmfQpTY&keywords=maynard%20webb&origin=CLUSTER_EXPANSION&position=0&searchId=fdd4c72b-bd61-4019-a39f-42877ff2b81a&sid=KrU&sortBy=%22date_posted%22
Maynard Webb,Male,2023-04-27,An accomplished executive aiming to “right size” their career portfolio asks me about how to manage too many commitments. My advice in this week's Dear Founder:,23,1,1,https://www.linkedin.com/search/results/content/?fromMember=%5B%22ACoAAAI4Aw4BS3TllsKr6E15v4CDckxNKmfQpTY%22%5D&heroEntityKey=urn%3Ali%3Afsd_profile%3AACoAAAI4Aw4BS3TllsKr6E15v4CDckxNKmfQpTY&keywords=maynard%20webb&origin=CLUSTER_EXPANSION&position=0&searchId=fdd4c72b-bd61-4019-a39f-42877ff2b81a&sid=KrU&sortBy=%22date_posted%22
Maynard Webb,Male,2024-04-20,"The best companies support employee career growth by continuing to do what they’re doing—being successful. Success begets success. If a company isn’t growing, opportunities are more limited for the people who work there. When I started as a director on the Salesforce board in 2006 there were 2,500 employees. Now, there are more than 70,000. This kind of growth has given a lot of people a lot of opportunity.But this isn’t just a numbers game. Great companies make sure that their employees feel valued. They give people new assignments that build their capabilities and expertise. The best companies are always investing in training, paying for classes and seminars, and offering “extra credit” assignments. They make employee growth a priority and they walk the talk. They promote from within when they can, and help people achieve their full potential.#LinkedInTopCompanies",20,2,0,https://www.linkedin.com/search/results/content/?fromMember=%5B%22ACoAAAI4Aw4BS3TllsKr6E15v4CDckxNKmfQpTY%22%5D&heroEntityKey=urn%3Ali%3Afsd_profile%3AACoAAAI4Aw4BS3TllsKr6E15v4CDckxNKmfQpTY&keywords=maynard%20webb&origin=CLUSTER_EXPANSION&position=0&searchId=fdd4c72b-bd61-4019-a39f-42877ff2b81a&sid=KrU&sortBy=%22date_posted%22
Maynard Webb,Male,2024-04-20,"This week, a young executive with big career aspirations tells me that they routinely ask their boss for help. They ask me how to get better at handling things on their own. My advice, and thoughts on why this is so important, in this edition of #DearFounder:",19,4,2,https://www.linkedin.com/search/results/content/?fromMember=%5B%22ACoAAAI4Aw4BS3TllsKr6E15v4CDckxNKmfQpTY%22%5D&heroEntityKey=urn%3Ali%3Afsd_profile%3AACoAAAI4Aw4BS3TllsKr6E15v4CDckxNKmfQpTY&keywords=maynard%20webb&origin=CLUSTER_EXPANSION&position=0&searchId=fdd4c72b-bd61-4019-a39f-42877ff2b81a&sid=KrU&sortBy=%22date_posted%22
Maynard Webb,Male,2023-07-27,"A fast-growing startup hired a world-class leader to help the company scale. The CEO thinks he’s doing a good job, but the people who work for him don’t like him.",19,12,1,https://www.linkedin.com/search/results/content/?fromMember=%5B%22ACoAAAI4Aw4BS3TllsKr6E15v4CDckxNKmfQpTY%22%5D&heroEntityKey=urn%3Ali%3Afsd_profile%3AACoAAAI4Aw4BS3TllsKr6E15v4CDckxNKmfQpTY&keywords=maynard%20webb&origin=CLUSTER_EXPANSION&position=0&searchId=fdd4c72b-bd61-4019-a39f-42877ff2b81a&sid=KrU&sortBy=%22date_posted%22
Maynard Webb,Male,2023-11-27,"I frequently receive questions about how to build a board and how to find the best board members. As we've seen recently, these are some of the most important decisions a founder can make. This week, a founder asks me if it's better to put a co-founder or independent on the board. My response in this week's edition of Dear Founder:",19,3,0,https://www.linkedin.com/search/results/content/?fromMember=%5B%22ACoAAAI4Aw4BS3TllsKr6E15v4CDckxNKmfQpTY%22%5D&heroEntityKey=urn%3Ali%3Afsd_profile%3AACoAAAI4Aw4BS3TllsKr6E15v4CDckxNKmfQpTY&keywords=maynard%20webb&origin=CLUSTER_EXPANSION&position=0&searchId=fdd4c72b-bd61-4019-a39f-42877ff2b81a&sid=KrU&sortBy=%22date_posted%22
Maynard Webb,Male,2023-04-27,"Congrats to all the recent graduates! Many will be starting new jobs in the coming weeks; others might still be searching. While the headlines point to a bleak job outlook, this is still an exciting time to enter the workforce. And when it comes to new advances like AI, your generation is the one who gets it the most. You are not bound by the old rules. At the same time, there are some timeless learnings that stay the same. Some career advice as you start this new chapter: Focus on being voted on the team every day. Make sure you do something every day to show others you deserve to be part of their team. It’s all about integrity. Do what you say. Say what you do. Always act in a way that makes people remember you positively. Have a great attitude. We all know cranky people. You might be brilliant, but if you are hard to manage it’s simple to find someone else. Be fun and easy to work with. Work for a higher purpose. You will find more meaning in what you do every day, and it will drive you through the inevitable tough days. Pick your battles. There are a million things to be upset about in any work situation. Only fight about things that are important. Don’t get distracted by noise. Only worry about what you’re doing. It’s hard to run up the stairs as fast as you can when you are looking to the side or at the hundred people behind you trying to catch up.  Don’t be afraid of change. As you advance, don’t look back and wish for things to be the way they used to be. You always want to be growing. Step up to challenges, always volunteering, “I can do that.” Have a higher opinion of yourself and live up to your view of yourself—not what others think of you. Don’t confuse action for traction. Focus on outcomes. Have a talk with your boss. Ask, “What does success look like in 30 days, in 90 days.” Also ask, “What does great look like?”  Focus on expanding your sphere of influence. Don’t get upset about things over which you have no control. If you, invest your energy instead into expanding your sphere of influence, you can make a dramatic impact over more zones. Take time to sit back and reflect on where you are and where you want to be. Make time for a ‘compass check’— it is so easy to fall into a routine and not take the time to see if you are heading where you want to go.  Be a breakout. Most things worth doing are hard. Successful people get to where they are in their careers because they make the hard easy. Be especially brave and bold right now in this crazy economic time. Out of the craziest times come the world’s best innovations. Have fun. I didn’t focus on that enough early in my career. Figure out what you aspire to do and go for it with gusto. P.S. If you are still looking for a job, check out the open position at the Webb Investment Network’s portfolio companies! https://lnkd.in/gvGCwwp5 #GetStarted",17,1,1,https://www.linkedin.com/search/results/content/?fromMember=%5B%22ACoAAAI4Aw4BS3TllsKr6E15v4CDckxNKmfQpTY%22%5D&heroEntityKey=urn%3Ali%3Afsd_profile%3AACoAAAI4Aw4BS3TllsKr6E15v4CDckxNKmfQpTY&keywords=maynard%20webb&origin=CLUSTER_EXPANSION&position=0&searchId=fdd4c72b-bd61-4019-a39f-42877ff2b81a&sid=KrU&sortBy=%22date_posted%22
Maynard Webb,Male,2024-02-27,"A tech employee, recently laid off, asks if there are still opportunities in tech or if they should consider moving to a different industry.",15,12,1,https://www.linkedin.com/search/results/content/?fromMember=%5B%22ACoAAAI4Aw4BS3TllsKr6E15v4CDckxNKmfQpTY%22%5D&heroEntityKey=urn%3Ali%3Afsd_profile%3AACoAAAI4Aw4BS3TllsKr6E15v4CDckxNKmfQpTY&keywords=maynard%20webb&origin=CLUSTER_EXPANSION&position=0&searchId=fdd4c72b-bd61-4019-a39f-42877ff2b81a&sid=KrU&sortBy=%22date_posted%22
Maynard Webb,Male,2023-09-27,"What it takes to start a business in today’s economy is the same as any economy. We’re focusing a lot on #resilience, but it really comes down to #adaptability. External and internal factors are always in flux and therefore great companies are always changing. In the early days, leaders must be judicious about the use of cash, they have to test their way to product market fit. Once they turn on the jets, they have to hire feet on the street. There’s so much that changes as a startup grows from having a product in one country to one that’s sold globally, or as a company scales from three to 3,000 people. This is the natural cycle of building a business that demands constant evolution. Then there are external factors and black swan events—which are unpredictable and outside of anyone’s control—that demand further adaptability. All of this requires having a calm hand at the tiller. The best leaders have very good judgement and can pivot when necessary. Leading a company in any time demands a unique combination of arrogance required to build something out of nothing, and humility necessary to listen to customers and the market. Leading successfully comes down to having a strong value system where there’s great clarity on what you are trying to build and how you will get there.  What do you think are the most important skills for founders?#LinkedInTopStartupsPhoto by Håkon Grimstad on Unsplash",13,2,1,https://www.linkedin.com/search/results/content/?fromMember=%5B%22ACoAAAI4Aw4BS3TllsKr6E15v4CDckxNKmfQpTY%22%5D&heroEntityKey=urn%3Ali%3Afsd_profile%3AACoAAAI4Aw4BS3TllsKr6E15v4CDckxNKmfQpTY&keywords=maynard%20webb&origin=CLUSTER_EXPANSION&position=0&searchId=fdd4c72b-bd61-4019-a39f-42877ff2b81a&sid=KrU&sortBy=%22date_posted%22
Maynard Webb,Male,2023-10-27,"A founder of a financial institution wants to get a coveted board position. He asks me, “How do I position myself to stand out?”",12,4,0,https://www.linkedin.com/search/results/content/?fromMember=%5B%22ACoAAAI4Aw4BS3TllsKr6E15v4CDckxNKmfQpTY%22%5D&heroEntityKey=urn%3Ali%3Afsd_profile%3AACoAAAI4Aw4BS3TllsKr6E15v4CDckxNKmfQpTY&keywords=maynard%20webb&origin=CLUSTER_EXPANSION&position=0&searchId=fdd4c72b-bd61-4019-a39f-42877ff2b81a&sid=KrU&sortBy=%22date_posted%22
Maynard Webb,Male,2023-09-27,A manager looking to grow her career asks me how to become a more trusted colleague.,12,5,0,https://www.linkedin.com/search/results/content/?fromMember=%5B%22ACoAAAI4Aw4BS3TllsKr6E15v4CDckxNKmfQpTY%22%5D&heroEntityKey=urn%3Ali%3Afsd_profile%3AACoAAAI4Aw4BS3TllsKr6E15v4CDckxNKmfQpTY&keywords=maynard%20webb&origin=CLUSTER_EXPANSION&position=0&searchId=fdd4c72b-bd61-4019-a39f-42877ff2b81a&sid=KrU&sortBy=%22date_posted%22
Maynard Webb,Male,2023-05-27,The CEO of a mid-stage company with a few hundred employees is getting inundated with requests. How should they parse through them and stay focused on what really matters?,12,9,0,https://www.linkedin.com/search/results/content/?fromMember=%5B%22ACoAAAI4Aw4BS3TllsKr6E15v4CDckxNKmfQpTY%22%5D&heroEntityKey=urn%3Ali%3Afsd_profile%3AACoAAAI4Aw4BS3TllsKr6E15v4CDckxNKmfQpTY&keywords=maynard%20webb&origin=CLUSTER_EXPANSION&position=0&searchId=fdd4c72b-bd61-4019-a39f-42877ff2b81a&sid=KrU&sortBy=%22date_posted%22
Maynard Webb,Male,2023-10-27,"A CEO is struggling with the departure of a key executive, not long after a cofounder left. They asked me how to best address this.",12,11,0,https://www.linkedin.com/search/results/content/?fromMember=%5B%22ACoAAAI4Aw4BS3TllsKr6E15v4CDckxNKmfQpTY%22%5D&heroEntityKey=urn%3Ali%3Afsd_profile%3AACoAAAI4Aw4BS3TllsKr6E15v4CDckxNKmfQpTY&keywords=maynard%20webb&origin=CLUSTER_EXPANSION&position=0&searchId=fdd4c72b-bd61-4019-a39f-42877ff2b81a&sid=KrU&sortBy=%22date_posted%22
Maynard Webb,Male,2023-04-27,"A company had a major systems issue, and the founder is looking to hold someone accountable.",11,6,0,https://www.linkedin.com/search/results/content/?fromMember=%5B%22ACoAAAI4Aw4BS3TllsKr6E15v4CDckxNKmfQpTY%22%5D&heroEntityKey=urn%3Ali%3Afsd_profile%3AACoAAAI4Aw4BS3TllsKr6E15v4CDckxNKmfQpTY&keywords=maynard%20webb&origin=CLUSTER_EXPANSION&position=0&searchId=fdd4c72b-bd61-4019-a39f-42877ff2b81a&sid=KrU&sortBy=%22date_posted%22
Maynard Webb,Male,2023-06-27,A founder hired a recruiter for the first time.,11,5,0,https://www.linkedin.com/search/results/content/?fromMember=%5B%22ACoAAAI4Aw4BS3TllsKr6E15v4CDckxNKmfQpTY%22%5D&heroEntityKey=urn%3Ali%3Afsd_profile%3AACoAAAI4Aw4BS3TllsKr6E15v4CDckxNKmfQpTY&keywords=maynard%20webb&origin=CLUSTER_EXPANSION&position=0&searchId=fdd4c72b-bd61-4019-a39f-42877ff2b81a&sid=KrU&sortBy=%22date_posted%22
Maynard Webb,Male,2023-12-27,"An aspiring entrepreneur reaches out and tells me: “I’m in a corporate job, which is going ok, but I don’t love working for someone else. I’m wondering if I should go out on my own.”",11,1,0,https://www.linkedin.com/search/results/content/?fromMember=%5B%22ACoAAAI4Aw4BS3TllsKr6E15v4CDckxNKmfQpTY%22%5D&heroEntityKey=urn%3Ali%3Afsd_profile%3AACoAAAI4Aw4BS3TllsKr6E15v4CDckxNKmfQpTY&keywords=maynard%20webb&origin=CLUSTER_EXPANSION&position=0&searchId=fdd4c72b-bd61-4019-a39f-42877ff2b81a&sid=KrU&sortBy=%22date_posted%22
Maynard Webb,Male,2024-01-27,"A CEO tells me, “My startup is experiencing a cash crunch.” And asks, “What are my options to keep it afloat?”",10,8,1,https://www.linkedin.com/search/results/content/?fromMember=%5B%22ACoAAAI4Aw4BS3TllsKr6E15v4CDckxNKmfQpTY%22%5D&heroEntityKey=urn%3Ali%3Afsd_profile%3AACoAAAI4Aw4BS3TllsKr6E15v4CDckxNKmfQpTY&keywords=maynard%20webb&origin=CLUSTER_EXPANSION&position=0&searchId=fdd4c72b-bd61-4019-a39f-42877ff2b81a&sid=KrU&sortBy=%22date_posted%22
Maynard Webb,Male,2023-08-27,A new manager has people constantly asking for direction.,10,6,0,https://www.linkedin.com/search/results/content/?fromMember=%5B%22ACoAAAI4Aw4BS3TllsKr6E15v4CDckxNKmfQpTY%22%5D&heroEntityKey=urn%3Ali%3Afsd_profile%3AACoAAAI4Aw4BS3TllsKr6E15v4CDckxNKmfQpTY&keywords=maynard%20webb&origin=CLUSTER_EXPANSION&position=0&searchId=fdd4c72b-bd61-4019-a39f-42877ff2b81a&sid=KrU&sortBy=%22date_posted%22
Maynard Webb,Male,2023-06-27,Exciting news from Webb Investment Network portfolio company Pictorus. Congrats Chris Sullivan and Dillon McEwan!,9,2,0,https://www.linkedin.com/search/results/content/?fromMember=%5B%22ACoAAAI4Aw4BS3TllsKr6E15v4CDckxNKmfQpTY%22%5D&heroEntityKey=urn%3Ali%3Afsd_profile%3AACoAAAI4Aw4BS3TllsKr6E15v4CDckxNKmfQpTY&keywords=maynard%20webb&origin=CLUSTER_EXPANSION&position=0&searchId=fdd4c72b-bd61-4019-a39f-42877ff2b81a&sid=KrU&sortBy=%22date_posted%22
