Author,Gender,Date,Post Text,Likes,Comments,Shares,Page Link
Melissa Snover,Female,2024-01-27,"Today we are launching a new and exclusive stack flavour at Get Nourish3d; Citrus. We have worked hard to develop this tangy flavour which is already proving a hit when we soft launched it in Japan last year. Our Citrus flavour is made from the East Asian Yuzu fruit, giving it a delicious tart and fragrant kick. This can be added to all Personalised Nourished Stacks today. https://get-nourished.com/",77,6,1,https://www.linkedin.com/search/results/content/?fromMember=%5B%22ACoAAARiO3IBHx5SsO9k14J8Nxd_SccMFE0LAFw%22%5D&heroEntityKey=urn%3Ali%3Afsd_profile%3AACoAAARiO3IBHx5SsO9k14J8Nxd_SccMFE0LAFw&keywords=melissa%20snover&origin=CLUSTER_EXPANSION&position=0&searchId=c50fe653-070e-497e-92f1-0d111f07a987&sid=o%3AE&sortBy=%22date_posted%22
Melissa Snover,Female,2023-09-27,"We recently launched our brand-new Get Nourish3d Stack Builder, which gives our customers the opportunity to make a personalised nutrient gummy specifically tailored to their lifestyle and goals. This enables our customers to choose a unique combination of ingredients out of millions of potential combinations. You can learn more here: https://lnkd.in/es-k5yUH",77,5,0,https://www.linkedin.com/search/results/content/?fromMember=%5B%22ACoAAARiO3IBHx5SsO9k14J8Nxd_SccMFE0LAFw%22%5D&heroEntityKey=urn%3Ali%3Afsd_profile%3AACoAAARiO3IBHx5SsO9k14J8Nxd_SccMFE0LAFw&keywords=melissa%20snover&origin=CLUSTER_EXPANSION&position=0&searchId=c50fe653-070e-497e-92f1-0d111f07a987&sid=o%3AE&sortBy=%22date_posted%22
Melissa Snover,Female,2024-03-27,"It was an honour to be a keynote speaker last night at TheBusinessDesk.com Leadership Awards, having won Leader of the Year in 2023. It was truly inspiring to witness some of the extraordinary leadership and business achievements of the nominees. Congratulations to everyone who participated and thank you to The Business Desk for organising such a fantastic celebration of the business community in the West Midlands.",77,8,2,https://www.linkedin.com/search/results/content/?fromMember=%5B%22ACoAAARiO3IBHx5SsO9k14J8Nxd_SccMFE0LAFw%22%5D&heroEntityKey=urn%3Ali%3Afsd_profile%3AACoAAARiO3IBHx5SsO9k14J8Nxd_SccMFE0LAFw&keywords=melissa%20snover&origin=CLUSTER_EXPANSION&position=0&searchId=c50fe653-070e-497e-92f1-0d111f07a987&sid=o%3AE&sortBy=%22date_posted%22
Melissa Snover,Female,2023-08-27,"I’m delighted that Get Nourish3d has been reviewed again in Vogue, for the second time this month, this time talking about how much they loved our brand-new Collagen+ range. Thank you to Vogue for this glowing feature, and you can learn more about our brand-new product on the following link: https://lnkd.in/eXD5P37M",77,4,0,https://www.linkedin.com/search/results/content/?fromMember=%5B%22ACoAAARiO3IBHx5SsO9k14J8Nxd_SccMFE0LAFw%22%5D&heroEntityKey=urn%3Ali%3Afsd_profile%3AACoAAARiO3IBHx5SsO9k14J8Nxd_SccMFE0LAFw&keywords=melissa%20snover&origin=CLUSTER_EXPANSION&position=0&searchId=c50fe653-070e-497e-92f1-0d111f07a987&sid=o%3AE&sortBy=%22date_posted%22
Melissa Snover,Female,2023-12-27,"I wanted to extend my gratitude to all of the Get Nourish3d team for their collective effort in generously donating a range of gifts to children in need this Christmas through our partners, Birmingham City Mission. Charitable causes like Birmingham City Mission, have a substantial impact on communities throughout the UK, and we are proud to support them.",76,5,0,https://www.linkedin.com/search/results/content/?fromMember=%5B%22ACoAAARiO3IBHx5SsO9k14J8Nxd_SccMFE0LAFw%22%5D&heroEntityKey=urn%3Ali%3Afsd_profile%3AACoAAARiO3IBHx5SsO9k14J8Nxd_SccMFE0LAFw&keywords=melissa%20snover&origin=CLUSTER_EXPANSION&position=0&searchId=c50fe653-070e-497e-92f1-0d111f07a987&sid=o%3AE&sortBy=%22date_posted%22
Melissa Snover,Female,2023-06-27,"Within just 30 days of supplementing Ovoderm Collagen, participants in clinical studies saw softer, brighter, and more hydrated skin, plus over 50% improvement in joint health.Ovoderm is more than just collagen though, and was one of the reasons why we chose it for our Get Nourish3d Collagen+ stacks. You can learn more about our Nourished Collagen+ stacks on our website: https://lnkd.in/eXD5P37M",73,3,1,https://www.linkedin.com/search/results/content/?fromMember=%5B%22ACoAAARiO3IBHx5SsO9k14J8Nxd_SccMFE0LAFw%22%5D&heroEntityKey=urn%3Ali%3Afsd_profile%3AACoAAARiO3IBHx5SsO9k14J8Nxd_SccMFE0LAFw&keywords=melissa%20snover&origin=CLUSTER_EXPANSION&position=0&searchId=c50fe653-070e-497e-92f1-0d111f07a987&sid=o%3AE&sortBy=%22date_posted%22
Melissa Snover,Female,2023-08-27,"Since starting my career as an entrepreneur, I often get asked for pieces of advice for people just starting out. One of the best things you can do as an entrepreneur is learn when to say no. Watch the video to hear more.",69,3,1,https://www.linkedin.com/search/results/content/?fromMember=%5B%22ACoAAARiO3IBHx5SsO9k14J8Nxd_SccMFE0LAFw%22%5D&heroEntityKey=urn%3Ali%3Afsd_profile%3AACoAAARiO3IBHx5SsO9k14J8Nxd_SccMFE0LAFw&keywords=melissa%20snover&origin=CLUSTER_EXPANSION&position=0&searchId=c50fe653-070e-497e-92f1-0d111f07a987&sid=o%3AE&sortBy=%22date_posted%22
Melissa Snover,Female,2024-02-27,"Our extended range of Get Nourish3d Collagen+ has been a bestseller in Selfridges since launching in July last year. Due to an overwhelmingly positive response, we are delighted to add Nourished Collagen+ Sleep, Energy & the Age Rewind stacks to our UK website. You can learn more by visiting the link below:https://lnkd.in/eXD5P37M",68,2,2,https://www.linkedin.com/search/results/content/?fromMember=%5B%22ACoAAARiO3IBHx5SsO9k14J8Nxd_SccMFE0LAFw%22%5D&heroEntityKey=urn%3Ali%3Afsd_profile%3AACoAAARiO3IBHx5SsO9k14J8Nxd_SccMFE0LAFw&keywords=melissa%20snover&origin=CLUSTER_EXPANSION&position=0&searchId=c50fe653-070e-497e-92f1-0d111f07a987&sid=o%3AE&sortBy=%22date_posted%22
Melissa Snover,Female,2023-06-27,"Happy work anniversary to our Chief of Staff, Caitlin Stanley, our Chief Operating Office, Leanne Jordan, our Chief Technology Officer, Martyn C. and our Head of Design Reece Pedley, all of whom have been with the business for 4 years!",68,1,0,https://www.linkedin.com/search/results/content/?fromMember=%5B%22ACoAAARiO3IBHx5SsO9k14J8Nxd_SccMFE0LAFw%22%5D&heroEntityKey=urn%3Ali%3Afsd_profile%3AACoAAARiO3IBHx5SsO9k14J8Nxd_SccMFE0LAFw&keywords=melissa%20snover&origin=CLUSTER_EXPANSION&position=0&searchId=c50fe653-070e-497e-92f1-0d111f07a987&sid=o%3AE&sortBy=%22date_posted%22
Melissa Snover,Female,2023-05-27,"I’m definitely not keen on surprises, but I certainly enjoyed the surprise baby shower we threw for Zayna this week! Zayna is a valued member of our New Product Development team and has been with Get Nourish3d over 2 years. We’re so excited for the arrival of her baby boy and wish her all the best on her new journey of motherhood!",68,1,2,https://www.linkedin.com/search/results/content/?fromMember=%5B%22ACoAAARiO3IBHx5SsO9k14J8Nxd_SccMFE0LAFw%22%5D&heroEntityKey=urn%3Ali%3Afsd_profile%3AACoAAARiO3IBHx5SsO9k14J8Nxd_SccMFE0LAFw&keywords=melissa%20snover&origin=CLUSTER_EXPANSION&position=0&searchId=c50fe653-070e-497e-92f1-0d111f07a987&sid=o%3AE&sortBy=%22date_posted%22
Melissa Snover,Female,2023-05-27,I am honoured to announce that Get Nourish3d has been included in this year's FEBE Growth 100 Watch List. This list celebrates entrepreneurship and companies that have built a team of talented individuals as they continue to push the business's growth. I want to thank FEBE Growth 100 for this recognition and extend a special thank you to the Nourished team. #febe,67,7,5,https://www.linkedin.com/search/results/content/?fromMember=%5B%22ACoAAARiO3IBHx5SsO9k14J8Nxd_SccMFE0LAFw%22%5D&heroEntityKey=urn%3Ali%3Afsd_profile%3AACoAAARiO3IBHx5SsO9k14J8Nxd_SccMFE0LAFw&keywords=melissa%20snover&origin=CLUSTER_EXPANSION&position=0&searchId=c50fe653-070e-497e-92f1-0d111f07a987&sid=o%3AE&sortBy=%22date_posted%22
Melissa Snover,Female,2024-04-26,"I had the privilege of joining a remarkable group of leaders at the BUY WOMEN BUILT Afternoon Tea 10 Downing Street yesterday, hosted by Mrs. Akshata Murty. This event not only celebrated the innovative spirit and resilience of female entrepreneurs but also emphasised how businesses like ours can drive meaningful impact both in our communities and in the UK business ecosystem.Thank you to Sahar Hashemi OBE (Founder of BWB) and every attendee who continues to push boundaries and champion female-founded businesses. By supporting organisations like Buy Women Built, we empower one another to build on our collective journeys and inspire a future generation of disruptors.",67,3,3,https://www.linkedin.com/search/results/content/?fromMember=%5B%22ACoAAARiO3IBHx5SsO9k14J8Nxd_SccMFE0LAFw%22%5D&heroEntityKey=urn%3Ali%3Afsd_profile%3AACoAAARiO3IBHx5SsO9k14J8Nxd_SccMFE0LAFw&keywords=melissa%20snover&origin=CLUSTER_EXPANSION&position=0&searchId=c50fe653-070e-497e-92f1-0d111f07a987&sid=o%3AE&sortBy=%22date_posted%22
Melissa Snover,Female,2023-04-27,"I’m grateful to see that Get Nourish3d has been shortlisted for ‘Manufacturing Innovator of the Year’ at the Innovation Awards 2023. This prestigious award by The Technology Supply Chain, and supported by partners such as NatWest, Innovate UK, the West Midlands Combined Authority and more, celebrates businesses and organisations that are dedicated to innovation.To show your support for Nourished, we kindly invite you to cast your vote for us through the following link: https://lnkd.in/eBgnQy32. Please vote by selecting ‘Nourish3d’ in the first category and completing your contact details at the end of the form, which only takes 1-2 minutes. Voting will close at 6 pm on Friday, June 2nd.",66,4,1,https://www.linkedin.com/search/results/content/?fromMember=%5B%22ACoAAARiO3IBHx5SsO9k14J8Nxd_SccMFE0LAFw%22%5D&heroEntityKey=urn%3Ali%3Afsd_profile%3AACoAAARiO3IBHx5SsO9k14J8Nxd_SccMFE0LAFw&keywords=melissa%20snover&origin=CLUSTER_EXPANSION&position=0&searchId=c50fe653-070e-497e-92f1-0d111f07a987&sid=o%3AE&sortBy=%22date_posted%22
Melissa Snover,Female,2023-10-27,"Birmingham Tech Week/TechWM is always an event I look forward to each year, and I wanted to once again thank the organisers for inviting me to speak at a variety of keynotes and panels this week about topics around innovation, future tech, female fundraising, Get Nourish3d and more.I also wanted to extend my gratitude to everyone who attended an event and the other inspiring guests I had the honour of sharing a stage with. Together, I am confident we can continue to foster innovation, collaboration, and growth in Birmingham's tech community.",66,2,2,https://www.linkedin.com/search/results/content/?fromMember=%5B%22ACoAAARiO3IBHx5SsO9k14J8Nxd_SccMFE0LAFw%22%5D&heroEntityKey=urn%3Ali%3Afsd_profile%3AACoAAARiO3IBHx5SsO9k14J8Nxd_SccMFE0LAFw&keywords=melissa%20snover&origin=CLUSTER_EXPANSION&position=0&searchId=c50fe653-070e-497e-92f1-0d111f07a987&sid=o%3AE&sortBy=%22date_posted%22
Melissa Snover,Female,2024-03-27,"At the start of 2024, our first-ever Pop-up store in Asia, was a phenomenal success, bringing Get Nourish3d to one of the world's busiest districts in Japan’s famous Shibuya Scramble Square. This event introduced us to not only a dynamic new audience but also the Japanese media. Thank you to Ray Rehito Hatoyama who this week has featured us in this creative video, covering our cutting-edge technology, the importance of personalised nutrition and more. You can watch it here:https://lnkd.in/dakcb_qz",64,10,1,https://www.linkedin.com/search/results/content/?fromMember=%5B%22ACoAAARiO3IBHx5SsO9k14J8Nxd_SccMFE0LAFw%22%5D&heroEntityKey=urn%3Ali%3Afsd_profile%3AACoAAARiO3IBHx5SsO9k14J8Nxd_SccMFE0LAFw&keywords=melissa%20snover&origin=CLUSTER_EXPANSION&position=0&searchId=c50fe653-070e-497e-92f1-0d111f07a987&sid=o%3AE&sortBy=%22date_posted%22
Melissa Snover,Female,2023-12-27,Get Nourish3d wouldn't be where it is today without the support of our loyal customers. We’ve received over 1100 5-star reviews this year…here’s a sneak peek at some of my favourites! ⭐️⭐️⭐️⭐️⭐️,62,6,2,https://www.linkedin.com/search/results/content/?fromMember=%5B%22ACoAAARiO3IBHx5SsO9k14J8Nxd_SccMFE0LAFw%22%5D&heroEntityKey=urn%3Ali%3Afsd_profile%3AACoAAARiO3IBHx5SsO9k14J8Nxd_SccMFE0LAFw&keywords=melissa%20snover&origin=CLUSTER_EXPANSION&position=0&searchId=c50fe653-070e-497e-92f1-0d111f07a987&sid=o%3AE&sortBy=%22date_posted%22
Melissa Snover,Female,2023-10-27,"It was a great honour to sit on the West Midlands Growth Company’s panel today with Lisa Perkins (Adastral Park & Research Realisation Director at BT) and Sarah Walker (CISM) (Managing Director, Enterprise at Cisco) to discuss how the innovative technology of tomorrow can make a huge impact to the way we live and work.  Thank you to the organisers for having me as a panellist and to everyone who attended.",61,3,1,https://www.linkedin.com/search/results/content/?fromMember=%5B%22ACoAAARiO3IBHx5SsO9k14J8Nxd_SccMFE0LAFw%22%5D&heroEntityKey=urn%3Ali%3Afsd_profile%3AACoAAARiO3IBHx5SsO9k14J8Nxd_SccMFE0LAFw&keywords=melissa%20snover&origin=CLUSTER_EXPANSION&position=0&searchId=c50fe653-070e-497e-92f1-0d111f07a987&sid=o%3AE&sortBy=%22date_posted%22
Melissa Snover,Female,2023-10-27,"I was honoured to have been invited to the launch of the Female Founders Forum at the UK House of Lords yesterday in partnership with Barclays & The Entrepreneurs Network. Unfortunately, I was unable to attend due to other business commitments, but this topic is extremely close to my heart, and I’m reassured to see these topics being discussed on such a significant platform. This organisation has undertaken six major research reports, revealing the extent of the equality funding gap, the importance of high-growth sectors and more, and I am excited to see how this latest initiative can encourage, support and promote female entrepreneurship.You can learn more here: https://lnkd.in/ecjwhnBJ",60,1,0,https://www.linkedin.com/search/results/content/?fromMember=%5B%22ACoAAARiO3IBHx5SsO9k14J8Nxd_SccMFE0LAFw%22%5D&heroEntityKey=urn%3Ali%3Afsd_profile%3AACoAAARiO3IBHx5SsO9k14J8Nxd_SccMFE0LAFw&keywords=melissa%20snover&origin=CLUSTER_EXPANSION&position=0&searchId=c50fe653-070e-497e-92f1-0d111f07a987&sid=o%3AE&sortBy=%22date_posted%22
Melissa Snover,Female,2023-08-27,"Last month, we launched Get Nourish3d in Japan, and we are already seeing an extremely positive reception from customers and media about our expansion into this new market. I recently had the privilege of sitting down for an interview with TECHBLITZ, a prominent Japanese publication, where I delved into the 'why' behind our decision to introduce Nourished to Japan and how our 3D-printing technology can provide innovative and personalized health solutions to consumers.",59,7,1,https://www.linkedin.com/search/results/content/?fromMember=%5B%22ACoAAARiO3IBHx5SsO9k14J8Nxd_SccMFE0LAFw%22%5D&heroEntityKey=urn%3Ali%3Afsd_profile%3AACoAAARiO3IBHx5SsO9k14J8Nxd_SccMFE0LAFw&keywords=melissa%20snover&origin=CLUSTER_EXPANSION&position=0&searchId=c50fe653-070e-497e-92f1-0d111f07a987&sid=o%3AE&sortBy=%22date_posted%22
Melissa Snover,Female,2023-09-27,"I’m a big fan of Birmingham Tech Week (TechWM) and the work it does to celebrate the incredible tech businesses we have in the area, as well as address important topics in the industry. This year I am honoured to participate in a number of panels and keynotes next week, including;- Tech Leadership Breakfast - Monday- The Future is Female: Navigating the Funding Landscape Effectively - Tuesday- Global West Midlands: The Tech That Makes Tomorrow - Growth Zone - Wednesday- Keynote at Growth Zone - Thursday- The Investment Zone Pannel - Thursday",59,3,1,https://www.linkedin.com/search/results/content/?fromMember=%5B%22ACoAAARiO3IBHx5SsO9k14J8Nxd_SccMFE0LAFw%22%5D&heroEntityKey=urn%3Ali%3Afsd_profile%3AACoAAARiO3IBHx5SsO9k14J8Nxd_SccMFE0LAFw&keywords=melissa%20snover&origin=CLUSTER_EXPANSION&position=0&searchId=c50fe653-070e-497e-92f1-0d111f07a987&sid=o%3AE&sortBy=%22date_posted%22
Melissa Snover,Female,2023-11-27,"It’s a huge honour to see that Get Nourish3d has been awarded the ‘Most Innovative Food Supplement’ at this year's ‘Global Beauty & Wellness Awards’. I wanted to thank GBWA - The Global Beauty and Wellness Awards for honouring us with this award, and to our customers who continue to support us as we look for new ways to continue our innovative development in the wellness space.",59,8,2,https://www.linkedin.com/search/results/content/?fromMember=%5B%22ACoAAARiO3IBHx5SsO9k14J8Nxd_SccMFE0LAFw%22%5D&heroEntityKey=urn%3Ali%3Afsd_profile%3AACoAAARiO3IBHx5SsO9k14J8Nxd_SccMFE0LAFw&keywords=melissa%20snover&origin=CLUSTER_EXPANSION&position=0&searchId=c50fe653-070e-497e-92f1-0d111f07a987&sid=o%3AE&sortBy=%22date_posted%22
Melissa Snover,Female,2023-06-27,"I recently had the privilege of participating in the Jeffries European Vitamins and Supplements Conference in London. It was a real pleasure to share the stage with Lucy Goff (CEO of Lyma) and Darcy Laceby from Absolute Collagen in the high growth panel and to listen in on the discussions around supply chain, investment, and women's health throughout the day.Thank you to Jefferies for organising this insightful event and I look forward to the next one!",59,2,1,https://www.linkedin.com/search/results/content/?fromMember=%5B%22ACoAAARiO3IBHx5SsO9k14J8Nxd_SccMFE0LAFw%22%5D&heroEntityKey=urn%3Ali%3Afsd_profile%3AACoAAARiO3IBHx5SsO9k14J8Nxd_SccMFE0LAFw&keywords=melissa%20snover&origin=CLUSTER_EXPANSION&position=0&searchId=c50fe653-070e-497e-92f1-0d111f07a987&sid=o%3AE&sortBy=%22date_posted%22
Melissa Snover,Female,2023-09-27,I am honoured to announce that I will be joining the Greater Birmingham Chambers of Commerce's 'Business Commission West Midlands' as Commissioner.  The Commission has been launched to deliver a roadmap for business growth and bases its recommendation on insights from hundreds of businesses and organisations across the region.  I am looking forward to bringing my experience and expertise to this important initiative.  You can find out more about it here:  https://lnkd.in/esa75JAa #WestMidlands #BusinessInsights #BusinessGrowth,58,2,0,https://www.linkedin.com/search/results/content/?fromMember=%5B%22ACoAAARiO3IBHx5SsO9k14J8Nxd_SccMFE0LAFw%22%5D&heroEntityKey=urn%3Ali%3Afsd_profile%3AACoAAARiO3IBHx5SsO9k14J8Nxd_SccMFE0LAFw&keywords=melissa%20snover&origin=CLUSTER_EXPANSION&position=0&searchId=c50fe653-070e-497e-92f1-0d111f07a987&sid=o%3AE&sortBy=%22date_posted%22
Melissa Snover,Female,2023-04-27,I am honoured to share that Get Nourish3d has been featured across a variety of esteemed news stations throughout the United States this week. Thank you to Jamey Tucker for featuring us in his WHAT THE TECH? segment. You can learn more about our personalised gummy stacks on our website here: https://get-nourished.com/,58,3,1,https://www.linkedin.com/search/results/content/?fromMember=%5B%22ACoAAARiO3IBHx5SsO9k14J8Nxd_SccMFE0LAFw%22%5D&heroEntityKey=urn%3Ali%3Afsd_profile%3AACoAAARiO3IBHx5SsO9k14J8Nxd_SccMFE0LAFw&keywords=melissa%20snover&origin=CLUSTER_EXPANSION&position=0&searchId=c50fe653-070e-497e-92f1-0d111f07a987&sid=o%3AE&sortBy=%22date_posted%22
Melissa Snover,Female,2023-11-27,"It’s great to see that our Get Nourish3d Life Stacks were recently featured in an MSN Christmas Gift Guide😃⁠⁠Our specially formulated Life Stacks are curated to support an array of different lifestyles, including fitness fanatics, busy professionals and even partygoers! Check them out on our website for the perfect Christmas gift for a loved one this festive period https://get-nourished.com/",57,8,0,https://www.linkedin.com/search/results/content/?fromMember=%5B%22ACoAAARiO3IBHx5SsO9k14J8Nxd_SccMFE0LAFw%22%5D&heroEntityKey=urn%3Ali%3Afsd_profile%3AACoAAARiO3IBHx5SsO9k14J8Nxd_SccMFE0LAFw&keywords=melissa%20snover&origin=CLUSTER_EXPANSION&position=0&searchId=c50fe653-070e-497e-92f1-0d111f07a987&sid=o%3AE&sortBy=%22date_posted%22
Melissa Snover,Female,2023-04-27,Join me live on BBC WM this morning from 11:30-12 as I discuss my journey with Get Nourish3d.,57,1,0,https://www.linkedin.com/search/results/content/?fromMember=%5B%22ACoAAARiO3IBHx5SsO9k14J8Nxd_SccMFE0LAFw%22%5D&heroEntityKey=urn%3Ali%3Afsd_profile%3AACoAAARiO3IBHx5SsO9k14J8Nxd_SccMFE0LAFw&keywords=melissa%20snover&origin=CLUSTER_EXPANSION&position=0&searchId=c50fe653-070e-497e-92f1-0d111f07a987&sid=o%3AE&sortBy=%22date_posted%22
Melissa Snover,Female,2023-04-27,"Get Nourish3d has been shortlisted at this year's Health Tech 50 awards by BusinessCloud, which recognises companies creating original tech for personal and preventative healthcare. Voting for this award is now live and will close next Monday (29th). If you would like to show your support by voting for Nourished, then please click on the following link; it only takes a few minutes!  https://lnkd.in/g7r83W_4 #awards #businessawards #healthtech50 #healthtech",53,2,3,https://www.linkedin.com/search/results/content/?fromMember=%5B%22ACoAAARiO3IBHx5SsO9k14J8Nxd_SccMFE0LAFw%22%5D&heroEntityKey=urn%3Ali%3Afsd_profile%3AACoAAARiO3IBHx5SsO9k14J8Nxd_SccMFE0LAFw&keywords=melissa%20snover&origin=CLUSTER_EXPANSION&position=0&searchId=c50fe653-070e-497e-92f1-0d111f07a987&sid=o%3AE&sortBy=%22date_posted%22
Melissa Snover,Female,2024-04-20,"It’s a common misconception that launching a business requires having all the answers upfront. The best entrepreneurs understand the power of learning and instead of fearing the unknown, embrace it as a stepping stone toward professional development and growth.",53,4,1,https://www.linkedin.com/search/results/content/?fromMember=%5B%22ACoAAARiO3IBHx5SsO9k14J8Nxd_SccMFE0LAFw%22%5D&heroEntityKey=urn%3Ali%3Afsd_profile%3AACoAAARiO3IBHx5SsO9k14J8Nxd_SccMFE0LAFw&keywords=melissa%20snover&origin=CLUSTER_EXPANSION&position=0&searchId=c50fe653-070e-497e-92f1-0d111f07a987&sid=o%3AE&sortBy=%22date_posted%22
Melissa Snover,Female,2024-02-27,"I am honoured to be attending Tech Nation's first event today since their strategic acquisition by Founders Forum Group; a pivotal moment which promises to help supercharge UK tech innovation and further empower entrepreneurial growth. I am excited to share how Get Nourish3d aligns with this transformative journey alongside other entrepreneurs, Carolyn Dawson OBE, CEO of Founders Forum Group, and Brent Hoberman, Co-Founder of the Founders Forum Group.",52,4,0,https://www.linkedin.com/search/results/content/?fromMember=%5B%22ACoAAARiO3IBHx5SsO9k14J8Nxd_SccMFE0LAFw%22%5D&heroEntityKey=urn%3Ali%3Afsd_profile%3AACoAAARiO3IBHx5SsO9k14J8Nxd_SccMFE0LAFw&keywords=melissa%20snover&origin=CLUSTER_EXPANSION&position=0&searchId=c50fe653-070e-497e-92f1-0d111f07a987&sid=o%3AE&sortBy=%22date_posted%22
Melissa Snover,Female,2023-04-27,"A question I always get asked is what my morning routine looks like. I'm a big believer that how we start our day sets the tone for the rest of it, so I try to make the most of my mornings. Here's how my typical morning goes: - 4 am: I wake up early and gather my thoughts for the day ahead. With a business and three children to look after, I don’t get much time to myself. Waking up before everyone else gives me an opportunity to prioritise myself and prepare for the day.  - 4:30 am: I typically do a 7-minute workout routine. I have been doing these quick workouts for years now and find them to be extremely effective in keeping my body fit and energised! - 5 am: After my workout, I spend some time catching up on emails and writing out a list of what I will achieve that day.  - 6 am: I will either take my dog for a walk or a run.  - 6:30 am: Once I’m back home, I take a quick shower and get ready. - 7:15 am: I start work! What does your morning routine usually look like? Let me know below.",52,11,0,https://www.linkedin.com/search/results/content/?fromMember=%5B%22ACoAAARiO3IBHx5SsO9k14J8Nxd_SccMFE0LAFw%22%5D&heroEntityKey=urn%3Ali%3Afsd_profile%3AACoAAARiO3IBHx5SsO9k14J8Nxd_SccMFE0LAFw&keywords=melissa%20snover&origin=CLUSTER_EXPANSION&position=0&searchId=c50fe653-070e-497e-92f1-0d111f07a987&sid=o%3AE&sortBy=%22date_posted%22
Melissa Snover,Female,2023-12-27,"A study from the European Journal of Social Psychology found that it takes around 66 days to form a habit and get it to stick, which means, for those of you looking to cement New Year's Resolutions into your everyday routine, the goal is March 6th.James Clear’s technique of Habit Stacking is a great way to help, whether you are looking to make progress on a new business idea, taking your Nourished stacks or reading more often. We have a blog on the Nourished site which can help here:https://lnkd.in/eXikfaEk",51,3,1,https://www.linkedin.com/search/results/content/?fromMember=%5B%22ACoAAARiO3IBHx5SsO9k14J8Nxd_SccMFE0LAFw%22%5D&heroEntityKey=urn%3Ali%3Afsd_profile%3AACoAAARiO3IBHx5SsO9k14J8Nxd_SccMFE0LAFw&keywords=melissa%20snover&origin=CLUSTER_EXPANSION&position=0&searchId=c50fe653-070e-497e-92f1-0d111f07a987&sid=o%3AE&sortBy=%22date_posted%22
