Author,Gender,Date,Post Text,Likes,Comments,Shares,Page Link
Melissa Snover,Female,2023-06-27,"Thank you to Ellen Kinsey for the glowing review of Get Nourish3d in the latest issue of Closer, after she ordered a bespoke blend of our high-impact nutrient gummies! Want to experience the same personalised goodness? You can get your own customised stacks by taking our short consultation on the Nourished website. https://get-nourished.com/",32,Comment,0,https://www.linkedin.com/search/results/content/?fromMember=%5B%22ACoAAARiO3IBHx5SsO9k14J8Nxd_SccMFE0LAFw%22%5D&heroEntityKey=urn%3Ali%3Afsd_profile%3AACoAAARiO3IBHx5SsO9k14J8Nxd_SccMFE0LAFw&keywords=melissa%20snover&origin=CLUSTER_EXPANSION&position=0&searchId=c50fe653-070e-497e-92f1-0d111f07a987&sid=o%3AE&sortBy=%22date_posted%22
Melissa Snover,Female,2024-02-27,"I'm honoured to join the panel at FoodNavigator Positive Nutrition's 2024 Summit in March, alongside experts like Timo Spring (Prevess), Manon Rodriguez Mate (Zest), Markus Stripf (Spoon Guru), and Marjolijn Bragt (Wageningen Research). This talk aims to explore topics around reformulation and fortification, plant-based food, food as medicine, impacts of personalised nutrition, and more.You can learn more and register for the event by clicking the link below:https://lnkd.in/ea9Usi9J",32,Comment,0,https://www.linkedin.com/search/results/content/?fromMember=%5B%22ACoAAARiO3IBHx5SsO9k14J8Nxd_SccMFE0LAFw%22%5D&heroEntityKey=urn%3Ali%3Afsd_profile%3AACoAAARiO3IBHx5SsO9k14J8Nxd_SccMFE0LAFw&keywords=melissa%20snover&origin=CLUSTER_EXPANSION&position=0&searchId=c50fe653-070e-497e-92f1-0d111f07a987&sid=o%3AE&sortBy=%22date_posted%22
Melissa Snover,Female,2023-06-27,This morning I was live on BBC Radio 5 Live’s Wake Up To Money show again to share my thoughts on the latest news stories from the business world. You can listen to the episode on BBC Sounds catch up now.  https://lnkd.in/gJT98GXb,32,Comment,0,https://www.linkedin.com/search/results/content/?fromMember=%5B%22ACoAAARiO3IBHx5SsO9k14J8Nxd_SccMFE0LAFw%22%5D&heroEntityKey=urn%3Ali%3Afsd_profile%3AACoAAARiO3IBHx5SsO9k14J8Nxd_SccMFE0LAFw&keywords=melissa%20snover&origin=CLUSTER_EXPANSION&position=0&searchId=c50fe653-070e-497e-92f1-0d111f07a987&sid=o%3AE&sortBy=%22date_posted%22
Melissa Snover,Female,2024-03-27,"It was a pleasure to attend the SME Department for Business and Trade Business Connect event in Coventry yesterday and learn more about the government's latest set of initiatives to support SMEs. The highlight for me was undoubtedly the Prime Minister's announcement of the Invest In Women Taskforce. This pioneering initiative, led by Hannah Bernard OBE of Barclays Business Banking and the esteemed entrepreneur Debbie Wosskow, OBE, aims to establish the largest fund dedicated to supporting female founders. Its ambition is to make the UK the best place in the world for women to start and grow a business. As a female entrepreneur myself, I am convinced that if successful, this could significantly bolster the UK economy and afford our nation a distinctive competitive edge internationally.",31,3,0,https://www.linkedin.com/search/results/content/?fromMember=%5B%22ACoAAARiO3IBHx5SsO9k14J8Nxd_SccMFE0LAFw%22%5D&heroEntityKey=urn%3Ali%3Afsd_profile%3AACoAAARiO3IBHx5SsO9k14J8Nxd_SccMFE0LAFw&keywords=melissa%20snover&origin=CLUSTER_EXPANSION&position=0&searchId=c50fe653-070e-497e-92f1-0d111f07a987&sid=o%3AE&sortBy=%22date_posted%22
Melissa Snover,Female,2023-04-27,"Get Nourish3d’s Sleep Tight Stack was featured on MSN this week, highlighting how the ingredients inside our stack can help to promote better sleep. You can learn more about how our scientifically backed ingredients can aid sleep quality on our website: https://lnkd.in/dd3xu9ft",31,1,0,https://www.linkedin.com/search/results/content/?fromMember=%5B%22ACoAAARiO3IBHx5SsO9k14J8Nxd_SccMFE0LAFw%22%5D&heroEntityKey=urn%3Ali%3Afsd_profile%3AACoAAARiO3IBHx5SsO9k14J8Nxd_SccMFE0LAFw&keywords=melissa%20snover&origin=CLUSTER_EXPANSION&position=0&searchId=c50fe653-070e-497e-92f1-0d111f07a987&sid=o%3AE&sortBy=%22date_posted%22
Melissa Snover,Female,2024-02-27,I was grateful for the opportunity to attend the Department for Business and Trade Midlands Investment Team's reception at the Hilton Metropole Hotel yesterday. The insights shared by Ceri Smith and other senior investment officials on the UK Government's trade and investment priorities are instrumental in reinforcing the West Midlands' status as a progressive and internationally recognised business hub.,31,Comment,0,https://www.linkedin.com/search/results/content/?fromMember=%5B%22ACoAAARiO3IBHx5SsO9k14J8Nxd_SccMFE0LAFw%22%5D&heroEntityKey=urn%3Ali%3Afsd_profile%3AACoAAARiO3IBHx5SsO9k14J8Nxd_SccMFE0LAFw&keywords=melissa%20snover&origin=CLUSTER_EXPANSION&position=0&searchId=c50fe653-070e-497e-92f1-0d111f07a987&sid=o%3AE&sortBy=%22date_posted%22
Melissa Snover,Female,2023-05-27,"Innovation is at the heart of everything we do at Get Nourish3d, and our in-house tech team are always pushing the boundaries of what's possible with our patented technology. Our pioneering manufacturing processes and agile NPD capabilities allow us to respond quickly to new trends and customer demands, enhancing our product offering in a matter of weeks, not years.I am so grateful to our expert team for their continued passion and dedication to changing the world with personalised nutrition, one stack at a time! To find out more, check out our website!https://lnkd.in/eKmTbw6Zhttps://lnkd.in/eJJJbaXs",30,Comment,0,https://www.linkedin.com/search/results/content/?fromMember=%5B%22ACoAAARiO3IBHx5SsO9k14J8Nxd_SccMFE0LAFw%22%5D&heroEntityKey=urn%3Ali%3Afsd_profile%3AACoAAARiO3IBHx5SsO9k14J8Nxd_SccMFE0LAFw&keywords=melissa%20snover&origin=CLUSTER_EXPANSION&position=0&searchId=c50fe653-070e-497e-92f1-0d111f07a987&sid=o%3AE&sortBy=%22date_posted%22
Melissa Snover,Female,2023-09-27,Get Nourish3d is hiring! We are so much more than just a health company. We are a team of innovators in the world of food tech who are on a mission to bring personalised nutrition to the world. We are looking for a talented Supply Chain and Planning Manager who wants to join us on our journey to change the world of health and wellness. #job #hiring #westmidlands,29,Comment,2,https://www.linkedin.com/search/results/content/?fromMember=%5B%22ACoAAARiO3IBHx5SsO9k14J8Nxd_SccMFE0LAFw%22%5D&heroEntityKey=urn%3Ali%3Afsd_profile%3AACoAAARiO3IBHx5SsO9k14J8Nxd_SccMFE0LAFw&keywords=melissa%20snover&origin=CLUSTER_EXPANSION&position=0&searchId=c50fe653-070e-497e-92f1-0d111f07a987&sid=o%3AE&sortBy=%22date_posted%22
Melissa Snover,Female,2024-02-27,"I am in Miami this week attending the 2024 FII Institute Priority Summit, where the theme of ‘On the Edge of a New Frontier’ promises to delve into disruptive technologies and topics with the goal of accelerating innovation for the betterment of mankind. It's a privilege to join inspiring industry leaders and pioneering entrepreneurs in exploring solutions to pressing global challenges, fostering collaboration and innovation to shape a sustainable future. #FIIPriorityMiami",28,2,2,https://www.linkedin.com/search/results/content/?fromMember=%5B%22ACoAAARiO3IBHx5SsO9k14J8Nxd_SccMFE0LAFw%22%5D&heroEntityKey=urn%3Ali%3Afsd_profile%3AACoAAARiO3IBHx5SsO9k14J8Nxd_SccMFE0LAFw&keywords=melissa%20snover&origin=CLUSTER_EXPANSION&position=0&searchId=c50fe653-070e-497e-92f1-0d111f07a987&sid=o%3AE&sortBy=%22date_posted%22
Melissa Snover,Female,2024-03-27,I still enjoy reading our customer’s stories and how our stacks are making a real-world impact on their well-being. This was just one of the recent reviews one of our customers left us.,28,Comment,0,https://www.linkedin.com/search/results/content/?fromMember=%5B%22ACoAAARiO3IBHx5SsO9k14J8Nxd_SccMFE0LAFw%22%5D&heroEntityKey=urn%3Ali%3Afsd_profile%3AACoAAARiO3IBHx5SsO9k14J8Nxd_SccMFE0LAFw&keywords=melissa%20snover&origin=CLUSTER_EXPANSION&position=0&searchId=c50fe653-070e-497e-92f1-0d111f07a987&sid=o%3AE&sortBy=%22date_posted%22
Melissa Snover,Female,2023-04-27,"I had the privilege of being a guest on the Unnoticed Entrepreneur podcast by Jim James, where I spoke about 3D printing, shared my journey with Get Nourish3d, and offered insights on how entrepreneurs can gain recognition. You can listen to the interview here: https://lnkd.in/eWnsyQDj #podcast #interview #entrepreneur #3dprinting #entrepreneurs",27,1,0,https://www.linkedin.com/search/results/content/?fromMember=%5B%22ACoAAARiO3IBHx5SsO9k14J8Nxd_SccMFE0LAFw%22%5D&heroEntityKey=urn%3Ali%3Afsd_profile%3AACoAAARiO3IBHx5SsO9k14J8Nxd_SccMFE0LAFw&keywords=melissa%20snover&origin=CLUSTER_EXPANSION&position=0&searchId=c50fe653-070e-497e-92f1-0d111f07a987&sid=o%3AE&sortBy=%22date_posted%22
Melissa Snover,Female,2024-03-27,"This week, I had the privilege of attending the Pictet Group Women's Summit in Geneva. The summit masterfully blended inspiration with actionable insights to help empower female entrepreneurs. I wanted to thank Pictet for emphasising the critical role of informed decision-making in both our professional and personal financial journeys and it was also great to meet other like-minded entrepreneurs and share our stories and insights.",26,Comment,0,https://www.linkedin.com/search/results/content/?fromMember=%5B%22ACoAAARiO3IBHx5SsO9k14J8Nxd_SccMFE0LAFw%22%5D&heroEntityKey=urn%3Ali%3Afsd_profile%3AACoAAARiO3IBHx5SsO9k14J8Nxd_SccMFE0LAFw&keywords=melissa%20snover&origin=CLUSTER_EXPANSION&position=0&searchId=c50fe653-070e-497e-92f1-0d111f07a987&sid=o%3AE&sortBy=%22date_posted%22
Melissa Snover,Female,2023-04-27,I wanted to take a moment to express my appreciation to our wonderful customers who take the time to leave a review and share their experiences with Nourished. Each one means so much to us and reinforces our commitment to improving people's health and wellness through premium ingredients and disruptive technology. Thank you all for your continued support. #customerreview,26,Comment,0,https://www.linkedin.com/search/results/content/?fromMember=%5B%22ACoAAARiO3IBHx5SsO9k14J8Nxd_SccMFE0LAFw%22%5D&heroEntityKey=urn%3Ali%3Afsd_profile%3AACoAAARiO3IBHx5SsO9k14J8Nxd_SccMFE0LAFw&keywords=melissa%20snover&origin=CLUSTER_EXPANSION&position=0&searchId=c50fe653-070e-497e-92f1-0d111f07a987&sid=o%3AE&sortBy=%22date_posted%22
Melissa Snover,Female,2023-08-27,"According to the World Health Organisation, PCOS is a significant problem that affects an estimated 8-13% of women of productive age, and up to 70% of cases go undiagnosed.  At Get Nourish3d, we are committed to supporting women suffering from the uncomfortable symptoms that come with PCOS. That’s why we introduced Inositol into our Nourished stack offering, which can help to:- Restore ovarian activity/regularity- Increase fertility- Improve the regularity of the menstrual cycle - Has a beneficial effect on the metabolic profile of women with PCOS- Regulates insulin levels and reduces blood pressure You can learn more on the following link:https://lnkd.in/edyciX36",26,1,0,https://www.linkedin.com/search/results/content/?fromMember=%5B%22ACoAAARiO3IBHx5SsO9k14J8Nxd_SccMFE0LAFw%22%5D&heroEntityKey=urn%3Ali%3Afsd_profile%3AACoAAARiO3IBHx5SsO9k14J8Nxd_SccMFE0LAFw&keywords=melissa%20snover&origin=CLUSTER_EXPANSION&position=0&searchId=c50fe653-070e-497e-92f1-0d111f07a987&sid=o%3AE&sortBy=%22date_posted%22
Melissa Snover,Female,2024-03-27,"It's great to see the Midlands being celebrated in WIRED's recent feature, ""The Midlands Mentality: Why The UK’s Centre Keeps Producing Top-Flight Scale-Ups."" As the founder of Get Nourish3d, I've witnessed firsthand the dynamic energy, work ethic and collaborative spirit in this region. Starting Nourished in the Midlands has been key to our success, especially as there is an ethos of collaboration and encouragement here, making it a great place for innovation to thrive and to start and scale a business.",25,Comment,0,https://www.linkedin.com/search/results/content/?fromMember=%5B%22ACoAAARiO3IBHx5SsO9k14J8Nxd_SccMFE0LAFw%22%5D&heroEntityKey=urn%3Ali%3Afsd_profile%3AACoAAARiO3IBHx5SsO9k14J8Nxd_SccMFE0LAFw&keywords=melissa%20snover&origin=CLUSTER_EXPANSION&position=0&searchId=c50fe653-070e-497e-92f1-0d111f07a987&sid=o%3AE&sortBy=%22date_posted%22
Melissa Snover,Female,2023-11-27,Get Nourish3d is hiring! We are so much more than just a health company. We are a team of innovators in the world of food tech who are on a mission to bring personalised nutrition to the world. We are looking for a talented Shift Manager who wants to join us on our journey to change the world of health and wellness.,25,Comment,1,https://www.linkedin.com/search/results/content/?fromMember=%5B%22ACoAAARiO3IBHx5SsO9k14J8Nxd_SccMFE0LAFw%22%5D&heroEntityKey=urn%3Ali%3Afsd_profile%3AACoAAARiO3IBHx5SsO9k14J8Nxd_SccMFE0LAFw&keywords=melissa%20snover&origin=CLUSTER_EXPANSION&position=0&searchId=c50fe653-070e-497e-92f1-0d111f07a987&sid=o%3AE&sortBy=%22date_posted%22
Melissa Snover,Female,2023-05-27,I am always so grateful to our customers who take the time to leave a review on how Get Nourish3d is impacting their well-being. It is the continuous feedback from our customers that inspires us to keep optimizing our offering and disrupting our market. Thank you to every customer who has left a review of Nourished!,25,1,0,https://www.linkedin.com/search/results/content/?fromMember=%5B%22ACoAAARiO3IBHx5SsO9k14J8Nxd_SccMFE0LAFw%22%5D&heroEntityKey=urn%3Ali%3Afsd_profile%3AACoAAARiO3IBHx5SsO9k14J8Nxd_SccMFE0LAFw&keywords=melissa%20snover&origin=CLUSTER_EXPANSION&position=0&searchId=c50fe653-070e-497e-92f1-0d111f07a987&sid=o%3AE&sortBy=%22date_posted%22
Melissa Snover,Female,2024-01-27,"""We’re already experiencing a shift towards personalised products that tackle specific issues highlighted by the user, as opposed to multi-use products that simply can’t take variable factors and needs into account.“As consumer’s understanding of their own health and well-being grows, so too will the demand for unique, custom-made products that tackle their concerns – not everyone else's.”I had the opportunity to delve deeper into the key trends and priorities shaping the wellness industry, alongside other business leaders in HBW's annual report. To learn more, you can access the full article on the link below:",24,1,1,https://www.linkedin.com/search/results/content/?fromMember=%5B%22ACoAAARiO3IBHx5SsO9k14J8Nxd_SccMFE0LAFw%22%5D&heroEntityKey=urn%3Ali%3Afsd_profile%3AACoAAARiO3IBHx5SsO9k14J8Nxd_SccMFE0LAFw&keywords=melissa%20snover&origin=CLUSTER_EXPANSION&position=0&searchId=c50fe653-070e-497e-92f1-0d111f07a987&sid=o%3AE&sortBy=%22date_posted%22
Melissa Snover,Female,2023-05-27,"Since partnering with Vitamin Angels UK / Vitamin Angels, our Get Nourish3d customers have helped us bring life-changing nutritional support to over 177,870 women and children in the UK and around the world.  In honour of #NationalChildhoodNutritionDay, I will be speaking at Vitamin Angles UK’s special webinar later today. During this event, I will talk about our impactful partnership and shed more light on the amazing work they are doing to transform lives around the world.  You can join the webinar today at 11AM EST/ 8AM PT by clicking the link below.  https://lnkd.in/e7zwaf8K #webinar",23,1,0,https://www.linkedin.com/search/results/content/?fromMember=%5B%22ACoAAARiO3IBHx5SsO9k14J8Nxd_SccMFE0LAFw%22%5D&heroEntityKey=urn%3Ali%3Afsd_profile%3AACoAAARiO3IBHx5SsO9k14J8Nxd_SccMFE0LAFw&keywords=melissa%20snover&origin=CLUSTER_EXPANSION&position=0&searchId=c50fe653-070e-497e-92f1-0d111f07a987&sid=o%3AE&sortBy=%22date_posted%22
Melissa Snover,Female,2023-04-27,"Thank you to WIRED/WIRED UK and HSBC for inviting me to speak at today's Trailblazers event. It was an honour to share my advice with other SMEs, shedding light on the challenges we have faced and how we have overcome them at Get Nourish3d during our scale-up journey. Thank you to everyone who attended, and I look forward to more of the Trailblazer events in the near future. #Trailblazers #SMEs #event",23,Comment,0,https://www.linkedin.com/search/results/content/?fromMember=%5B%22ACoAAARiO3IBHx5SsO9k14J8Nxd_SccMFE0LAFw%22%5D&heroEntityKey=urn%3Ali%3Afsd_profile%3AACoAAARiO3IBHx5SsO9k14J8Nxd_SccMFE0LAFw&keywords=melissa%20snover&origin=CLUSTER_EXPANSION&position=0&searchId=c50fe653-070e-497e-92f1-0d111f07a987&sid=o%3AE&sortBy=%22date_posted%22
Melissa Snover,Female,2024-04-20,"I'm delighted to be speaking at the Retail Technology Show (24-25 April 2024, Olympia, London). To join me at retail’s leading event for retail technology, please click the following link to register for free: https://lnkd.in/eV5WvxKy #RTS2024",23,3,0,https://www.linkedin.com/search/results/content/?fromMember=%5B%22ACoAAARiO3IBHx5SsO9k14J8Nxd_SccMFE0LAFw%22%5D&heroEntityKey=urn%3Ali%3Afsd_profile%3AACoAAARiO3IBHx5SsO9k14J8Nxd_SccMFE0LAFw&keywords=melissa%20snover&origin=CLUSTER_EXPANSION&position=0&searchId=c50fe653-070e-497e-92f1-0d111f07a987&sid=o%3AE&sortBy=%22date_posted%22
Melissa Snover,Female,2024-02-27,"As a Tech Nation ambassador, this week I had the privilege of attending an exclusive event hosted by Tech Nation and Founders Forum Group. It was a moment to reflect on their recent partnership and its potential to further empower UK tech entrepreneurs. Over the past decade, Tech Nation has been instrumental in establishing the UK as a leading digital economy in Europe and the third globally. Their programs have been a cornerstone for growth, connecting talents and transforming startups into success stories. Remarkably, a third of all UK tech unicorns have passed through one of their programmes, highlighting the impactful work they do. Sharing the space with fellow entrepreneurs, including Carolyn Dawson and Brent Hoberman, and discussing Tech Nation’s vision for the future was both an honour and a responsibility I am proud to be a part of. It offered us a chance to contribute our insights towards shaping an ambitious path forward for Tech Nation. I'm grateful for the opportunity to be part of this conversation and look forward to what lies ahead for the UK tech sector.#TechNation #Innovation #StartUpCulture #UKTech",22,1,0,https://www.linkedin.com/search/results/content/?fromMember=%5B%22ACoAAARiO3IBHx5SsO9k14J8Nxd_SccMFE0LAFw%22%5D&heroEntityKey=urn%3Ali%3Afsd_profile%3AACoAAARiO3IBHx5SsO9k14J8Nxd_SccMFE0LAFw&keywords=melissa%20snover&origin=CLUSTER_EXPANSION&position=0&searchId=c50fe653-070e-497e-92f1-0d111f07a987&sid=o%3AE&sortBy=%22date_posted%22
Melissa Snover,Female,2024-03-27,"A recent study by the University College London has unveiled that inadequate sleep is costing the UK economy a staggering £40 billion each year. Sleep is a key pillar of both physical and mental health, and the consequences of poor sleep extend beyond just individual well-being, as evidenced by the study. Proper nutrition, involving high-impact nutrients, vitamins, and superfoods, can play a vital role in mitigating the adverse effects of poor sleep – especially when we take the time to understand our bodies and make informed, personalised decisions.My comments and thoughts on this study have been featured in over 100 different press publications in the last week. You can find out more and read it here:https://lnkd.in/eyhM4rnH",21,Comment,0,https://www.linkedin.com/search/results/content/?fromMember=%5B%22ACoAAARiO3IBHx5SsO9k14J8Nxd_SccMFE0LAFw%22%5D&heroEntityKey=urn%3Ali%3Afsd_profile%3AACoAAARiO3IBHx5SsO9k14J8Nxd_SccMFE0LAFw&keywords=melissa%20snover&origin=CLUSTER_EXPANSION&position=0&searchId=c50fe653-070e-497e-92f1-0d111f07a987&sid=o%3AE&sortBy=%22date_posted%22
Melissa Snover,Female,2024-04-27,"It was an honour to have joined the Modern Woman Show yesterday. This event is all about creating an innovative experience which reinvents the traditional business conference to enrich, elevate & support remarkable women to achieve their ambitions. It was a privilege to have been invited to speak and I wanted to thank all of the attendees to my talk and the organisers for putting on a great event.",20,2,1,https://www.linkedin.com/search/results/content/?fromMember=%5B%22ACoAAARiO3IBHx5SsO9k14J8Nxd_SccMFE0LAFw%22%5D&heroEntityKey=urn%3Ali%3Afsd_profile%3AACoAAARiO3IBHx5SsO9k14J8Nxd_SccMFE0LAFw&keywords=melissa%20snover&origin=CLUSTER_EXPANSION&position=0&searchId=c50fe653-070e-497e-92f1-0d111f07a987&sid=o%3AE&sortBy=%22date_posted%22
Melissa Snover,Female,2023-09-27,"Next week, I will be speaking at this year's Future Food-Tech event in London (September 28-29th), at a session that focuses on ‘Prioritising Women’s Health & Nutrition: Solutions for Every Stage of Life’.You can register for the event now to join over 800 leaders from food brands, ingredient providers, pioneering entrepreneurs, and investors as they come together to address the challenges in creating foods that are nutritious, accessible, and climate-smart: https://lnkd.in/gAyWYmJ5#FutureFoodTech",19,1,1,https://www.linkedin.com/search/results/content/?fromMember=%5B%22ACoAAARiO3IBHx5SsO9k14J8Nxd_SccMFE0LAFw%22%5D&heroEntityKey=urn%3Ali%3Afsd_profile%3AACoAAARiO3IBHx5SsO9k14J8Nxd_SccMFE0LAFw&keywords=melissa%20snover&origin=CLUSTER_EXPANSION&position=0&searchId=c50fe653-070e-497e-92f1-0d111f07a987&sid=o%3AE&sortBy=%22date_posted%22
Melissa Snover,Female,2023-04-27,"This week is Mental Health Awareness week in the UK. At Get Nourish3d, we believe that mental health should be a priority every day, so I wanted to share some tips and tools that could help your Inner Peace:- Many studies show that exercise can help with anxiety, sleep deprivation, and mood swings. - Try to stimulate the vagus nerve system, which can activate a sense of relaxation in the body and tackle feelings of stress. Try humming, laughing, cold water exposure, or breathing exercises.- Writing down your thoughts and feelings.- Keep in touch with family and friends as much as possible.- Certain superfoods and vitamins have been known to help combat stress, anxiety, and depression, such as Scutell'Up, Ashwagandha, Maca Powder, and Ginseng.You can read more about this topic and the above ingredients from the Nourished blog here: https://lnkd.in/eRwnXdRT",17,Comment,0,https://www.linkedin.com/search/results/content/?fromMember=%5B%22ACoAAARiO3IBHx5SsO9k14J8Nxd_SccMFE0LAFw%22%5D&heroEntityKey=urn%3Ali%3Afsd_profile%3AACoAAARiO3IBHx5SsO9k14J8Nxd_SccMFE0LAFw&keywords=melissa%20snover&origin=CLUSTER_EXPANSION&position=0&searchId=c50fe653-070e-497e-92f1-0d111f07a987&sid=o%3AE&sortBy=%22date_posted%22
Melissa Snover,Female,2024-03-27,"Thank you to FoodNavigator for inviting me to talk at this week's Positive Nutrition fireside chat, as well as a panel yesterday. I shared my insights on how personalised nutrition can make a significant impact on the future of wellness, and how this compares to the more traditional route companies take of creating products for the masses.",16,2,1,https://www.linkedin.com/search/results/content/?fromMember=%5B%22ACoAAARiO3IBHx5SsO9k14J8Nxd_SccMFE0LAFw%22%5D&heroEntityKey=urn%3Ali%3Afsd_profile%3AACoAAARiO3IBHx5SsO9k14J8Nxd_SccMFE0LAFw&keywords=melissa%20snover&origin=CLUSTER_EXPANSION&position=0&searchId=c50fe653-070e-497e-92f1-0d111f07a987&sid=o%3AE&sortBy=%22date_posted%22
Melissa Snover,Female,2023-04-27,Thank you to Retail Technology Show for including me in their TOP 30 Retail Disruptors & Innovators for 2023. It's an honour to be recognised amongst such an outstanding group of accomplished peers!,16,1,0,https://www.linkedin.com/search/results/content/?fromMember=%5B%22ACoAAARiO3IBHx5SsO9k14J8Nxd_SccMFE0LAFw%22%5D&heroEntityKey=urn%3Ali%3Afsd_profile%3AACoAAARiO3IBHx5SsO9k14J8Nxd_SccMFE0LAFw&keywords=melissa%20snover&origin=CLUSTER_EXPANSION&position=0&searchId=c50fe653-070e-497e-92f1-0d111f07a987&sid=o%3AE&sortBy=%22date_posted%22
Melissa Snover,Female,2024-03-27,"In 2010, women accounted for less than 12% of FTSE 100 board members, but as of April 2022, it has increased to 39%.At this week’s Institute of Directors (IoD) IoD West Midlands Central Glass Ceiling Summit, a partnership event with IoD Glass Ceiling, Barclays Eagle Labs, and Fieldfisher, this was one of the focal discussions as well as highlighting the challenges women face in securing board positions in 2024. Speaking at this event alongside esteemed business leaders was a privilege and I wanted to extend my gratitude to IoD for the invitation.International Women's Day",15,Comment,0,https://www.linkedin.com/search/results/content/?fromMember=%5B%22ACoAAARiO3IBHx5SsO9k14J8Nxd_SccMFE0LAFw%22%5D&heroEntityKey=urn%3Ali%3Afsd_profile%3AACoAAARiO3IBHx5SsO9k14J8Nxd_SccMFE0LAFw&keywords=melissa%20snover&origin=CLUSTER_EXPANSION&position=0&searchId=c50fe653-070e-497e-92f1-0d111f07a987&sid=o%3AE&sortBy=%22date_posted%22
Melissa Snover,Female,2023-10-27,"A 2022 report highlighted the progress we have made in the UK with how female-led companies increased to 151,603 in 2022 from only 56,269 in 2018. Today, I spoke at an even by EAST VILLAGE. Agency to share my insight and advice about navigating the funding landscape successfully as a female entrepreneur.Thank you to everyone who attended, and for those of you who weren't able to be there or would like to know more, then you can take a short read of a piece I wrote for Elite Business last December on this topic:https://lnkd.in/e4MSb77f",12,2,0,https://www.linkedin.com/search/results/content/?fromMember=%5B%22ACoAAARiO3IBHx5SsO9k14J8Nxd_SccMFE0LAFw%22%5D&heroEntityKey=urn%3Ali%3Afsd_profile%3AACoAAARiO3IBHx5SsO9k14J8Nxd_SccMFE0LAFw&keywords=melissa%20snover&origin=CLUSTER_EXPANSION&position=0&searchId=c50fe653-070e-497e-92f1-0d111f07a987&sid=o%3AE&sortBy=%22date_posted%22
