Author,Gender,Date,Post Text,Likes,Comments,Shares,Page Link
Melissa Snover,Female,2024-04-06,"As we welcome the start of Spring and temperatures begin to creep up, it's important to look after our skin health. Here are some quick tips to help make an impact:  ●      Support skin health by helping the body's natural collagen production with our best-selling/premium Nourished Collagen+ range.●      Aim to drink 6 to 8 glasses of water per day to improve skin hydration.●      Protect your skin from harmful UV rays by using a waterproof sunscreen every day, particularly on your face.You can learn more about Nourished Collagen here: https://lnkd.in/eXD5P37M",51,2,1,https://www.linkedin.com/search/results/content/?fromMember=%5B%22ACoAAARiO3IBHx5SsO9k14J8Nxd_SccMFE0LAFw%22%5D&heroEntityKey=urn%3Ali%3Afsd_profile%3AACoAAARiO3IBHx5SsO9k14J8Nxd_SccMFE0LAFw&keywords=melissa%20snover&origin=CLUSTER_EXPANSION&position=0&searchId=c50fe653-070e-497e-92f1-0d111f07a987&sid=o%3AE&sortBy=%22date_posted%22
Melissa Snover,Female,2023-10-27,"It was a pleasure to speak at my final two events of Birmingham Tech Week/ TechWM today, starting with a keynote presentation on 'Building a world-class team for global growth' as part of Growth Zone's event.This afternoon, I also joined a panel discussion on 'Getting investment' hosted by British Business Bank and Invest West Midlands UK (West Midlands Growth Company) .These are two topics which have helped to dramatically scale REM3DY Health Group / Get Nourish3d, and it was very insightful to discuss them with other industry experts!",50,1,0,https://www.linkedin.com/search/results/content/?fromMember=%5B%22ACoAAARiO3IBHx5SsO9k14J8Nxd_SccMFE0LAFw%22%5D&heroEntityKey=urn%3Ali%3Afsd_profile%3AACoAAARiO3IBHx5SsO9k14J8Nxd_SccMFE0LAFw&keywords=melissa%20snover&origin=CLUSTER_EXPANSION&position=0&searchId=c50fe653-070e-497e-92f1-0d111f07a987&sid=o%3AE&sortBy=%22date_posted%22
Melissa Snover,Female,2024-02-27,Get Nourish3d is hiring! We are so much more than just a health company. We are a team of innovators in the world of food tech who are on a mission to bring personalised nutrition to the world. We are looking for a talented Project Manager who wants to join us on our journey to change the world of health and wellness.,50,Comment,6,https://www.linkedin.com/search/results/content/?fromMember=%5B%22ACoAAARiO3IBHx5SsO9k14J8Nxd_SccMFE0LAFw%22%5D&heroEntityKey=urn%3Ali%3Afsd_profile%3AACoAAARiO3IBHx5SsO9k14J8Nxd_SccMFE0LAFw&keywords=melissa%20snover&origin=CLUSTER_EXPANSION&position=0&searchId=c50fe653-070e-497e-92f1-0d111f07a987&sid=o%3AE&sortBy=%22date_posted%22
Melissa Snover,Female,2024-01-27,"I’m delighted to share that our esteemed partners, Elo Health, have been featured in NutraIngredients this week, highlighting their recent pilot study on our Get Nourish3d gummy stacks. The article looked at how our stacks raised Vitamin D levels of participants and assessed the improved bioavailability of gummies compared to traditional pills.You can read more here: https://lnkd.in/ehiQrhEC",48,1,0,https://www.linkedin.com/search/results/content/?fromMember=%5B%22ACoAAARiO3IBHx5SsO9k14J8Nxd_SccMFE0LAFw%22%5D&heroEntityKey=urn%3Ali%3Afsd_profile%3AACoAAARiO3IBHx5SsO9k14J8Nxd_SccMFE0LAFw&keywords=melissa%20snover&origin=CLUSTER_EXPANSION&position=0&searchId=c50fe653-070e-497e-92f1-0d111f07a987&sid=o%3AE&sortBy=%22date_posted%22
Melissa Snover,Female,2023-07-27,Get Nourish3d recently received a glowing review of our personalised stacks in the Evening Standard. Receiving such positive feedback from top-tier media outlets is always an honour and reaffirms our mission to deliver innovative and personalised nutritional solutions to the market.You can receive your own bespoke Nourished stack by taking our short consultation on our website: https://lnkd.in/dkH5pxk,48,2,0,https://www.linkedin.com/search/results/content/?fromMember=%5B%22ACoAAARiO3IBHx5SsO9k14J8Nxd_SccMFE0LAFw%22%5D&heroEntityKey=urn%3Ali%3Afsd_profile%3AACoAAARiO3IBHx5SsO9k14J8Nxd_SccMFE0LAFw&keywords=melissa%20snover&origin=CLUSTER_EXPANSION&position=0&searchId=c50fe653-070e-497e-92f1-0d111f07a987&sid=o%3AE&sortBy=%22date_posted%22
Melissa Snover,Female,2024-03-27,"Thank you to the Evening Standard for including Get Nourish3d in their recent feature of the best gym supplements according to experts, which showcased a curated list of nutritional products designed to enhance your fitness journey. You can take our short Nourished quiz to get a bespoke stack recommendation tailored to your mind and body by visiting the following link:https://get-nourished.com/",48,2,0,https://www.linkedin.com/search/results/content/?fromMember=%5B%22ACoAAARiO3IBHx5SsO9k14J8Nxd_SccMFE0LAFw%22%5D&heroEntityKey=urn%3Ali%3Afsd_profile%3AACoAAARiO3IBHx5SsO9k14J8Nxd_SccMFE0LAFw&keywords=melissa%20snover&origin=CLUSTER_EXPANSION&position=0&searchId=c50fe653-070e-497e-92f1-0d111f07a987&sid=o%3AE&sortBy=%22date_posted%22
Melissa Snover,Female,2023-08-27,"I am excited to share that I recently wrote an article for Elite Business , where I delved into strategies for entrepreneurs aiming to thrive in a fiercely competitive landscape and the art of innovation within the dynamic £30 billion wellness market. At Get Nourish3d, we're fortunate to have witnessed year-on-year growth by championing innovation and staying attuned to industry trends. To find out more, visit the following link and let me know what you think: https://lnkd.in/eJTKew-f",48,2,0,https://www.linkedin.com/search/results/content/?fromMember=%5B%22ACoAAARiO3IBHx5SsO9k14J8Nxd_SccMFE0LAFw%22%5D&heroEntityKey=urn%3Ali%3Afsd_profile%3AACoAAARiO3IBHx5SsO9k14J8Nxd_SccMFE0LAFw&keywords=melissa%20snover&origin=CLUSTER_EXPANSION&position=0&searchId=c50fe653-070e-497e-92f1-0d111f07a987&sid=o%3AE&sortBy=%22date_posted%22
Melissa Snover,Female,2023-06-27,"We have some exciting news to share with you next week! To be the first to find out about our new market-leading product range and to receive exclusive early access, subscribe to our Get Nourish3d newsletter on our website today! https://get-nourished.com/",46,2,0,https://www.linkedin.com/search/results/content/?fromMember=%5B%22ACoAAARiO3IBHx5SsO9k14J8Nxd_SccMFE0LAFw%22%5D&heroEntityKey=urn%3Ali%3Afsd_profile%3AACoAAARiO3IBHx5SsO9k14J8Nxd_SccMFE0LAFw&keywords=melissa%20snover&origin=CLUSTER_EXPANSION&position=0&searchId=c50fe653-070e-497e-92f1-0d111f07a987&sid=o%3AE&sortBy=%22date_posted%22
Melissa Snover,Female,2023-12-27,"As we take a look back at our top moments from 2023 at @get_nourished, we wanted to wish all of our customers a Happy New Year and a massive thank you for all of your support. We can’t wait to share with you soon what we are working on for 2024! 🙂",45,4,2,https://www.linkedin.com/search/results/content/?fromMember=%5B%22ACoAAARiO3IBHx5SsO9k14J8Nxd_SccMFE0LAFw%22%5D&heroEntityKey=urn%3Ali%3Afsd_profile%3AACoAAARiO3IBHx5SsO9k14J8Nxd_SccMFE0LAFw&keywords=melissa%20snover&origin=CLUSTER_EXPANSION&position=0&searchId=c50fe653-070e-497e-92f1-0d111f07a987&sid=o%3AE&sortBy=%22date_posted%22
Melissa Snover,Female,2023-10-27,"I recently spoke with UK News Group to discuss Get Nourish3d's growth over the last 12 months, as well as sharing the best piece of business advice I have been given. You can read the full interview here: https://lnkd.in/dHk_d3QD",45,4,0,https://www.linkedin.com/search/results/content/?fromMember=%5B%22ACoAAARiO3IBHx5SsO9k14J8Nxd_SccMFE0LAFw%22%5D&heroEntityKey=urn%3Ali%3Afsd_profile%3AACoAAARiO3IBHx5SsO9k14J8Nxd_SccMFE0LAFw&keywords=melissa%20snover&origin=CLUSTER_EXPANSION&position=0&searchId=c50fe653-070e-497e-92f1-0d111f07a987&sid=o%3AE&sortBy=%22date_posted%22
Melissa Snover,Female,2023-10-27,I recently spoke with UKTN about our Get Nourish3d journey. We discussed how 3D printing technology is transforming personalised wellness with our bespoke nutrient stacks and I also shared some valuable entrepreneurial tips and thoughts on innovation in the health sector.You can read the full interview here:https://lnkd.in/exSKpc3y,44,Comment,1,https://www.linkedin.com/search/results/content/?fromMember=%5B%22ACoAAARiO3IBHx5SsO9k14J8Nxd_SccMFE0LAFw%22%5D&heroEntityKey=urn%3Ali%3Afsd_profile%3AACoAAARiO3IBHx5SsO9k14J8Nxd_SccMFE0LAFw&keywords=melissa%20snover&origin=CLUSTER_EXPANSION&position=0&searchId=c50fe653-070e-497e-92f1-0d111f07a987&sid=o%3AE&sortBy=%22date_posted%22
Melissa Snover,Female,2023-07-27,"Through our latest donation to Vitamin Angels, Get Nourish3d customers have helped provide life-changing nutritional support to 12,666 women and children over the last 3 months. We believe that nutrition should be accessible to everyone, and we are proud of our ongoing partnership with Vitamin Angels UK, where we donate a percentage of every Nourished order to their amazing cause.https://lnkd.in/gxMvm7i",44,4,0,https://www.linkedin.com/search/results/content/?fromMember=%5B%22ACoAAARiO3IBHx5SsO9k14J8Nxd_SccMFE0LAFw%22%5D&heroEntityKey=urn%3Ali%3Afsd_profile%3AACoAAARiO3IBHx5SsO9k14J8Nxd_SccMFE0LAFw&keywords=melissa%20snover&origin=CLUSTER_EXPANSION&position=0&searchId=c50fe653-070e-497e-92f1-0d111f07a987&sid=o%3AE&sortBy=%22date_posted%22
Melissa Snover,Female,2024-03-27,"Yesterday marked a significant milestone with the presentation of the Business Commission West Midlands report to mayoral candidates, an initiative I had the opportunity to support as a Tech Commissioner.The recommendations, spanning key areas such as International Trade, Net Zero, and Innovation, are the culmination of collaborative efforts aimed at enhancing our economic landscape. It was a privilege to lend my expertise to the foundational research that has now informed actionable strategies for the West Midlands.I wanted to extend my gratitude to my fellow commissioners and members of the advisory panel Carmen Watson, Dan Barlow, Prof Deborah Leary OBE D.Univ,FRSA, Declan Allen, Eleanor Deeley, Dr Jason Wouhra O.B.E., Jeanette McFarland, Sandra M Wallace CBE, Vicki Wilkes, Anne Green, David Paulson, Jun Du, Mike Leonard, Monder Ram, nigel driffield, Vikki Potts, and the leadership team of Mark Taylor, Henrietta Brealey, Sarah Moorhouse, and Corin Crane for their dedication to this project. Together, we hope that this roadmap can help to drive business growth and prosperity in the West Midlands.Find out more here: https://lnkd.in/d4kJ-_vE #BusinessGrowth #BCWM #WestMidlands #PolicyRecommendations #LocalElections #MayoralElection",44,4,4,https://www.linkedin.com/search/results/content/?fromMember=%5B%22ACoAAARiO3IBHx5SsO9k14J8Nxd_SccMFE0LAFw%22%5D&heroEntityKey=urn%3Ali%3Afsd_profile%3AACoAAARiO3IBHx5SsO9k14J8Nxd_SccMFE0LAFw&keywords=melissa%20snover&origin=CLUSTER_EXPANSION&position=0&searchId=c50fe653-070e-497e-92f1-0d111f07a987&sid=o%3AE&sortBy=%22date_posted%22
Melissa Snover,Female,2023-09-27,"At Nourished, we are constantly monitoring which ingredients are increasing in popularity, based on consumer trends and emerging clinical research. One particular ingredient that has been trending recently is vitamin B12, which provides a host of health benefits. We recently published a blog post on the Get Nourish3d website, which details more about the benefits of this vitamin and its importance in our overall well-being. You can learn more from the following link:https://lnkd.in/eN2K9zy8",43,3,0,https://www.linkedin.com/search/results/content/?fromMember=%5B%22ACoAAARiO3IBHx5SsO9k14J8Nxd_SccMFE0LAFw%22%5D&heroEntityKey=urn%3Ali%3Afsd_profile%3AACoAAARiO3IBHx5SsO9k14J8Nxd_SccMFE0LAFw&keywords=melissa%20snover&origin=CLUSTER_EXPANSION&position=0&searchId=c50fe653-070e-497e-92f1-0d111f07a987&sid=o%3AE&sortBy=%22date_posted%22
Melissa Snover,Female,2023-08-27,"It was a real honour when John Maffioli asked to interview me recently for part of their ‘Founder Stories’ series at FEBE Growth 100. We had an interesting discussion on various topics, including launching a business, raising investment, and overcoming boundaries as an entrepreneur. To check out the full video, please visit the link below:",43,2,0,https://www.linkedin.com/search/results/content/?fromMember=%5B%22ACoAAARiO3IBHx5SsO9k14J8Nxd_SccMFE0LAFw%22%5D&heroEntityKey=urn%3Ali%3Afsd_profile%3AACoAAARiO3IBHx5SsO9k14J8Nxd_SccMFE0LAFw&keywords=melissa%20snover&origin=CLUSTER_EXPANSION&position=0&searchId=c50fe653-070e-497e-92f1-0d111f07a987&sid=o%3AE&sortBy=%22date_posted%22
Melissa Snover,Female,2023-04-27,"I was so excited to have been invited back onto this morning's 5 am Wake Up To Money show, live on BBC Radio 5 Live. You can listen to the show on catch-up to hear me speaking about my thoughts on the latest news and developments impacting the business world. #WakeUpToMoney #BBC #Radio5 #BBCRadio5",42,2,1,https://www.linkedin.com/search/results/content/?fromMember=%5B%22ACoAAARiO3IBHx5SsO9k14J8Nxd_SccMFE0LAFw%22%5D&heroEntityKey=urn%3Ali%3Afsd_profile%3AACoAAARiO3IBHx5SsO9k14J8Nxd_SccMFE0LAFw&keywords=melissa%20snover&origin=CLUSTER_EXPANSION&position=0&searchId=c50fe653-070e-497e-92f1-0d111f07a987&sid=o%3AE&sortBy=%22date_posted%22
Melissa Snover,Female,2023-07-27,"Ever since the introduction of our Get Nourish3d Collagen+ Range just last month, we've been delighted to hear the wonderful feedback from our customers, especially about how they are already noticing a difference and enjoying the delicious taste of our Stacks. https://lnkd.in/eXD5P37M",40,3,0,https://www.linkedin.com/search/results/content/?fromMember=%5B%22ACoAAARiO3IBHx5SsO9k14J8Nxd_SccMFE0LAFw%22%5D&heroEntityKey=urn%3Ali%3Afsd_profile%3AACoAAARiO3IBHx5SsO9k14J8Nxd_SccMFE0LAFw&keywords=melissa%20snover&origin=CLUSTER_EXPANSION&position=0&searchId=c50fe653-070e-497e-92f1-0d111f07a987&sid=o%3AE&sortBy=%22date_posted%22
Melissa Snover,Female,2023-12-27,"From everyone at Get Nourish3d, we wanted to wish you a Happy Christmas!",39,3,0,https://www.linkedin.com/search/results/content/?fromMember=%5B%22ACoAAARiO3IBHx5SsO9k14J8Nxd_SccMFE0LAFw%22%5D&heroEntityKey=urn%3Ali%3Afsd_profile%3AACoAAARiO3IBHx5SsO9k14J8Nxd_SccMFE0LAFw&keywords=melissa%20snover&origin=CLUSTER_EXPANSION&position=0&searchId=c50fe653-070e-497e-92f1-0d111f07a987&sid=o%3AE&sortBy=%22date_posted%22
Melissa Snover,Female,2024-04-13,"Get Nourish3d has been featured in this article by GlobalData Plc highlighting the potent role of 3D printing in the food industry, particularly in meat alternatives and personalised nutrition. Since starting the company in 2019, we have continued to innovate what’s possible with 3D-printing technology to further expand the capabilities of personalised nutrition. It’s an exciting time for food tech, proving that innovation can indeed meet unique health needs on a mass scale. Thank you to Global Data for this recognition. https://shorturl.at/mxVW4",39,1,1,https://www.linkedin.com/search/results/content/?fromMember=%5B%22ACoAAARiO3IBHx5SsO9k14J8Nxd_SccMFE0LAFw%22%5D&heroEntityKey=urn%3Ali%3Afsd_profile%3AACoAAARiO3IBHx5SsO9k14J8Nxd_SccMFE0LAFw&keywords=melissa%20snover&origin=CLUSTER_EXPANSION&position=0&searchId=c50fe653-070e-497e-92f1-0d111f07a987&sid=o%3AE&sortBy=%22date_posted%22
Melissa Snover,Female,2023-11-27,"It was an honour to speak at the Entrepreneurship Forum at Eton College, last week to help inform, engage and inspire the Oxford entrepreneurial community. This event is held annually to promote entrepreneurship and innovation in the Oxford ecosystem and beyond.Thank you to Eton College for the opportunity!",38,1,0,https://www.linkedin.com/search/results/content/?fromMember=%5B%22ACoAAARiO3IBHx5SsO9k14J8Nxd_SccMFE0LAFw%22%5D&heroEntityKey=urn%3Ali%3Afsd_profile%3AACoAAARiO3IBHx5SsO9k14J8Nxd_SccMFE0LAFw&keywords=melissa%20snover&origin=CLUSTER_EXPANSION&position=0&searchId=c50fe653-070e-497e-92f1-0d111f07a987&sid=o%3AE&sortBy=%22date_posted%22
Melissa Snover,Female,2023-09-27,"Today I spoke at this year's Future Food-Tech event in London to share how we are using personalised nutrition to provide innovative solutions to women’s health issues, what consumers are looking for when it comes to a personalised solution and the challenges facing businesses in this sector. Thank you to everyone who attended this session and for the event organisers.",38,3,0,https://www.linkedin.com/search/results/content/?fromMember=%5B%22ACoAAARiO3IBHx5SsO9k14J8Nxd_SccMFE0LAFw%22%5D&heroEntityKey=urn%3Ali%3Afsd_profile%3AACoAAARiO3IBHx5SsO9k14J8Nxd_SccMFE0LAFw&keywords=melissa%20snover&origin=CLUSTER_EXPANSION&position=0&searchId=c50fe653-070e-497e-92f1-0d111f07a987&sid=o%3AE&sortBy=%22date_posted%22
Melissa Snover,Female,2023-08-27,"It was an honour to attend a special lunch yesterday with the other acclaimed finalists and judges from this year’s ‘The Spectator Economic Innovator of the Year Award for the West Midlands’. Thank you to the organisation for recognising Get Nourish3d as one of this year's nominees, and I look forward to the finals.",36,2,0,https://www.linkedin.com/search/results/content/?fromMember=%5B%22ACoAAARiO3IBHx5SsO9k14J8Nxd_SccMFE0LAFw%22%5D&heroEntityKey=urn%3Ali%3Afsd_profile%3AACoAAARiO3IBHx5SsO9k14J8Nxd_SccMFE0LAFw&keywords=melissa%20snover&origin=CLUSTER_EXPANSION&position=0&searchId=c50fe653-070e-497e-92f1-0d111f07a987&sid=o%3AE&sortBy=%22date_posted%22
Melissa Snover,Female,2024-02-27,"Last week, I had the privilege of attending the FII Institute Priority Summit in Miami, themed ‘On The Edge of a New Frontier’. This event brought together over 800 attendees including global leaders, investors, CEOs, entrepreneurs, and innovators, all converging to share insights and ideas aimed at shaping the future of business and society.The distinguished panellists included the likes of Stephen A. Schwarzman (Chairman and CEO of The Blackstone Group) and Marcelo Claure (CEO of Claure Group). Particularly striking was Marcelo Claure's summary of the transformative effects of AI, where he highlighted how, just as the internet dramatically reduced the cost of accessing information, #AI is poised to make creativity, cognition, and problem-solving equally accessible, virtually bringing their net cost to zero. Other key discussions pointed towards the necessity for a sustainable financial marketplace blueprint, concerns around the growing cost of living crisis, navigating the challenges of a green energy transition costing between $100-300 trillion by 2050, and leveraging deep tech markets, which is expected to soar as we move forward.  I am grateful for the opportunity to have been involved and wanted to thank Fii for hosting an event filled with inspirational panels and insightful sessions. I am excited about the potential impacts of these discussions on our future and look forward to next year's event.#FIIPriority",36,1,1,https://www.linkedin.com/search/results/content/?fromMember=%5B%22ACoAAARiO3IBHx5SsO9k14J8Nxd_SccMFE0LAFw%22%5D&heroEntityKey=urn%3Ali%3Afsd_profile%3AACoAAARiO3IBHx5SsO9k14J8Nxd_SccMFE0LAFw&keywords=melissa%20snover&origin=CLUSTER_EXPANSION&position=0&searchId=c50fe653-070e-497e-92f1-0d111f07a987&sid=o%3AE&sortBy=%22date_posted%22
Melissa Snover,Female,2023-06-27,Get Nourish3d is hiring! We are so much more than just a health company. We are a team of innovators in the world of food tech who are on a mission to bring personalised nutrition to the world. We are looking for a talented General Manager in Food Manufacturing who wants to join us on our journey to change the world of health and wellness. #job #hiring #westmidlands,36,Comment,2,https://www.linkedin.com/search/results/content/?fromMember=%5B%22ACoAAARiO3IBHx5SsO9k14J8Nxd_SccMFE0LAFw%22%5D&heroEntityKey=urn%3Ali%3Afsd_profile%3AACoAAARiO3IBHx5SsO9k14J8Nxd_SccMFE0LAFw&keywords=melissa%20snover&origin=CLUSTER_EXPANSION&position=0&searchId=c50fe653-070e-497e-92f1-0d111f07a987&sid=o%3AE&sortBy=%22date_posted%22
Melissa Snover,Female,2023-08-27,"Thank you to BUY WOMEN BUILT for inviting me to a special dinner this week, along with some of the top female founders from around the country. Having the opportunity to meet other like-minded entrepreneurs is always an opportunity I am immensely grateful for.",35,2,0,https://www.linkedin.com/search/results/content/?fromMember=%5B%22ACoAAARiO3IBHx5SsO9k14J8Nxd_SccMFE0LAFw%22%5D&heroEntityKey=urn%3Ali%3Afsd_profile%3AACoAAARiO3IBHx5SsO9k14J8Nxd_SccMFE0LAFw&keywords=melissa%20snover&origin=CLUSTER_EXPANSION&position=0&searchId=c50fe653-070e-497e-92f1-0d111f07a987&sid=o%3AE&sortBy=%22date_posted%22
Melissa Snover,Female,2023-04-27,A piece of advice I have always given to young entrepreneurs is that networking is hugely important for advancing your career in business. I find it incredibly interesting speaking to other people in my field at events across the country and abroad to learn how they overcome challenges and grow their businesses. Try to attend events and prioritise networking where possible to seek out opportunities to connect with others in your industry and beyond. #business #networking #entrepreneurs,35,3,0,https://www.linkedin.com/search/results/content/?fromMember=%5B%22ACoAAARiO3IBHx5SsO9k14J8Nxd_SccMFE0LAFw%22%5D&heroEntityKey=urn%3Ali%3Afsd_profile%3AACoAAARiO3IBHx5SsO9k14J8Nxd_SccMFE0LAFw&keywords=melissa%20snover&origin=CLUSTER_EXPANSION&position=0&searchId=c50fe653-070e-497e-92f1-0d111f07a987&sid=o%3AE&sortBy=%22date_posted%22
Melissa Snover,Female,2023-05-27,Thank you to Startups.co.uk and Fernanda Alvarez Pineiro for featuring Get Nourish3d in a feature about our recent Kings Award for Innovation. You can read the article here at the following link: https://lnkd.in/emutU3JS #innovation,34,1,0,https://www.linkedin.com/search/results/content/?fromMember=%5B%22ACoAAARiO3IBHx5SsO9k14J8Nxd_SccMFE0LAFw%22%5D&heroEntityKey=urn%3Ali%3Afsd_profile%3AACoAAARiO3IBHx5SsO9k14J8Nxd_SccMFE0LAFw&keywords=melissa%20snover&origin=CLUSTER_EXPANSION&position=0&searchId=c50fe653-070e-497e-92f1-0d111f07a987&sid=o%3AE&sortBy=%22date_posted%22
Melissa Snover,Female,2023-06-27,"Last week we had the pleasure of hosting an exclusive event at Selfridges, Oxford Street, to unveil our fabulous new Get Nourish3d Collagen+ range. We are thrilled to have received such positive feedback already from our customers, partners and the media and to hear how tasty our Collagen stacks are! Thank you to everyone who was able to attend, Lina Stores for hosting our breakfast and our PR team for helping to organise this special event.You can learn more about our incredible new Nourished Collagen range here:https://lnkd.in/eXD5P37M",34,1,0,https://www.linkedin.com/search/results/content/?fromMember=%5B%22ACoAAARiO3IBHx5SsO9k14J8Nxd_SccMFE0LAFw%22%5D&heroEntityKey=urn%3Ali%3Afsd_profile%3AACoAAARiO3IBHx5SsO9k14J8Nxd_SccMFE0LAFw&keywords=melissa%20snover&origin=CLUSTER_EXPANSION&position=0&searchId=c50fe653-070e-497e-92f1-0d111f07a987&sid=o%3AE&sortBy=%22date_posted%22
Melissa Snover,Female,2023-04-27,"Vitamin B12 is crucial for maintaining our nervous system, red blood cells, and overall health. However, some people struggle to get enough of it in their diets, leading to a B12 deficiency. If you would like to read more about the benefits of Vitamin B12, then you can read one of our blog posts on the Get Nourish3d website: https://lnkd.in/eN2K9zy8",34,1,0,https://www.linkedin.com/search/results/content/?fromMember=%5B%22ACoAAARiO3IBHx5SsO9k14J8Nxd_SccMFE0LAFw%22%5D&heroEntityKey=urn%3Ali%3Afsd_profile%3AACoAAARiO3IBHx5SsO9k14J8Nxd_SccMFE0LAFw&keywords=melissa%20snover&origin=CLUSTER_EXPANSION&position=0&searchId=c50fe653-070e-497e-92f1-0d111f07a987&sid=o%3AE&sortBy=%22date_posted%22
Melissa Snover,Female,2023-07-27,"Thank you to Natalie Chui for her extremely positive review of Get Nourish3d in the Sun, where she highlighted how our stacks help to form a convenient and effective health habit. It’s feedback like this that keeps us inspired to continue pushing the boundaries of innovation and providing high-impact health solutions to our customers!",34,3,0,https://www.linkedin.com/search/results/content/?fromMember=%5B%22ACoAAARiO3IBHx5SsO9k14J8Nxd_SccMFE0LAFw%22%5D&heroEntityKey=urn%3Ali%3Afsd_profile%3AACoAAARiO3IBHx5SsO9k14J8Nxd_SccMFE0LAFw&keywords=melissa%20snover&origin=CLUSTER_EXPANSION&position=0&searchId=c50fe653-070e-497e-92f1-0d111f07a987&sid=o%3AE&sortBy=%22date_posted%22
Melissa Snover,Female,2023-05-27,"This National Childhood Nutrition Day, we’re proud to partner with Vitamin Angels/Vitamin Angels UK to help provide nutritious food to children attending nurseries in low-income communities in the UK. Since partnering with Vitamin Angels in 2020, Get Nourish3d has helped reach over 177,870 women and children in the UK and around the world.  Vitamin Angels UK provides over 1 million servings of fruits, vegetables and protein-rich foods to children every year through their supplemental feeding program, free of charge. Together, we’re helping to improve nutrition. #NCNDhttps://lnkd.in/gxMvm7i",33,1,0,https://www.linkedin.com/search/results/content/?fromMember=%5B%22ACoAAARiO3IBHx5SsO9k14J8Nxd_SccMFE0LAFw%22%5D&heroEntityKey=urn%3Ali%3Afsd_profile%3AACoAAARiO3IBHx5SsO9k14J8Nxd_SccMFE0LAFw&keywords=melissa%20snover&origin=CLUSTER_EXPANSION&position=0&searchId=c50fe653-070e-497e-92f1-0d111f07a987&sid=o%3AE&sortBy=%22date_posted%22
