Author,Gender,Date,Post Text,Likes,Comments,Shares,Page Link
Michelle De Leon,Female,2023-09-27,"I’m thankful today that World Afro Day matters to people of all backgrounds. I think people assume that only people with Afro hair get it but for the last seven years I have worked with people of all colours and nationalities.Truth is truth, straight hair should not determine better opportunities in the workplace.Straight hair should not determine better treatment at school but the global system has operated counter to these truths for over 150 years.I passionately want to see change and this is why I understand this mother’s gratitude for the small wins, which can sometimes seem huge.What small win could you make in your school or company towards Afro hair? Prof. Jonathan A.J. Wilson PhD DLitt Patti O'Brien-Richardson, PhD D. Wendy Greene Paulette Watson MBA Global Tech Disruptor Ross Morrison McGill",25,1,2,https://www.linkedin.com/search/results/content/?fromMember=%5B%22ACoAAAM63CEB4FijLi16qxpVM7kjCbqjwBoAxHs%22%5D&heroEntityKey=urn%3Ali%3Afsd_profile%3AACoAAAM63CEB4FijLi16qxpVM7kjCbqjwBoAxHs&keywords=michelle%20de%20leon&origin=CLUSTER_EXPANSION&position=0&searchId=e7d954d0-210f-4ba8-b997-6b172d522ca3&sid=O)f&sortBy=%22date_posted%22
Michelle De Leon,Female,2024-03-27,I’m so pleased to share some good news about ending hair discrimination in France. The new bill passed the first stage 44 to 2 hallelujah! Now only one more stage to go congratulations to Guylaine Conquet Olivier SERVA Natasha Gaspard D. Wendy Greene and to those behind the scenes making this happen.I was honoured to be asked to support in a small way.,24,6,3,https://www.linkedin.com/search/results/content/?fromMember=%5B%22ACoAAAM63CEB4FijLi16qxpVM7kjCbqjwBoAxHs%22%5D&heroEntityKey=urn%3Ali%3Afsd_profile%3AACoAAAM63CEB4FijLi16qxpVM7kjCbqjwBoAxHs&keywords=michelle%20de%20leon&origin=CLUSTER_EXPANSION&position=0&searchId=e7d954d0-210f-4ba8-b997-6b172d522ca3&sid=O)f&sortBy=%22date_posted%22
Michelle De Leon,Female,2023-05-27,"Happy Fro Friday!Texas passed the CROWN Act and one of its champions Tashara Parker, MA will be joining us 1-2pm BST June 7 for the World Afro Day® special announcement at our #linkedinaudioevent along with other special guests Paulette Watson MBA Global Tech Disruptor Prof. Jonathan A.J. Wilson PhD DLitt Georgina Wilson FRSA D. Wendy Greene The law and Afro hair, protective styles and professionalism. Get your questions and comments ready. Event link in comments and bio. #professional #hair #blacklinkedin #thecrown",23,2,0,https://www.linkedin.com/search/results/content/?fromMember=%5B%22ACoAAAM63CEB4FijLi16qxpVM7kjCbqjwBoAxHs%22%5D&heroEntityKey=urn%3Ali%3Afsd_profile%3AACoAAAM63CEB4FijLi16qxpVM7kjCbqjwBoAxHs&keywords=michelle%20de%20leon&origin=CLUSTER_EXPANSION&position=0&searchId=e7d954d0-210f-4ba8-b997-6b172d522ca3&sid=O)f&sortBy=%22date_posted%22
Michelle De Leon,Female,2023-10-27,This is just so inspiring! When women and girls get a chance to be educated the whole world can change. I salute Dr Thibela and wish her continued success.,21,1,0,https://www.linkedin.com/search/results/content/?fromMember=%5B%22ACoAAAM63CEB4FijLi16qxpVM7kjCbqjwBoAxHs%22%5D&heroEntityKey=urn%3Ali%3Afsd_profile%3AACoAAAM63CEB4FijLi16qxpVM7kjCbqjwBoAxHs&keywords=michelle%20de%20leon&origin=CLUSTER_EXPANSION&position=0&searchId=e7d954d0-210f-4ba8-b997-6b172d522ca3&sid=O)f&sortBy=%22date_posted%22
Michelle De Leon,Female,2024-02-27,"What sort of impact do you want to make in 2024? I am really excited to be preparing to make a presentation to a major British institution, employer, regulator and global leader. Any ideas who it is?Finance is the clue...drop your answers below. I have created a quiz which will be interactive and thought provoking.Tip: Don't afraid to be bold and different in order to make an impact.Does your workplace need a quiz like this to understand Afro hair discrimination? I will also be speaking about our Workplace Hair Acceptance Report. You can read about this on our website www.worldafroday.com. I hope that you will come back later this week to see which workplace it was. Fact: Finance and Insurance are the worst industries for Afro hair discrimination. (source: Workplace Hair Acceptance Report 2023)In the lines of a song: ""Do you know where you're going to...?"" I hope my financial friends can guess Emmanuel Asuquo - One Stop Save Uchechi C Ndukwe and Andrea Davidson Ndukwe FCG. Black women in the workplace Gloria Tabi Alicia Richardson Roianne Nedd (Fellow CIPD and Fellow ACCA) Shauna R. I'm expecting you to guess this...and Simeon Quarrie Barbara H. Joan MB Amo-Sakyi. Nyasha Daley Thanks Tehila Okagbue for the photo and Daniella Genas MA. MBA. for overcoming.",20,6,2,https://www.linkedin.com/search/results/content/?fromMember=%5B%22ACoAAAM63CEB4FijLi16qxpVM7kjCbqjwBoAxHs%22%5D&heroEntityKey=urn%3Ali%3Afsd_profile%3AACoAAAM63CEB4FijLi16qxpVM7kjCbqjwBoAxHs&keywords=michelle%20de%20leon&origin=CLUSTER_EXPANSION&position=0&searchId=e7d954d0-210f-4ba8-b997-6b172d522ca3&sid=O)f&sortBy=%22date_posted%22
Michelle De Leon,Female,2024-02-27,"We need your help please spread the word. Our women are vulnerable and invisible too. Please can you share and pray for their safe return? Thanks Marvyn Harrison for highlighting this issue Lydia Amoah FRSA Scarlette Douglas Jacqueline Shepherd Catherine Byaruhanga Georgina Wilson FRSA Haddy Folivi Sharlene Monique Sabrina Ben Salmi BSc FRSA Serlina Boyd Carol Stewart MSc, FIoL Shereen Daniels 🇬🇧🇯🇲🇬🇾 Prof. Jonathan A.J. Wilson PhD DLitt Sarah-Jane Crawford Paige Lewin Simi J. Yasmin Khatun Dewan Anyone in media and comms let’s put some eyes on this!THANK YOU",20,Comment,17,https://www.linkedin.com/search/results/content/?fromMember=%5B%22ACoAAAM63CEB4FijLi16qxpVM7kjCbqjwBoAxHs%22%5D&heroEntityKey=urn%3Ali%3Afsd_profile%3AACoAAAM63CEB4FijLi16qxpVM7kjCbqjwBoAxHs&keywords=michelle%20de%20leon&origin=CLUSTER_EXPANSION&position=0&searchId=e7d954d0-210f-4ba8-b997-6b172d522ca3&sid=O)f&sortBy=%22date_posted%22
Michelle De Leon,Female,2024-04-20,"What is it all for?I find myself asking the big questions in life again. Am I living my purpose and what does that look like? How does my relationship with money influence my outcomes. There is so much to do and what next?We are all living on one of these three levels according to the book Purpose Driven Life:- survival - success- significance I think I straddle between significance and success. World Afro Day® has certainly achieved significance but is it a success materially?2024 is not yet clear and yesterday one door closed and another one opened. This next door has major significance but it doesn’t make any money. I know God has given me purpose in what I am doing and it’s not just about me.There is another project tbc which involves my heart and because of Yinka Ewuola I am structuring it in a way to make money. I always lead with my heart but I need to act with my financial head too. It’s an exciting and much needed immersion experience for African diaspora women but women and businesses of all types can still support. I hope I get to go on that journey with you or your business. Anyway feeling philosophical this morning. Which level are you living on? Carol Stewart MSc, FIoL Carole Pyke MCIM Géraldine Poukens Myriah Hampton Pamela Aculey Denese Chikwendu, MAPM, CertCoach, MA, BA (Hons)",20,9,2,https://www.linkedin.com/search/results/content/?fromMember=%5B%22ACoAAAM63CEB4FijLi16qxpVM7kjCbqjwBoAxHs%22%5D&heroEntityKey=urn%3Ali%3Afsd_profile%3AACoAAAM63CEB4FijLi16qxpVM7kjCbqjwBoAxHs&keywords=michelle%20de%20leon&origin=CLUSTER_EXPANSION&position=0&searchId=e7d954d0-210f-4ba8-b997-6b172d522ca3&sid=O)f&sortBy=%22date_posted%22
Michelle De Leon,Female,2024-03-27,"Meetings that change your life…We spend so much time in meetings but some meetings will be dates that you remember forever: first big sponsor, first regulator, first multinational, first invitation to Downing Street.Today was my introductory book meeting with Nancy Adimora and we are beyond excited to be crafting my first book. 2024 has so much more in store for me than I pictured at the start of the year. I couldn’t quite see it through the turbulent times that I am in. ✅ Don’t be afraid to change it up. You will be seeing some new things from me this year but letting go of some of the old is hard because I care so much and I want to help children too.✅ Allow the good to make way for the great. Thanks Denese Chikwendu, MAPM, CertCoach, MA, BA (Hons) for helping me to see that.✅ Get yourself around people who are on a success level that you want to get to. Candace Junée Armour is showing other business women how to take their business to six figures so I am part of her “Pray for your business challenge” BIG THANK YOU to the people who have sent DMs, left voice notes and called to check in on me. I appreciate your support. Pamela Aculey Subira Jones Mathurini Visakan (MCIM) Sarah-Jane Crawford Lere Fisher Gloria Tabi and everyone else too.#meetings #iwd2024 #newbusiness",20,6,1,https://www.linkedin.com/search/results/content/?fromMember=%5B%22ACoAAAM63CEB4FijLi16qxpVM7kjCbqjwBoAxHs%22%5D&heroEntityKey=urn%3Ali%3Afsd_profile%3AACoAAAM63CEB4FijLi16qxpVM7kjCbqjwBoAxHs&keywords=michelle%20de%20leon&origin=CLUSTER_EXPANSION&position=0&searchId=e7d954d0-210f-4ba8-b997-6b172d522ca3&sid=O)f&sortBy=%22date_posted%22
Michelle De Leon,Female,2024-02-27,"I got to celebrate the amazing Georgina Wilson FRSA and the 10 year anniversary of BUD Leaders. I was drawn to this poster of her as a fearless leader. I learned from her speech that as a very young child she was inspired to help others, after receiving a “no.” She has now turned around her own hurt and loss into victory. “I will never let someone take my power again” she declared as an eight year old child. Now her whole life’s mission is empowering global majority women through BUD Leaders.The conference was no ordinary event because she is no ordinary leader. There was energy, power and synergy in the room. People didn’t want to leave and everyone asked for more, next year, next one, when, Georgina was asked… But as the wise woman she is, she didn’t move with the crowd and circumstances, she will commit to what aligns with her vision.The room was full of leaders, who are changemakers. ✅ Tip: The digital age cannot replace the power of networking.#BUDevent2024 #BUDCX2 BUD Leaders",19,Comment,1,https://www.linkedin.com/search/results/content/?fromMember=%5B%22ACoAAAM63CEB4FijLi16qxpVM7kjCbqjwBoAxHs%22%5D&heroEntityKey=urn%3Ali%3Afsd_profile%3AACoAAAM63CEB4FijLi16qxpVM7kjCbqjwBoAxHs&keywords=michelle%20de%20leon&origin=CLUSTER_EXPANSION&position=0&searchId=e7d954d0-210f-4ba8-b997-6b172d522ca3&sid=O)f&sortBy=%22date_posted%22
Michelle De Leon,Female,2023-05-27,"And so we begin…Can we update every workplace? Will they embrace change or will it be business as usual? The World Afro Day - Workplace movement has started so have you told your HR, ERG and DEI professionals? Our first HR industry article is below. What do you think? Please share Akima Paul Lambert Prof. Jonathan A.J. Wilson PhD DLitt Sarah-Jane Crawford Jane Powell Patti O'Brien-Richardson, PhD D. Wendy Greene Tashara Parker, MA Emmanuel Asuquo - TV Financial Adviser Paulette Watson MBA Global Tech Disruptor Sabrina Ben Salmi BSc FRSA Sabrina Clarke Zena CollIns  #hr #erg #dei #change",19,1,3,https://www.linkedin.com/search/results/content/?fromMember=%5B%22ACoAAAM63CEB4FijLi16qxpVM7kjCbqjwBoAxHs%22%5D&heroEntityKey=urn%3Ali%3Afsd_profile%3AACoAAAM63CEB4FijLi16qxpVM7kjCbqjwBoAxHs&keywords=michelle%20de%20leon&origin=CLUSTER_EXPANSION&position=0&searchId=e7d954d0-210f-4ba8-b997-6b172d522ca3&sid=O)f&sortBy=%22date_posted%22
Michelle De Leon,Female,2023-05-27,"What's not to love about Afro textured hair and styles? Many workplaces have set ideas about neatness, smartness and professionalism, which are biased towards European presentation. These outdated ideas disadvantage people of African descent in our careers so it is time for a change. Prof. Jonathan A.J. Wilson PhD DLitt is a highly qualified academic, professional and professor speaking at our #linkedinaudioevent tomorrow 1-2pm BST, June 7. Link in comments and bio.Would your workplace employ him or turn him away based on his hair? How many businesses miss out on talented people and are potentially breaking the law?Your business can either be for or against liberation in the workplace for African descendents.  #people #change #careers #law",19,4,3,https://www.linkedin.com/search/results/content/?fromMember=%5B%22ACoAAAM63CEB4FijLi16qxpVM7kjCbqjwBoAxHs%22%5D&heroEntityKey=urn%3Ali%3Afsd_profile%3AACoAAAM63CEB4FijLi16qxpVM7kjCbqjwBoAxHs&keywords=michelle%20de%20leon&origin=CLUSTER_EXPANSION&position=0&searchId=e7d954d0-210f-4ba8-b997-6b172d522ca3&sid=O)f&sortBy=%22date_posted%22
Michelle De Leon,Female,2023-12-27,"I may be quiet right now but it doesn’t mean I can’t shout about this amazing man, doing great things Emmanuel Asuquo - TV Financial Adviser",19,1,0,https://www.linkedin.com/search/results/content/?fromMember=%5B%22ACoAAAM63CEB4FijLi16qxpVM7kjCbqjwBoAxHs%22%5D&heroEntityKey=urn%3Ali%3Afsd_profile%3AACoAAAM63CEB4FijLi16qxpVM7kjCbqjwBoAxHs&keywords=michelle%20de%20leon&origin=CLUSTER_EXPANSION&position=0&searchId=e7d954d0-210f-4ba8-b997-6b172d522ca3&sid=O)f&sortBy=%22date_posted%22
Michelle De Leon,Female,2023-04-27,"Thanks Janice Gassam Asare, Ph.D. and Joel Bervell for shedding light on this. Our textured hair literally affects so many aspects of our lives and it’s great to see our needs being addressed in healthcare by Joy Jackson. Great work. #healthcare #equity #afrohair",18,2,0,https://www.linkedin.com/search/results/content/?fromMember=%5B%22ACoAAAM63CEB4FijLi16qxpVM7kjCbqjwBoAxHs%22%5D&heroEntityKey=urn%3Ali%3Afsd_profile%3AACoAAAM63CEB4FijLi16qxpVM7kjCbqjwBoAxHs&keywords=michelle%20de%20leon&origin=CLUSTER_EXPANSION&position=0&searchId=e7d954d0-210f-4ba8-b997-6b172d522ca3&sid=O)f&sortBy=%22date_posted%22
Michelle De Leon,Female,2023-05-27,"The workplace has been hostile to Afro hair for far too long! This has cost African descendants so much, especially women but it is time for change. Viola Davis has spoken out on this and she is finally able to be herself and what an impact! Join our event #linkedinaudioevent 1-2pmJune 7 and unleash the potential in all of us! Thanks for sharing Ekene Ajene Onu #change #womeninbusiness",18,1,0,https://www.linkedin.com/search/results/content/?fromMember=%5B%22ACoAAAM63CEB4FijLi16qxpVM7kjCbqjwBoAxHs%22%5D&heroEntityKey=urn%3Ali%3Afsd_profile%3AACoAAAM63CEB4FijLi16qxpVM7kjCbqjwBoAxHs&keywords=michelle%20de%20leon&origin=CLUSTER_EXPANSION&position=0&searchId=e7d954d0-210f-4ba8-b997-6b172d522ca3&sid=O)f&sortBy=%22date_posted%22
Michelle De Leon,Female,2023-08-27,World Afro Day - 7th Anniversary,18,Comment,0,https://www.linkedin.com/search/results/content/?fromMember=%5B%22ACoAAAM63CEB4FijLi16qxpVM7kjCbqjwBoAxHs%22%5D&heroEntityKey=urn%3Ali%3Afsd_profile%3AACoAAAM63CEB4FijLi16qxpVM7kjCbqjwBoAxHs&keywords=michelle%20de%20leon&origin=CLUSTER_EXPANSION&position=0&searchId=e7d954d0-210f-4ba8-b997-6b172d522ca3&sid=O)f&sortBy=%22date_posted%22
Michelle De Leon,Female,2023-04-27,It is so powerful to see the everyday resistance to hair discrimination being discussed on #linkedin Well done for this great podcast Nyasha Daley Holly Kintuka These conversations will enlighten millions of employees and employers that there is a global shift happening that businesses need to prepare for now. World Afro Day® workplace is coming! Check this out Prof. Jonathan A.J. Wilson PhD DLitt Georgina Wilson FRSA Akima Paul Lambert #podcast #businesstrends #afrohair,17,4,0,https://www.linkedin.com/search/results/content/?fromMember=%5B%22ACoAAAM63CEB4FijLi16qxpVM7kjCbqjwBoAxHs%22%5D&heroEntityKey=urn%3Ali%3Afsd_profile%3AACoAAAM63CEB4FijLi16qxpVM7kjCbqjwBoAxHs&keywords=michelle%20de%20leon&origin=CLUSTER_EXPANSION&position=0&searchId=e7d954d0-210f-4ba8-b997-6b172d522ca3&sid=O)f&sortBy=%22date_posted%22
Michelle De Leon,Female,2023-04-27,Super proud this amazing business leader will be part of World Afro Day 2023. Yes Emmanuel Asuquo - TV Financial Adviser,17,4,0,https://www.linkedin.com/search/results/content/?fromMember=%5B%22ACoAAAM63CEB4FijLi16qxpVM7kjCbqjwBoAxHs%22%5D&heroEntityKey=urn%3Ali%3Afsd_profile%3AACoAAAM63CEB4FijLi16qxpVM7kjCbqjwBoAxHs&keywords=michelle%20de%20leon&origin=CLUSTER_EXPANSION&position=0&searchId=e7d954d0-210f-4ba8-b997-6b172d522ca3&sid=O)f&sortBy=%22date_posted%22
Michelle De Leon,Female,2024-04-23,"Afro gymnasts: how often do you see this?It’s important that Afro hair is associated with excellent standards! Gymnastics like many professions have promoted grooming standards based on straight European hair and this has mean’t hiding Afro hair or risking their health with hair relaxers.Some might see an untamed Afro hairstyle. I see a young man operating with feeedom, boldness and achieving high standards based on his skills and not his hair. I love how Gen Z are not going by the old playbook. My daughter is part of this generation but we have a responsibility to make the path easier for them. Like the Olympics we carry the torch to pass on so let’s change our professions and industries to accept that Afro coily curly hair is the standard for the majority of Africans. When a gymnast reaches the highest level they create an original move which is named after them. You can bring your own style, flare and ingenuity to your workplace. My signature move is World Afro Day® but you can add your move too! Business is often about creating something new or improving on the existing way, which is similar to gymnastics…I have something coming for 2024.The Paris Olympics are round the corner and as a former athlete I love the sports but as a textured hair advocate I love to watch the hair too. 😉 One of the most famous female athletes on the planet Sha’Carri Richardson has been sporting her Afro too along with many other athletes. I wonder if this year we will see something extra special or less extra and more natural…at the Olympics.Myriah Hampton Prof. Jonathan A.J. Wilson PhD DLitt Pamela Aculey Michelle Moore MA BA Akima Paul Lambert Carole Pyke MCIM #ParisOlympics #professional #hair",17,12,1,https://www.linkedin.com/search/results/content/?fromMember=%5B%22ACoAAAM63CEB4FijLi16qxpVM7kjCbqjwBoAxHs%22%5D&heroEntityKey=urn%3Ali%3Afsd_profile%3AACoAAAM63CEB4FijLi16qxpVM7kjCbqjwBoAxHs&keywords=michelle%20de%20leon&origin=CLUSTER_EXPANSION&position=0&searchId=e7d954d0-210f-4ba8-b997-6b172d522ca3&sid=O)f&sortBy=%22date_posted%22
Michelle De Leon,Female,2024-01-27,"This post from Gloria Tabi is so powerful and a great way to end my social media hiatus. When she told me behind the scenes she wanted to celebrate our hair, I had no idea she had such a rich story! I’m so excited for her 2024 there are so many millions more women we want to experience this freedom. Go go Gloria!",17,4,0,https://www.linkedin.com/search/results/content/?fromMember=%5B%22ACoAAAM63CEB4FijLi16qxpVM7kjCbqjwBoAxHs%22%5D&heroEntityKey=urn%3Ali%3Afsd_profile%3AACoAAAM63CEB4FijLi16qxpVM7kjCbqjwBoAxHs&keywords=michelle%20de%20leon&origin=CLUSTER_EXPANSION&position=0&searchId=e7d954d0-210f-4ba8-b997-6b172d522ca3&sid=O)f&sortBy=%22date_posted%22
Michelle De Leon,Female,2023-09-27,Happy Black History Month!I know we are worth more than one month and our history cannot be squeezed into one month but BHM still represents opportunities. I have worked in the media for over 25 years and everyone is vying to be heard and seen. Trust me without BHM we would have even less representation. Anyway this slice of history puts Black beauty and natural hair in the spotlight. Are things better or worse now?https://lnkd.in/ehf63ZHmChioma Fanawopo Sharlene Monique D. Wendy Greene Akima Paul Lambert Paige Lewin Sarah-Jane Crawford,16,1,2,https://www.linkedin.com/search/results/content/?fromMember=%5B%22ACoAAAM63CEB4FijLi16qxpVM7kjCbqjwBoAxHs%22%5D&heroEntityKey=urn%3Ali%3Afsd_profile%3AACoAAAM63CEB4FijLi16qxpVM7kjCbqjwBoAxHs&keywords=michelle%20de%20leon&origin=CLUSTER_EXPANSION&position=0&searchId=e7d954d0-210f-4ba8-b997-6b172d522ca3&sid=O)f&sortBy=%22date_posted%22
Michelle De Leon,Female,2023-05-27,"What would changes to Equality Law mean for Afro hair in the UK? We have seen the CROWN act gaining momentum in the USA but what about the rest of the world? What tips would you give workplaces about Afro hair and the law? Is the law the key change or is it the workplace? Have you registered for our next event June 7th 1-2pm  #professional #blackwomeninbusiness Akima Paul Lambert Prof. Jonathan A.J. Wilson PhD DLitt Emmanuel Asuquo - TV Financial Adviser Jane Powell Patti O'Brien-Richardson, PhD D. Wendy Greene Georgina Wilson FRSA Link in comments and bio.",16,1,1,https://www.linkedin.com/search/results/content/?fromMember=%5B%22ACoAAAM63CEB4FijLi16qxpVM7kjCbqjwBoAxHs%22%5D&heroEntityKey=urn%3Ali%3Afsd_profile%3AACoAAAM63CEB4FijLi16qxpVM7kjCbqjwBoAxHs&keywords=michelle%20de%20leon&origin=CLUSTER_EXPANSION&position=0&searchId=e7d954d0-210f-4ba8-b997-6b172d522ca3&sid=O)f&sortBy=%22date_posted%22
Michelle De Leon,Female,2024-02-27,I presented to the Bank of England this week! What workplace do you know that needs to hear about ending Afro hair discrimination?,16,Comment,0,https://www.linkedin.com/search/results/content/?fromMember=%5B%22ACoAAAM63CEB4FijLi16qxpVM7kjCbqjwBoAxHs%22%5D&heroEntityKey=urn%3Ali%3Afsd_profile%3AACoAAAM63CEB4FijLi16qxpVM7kjCbqjwBoAxHs&keywords=michelle%20de%20leon&origin=CLUSTER_EXPANSION&position=0&searchId=e7d954d0-210f-4ba8-b997-6b172d522ca3&sid=O)f&sortBy=%22date_posted%22
Michelle De Leon,Female,2023-05-27,"We have launched World Afro Day - Workplace in the news and now it's your turn to get involved. What an exciting time to be alive!Millions of businesses are unaware of hair discriminationMillions of businesses are untrained for Afro hair inclusionMillions of businesses may be breaking Equality LawWorld Afro Day - Workplace is the first global training day to tackle hair discrimination in careers and business on 15th of September 2023, World Afro Day. Find out more by watching our short film below. Can your business be part of change? You can join us at 1pm BST today for our #linkedinaudioevent including two professors, two CEOs and two TV Producers focused on creating Afro hair inclusion in the workplace. D. Wendy Greene Prof. Jonathan A.J. Wilson PhD DLitt Georgina Wilson FRSA Paulette Watson MBA Global Tech Disruptor Tashara Parker, MA Emmanuel Asuquo - TV Financial Adviser Jane Powell Patti O'Brien-Richardson, PhD JANELL STEPHENS Sabrina Ben Salmi BSc FRSA Sabrina Clarke Raquel ""Rocky"" Harris Nadine WhiteShare the film and let's train the world to embrace Afro textured hair! #film #share #training #careers #blacklinkedin #hairandbusiness",15,3,1,https://www.linkedin.com/search/results/content/?fromMember=%5B%22ACoAAAM63CEB4FijLi16qxpVM7kjCbqjwBoAxHs%22%5D&heroEntityKey=urn%3Ali%3Afsd_profile%3AACoAAAM63CEB4FijLi16qxpVM7kjCbqjwBoAxHs&keywords=michelle%20de%20leon&origin=CLUSTER_EXPANSION&position=0&searchId=e7d954d0-210f-4ba8-b997-6b172d522ca3&sid=O)f&sortBy=%22date_posted%22
Michelle De Leon,Female,2023-12-27,"Another day and another chance to celebrate someone doing great things. Paulette Watson MBA Global Tech Disruptor is an expert in her field, her book could be a gift for someone.",14,1,1,https://www.linkedin.com/search/results/content/?fromMember=%5B%22ACoAAAM63CEB4FijLi16qxpVM7kjCbqjwBoAxHs%22%5D&heroEntityKey=urn%3Ali%3Afsd_profile%3AACoAAAM63CEB4FijLi16qxpVM7kjCbqjwBoAxHs&keywords=michelle%20de%20leon&origin=CLUSTER_EXPANSION&position=0&searchId=e7d954d0-210f-4ba8-b997-6b172d522ca3&sid=O)f&sortBy=%22date_posted%22
Michelle De Leon,Female,2023-11-27,"This woman Tashara Parker, MA is rewriting the rule book on what can be achieved with our natural talent and beauty. I look forward to the young women who will take up the baton because she did it first!",14,Comment,0,https://www.linkedin.com/search/results/content/?fromMember=%5B%22ACoAAAM63CEB4FijLi16qxpVM7kjCbqjwBoAxHs%22%5D&heroEntityKey=urn%3Ali%3Afsd_profile%3AACoAAAM63CEB4FijLi16qxpVM7kjCbqjwBoAxHs&keywords=michelle%20de%20leon&origin=CLUSTER_EXPANSION&position=0&searchId=e7d954d0-210f-4ba8-b997-6b172d522ca3&sid=O)f&sortBy=%22date_posted%22
Michelle De Leon,Female,2024-03-27,"The English countryside between Cheltenham and Gloucester. I am grateful for today and I am enjoying truffle tortillas because I wanted to try something new.Just a reminder to hardworking founders, CEOs and professionals to take some time out to refresh.",14,3,0,https://www.linkedin.com/search/results/content/?fromMember=%5B%22ACoAAAM63CEB4FijLi16qxpVM7kjCbqjwBoAxHs%22%5D&heroEntityKey=urn%3Ali%3Afsd_profile%3AACoAAAM63CEB4FijLi16qxpVM7kjCbqjwBoAxHs&keywords=michelle%20de%20leon&origin=CLUSTER_EXPANSION&position=0&searchId=e7d954d0-210f-4ba8-b997-6b172d522ca3&sid=O)f&sortBy=%22date_posted%22
Michelle De Leon,Female,2023-11-27,I would like to champion the work of Paige Lewin doing great work in the space of Afro hair inclusion. While my own work is in transition it’s great to be able to lift her up. Her new series of podcast Texture Talks has some amazing guests!,14,1,3,https://www.linkedin.com/search/results/content/?fromMember=%5B%22ACoAAAM63CEB4FijLi16qxpVM7kjCbqjwBoAxHs%22%5D&heroEntityKey=urn%3Ali%3Afsd_profile%3AACoAAAM63CEB4FijLi16qxpVM7kjCbqjwBoAxHs&keywords=michelle%20de%20leon&origin=CLUSTER_EXPANSION&position=0&searchId=e7d954d0-210f-4ba8-b997-6b172d522ca3&sid=O)f&sortBy=%22date_posted%22
