Author,Gender,Date,Post Text,Likes,Comments,Shares,Page Link
Michelle De Leon,Female,2024-04-26,"“A woman who cuts her hair is about to change her life.” Coco ChanelThis time April 2021 I did the big chop. For many women the idea of cutting off their hair is a complete no no and I was one of them but somehow coming out of lockdown I was ready to face the world differently. African heritage women experience more scrutiny than any other group, when it comes to their hair. Long or short we are asked too many questions about our hair and the worst is when we are touched without our permission. However, the only way to change this is through conversation and education. World Afro Day® has been on this mission for seven years, sometimes changing hearts and minds one person, one school or one organisation at a time.Stepping out of my comfort zone with my hair, maybe helped me to be more bold in other ways. Some women do regular big chops and I do think that they can be bolder than other women. They do not need to be as conventional. Yet African heritage women can look stunning with short hair. It doesn’t have to be the big chop but stepping out of your comfort zone with hair can challenge you on many levels. Lockdown allowed many people to go natural, grow longer hair, bigger fros and become less conformist.Some hairstyles challenge your own beliefs, confidence and identity as well as dealing with other people’s perceptions. Maybe my hair reflects my attitudes to risk…I am courageous and in business and life that is good. What made you do a big hair change? Styling thanks to hair legend Anastasia Chikezie Samuel Kasumu Scarlette Douglas Paige Lewin 🌐Gloria Tabi Carol Stewart MSc, FIoL #lockdown #womeninbusiness #bigchop #hair",45,25,0,https://www.linkedin.com/search/results/content/?fromMember=%5B%22ACoAAAM63CEB4FijLi16qxpVM7kjCbqjwBoAxHs%22%5D&heroEntityKey=urn%3Ali%3Afsd_profile%3AACoAAAM63CEB4FijLi16qxpVM7kjCbqjwBoAxHs&keywords=michelle%20de%20leon&origin=CLUSTER_EXPANSION&position=0&searchId=e7d954d0-210f-4ba8-b997-6b172d522ca3&sid=O)f&sortBy=%22date_posted%22
Michelle De Leon,Female,2024-03-27,"Monday I was speaking in suppprt of the French Parliament.Today I attended the UK Parliament.Shh someone might think that I am up to something…Thanks to the force of fruitfulness Cherron Inko-Tariah MBE for the invitation.Are corporates, SMEs and DEI award winning companies ready to embrace Afro hair at work? We know the majority aren’t so it’s time for change. Saluting my sisters who shake things up! Guylaine Conquet Tashara Parker, MA Myriah Hampton Beverley Bramwell Carol Stewart MSc, FIoL Carole Pyke MCIM Beverley Samuel Akima Paul Lambert Gloria Tabi Sharlene Monique Denese Chikwendu, MAPM, CertCoach, MA, BA (Hons) Shanaz Mahomed Dion Johnson- The Board Level POWER Coach",44,7,2,https://www.linkedin.com/search/results/content/?fromMember=%5B%22ACoAAAM63CEB4FijLi16qxpVM7kjCbqjwBoAxHs%22%5D&heroEntityKey=urn%3Ali%3Afsd_profile%3AACoAAAM63CEB4FijLi16qxpVM7kjCbqjwBoAxHs&keywords=michelle%20de%20leon&origin=CLUSTER_EXPANSION&position=0&searchId=e7d954d0-210f-4ba8-b997-6b172d522ca3&sid=O)f&sortBy=%22date_posted%22
Michelle De Leon,Female,2023-08-27,"What do these three women have in common? They showcase the versatility and beauty of natural Afro hair. Their skills talents and abilities are not in their hair so why would companies choose the straight hairstyle as a standard of professionalism? It’s illogical and discriminatory but this has been business as usual since the early 1900s, when we started to straighten our hair with hot combs. Hair discrimination originates as an employment issue because African diaspora people straightened their hair for better job prospects.If you believe all three women should be able to be employed on merit not on hairstyle. If you believe that Africans looking African is our heritage and that this should be respected at work, then join the movement World Afro Day - Workplace, 15 September.It’s time for change, it’s time for employers to get trained, it’s time to be ourselves. New employer research released on World Afro Day! Will you be there? Event links in comments.#training #research #companyculture #legal Get in touch about your workplace hair stories and let’s change this together! Changemakers Akima Paul Lambert Paulette Watson MBA Global Tech Disruptor Patti O'Brien-Richardson, PhD Tashara Parker, MA D. Wendy Greene Lisa Maria Mai Carol Stewart MSc, FInstLM Carole Pyke MCIM Prof. Jonathan A.J. Wilson PhD DLitt Emmanuel Asuquo - TV Financial Adviser Anastasia Chikezie Sharlene Monique Sharley Butcher Sabrina Clarke Juanita Rosenior BA. Postgrad. Nyasha Daley Nikki Tapper Cherron Inko-Tariah MBE Ambassador Shabazz Nana Agyeiwah",43,10,4,https://www.linkedin.com/search/results/content/?fromMember=%5B%22ACoAAAM63CEB4FijLi16qxpVM7kjCbqjwBoAxHs%22%5D&heroEntityKey=urn%3Ali%3Afsd_profile%3AACoAAAM63CEB4FijLi16qxpVM7kjCbqjwBoAxHs&keywords=michelle%20de%20leon&origin=CLUSTER_EXPANSION&position=0&searchId=e7d954d0-210f-4ba8-b997-6b172d522ca3&sid=O)f&sortBy=%22date_posted%22
Michelle De Leon,Female,2023-09-27,Have you seen the BHM magazine packed full of great features celebrating our sisters? I’m so grateful to be included amongst such wonderful women past and present and my page is so easy to find because it’s pink! Thank you to the very generous Cherron Inko-Tariah MBE for celebrating my work for World Afro Day®.Black History Month is an important time of reflection and resetting. What do you get out of it?,41,5,1,https://www.linkedin.com/search/results/content/?fromMember=%5B%22ACoAAAM63CEB4FijLi16qxpVM7kjCbqjwBoAxHs%22%5D&heroEntityKey=urn%3Ali%3Afsd_profile%3AACoAAAM63CEB4FijLi16qxpVM7kjCbqjwBoAxHs&keywords=michelle%20de%20leon&origin=CLUSTER_EXPANSION&position=0&searchId=e7d954d0-210f-4ba8-b997-6b172d522ca3&sid=O)f&sortBy=%22date_posted%22
Michelle De Leon,Female,2024-03-27,"Who knew that the law could be so exciting...Today I joined a member of the French Parliament Olivier SERVA (bottom left in photo) to give evidence towards a new law against hair discrimination in France. I got this opportunity because of Guylaine Conquet who has been doing great work campaigning to change the law in France. This work is gaining momentum and if they pass the law it might be the first country  in the world to have a national law! The CROWN Act is only at the state level so all eyes are on France now... Even African and Caribbean nations have been slow to legislate against hair discrimination, although it is needed just as much in these nations as anywhere else. The minister for education and social development Dee-ann Kentish-Rogers also pioneered this work in Anguilla by introducing a new hair code in 2022. From my experience leading World Afro Day®, people of African descent really want these laws to rectify an issue that has been hidden for far too long.Let's be honest, workplaces will not change fast enough until the law changes. However, the research clearly shows that people with Afro hair have been denied economic opportunity for hundreds of years because they are deemed to have the 'wrong type' of hair. Why didn't you get the job? I wouldn't straighten my hair to look more European...does this make any sense, when you're an African? Companies need to understand that being ourselves, brings the best results!Anyone else looking forward to a new law to end Afro hair discrimination? Tashara Parker, MA D. Wendy Greene Dr. Patti O'Brien-Richardson Myriah Hampton Tehila Okagbue Beverley Bramwell Akima Paul Lambert Denese Chikwendu, MAPM, CertCoach, MA, BA (Hons)Beverley Samuel Marverine Cole Estelle Emmannuelle BIYIHA Gloria Tabi Carole Pyke MCIM Carol Stewart MSc, FIoL Paige Lewin Sarah-Jane Crawford Prof. Jonathan A.J. Wilson PhD DLitt Georgina Wilson FRSA Kadisha J.#law #economics #hair #iwd2024",40,9,3,https://www.linkedin.com/search/results/content/?fromMember=%5B%22ACoAAAM63CEB4FijLi16qxpVM7kjCbqjwBoAxHs%22%5D&heroEntityKey=urn%3Ali%3Afsd_profile%3AACoAAAM63CEB4FijLi16qxpVM7kjCbqjwBoAxHs&keywords=michelle%20de%20leon&origin=CLUSTER_EXPANSION&position=0&searchId=e7d954d0-210f-4ba8-b997-6b172d522ca3&sid=O)f&sortBy=%22date_posted%22
Michelle De Leon,Female,2023-05-27,"Finally we can talk about the News!World Afro Day - Workplace launched on ITV News today in many parts of the UK. Special thanks to Levi Roots who is backing the end of hair discrimination in workplaces. We did our interview and discussed the changes we are calling for. I can’t wait to see these news packages!Join us at our #linkedinaudioevent tomorrow to see how you can be part of long overdue change! Akima Paul Lambert Prof. Jonathan A.J. Wilson PhD DLitt Georgina Wilson FRSA 🧨 Dynamitri Joachim Nawrot-Syreda Steven Bartlett Sara Davies MBE Jane Powell Paulette Watson MBA Global Tech Disruptor Patti O'Brien-Richardson, PhD D. Wendy Greene Dave Mason MCIPR Carole Pyke MCIM Carol Stewart MSc, FInstLM  #change #dragonsden #inclusion #hair Event links in comments and bio.",40,2,8,https://www.linkedin.com/search/results/content/?fromMember=%5B%22ACoAAAM63CEB4FijLi16qxpVM7kjCbqjwBoAxHs%22%5D&heroEntityKey=urn%3Ali%3Afsd_profile%3AACoAAAM63CEB4FijLi16qxpVM7kjCbqjwBoAxHs&keywords=michelle%20de%20leon&origin=CLUSTER_EXPANSION&position=0&searchId=e7d954d0-210f-4ba8-b997-6b172d522ca3&sid=O)f&sortBy=%22date_posted%22
Michelle De Leon,Female,2023-12-27,"Lessons from 2023✅Be grateful at all times. It’s been a really tough year but I was invited to a Black History Month event at UK Parliament and got to enlarge my network.✅Knowledge is still power. Our Workplace Hair Acceptance report was pioneering and we can build on this new evidence for the future.✅ There are no mistakes just learning opportunities and ways to grow. My personality is to win so I find this one hard. ✅Health & Wellbeing is a life and business priority. We need to speak more about what we are doing in this area on LinkedIn. I did way too much work in 2023 and I need to take care of myself and loved ones better in 2024.✅Sharing more personal information on LinkedIn that shapes my leadership and why I am committed to my vision of Afro hair acceptance in the workplace. I am a private person but life has real challenges that when we overcome them, it can help others.✅Forgiveness is perhaps the hardest thing we can ever do. Has someone disappointed you this year? Leave it in 2023 forgive and be free to embrace 2024 with everything you have!✅Christmas is still a time to believe in miracles. If you have lost someone who was a big part of Christmas, then this can keep you in the past… After seven years of lost Christmases we finally had a family Christmas to bring comfort and joy.I can’t say I liked 2023 but I am here, you are here so I am grateful and by God’s grace I hope you and I have an amazing 2024.#grateful #2023year #family",39,1,2,https://www.linkedin.com/search/results/content/?fromMember=%5B%22ACoAAAM63CEB4FijLi16qxpVM7kjCbqjwBoAxHs%22%5D&heroEntityKey=urn%3Ali%3Afsd_profile%3AACoAAAM63CEB4FijLi16qxpVM7kjCbqjwBoAxHs&keywords=michelle%20de%20leon&origin=CLUSTER_EXPANSION&position=0&searchId=e7d954d0-210f-4ba8-b997-6b172d522ca3&sid=O)f&sortBy=%22date_posted%22
Michelle De Leon,Female,2023-08-27,Wow wow wow this young woman Coco Gauff has inspired the world! I love this picture because it took her family to raise her to become US champion at 19 years old. I will use a little bit of this inspiration as I keep the faith with 5 Days to go! Anyone who has a dream keep going and I look forward to reading about it! Beverley Samuel Carole Pyke MCIM,39,1,3,https://www.linkedin.com/search/results/content/?fromMember=%5B%22ACoAAAM63CEB4FijLi16qxpVM7kjCbqjwBoAxHs%22%5D&heroEntityKey=urn%3Ali%3Afsd_profile%3AACoAAAM63CEB4FijLi16qxpVM7kjCbqjwBoAxHs&keywords=michelle%20de%20leon&origin=CLUSTER_EXPANSION&position=0&searchId=e7d954d0-210f-4ba8-b997-6b172d522ca3&sid=O)f&sortBy=%22date_posted%22
Michelle De Leon,Female,2023-07-27,"It’s August 2023 and I am opening a dialogue with businesses about ending hair discrimination, which is an employment issue. So does your company know about this and are they ready to be part of the solution on World Afro Day® 15th September? Let’s not hide this anymore, some companies are ready to listen and some companies want to keep things the same. But we can all play a small part, let someone in HR know about our new training for employers or join our event for employees. Visit our website for more link in comments.What else do you think can we do to change workplaces? #training #business #dei",38,7,4,https://www.linkedin.com/search/results/content/?fromMember=%5B%22ACoAAAM63CEB4FijLi16qxpVM7kjCbqjwBoAxHs%22%5D&heroEntityKey=urn%3Ali%3Afsd_profile%3AACoAAAM63CEB4FijLi16qxpVM7kjCbqjwBoAxHs&keywords=michelle%20de%20leon&origin=CLUSTER_EXPANSION&position=0&searchId=e7d954d0-210f-4ba8-b997-6b172d522ca3&sid=O)f&sortBy=%22date_posted%22
Michelle De Leon,Female,2023-12-27,"Slavery was tradition too. Well done for Mel B and Geri for calling this out back in the 90s. Unfortunately it is still part of the Netherlands culture. There is no excuse for this behaviour, life must be tough growing up in the Netherlands with African ancestry. Why did this hateful tradition get so well preserved in the Netherlands and other parts of Europe? Thanks Mary Waweru for sharing this clip. I wonder how many popstars today would be as vocal.Sometimes progress feels like an illusion…Janine van Throo #netherlands #change #equality",38,9,4,https://www.linkedin.com/search/results/content/?fromMember=%5B%22ACoAAAM63CEB4FijLi16qxpVM7kjCbqjwBoAxHs%22%5D&heroEntityKey=urn%3Ali%3Afsd_profile%3AACoAAAM63CEB4FijLi16qxpVM7kjCbqjwBoAxHs&keywords=michelle%20de%20leon&origin=CLUSTER_EXPANSION&position=0&searchId=e7d954d0-210f-4ba8-b997-6b172d522ca3&sid=O)f&sortBy=%22date_posted%22
Michelle De Leon,Female,2024-04-06,"I’m excited about this hire Myriah Hampton.Great people are the beating heart of any business but World Afro Day® is more than a business it is making history. People relate to World Afro Day on many levels but some people really get the depth of it and this is not determined by race. Supporters can come from all backgrounds and they will get in the trenches with you and walk the extra mile with you like Jane Powell.Back to Myriah Hampton who is an outstanding PhD student soon to become Dr Hampton. She wanted to work for us in any capacity and for now she is volunteering.✅Her reference process was exemplary. I sent the email request out yesterday morning and within 4 hours and UK/USA time difference, three excellent references came back! I think this is testament to her calibre and reputation. Welcome Myriah we are looking forward to working with you on some exciting projects for 2024.#womeninbusiness #academic #volunteering",37,4,3,https://www.linkedin.com/search/results/content/?fromMember=%5B%22ACoAAAM63CEB4FijLi16qxpVM7kjCbqjwBoAxHs%22%5D&heroEntityKey=urn%3Ali%3Afsd_profile%3AACoAAAM63CEB4FijLi16qxpVM7kjCbqjwBoAxHs&keywords=michelle%20de%20leon&origin=CLUSTER_EXPANSION&position=0&searchId=e7d954d0-210f-4ba8-b997-6b172d522ca3&sid=O)f&sortBy=%22date_posted%22
Michelle De Leon,Female,2023-05-27,"This week the future got a whole lot brighter with the launch of the World Afro Day - Workplace. A global training event to end hair discrimination in millions of businesses.Is your company clued up or clueless about this much needed change? ITV News did some powerful reports with local case studies, plus Levi Roots and myself. Check out the film and article belowThanks to the speakers at our launch #linkedinaudioevent yesterday Prof. Jonathan A.J. Wilson PhD DLitt Georgina Wilson FRSA Jane Powell D. Wendy Greene Paulette Watson MBA Global Tech Disruptor Tashara Parker, MA and all the audience who gave us their feedback. This is a liberation movement is your company for or against? #training #tech #change #event",35,Comment,7,https://www.linkedin.com/search/results/content/?fromMember=%5B%22ACoAAAM63CEB4FijLi16qxpVM7kjCbqjwBoAxHs%22%5D&heroEntityKey=urn%3Ali%3Afsd_profile%3AACoAAAM63CEB4FijLi16qxpVM7kjCbqjwBoAxHs&keywords=michelle%20de%20leon&origin=CLUSTER_EXPANSION&position=0&searchId=e7d954d0-210f-4ba8-b997-6b172d522ca3&sid=O)f&sortBy=%22date_posted%22
Michelle De Leon,Female,2024-03-27,"Women wear so many hats…Here are just a few of mine: CEO, TV Producer, mother and more recently carer to a sick relative, which you can’t be trained for. To anyone out there doing this, I think this role is harder than being a parent so please take some time for self-care. This also means that I am not always sure how I can continue World Afro Day® but it is so close to my heart, I literally had so much pain giving birth to it. I still want it to succeed. Yesterday at church the message was not to draw back into survival mode, there is more ‘rise up & build’. I have been retreating recently but also my dreams won’t leave me either. This time we need to do things differently and here on #linkedin you can help build something good. So keep watching this space…Is anyone ready to go BIG? Akima Paul Lambert Prof. Jonathan A.J. Wilson PhD DLitt Paulette Watson MBA Global Tech Disruptor Gloria Tabi Nancy Adimora Denese Chikwendu, MAPM, CertCoach, MA, BA (Hons) D. Wendy Greene Tashara Parker, MA Georgina Wilson FRSA Kadisha J. Lere Fisher Paige Lewin Sarah-Jane Crawford Estelle M. I am ‘thankful’ (challenge continues) for meeting up with some GMTV colleagues for a social escape for a few hours. I have known them for over 20 years! We had a lovely ‘Brown Girls’ afternoon tea with Donna Bernard Camille Solomon Esther Kuku  (MCIPR) We are all professional women and mothers, who still have dreams so we encouraged one another. #iwd2024womenleadingtheway #selfcare",34,1,2,https://www.linkedin.com/search/results/content/?fromMember=%5B%22ACoAAAM63CEB4FijLi16qxpVM7kjCbqjwBoAxHs%22%5D&heroEntityKey=urn%3Ali%3Afsd_profile%3AACoAAAM63CEB4FijLi16qxpVM7kjCbqjwBoAxHs&keywords=michelle%20de%20leon&origin=CLUSTER_EXPANSION&position=0&searchId=e7d954d0-210f-4ba8-b997-6b172d522ca3&sid=O)f&sortBy=%22date_posted%22
Michelle De Leon,Female,2023-04-27,"What a day! My business breakfast with Georgina Wilson FRSA highlighted some great conversations about ‘being ourselves’ in the workplace. In the train station I ran into a female HR consultant with locs!Then I got to Bankside Hotel and had this exchange with the staff and management about Afro hair. It’s good to get out there and I can’t wait to share with everyone about our plans for World Afro Day® workplace. #management #hotelindustry #business #afrohair What are your experiences of the hospitality industry and Afro hair? Akima Paul Lambert Prof. Jonathan A.J. Wilson PhD DLitt Prof. Laura Serrant OBE Patti O'Brien-Richardson, PhD D. Wendy Greene Emmanuel Asuquo - TV Financial Adviser Denese Chikwendu, MAPM, CertCoach, MA, BA (Hons) Yvonne Ottley, M.A, BA(Hons)",32,2,3,https://www.linkedin.com/search/results/content/?fromMember=%5B%22ACoAAAM63CEB4FijLi16qxpVM7kjCbqjwBoAxHs%22%5D&heroEntityKey=urn%3Ali%3Afsd_profile%3AACoAAAM63CEB4FijLi16qxpVM7kjCbqjwBoAxHs&keywords=michelle%20de%20leon&origin=CLUSTER_EXPANSION&position=0&searchId=e7d954d0-210f-4ba8-b997-6b172d522ca3&sid=O)f&sortBy=%22date_posted%22
Michelle De Leon,Female,2023-07-27,"Do you know it’s all about World Afro Day - Workplace on 15th September? It’s crazy to think that turning up at work with curly Afro hair, braids, locs and dreads is a legal issue until it becomes the norm. Ask your company to make history and join us for training to change the world! We also have a special event for employees so what support do you need to help your company accept Afro hair? Will your company change without legal intervention? Our training is a great way for your businesses to lead! Can’t wait to work with my US colleagues Tashara Parker, MA D. Wendy Greene Patti O'Brien-Richardson, PhD #training #equalityatwork #blackwomeninbusiness #blacklinkedin",30,4,0,https://www.linkedin.com/search/results/content/?fromMember=%5B%22ACoAAAM63CEB4FijLi16qxpVM7kjCbqjwBoAxHs%22%5D&heroEntityKey=urn%3Ali%3Afsd_profile%3AACoAAAM63CEB4FijLi16qxpVM7kjCbqjwBoAxHs&keywords=michelle%20de%20leon&origin=CLUSTER_EXPANSION&position=0&searchId=e7d954d0-210f-4ba8-b997-6b172d522ca3&sid=O)f&sortBy=%22date_posted%22
Michelle De Leon,Female,2023-05-27,"Get the latest news from Emmy-winning journalist Tashara Parker joining our #linkedinaudioevent June 1pm BST June 7Texas has just passed the CROWN Act! Let's keep the momentum going with the World Afro Day special announcement! Tashara Parker, MA Georgina Wilson FRSA Akima Paul Lambert Prof. Jonathan A.J. Wilson PhD DLitt Patti O'Brien-Richardson, PhD D. Wendy Greene Emmanuel Asuquo - TV Financial Adviser Jane Powell Chioma Fanawopo Paulette Watson MBA Global Tech Marverine Cole FRSA Nyasha Daley Janice Gassam Asare, Ph.D. Lisa Hurley Demisha Jennings Oria Breheny-Smith Sophia Ukor Selma Nicholls Sabrina Clarke Lydia Amoah FRSAHope to see you there link in my bio or sign up here https://lnkd.in/eD-rEubK #crownact #professional #afrohair #freedomofexpression",30,Comment,4,https://www.linkedin.com/search/results/content/?fromMember=%5B%22ACoAAAM63CEB4FijLi16qxpVM7kjCbqjwBoAxHs%22%5D&heroEntityKey=urn%3Ali%3Afsd_profile%3AACoAAAM63CEB4FijLi16qxpVM7kjCbqjwBoAxHs&keywords=michelle%20de%20leon&origin=CLUSTER_EXPANSION&position=0&searchId=e7d954d0-210f-4ba8-b997-6b172d522ca3&sid=O)f&sortBy=%22date_posted%22
Michelle De Leon,Female,2023-04-27,"If you need inspiration this morning check out Demisha Jennings post. She is celebrating her freedom to wear braids at work with hundreds of positive comments. So I ask you is the tide turning for Afrocentric hair in the workplace?There are a lot of ignorant comments in the true sense that white people didn’t know that Afro hair was an issue…really. Therein lies another problem but they all seem open to learn, which is encouraging. Thanks Rachael Jones CMgr FCMI Jane Powell Lisa Maria Mai  for supporting change. #work #change #womeninbusiness #hair",29,1,0,https://www.linkedin.com/search/results/content/?fromMember=%5B%22ACoAAAM63CEB4FijLi16qxpVM7kjCbqjwBoAxHs%22%5D&heroEntityKey=urn%3Ali%3Afsd_profile%3AACoAAAM63CEB4FijLi16qxpVM7kjCbqjwBoAxHs&keywords=michelle%20de%20leon&origin=CLUSTER_EXPANSION&position=0&searchId=e7d954d0-210f-4ba8-b997-6b172d522ca3&sid=O)f&sortBy=%22date_posted%22
Michelle De Leon,Female,2024-04-13,"I have to admit that I have let myself go…I used to be a champion runner. Here I am collecting the Surrey Championship relay cup for 100 and 200m. Athletics was great for discipline and a winning attitude. I had a great time with these girls, 3 out of 4 of our relay team were called Michelle!✅ I was even inspired by USA champion Valérie Briscoe Hooks because she could do a thousand sit ups so I followed suit!❌ Today I cannot really do press ups any more and I started off with just 30 sit ups…Although I have fallen a long way from my best, I will start off small and get better.✅ I felt in my spirit that taking up sit ups and press ups would be good for my discipline. I haven’t done them regularly for 19 years, before I had my daughter. Mind, body and spirit are related. I am coming into alignment.✅ World Afro Day® will be launching our 2024 theme soon and all this is all relevant.✅ I am still a champion in some areas of my life and I want to become a champion in new areas. My teen spirit which picked up that cup is still in me. I am just running different types of races and I am doing different types of events but a winning attitude is always needed. Carole Pyke MCIM Michelle Pierre-Carr Michelle Moore MA BA Is there something from your youth, which can help you succeed in business today?#winningattitude #youth #womeninbusiness",26,9,0,https://www.linkedin.com/search/results/content/?fromMember=%5B%22ACoAAAM63CEB4FijLi16qxpVM7kjCbqjwBoAxHs%22%5D&heroEntityKey=urn%3Ali%3Afsd_profile%3AACoAAAM63CEB4FijLi16qxpVM7kjCbqjwBoAxHs&keywords=michelle%20de%20leon&origin=CLUSTER_EXPANSION&position=0&searchId=e7d954d0-210f-4ba8-b997-6b172d522ca3&sid=O)f&sortBy=%22date_posted%22
Michelle De Leon,Female,2023-08-27,Are you willing to learn,25,3,0,https://www.linkedin.com/search/results/content/?fromMember=%5B%22ACoAAAM63CEB4FijLi16qxpVM7kjCbqjwBoAxHs%22%5D&heroEntityKey=urn%3Ali%3Afsd_profile%3AACoAAAM63CEB4FijLi16qxpVM7kjCbqjwBoAxHs&keywords=michelle%20de%20leon&origin=CLUSTER_EXPANSION&position=0&searchId=e7d954d0-210f-4ba8-b997-6b172d522ca3&sid=O)f&sortBy=%22date_posted%22
Michelle De Leon,Female,2023-08-27,"Let's start conversations to change perceptions of Afro hair in workplaces Akima Paul Lambert Emmanuel Nwankpa Jane Powell Prof. Jonathan A.J. Wilson PhD DLitt D. Wendy Greene Patti O'Brien-Richardson, PhD Tashara Parker, MA Sharlene Monique Paulette Watson MBA Global Tech Disruptor Simeon Quarrie Chioma Fanawopo Denese Chikwendu, MAPM, CertCoach, MA, BA (Hons) Carol Stewart MSc, FInstLM Shauna R. Barbara H. Joan MB Amo-Sakyi Tulela Pea Haddy Folivi Josimar Senior Rio Gayle",25,1,0,https://www.linkedin.com/search/results/content/?fromMember=%5B%22ACoAAAM63CEB4FijLi16qxpVM7kjCbqjwBoAxHs%22%5D&heroEntityKey=urn%3Ali%3Afsd_profile%3AACoAAAM63CEB4FijLi16qxpVM7kjCbqjwBoAxHs&keywords=michelle%20de%20leon&origin=CLUSTER_EXPANSION&position=0&searchId=e7d954d0-210f-4ba8-b997-6b172d522ca3&sid=O)f&sortBy=%22date_posted%22
