Author,Gender,Date,Post Text,Likes,Comments,Shares,Page Link
Michelle De Leon,Female,2023-04-27,"“If your presence doesn’t change the system, then the system changes you.” #change is coming",14,4,1,https://www.linkedin.com/search/results/content/?fromMember=%5B%22ACoAAAM63CEB4FijLi16qxpVM7kjCbqjwBoAxHs%22%5D&heroEntityKey=urn%3Ali%3Afsd_profile%3AACoAAAM63CEB4FijLi16qxpVM7kjCbqjwBoAxHs&keywords=michelle%20de%20leon&origin=CLUSTER_EXPANSION&position=0&searchId=e7d954d0-210f-4ba8-b997-6b172d522ca3&sid=O)f&sortBy=%22date_posted%22
Michelle De Leon,Female,2024-03-27,This is so good to see such quick progress in France to create a new law preventing hair discrimination. Well done Guylaine Conquet,13,6,1,https://www.linkedin.com/search/results/content/?fromMember=%5B%22ACoAAAM63CEB4FijLi16qxpVM7kjCbqjwBoAxHs%22%5D&heroEntityKey=urn%3Ali%3Afsd_profile%3AACoAAAM63CEB4FijLi16qxpVM7kjCbqjwBoAxHs&keywords=michelle%20de%20leon&origin=CLUSTER_EXPANSION&position=0&searchId=e7d954d0-210f-4ba8-b997-6b172d522ca3&sid=O)f&sortBy=%22date_posted%22
Michelle De Leon,Female,2023-09-27,"My Monday post is caught in LinkedIn no man’s land! So here I go again…This is officially my gratitude week, it’s been a tough year but I am choosing to respond with gratitude. I don’t know what World Afro Day will do next…Harvard Health Publishing: “…being grateful also helps people connect to something larger than themselves as individuals — whether to other people, nature, or a higher power.”I am incredibly thankful to God for seven years of World Afro Day® and to the millions of people who have shared this special day with me. Theme: art I am thankful for the wonderful art that is created for WAD. My imagination started this day so when people create something in return, it’s like a lovely loop. Thank you Creative Mama Che for this craft. If you’re a parent or in education I hope that you enjoy this post creativity is part of business. Beverley Samuel Prof. Jonathan A.J. Wilson PhD DLitt Carole Pyke MCIM Mina Prince MCIPD Dr. Jacqueline Harding - Vallance Jordan Ignatius Sharlene Monique Ross Morrison McGill",13,Comment,1,https://www.linkedin.com/search/results/content/?fromMember=%5B%22ACoAAAM63CEB4FijLi16qxpVM7kjCbqjwBoAxHs%22%5D&heroEntityKey=urn%3Ali%3Afsd_profile%3AACoAAAM63CEB4FijLi16qxpVM7kjCbqjwBoAxHs&keywords=michelle%20de%20leon&origin=CLUSTER_EXPANSION&position=0&searchId=e7d954d0-210f-4ba8-b997-6b172d522ca3&sid=O)f&sortBy=%22date_posted%22
Michelle De Leon,Female,2024-03-27,"It’s not about me it’s about you Yemi Jackson MBA, ACMA and all the hundreds of millions of women and children (men too) that I want to see free in ever area of life. Your post makes my heart sing you are an inspiration. I set up World Afro Day® for liberation in the workplace and you are doing it! We want companies to wake up and remove all the barriers to success.",12,1,2,https://www.linkedin.com/search/results/content/?fromMember=%5B%22ACoAAAM63CEB4FijLi16qxpVM7kjCbqjwBoAxHs%22%5D&heroEntityKey=urn%3Ali%3Afsd_profile%3AACoAAAM63CEB4FijLi16qxpVM7kjCbqjwBoAxHs&keywords=michelle%20de%20leon&origin=CLUSTER_EXPANSION&position=0&searchId=e7d954d0-210f-4ba8-b997-6b172d522ca3&sid=O)f&sortBy=%22date_posted%22
Michelle De Leon,Female,2023-10-27,I am trying to live healthier and because the food chain is messed up it’s a lot harder but this video reminds us why we have to keep trying,12,2,0,https://www.linkedin.com/search/results/content/?fromMember=%5B%22ACoAAAM63CEB4FijLi16qxpVM7kjCbqjwBoAxHs%22%5D&heroEntityKey=urn%3Ali%3Afsd_profile%3AACoAAAM63CEB4FijLi16qxpVM7kjCbqjwBoAxHs&keywords=michelle%20de%20leon&origin=CLUSTER_EXPANSION&position=0&searchId=e7d954d0-210f-4ba8-b997-6b172d522ca3&sid=O)f&sortBy=%22date_posted%22
Michelle De Leon,Female,2023-05-27,What a great idea! I can’t wait to see it…Dr Tru Powell,12,1,0,https://www.linkedin.com/search/results/content/?fromMember=%5B%22ACoAAAM63CEB4FijLi16qxpVM7kjCbqjwBoAxHs%22%5D&heroEntityKey=urn%3Ali%3Afsd_profile%3AACoAAAM63CEB4FijLi16qxpVM7kjCbqjwBoAxHs&keywords=michelle%20de%20leon&origin=CLUSTER_EXPANSION&position=0&searchId=e7d954d0-210f-4ba8-b997-6b172d522ca3&sid=O)f&sortBy=%22date_posted%22
Michelle De Leon,Female,2023-08-27,Congratulations,12,Comment,0,https://www.linkedin.com/search/results/content/?fromMember=%5B%22ACoAAAM63CEB4FijLi16qxpVM7kjCbqjwBoAxHs%22%5D&heroEntityKey=urn%3Ali%3Afsd_profile%3AACoAAAM63CEB4FijLi16qxpVM7kjCbqjwBoAxHs&keywords=michelle%20de%20leon&origin=CLUSTER_EXPANSION&position=0&searchId=e7d954d0-210f-4ba8-b997-6b172d522ca3&sid=O)f&sortBy=%22date_posted%22
Michelle De Leon,Female,2023-05-27,"Monday is a brand new opportunity to reset the dial. We are asking businesses to change the narrative about Afro hair and Afrocentric styles like braids, locs and Bantus in the workplace. Will you change this story or keep things as they are?Everyday hair discrimination is so normal, you may have overlooked it…1. How familiar is this quote?2. Would this be said in your workplace?3. Is your workplace hostile or hospitable towards Afro hair employees?Join the movement for change 1-2pm #linkedinaudioevent Weds June 7. Link in comments and bio Akima Paul Lambert Jane Powell Patti O'Brien-Richardson, PhD D. Wendy Greene Georgina Wilson FRSA Prof. Jonathan A.J. Wilson PhD DLitt Paulette Watson MBA Global Tech Disruptor Tashara Parker, MA #disruption #workplacewellbeing #professionalism MONDAY QUOTE",11,Comment,2,https://www.linkedin.com/search/results/content/?fromMember=%5B%22ACoAAAM63CEB4FijLi16qxpVM7kjCbqjwBoAxHs%22%5D&heroEntityKey=urn%3Ali%3Afsd_profile%3AACoAAAM63CEB4FijLi16qxpVM7kjCbqjwBoAxHs&keywords=michelle%20de%20leon&origin=CLUSTER_EXPANSION&position=0&searchId=e7d954d0-210f-4ba8-b997-6b172d522ca3&sid=O)f&sortBy=%22date_posted%22
Michelle De Leon,Female,2023-05-27,"Have you seen, have you heard World Afro Day - Workplace launched in the news? This is a training event to help businesses end hair discrimination and you are key to our plans!Employee Resource Groups can help business understand global shifts and this is a workplace movement! This free tool below simply explains World Afro Day - Workplace to senior leadership. Please share it with them and let us know how you get on. Will you join the movement? These people have Levi Roots Akima Paul Lambert Prof. Jonathan A.J. Wilson PhD DLitt Jane Powell Patti O'Brien-Richardson, PhD Paulette Watson MBA Global Tech Disruptor Tashara Parker, MA Scarlette Douglas Emmanuel Asuquo - TV Financial Adviser Alice Dearing OLY Chioma Fanawopo Denese Chikwendu, MAPM, CertCoach, MA, BA (Hons) Link to film in comments and website. #erg #workplaceculture #blackhair #afro #crownact",11,1,4,https://www.linkedin.com/search/results/content/?fromMember=%5B%22ACoAAAM63CEB4FijLi16qxpVM7kjCbqjwBoAxHs%22%5D&heroEntityKey=urn%3Ali%3Afsd_profile%3AACoAAAM63CEB4FijLi16qxpVM7kjCbqjwBoAxHs&keywords=michelle%20de%20leon&origin=CLUSTER_EXPANSION&position=0&searchId=e7d954d0-210f-4ba8-b997-6b172d522ca3&sid=O)f&sortBy=%22date_posted%22
Michelle De Leon,Female,2024-03-27,"#CountHerIn is such a great call to action from Gloria Tabi who is sometimes a voice in the wilderness of Australian consciousness. They literally do not acknowledge the pain of colour discrimination because ‘they see no colour.’ Therefore women of different heritages: Indigenous, African and Indian have to fight to be even acknowledged. If you are not seen, your value is denied. You are valuable Gloria Tabi, your work is valuable. Be strong and courageous.#internationalwomensmonth",11,Comment,0,https://www.linkedin.com/search/results/content/?fromMember=%5B%22ACoAAAM63CEB4FijLi16qxpVM7kjCbqjwBoAxHs%22%5D&heroEntityKey=urn%3Ali%3Afsd_profile%3AACoAAAM63CEB4FijLi16qxpVM7kjCbqjwBoAxHs&keywords=michelle%20de%20leon&origin=CLUSTER_EXPANSION&position=0&searchId=e7d954d0-210f-4ba8-b997-6b172d522ca3&sid=O)f&sortBy=%22date_posted%22
Michelle De Leon,Female,2023-08-27,"It is such an honour to be working with Patti O'Brien-Richardson, PhD D. Wendy Greene Tashara Parker, MA  coming to celebrat the 7th anniversary of World Afro Day® in the UK. This weekend I’m also continuing to work with the team at Shift Insight Jane Powell. Lessons of a leader:Don’t give up when things are tough. I’m not sure World Afro Day has ever been easy…",11,1,0,https://www.linkedin.com/search/results/content/?fromMember=%5B%22ACoAAAM63CEB4FijLi16qxpVM7kjCbqjwBoAxHs%22%5D&heroEntityKey=urn%3Ali%3Afsd_profile%3AACoAAAM63CEB4FijLi16qxpVM7kjCbqjwBoAxHs&keywords=michelle%20de%20leon&origin=CLUSTER_EXPANSION&position=0&searchId=e7d954d0-210f-4ba8-b997-6b172d522ca3&sid=O)f&sortBy=%22date_posted%22
Michelle De Leon,Female,2023-11-27,I never get tired of hearing testimonies about freedom and authenticity. Does anyone else want to celebrate Maxine Budhu with me?,11,Comment,0,https://www.linkedin.com/search/results/content/?fromMember=%5B%22ACoAAAM63CEB4FijLi16qxpVM7kjCbqjwBoAxHs%22%5D&heroEntityKey=urn%3Ali%3Afsd_profile%3AACoAAAM63CEB4FijLi16qxpVM7kjCbqjwBoAxHs&keywords=michelle%20de%20leon&origin=CLUSTER_EXPANSION&position=0&searchId=e7d954d0-210f-4ba8-b997-6b172d522ca3&sid=O)f&sortBy=%22date_posted%22
Michelle De Leon,Female,2023-05-27,"Have you got good taste? Are you invested in change and want better for the next generation? Well like Ambassador Shabazz you could support The Big Hair Assembly and want every child with Afro hair to be free from punishment. The legendary daughter of Malcolm X cares about the school system so if any of you feel the same, please sign up your school today! Mathurini Visakan (MCIM) Akima Paul Lambert Prof. Jonathan A.J. Wilson PhD DLitt Emmanuel Asuquo - TV Financial Adviser Paulette Watson MBA Global Tech Disruptor Patti O'Brien-Richardson, PhD D. Wendy Greene Jacqueline Shepherd Radzi Chinyanganya Chioma Fanawopo",10,Comment,1,https://www.linkedin.com/search/results/content/?fromMember=%5B%22ACoAAAM63CEB4FijLi16qxpVM7kjCbqjwBoAxHs%22%5D&heroEntityKey=urn%3Ali%3Afsd_profile%3AACoAAAM63CEB4FijLi16qxpVM7kjCbqjwBoAxHs&keywords=michelle%20de%20leon&origin=CLUSTER_EXPANSION&position=0&searchId=e7d954d0-210f-4ba8-b997-6b172d522ca3&sid=O)f&sortBy=%22date_posted%22
Michelle De Leon,Female,2023-10-27,Thank you Lisa Maria Mai and Headland for this opportunity to talk about this unknown and underestimated form of discrimination. It’s great how one person like Lisa can pass on knowledge and take responsibility to make a difference and create a snowball effect. We have a lot of workplaces to reach! We can do it together!,10,Comment,0,https://www.linkedin.com/search/results/content/?fromMember=%5B%22ACoAAAM63CEB4FijLi16qxpVM7kjCbqjwBoAxHs%22%5D&heroEntityKey=urn%3Ali%3Afsd_profile%3AACoAAAM63CEB4FijLi16qxpVM7kjCbqjwBoAxHs&keywords=michelle%20de%20leon&origin=CLUSTER_EXPANSION&position=0&searchId=e7d954d0-210f-4ba8-b997-6b172d522ca3&sid=O)f&sortBy=%22date_posted%22
Michelle De Leon,Female,2023-09-27,This was such a great project to work on with Soul Cap. Look out for more Black History Makers in October on Good Morning Britain.,10,Comment,0,https://www.linkedin.com/search/results/content/?fromMember=%5B%22ACoAAAM63CEB4FijLi16qxpVM7kjCbqjwBoAxHs%22%5D&heroEntityKey=urn%3Ali%3Afsd_profile%3AACoAAAM63CEB4FijLi16qxpVM7kjCbqjwBoAxHs&keywords=michelle%20de%20leon&origin=CLUSTER_EXPANSION&position=0&searchId=e7d954d0-210f-4ba8-b997-6b172d522ca3&sid=O)f&sortBy=%22date_posted%22
Michelle De Leon,Female,2024-03-27,Happy Easter here’s something to listen to over the weekend. How has your childhood shaped your leadership? We delve into this with Alicia Richardson on her fantastic podcast BlackCreateConnect I overcame so much to start a global movement World Afro Day® but it wouldn’t have started without God.#happyeaster #businessgoals,10,Comment,0,https://www.linkedin.com/search/results/content/?fromMember=%5B%22ACoAAAM63CEB4FijLi16qxpVM7kjCbqjwBoAxHs%22%5D&heroEntityKey=urn%3Ali%3Afsd_profile%3AACoAAAM63CEB4FijLi16qxpVM7kjCbqjwBoAxHs&keywords=michelle%20de%20leon&origin=CLUSTER_EXPANSION&position=0&searchId=e7d954d0-210f-4ba8-b997-6b172d522ca3&sid=O)f&sortBy=%22date_posted%22
Michelle De Leon,Female,2024-04-06,"12,888 and counting for the post about the woman who hates her Afro hair.I said “I can’t ignore this”She said “it’s a shame” about the way she feels.Many of you said “It’s sad…”So where does this leave us? We keep pressing forward for change and when I release what we can do this World Afro Day I pray you will share the joy, the same way that we have shared the pain. ✅ Check out BlackCreateConnect  podcast which was recorded before but addresses this situation perfectly. 🎧- Listen via https://lnkd.in/gdKxgaDx✅ Thanks to Alicia Richardson  Richardson who asked this question while she also wears wigs so we are all included in this conversation about Afro hair acceptance. What a good interviewer!Let’s keep talking about solutions. #podcast #womeninbusiness #hair #worldafroday",10,Comment,0,https://www.linkedin.com/search/results/content/?fromMember=%5B%22ACoAAAM63CEB4FijLi16qxpVM7kjCbqjwBoAxHs%22%5D&heroEntityKey=urn%3Ali%3Afsd_profile%3AACoAAAM63CEB4FijLi16qxpVM7kjCbqjwBoAxHs&keywords=michelle%20de%20leon&origin=CLUSTER_EXPANSION&position=0&searchId=e7d954d0-210f-4ba8-b997-6b172d522ca3&sid=O)f&sortBy=%22date_posted%22
Michelle De Leon,Female,2023-08-27,Afro hair is never just hair. No more so than on World Afro Day because there is so much to say…But now it will be business conversations so will companies be ready?,9,Comment,0,https://www.linkedin.com/search/results/content/?fromMember=%5B%22ACoAAAM63CEB4FijLi16qxpVM7kjCbqjwBoAxHs%22%5D&heroEntityKey=urn%3Ali%3Afsd_profile%3AACoAAAM63CEB4FijLi16qxpVM7kjCbqjwBoAxHs&keywords=michelle%20de%20leon&origin=CLUSTER_EXPANSION&position=0&searchId=e7d954d0-210f-4ba8-b997-6b172d522ca3&sid=O)f&sortBy=%22date_posted%22
Michelle De Leon,Female,2023-05-27,"Professional dancer had to shave off her Afro hair to get work! Watch the whole story ITV News Anglia 13:45 for one day only, not available after 6pm! #artsandentertainment #work #afrohair #blackwomenatwork Akima Paul Lambert Prof. Jonathan A.J. Wilson PhD Georgina Wilson FRSA Tashara Parker, MA D. Wendy GreeneDLitt",9,Comment,3,https://www.linkedin.com/search/results/content/?fromMember=%5B%22ACoAAAM63CEB4FijLi16qxpVM7kjCbqjwBoAxHs%22%5D&heroEntityKey=urn%3Ali%3Afsd_profile%3AACoAAAM63CEB4FijLi16qxpVM7kjCbqjwBoAxHs&keywords=michelle%20de%20leon&origin=CLUSTER_EXPANSION&position=0&searchId=e7d954d0-210f-4ba8-b997-6b172d522ca3&sid=O)f&sortBy=%22date_posted%22
Michelle De Leon,Female,2024-04-25,"I am so glad that Sharon Thomas plans to highlight hair discrimination at her legal conference. We need to be the change to create environments where we can thrive!  Let’s hope other conferences leaders follow suit. We can’t just ask society and companies to change and be inclusive, if we are not setting the pace ourselves.The legal landscape is changing regarding Afro hair discrimination in the USA and France. World Afro Day® plans to address this in UK law too. Isn’t it better for your company reputation to learn willingly instead of being forced by the law? What are your conference experiences? Have Afro hair barriers been included? Our research and other reports clearly show that this is an issue in workplaces.#conference #legal #change",8,Comment,0,https://www.linkedin.com/search/results/content/?fromMember=%5B%22ACoAAAM63CEB4FijLi16qxpVM7kjCbqjwBoAxHs%22%5D&heroEntityKey=urn%3Ali%3Afsd_profile%3AACoAAAM63CEB4FijLi16qxpVM7kjCbqjwBoAxHs&keywords=michelle%20de%20leon&origin=CLUSTER_EXPANSION&position=0&searchId=e7d954d0-210f-4ba8-b997-6b172d522ca3&sid=O)f&sortBy=%22date_posted%22
Michelle De Leon,Female,2023-07-27,"Do you know about trailblazer Una Marson? Her great accomplishments are in this eye opening documentary but it didn’t escape me that despite her skills, talent and abilities she was criticised because her Afro hair wasn’t quite good enough. Sound familiar? I spoke about her at a recent employer workshop educating them about hair discrimination. Women of today wearing their natural hair in the workplace experience what Una did in the 1930s! We will be exploring this and new Employer research 15th September World Afro Day - Workplace. Have you got your tickets? Is your company doing the right thing to end this? Employer training eventEmployee empowerment eventLinks in commentsJuanita Rosenior BA. Postgrad. hope to see you there. #training #broadcaster #blackhair #professional",8,Comment,0,https://www.linkedin.com/search/results/content/?fromMember=%5B%22ACoAAAM63CEB4FijLi16qxpVM7kjCbqjwBoAxHs%22%5D&heroEntityKey=urn%3Ali%3Afsd_profile%3AACoAAAM63CEB4FijLi16qxpVM7kjCbqjwBoAxHs&keywords=michelle%20de%20leon&origin=CLUSTER_EXPANSION&position=0&searchId=e7d954d0-210f-4ba8-b997-6b172d522ca3&sid=O)f&sortBy=%22date_posted%22
Michelle De Leon,Female,2023-07-27,"The most beautiful skin…People of African descent have the most variety of shades and when I was at a barbecue yesterday, I couldn’t but help compliment a Black woman on her skin. Some brown skin actually glows it’s like irresescent and it is captivating. The tanning industry bottle and sell what we naturally have. It’s an absolute lie that we have been made to think that our skin is ugly or inferior. There are lies and there is truth.",7,Comment,0,https://www.linkedin.com/search/results/content/?fromMember=%5B%22ACoAAAM63CEB4FijLi16qxpVM7kjCbqjwBoAxHs%22%5D&heroEntityKey=urn%3Ali%3Afsd_profile%3AACoAAAM63CEB4FijLi16qxpVM7kjCbqjwBoAxHs&keywords=michelle%20de%20leon&origin=CLUSTER_EXPANSION&position=0&searchId=e7d954d0-210f-4ba8-b997-6b172d522ca3&sid=O)f&sortBy=%22date_posted%22
Michelle De Leon,Female,2024-02-27,"Mondays don’t have to be all serious.I was at the amazing BUD Leaders conference on Friday. I met some inspirational leaders Dr Carlton Brown and Lere Fisher is the clean and cheaper version to Kevin Hart, if you want someone to host your event he’s just as funny! Although BUD has a focus on global majority women it was really good to see men there and to be in a room full of progressive business people. I’m really looking forward to reading the Black Business Magazine after Justice Williams MBE hosted our panel.Then Colin Tomlin from Pitch Black magazine was also there. How great to have two platforms showcasing Black British entrepreneurship.Thanks to Georgina Wilson FRSA for building a movement challenging us all to lead change. I look forward to her next chapter.A bit of a caption quiz below, what am I doing in this picture? A completely professional act, clean answers only in the comments. Damilola Okeke Samantha Fray Simi J. Jacqueline Shepherd Prof. Jonathan A.J. Wilson PhD DLitt Dr. Jacqueline Harding - Vallance #entrepreneurship #BUDEVENT24 #BUDCX2 BUD Leaders",6,2,0,https://www.linkedin.com/search/results/content/?fromMember=%5B%22ACoAAAM63CEB4FijLi16qxpVM7kjCbqjwBoAxHs%22%5D&heroEntityKey=urn%3Ali%3Afsd_profile%3AACoAAAM63CEB4FijLi16qxpVM7kjCbqjwBoAxHs&keywords=michelle%20de%20leon&origin=CLUSTER_EXPANSION&position=0&searchId=e7d954d0-210f-4ba8-b997-6b172d522ca3&sid=O)f&sortBy=%22date_posted%22
Michelle De Leon,Female,2023-08-27,,5,1,0,https://www.linkedin.com/search/results/content/?fromMember=%5B%22ACoAAAM63CEB4FijLi16qxpVM7kjCbqjwBoAxHs%22%5D&heroEntityKey=urn%3Ali%3Afsd_profile%3AACoAAAM63CEB4FijLi16qxpVM7kjCbqjwBoAxHs&keywords=michelle%20de%20leon&origin=CLUSTER_EXPANSION&position=0&searchId=e7d954d0-210f-4ba8-b997-6b172d522ca3&sid=O)f&sortBy=%22date_posted%22
Michelle De Leon,Female,2023-09-27,"You may never have heard of Afro hair discrimination and your company may be doing absolutely nothing about it. This is why featuring on BBC Radio Five Live is so important  for changing attitudes in business and the public.There is so much more to say, so if your company could be inadvertently breaking the law or your company could be creating a hierarchy of Eurocentric appearance in your workplace. Then please get in touch and be a part of long overdue change. Also, don't just take my word for it, we had the best experts at World Afro Day 2023 event. Emmanuel Asuquo - TV Financial Adviser Jane Powell Prof. Jonathan A.J. Wilson PhD DLitt Patti O'Brien-Richardson, PhD Paulette Watson MBA Global Tech Disruptor Levi Roots Scarlette Douglas Tashara Parker, MA D. Wendy Greene Thanks Jenny 'Shine' Steel #journalism #blackhair #blackwomeninbusiness",5,Comment,0,https://www.linkedin.com/search/results/content/?fromMember=%5B%22ACoAAAM63CEB4FijLi16qxpVM7kjCbqjwBoAxHs%22%5D&heroEntityKey=urn%3Ali%3Afsd_profile%3AACoAAAM63CEB4FijLi16qxpVM7kjCbqjwBoAxHs&keywords=michelle%20de%20leon&origin=CLUSTER_EXPANSION&position=0&searchId=e7d954d0-210f-4ba8-b997-6b172d522ca3&sid=O)f&sortBy=%22date_posted%22
Michelle De Leon,Female,2023-09-27,It’s funny how Paige Lewin became part of the World Afro Day® story. The media interest made both of our lives quite intense. It’s good to have found like minded women with passions for Afro hair acceptance. Surely business as usual will have to be challenged…,5,Comment,0,https://www.linkedin.com/search/results/content/?fromMember=%5B%22ACoAAAM63CEB4FijLi16qxpVM7kjCbqjwBoAxHs%22%5D&heroEntityKey=urn%3Ali%3Afsd_profile%3AACoAAAM63CEB4FijLi16qxpVM7kjCbqjwBoAxHs&keywords=michelle%20de%20leon&origin=CLUSTER_EXPANSION&position=0&searchId=e7d954d0-210f-4ba8-b997-6b172d522ca3&sid=O)f&sortBy=%22date_posted%22
Michelle De Leon,Female,2023-05-27,A great news piece on ITV News Meridian. World Afro Day - Workplace has launched! Watch from 13:15 only available until 6pm today.Are you coming to our #linkedinaudioevent 1pm BST today? Link in my bio.,5,1,2,https://www.linkedin.com/search/results/content/?fromMember=%5B%22ACoAAAM63CEB4FijLi16qxpVM7kjCbqjwBoAxHs%22%5D&heroEntityKey=urn%3Ali%3Afsd_profile%3AACoAAAM63CEB4FijLi16qxpVM7kjCbqjwBoAxHs&keywords=michelle%20de%20leon&origin=CLUSTER_EXPANSION&position=0&searchId=e7d954d0-210f-4ba8-b997-6b172d522ca3&sid=O)f&sortBy=%22date_posted%22
Michelle De Leon,Female,2023-05-27,"A lot of this resonates with me my co-Director is often in the background but World Afro Day®  would not be successful without Denese Chikwendu, MAPM, CertCoach, MA, BA (Hons) by my side.",5,Comment,0,https://www.linkedin.com/search/results/content/?fromMember=%5B%22ACoAAAM63CEB4FijLi16qxpVM7kjCbqjwBoAxHs%22%5D&heroEntityKey=urn%3Ali%3Afsd_profile%3AACoAAAM63CEB4FijLi16qxpVM7kjCbqjwBoAxHs&keywords=michelle%20de%20leon&origin=CLUSTER_EXPANSION&position=0&searchId=e7d954d0-210f-4ba8-b997-6b172d522ca3&sid=O)f&sortBy=%22date_posted%22
Michelle De Leon,Female,2024-04-06,For anyone who wants to know a bit more about the changes to end hair discrimination in France. Formidable Guylaine Conquet,4,Comment,1,https://www.linkedin.com/search/results/content/?fromMember=%5B%22ACoAAAM63CEB4FijLi16qxpVM7kjCbqjwBoAxHs%22%5D&heroEntityKey=urn%3Ali%3Afsd_profile%3AACoAAAM63CEB4FijLi16qxpVM7kjCbqjwBoAxHs&keywords=michelle%20de%20leon&origin=CLUSTER_EXPANSION&position=0&searchId=e7d954d0-210f-4ba8-b997-6b172d522ca3&sid=O)f&sortBy=%22date_posted%22
Michelle De Leon,Female,2023-04-27,"Such vision from YolanDa Brown OBE DL to create a Black-owned music venue and restaurant. She is sharing her dream with the world and it is bold and courageous. I have pledged, will you?",4,Comment,0,https://www.linkedin.com/search/results/content/?fromMember=%5B%22ACoAAAM63CEB4FijLi16qxpVM7kjCbqjwBoAxHs%22%5D&heroEntityKey=urn%3Ali%3Afsd_profile%3AACoAAAM63CEB4FijLi16qxpVM7kjCbqjwBoAxHs&keywords=michelle%20de%20leon&origin=CLUSTER_EXPANSION&position=0&searchId=e7d954d0-210f-4ba8-b997-6b172d522ca3&sid=O)f&sortBy=%22date_posted%22
Michelle De Leon,Female,2023-08-27,"The momentum is building but don’t keep it to yourself. Remember workplaces need to know that change is coming to accept Afro hair in the workplace. Lessons to learn- speak to HR- speak to Employee groups- speak to the C-suite The new research will be relevant to every business. I’m on BBC Radio Midlands 9:20pm tonight with Nikki Taper https://lnkd.in/e-g9Mwfa. Akima Paul Lambert Nikki Tapper Tashara Parker, MA Tashara Forrest #changemakers #training #csuite",4,Comment,0,https://www.linkedin.com/search/results/content/?fromMember=%5B%22ACoAAAM63CEB4FijLi16qxpVM7kjCbqjwBoAxHs%22%5D&heroEntityKey=urn%3Ali%3Afsd_profile%3AACoAAAM63CEB4FijLi16qxpVM7kjCbqjwBoAxHs&keywords=michelle%20de%20leon&origin=CLUSTER_EXPANSION&position=0&searchId=e7d954d0-210f-4ba8-b997-6b172d522ca3&sid=O)f&sortBy=%22date_posted%22
Michelle De Leon,Female,2024-04-06,"If you have a goal do you let the weather stop you?So good old English rain scuppered my walk this morning but no I would not be defeated. I dug out my weighted hula hoop buried under the ladder, wiped it down and got hooping! (Clearly I haven’t used it much since I bought it years ago).✅Yes there are business lessons in this because doing new or different things is good for your brain.✅The hoop dropped many times in the beginning but I kept going and I got my rhythmn back.✅Healthy body and healthy mind is good for your business. ✅This is research for World Afro Day® 2024 announcement soon.✅10 minutes of weighted hula hooping daily can help improve core strength, stability and coordination.I was the best hopper at school. I plan to keep it up Happy Froday.#health #mind #business",3,1,0,https://www.linkedin.com/search/results/content/?fromMember=%5B%22ACoAAAM63CEB4FijLi16qxpVM7kjCbqjwBoAxHs%22%5D&heroEntityKey=urn%3Ali%3Afsd_profile%3AACoAAAM63CEB4FijLi16qxpVM7kjCbqjwBoAxHs&keywords=michelle%20de%20leon&origin=CLUSTER_EXPANSION&position=0&searchId=e7d954d0-210f-4ba8-b997-6b172d522ca3&sid=O)f&sortBy=%22date_posted%22
