Author,Gender,Date,Post Text,Likes,Comments,Shares,Page Link
Noella Coursaris Musunka,Female,2023-10-27,"When I founded Malaika, I knew I wanted to do much more than open a school for girls. I wanted to rewrite the narrative for the Congo and for the African continent. I wanted to put the Congo firmly on the global stage, work deeply with communities on the ground, and build sustainable progress that incorporated and built on the experiences and needs of those living there. 16 years on, and I’m so happy to say that when we talk about Malaika we are talking about a crucial country and continent, as well as globally-impacting issues that we should all be paying attention to.",427,27,2,https://www.linkedin.com/search/results/content/?fromMember=%5B%22ACoAAAEaK88B5IxNJB9ABVkz8teZWmScyIzH188%22%5D&heroEntityKey=urn%3Ali%3Afsd_profile%3AACoAAAEaK88B5IxNJB9ABVkz8teZWmScyIzH188&keywords=noella%20coursaris%20musunka&origin=CLUSTER_EXPANSION&position=0&searchId=5ae5bf9d-3f8b-4a32-8809-5ea84df692f4&sid=p%2Ct&sortBy=%22date_posted%22
Noella Coursaris Musunka,Female,2024-03-27,"What an incredible honour to have been able to receive this award from the DRC Embassy in London! A particularly meaningful award as it is recognition of all of Malaika's work from my own country. A beautiful event, made by possible by every involved. Thank you from the bottom of my heart - I'm dedicating this award to our Malaika team, supporters all over the world and the amazing community members we serve ✨ #internationalwomensday",354,35,6,https://www.linkedin.com/search/results/content/?fromMember=%5B%22ACoAAAEaK88B5IxNJB9ABVkz8teZWmScyIzH188%22%5D&heroEntityKey=urn%3Ali%3Afsd_profile%3AACoAAAEaK88B5IxNJB9ABVkz8teZWmScyIzH188&keywords=noella%20coursaris%20musunka&origin=CLUSTER_EXPANSION&position=0&searchId=5ae5bf9d-3f8b-4a32-8809-5ea84df692f4&sid=p%2Ct&sortBy=%22date_posted%22
Noella Coursaris Musunka,Female,2024-04-06,"History made! DRC's President Felix Tshisekedi names Judith Suminwa Tuluka as the first-ever female Prime minister. Judith Suminwa says she will work for peace and the development of the country. What an inspiration to so many of our students, who dream to lead our country! I wish her a successful road ahead.",225,10,4,https://www.linkedin.com/search/results/content/?fromMember=%5B%22ACoAAAEaK88B5IxNJB9ABVkz8teZWmScyIzH188%22%5D&heroEntityKey=urn%3Ali%3Afsd_profile%3AACoAAAEaK88B5IxNJB9ABVkz8teZWmScyIzH188&keywords=noella%20coursaris%20musunka&origin=CLUSTER_EXPANSION&position=0&searchId=5ae5bf9d-3f8b-4a32-8809-5ea84df692f4&sid=p%2Ct&sortBy=%22date_posted%22
Noella Coursaris Musunka,Female,2023-10-27,"Loved attending the book launch of Thicker than Water by the incredible Kerry Washington, at the beautiful May Fair Kitchen. You have such a powerful tale to tell - congratulations on sharing your memoir with the world! Thank you for the kind invitation Edward Enninful!",222,3,1,https://www.linkedin.com/search/results/content/?fromMember=%5B%22ACoAAAEaK88B5IxNJB9ABVkz8teZWmScyIzH188%22%5D&heroEntityKey=urn%3Ali%3Afsd_profile%3AACoAAAEaK88B5IxNJB9ABVkz8teZWmScyIzH188&keywords=noella%20coursaris%20musunka&origin=CLUSTER_EXPANSION&position=0&searchId=5ae5bf9d-3f8b-4a32-8809-5ea84df692f4&sid=p%2Ct&sortBy=%22date_posted%22
Noella Coursaris Musunka,Female,2023-10-27,"It was amazing to attend the Theirworld annual dinner event this year and spend time with some incredible global changemakers. It was hosted by the wonderful Sarah Brown and Gordon Brown with incredible speakers like Roger Federer, who it was a real pleasure to meet and hear about the work his foundation is doing to bring education to low-income communities around the world.",207,5,0,https://www.linkedin.com/search/results/content/?fromMember=%5B%22ACoAAAEaK88B5IxNJB9ABVkz8teZWmScyIzH188%22%5D&heroEntityKey=urn%3Ali%3Afsd_profile%3AACoAAAEaK88B5IxNJB9ABVkz8teZWmScyIzH188&keywords=noella%20coursaris%20musunka&origin=CLUSTER_EXPANSION&position=0&searchId=5ae5bf9d-3f8b-4a32-8809-5ea84df692f4&sid=p%2Ct&sortBy=%22date_posted%22
Noella Coursaris Musunka,Female,2024-04-20,"I'm just mere moments away from arriving in the Motherland and spending valuable time with our staff, students and community at Malaika. Excited is an understatement! 🇨🇩",187,16,5,https://www.linkedin.com/search/results/content/?fromMember=%5B%22ACoAAAEaK88B5IxNJB9ABVkz8teZWmScyIzH188%22%5D&heroEntityKey=urn%3Ali%3Afsd_profile%3AACoAAAEaK88B5IxNJB9ABVkz8teZWmScyIzH188&keywords=noella%20coursaris%20musunka&origin=CLUSTER_EXPANSION&position=0&searchId=5ae5bf9d-3f8b-4a32-8809-5ea84df692f4&sid=p%2Ct&sortBy=%22date_posted%22
Noella Coursaris Musunka,Female,2024-03-27,Special afternoon at 10 Downing Street celebrating 40 incredible years of London Fashion Week. Thank you British Fashion Council for a beautiful Afternoon Tea✨,187,8,1,https://www.linkedin.com/search/results/content/?fromMember=%5B%22ACoAAAEaK88B5IxNJB9ABVkz8teZWmScyIzH188%22%5D&heroEntityKey=urn%3Ali%3Afsd_profile%3AACoAAAEaK88B5IxNJB9ABVkz8teZWmScyIzH188&keywords=noella%20coursaris%20musunka&origin=CLUSTER_EXPANSION&position=0&searchId=5ae5bf9d-3f8b-4a32-8809-5ea84df692f4&sid=p%2Ct&sortBy=%22date_posted%22
Noella Coursaris Musunka,Female,2023-09-27,Great evening Forbes with incredible trailblazers #NewYork,186,Comment,2,https://www.linkedin.com/search/results/content/?fromMember=%5B%22ACoAAAEaK88B5IxNJB9ABVkz8teZWmScyIzH188%22%5D&heroEntityKey=urn%3Ali%3Afsd_profile%3AACoAAAEaK88B5IxNJB9ABVkz8teZWmScyIzH188&keywords=noella%20coursaris%20musunka&origin=CLUSTER_EXPANSION&position=0&searchId=5ae5bf9d-3f8b-4a32-8809-5ea84df692f4&sid=p%2Ct&sortBy=%22date_posted%22
Noella Coursaris Musunka,Female,2024-04-06,"It was an absolute honour to be invited to speak on a panel at the DRC Embassy in London! An amazing experience, surrounded by empowering women who each have unique innovative skills!  ✨",151,3,1,https://www.linkedin.com/search/results/content/?fromMember=%5B%22ACoAAAEaK88B5IxNJB9ABVkz8teZWmScyIzH188%22%5D&heroEntityKey=urn%3Ali%3Afsd_profile%3AACoAAAEaK88B5IxNJB9ABVkz8teZWmScyIzH188&keywords=noella%20coursaris%20musunka&origin=CLUSTER_EXPANSION&position=0&searchId=5ae5bf9d-3f8b-4a32-8809-5ea84df692f4&sid=p%2Ct&sortBy=%22date_posted%22
Noella Coursaris Musunka,Female,2024-02-27,"January 2024. Pinch me moment… what a special experience!To be able to have a seat at the table of the White House to discuss issues of education and Africa, topics that I am passionate about, is beyond incredible.I am so grateful to have shared this experience with my colleague Alain, who I have been working with for over 15 years!A moment that I will definitely not forget! #whitehouse",148,5,1,https://www.linkedin.com/search/results/content/?fromMember=%5B%22ACoAAAEaK88B5IxNJB9ABVkz8teZWmScyIzH188%22%5D&heroEntityKey=urn%3Ali%3Afsd_profile%3AACoAAAEaK88B5IxNJB9ABVkz8teZWmScyIzH188&keywords=noella%20coursaris%20musunka&origin=CLUSTER_EXPANSION&position=0&searchId=5ae5bf9d-3f8b-4a32-8809-5ea84df692f4&sid=p%2Ct&sortBy=%22date_posted%22
Noella Coursaris Musunka,Female,2024-04-22,"I'm so proud and honored to have been present at Malaika's most recent graduation of our technical vocational training cohort 🎓Last Friday, 76 young women and men completed their certification in mechanical and electrical training, an enormous milestone made possible with CATERPILLAR FOUNDATION and our dedicated teachers. I can't wait to see them embark on an exciting new chapter, kickstarting their respective careers and carving a path of success for themselves and their family!",146,8,1,https://www.linkedin.com/search/results/content/?fromMember=%5B%22ACoAAAEaK88B5IxNJB9ABVkz8teZWmScyIzH188%22%5D&heroEntityKey=urn%3Ali%3Afsd_profile%3AACoAAAEaK88B5IxNJB9ABVkz8teZWmScyIzH188&keywords=noella%20coursaris%20musunka&origin=CLUSTER_EXPANSION&position=0&searchId=5ae5bf9d-3f8b-4a32-8809-5ea84df692f4&sid=p%2Ct&sortBy=%22date_posted%22
Noella Coursaris Musunka,Female,2023-11-27,Lubumbashi... where my story started! ✨,142,4,0,https://www.linkedin.com/search/results/content/?fromMember=%5B%22ACoAAAEaK88B5IxNJB9ABVkz8teZWmScyIzH188%22%5D&heroEntityKey=urn%3Ali%3Afsd_profile%3AACoAAAEaK88B5IxNJB9ABVkz8teZWmScyIzH188&keywords=noella%20coursaris%20musunka&origin=CLUSTER_EXPANSION&position=0&searchId=5ae5bf9d-3f8b-4a32-8809-5ea84df692f4&sid=p%2Ct&sortBy=%22date_posted%22
Noella Coursaris Musunka,Female,2024-01-27,Sometimes I feel overwhelmed with emotion when I look at all we've built over the past 16 years at Malaika! It's been an incredible journey and I love sharing it with you all. Our community center!!,142,7,0,https://www.linkedin.com/search/results/content/?fromMember=%5B%22ACoAAAEaK88B5IxNJB9ABVkz8teZWmScyIzH188%22%5D&heroEntityKey=urn%3Ali%3Afsd_profile%3AACoAAAEaK88B5IxNJB9ABVkz8teZWmScyIzH188&keywords=noella%20coursaris%20musunka&origin=CLUSTER_EXPANSION&position=0&searchId=5ae5bf9d-3f8b-4a32-8809-5ea84df692f4&sid=p%2Ct&sortBy=%22date_posted%22
Noella Coursaris Musunka,Female,2024-01-27,"Absolutely loved visiting the incredible Victoria Falls and an incredible lunch with the winners from the Women in Science L'Oreal - UNESCO award, late last year. I feel so privileged to be able to visit so many diverse parts of our beautiful continent 🌍 L'Oréal Paris",138,5,0,https://www.linkedin.com/search/results/content/?fromMember=%5B%22ACoAAAEaK88B5IxNJB9ABVkz8teZWmScyIzH188%22%5D&heroEntityKey=urn%3Ali%3Afsd_profile%3AACoAAAEaK88B5IxNJB9ABVkz8teZWmScyIzH188&keywords=noella%20coursaris%20musunka&origin=CLUSTER_EXPANSION&position=0&searchId=5ae5bf9d-3f8b-4a32-8809-5ea84df692f4&sid=p%2Ct&sortBy=%22date_posted%22
Noella Coursaris Musunka,Female,2024-03-27,"An amazing event celebrating Chioma Nnadi's newest cover of British Vogue Thank you Chioma, for being one of the first people to believe in Malaika all these years ago. A massive thank you to the glam team Tory Burch for dressing me for this occasion 🌟",135,1,0,https://www.linkedin.com/search/results/content/?fromMember=%5B%22ACoAAAEaK88B5IxNJB9ABVkz8teZWmScyIzH188%22%5D&heroEntityKey=urn%3Ali%3Afsd_profile%3AACoAAAEaK88B5IxNJB9ABVkz8teZWmScyIzH188&keywords=noella%20coursaris%20musunka&origin=CLUSTER_EXPANSION&position=0&searchId=5ae5bf9d-3f8b-4a32-8809-5ea84df692f4&sid=p%2Ct&sortBy=%22date_posted%22
Noella Coursaris Musunka,Female,2023-11-27,"It’s the start of a new school year and we’ve recently welcomed 42 fresh, eager faces to the Malaika School. Watch this video with CNN Africa about our very first graduation ceremony this past summer, and what it means to study with Malaika.",134,15,8,https://www.linkedin.com/search/results/content/?fromMember=%5B%22ACoAAAEaK88B5IxNJB9ABVkz8teZWmScyIzH188%22%5D&heroEntityKey=urn%3Ali%3Afsd_profile%3AACoAAAEaK88B5IxNJB9ABVkz8teZWmScyIzH188&keywords=noella%20coursaris%20musunka&origin=CLUSTER_EXPANSION&position=0&searchId=5ae5bf9d-3f8b-4a32-8809-5ea84df692f4&sid=p%2Ct&sortBy=%22date_posted%22
Noella Coursaris Musunka,Female,2024-01-27,Thank you Association Femmes Inspirantes for including me in the Top 100 Inspiring Women of this year! It’s so lovely to be featured amongst so many incredible women✨,119,9,1,https://www.linkedin.com/search/results/content/?fromMember=%5B%22ACoAAAEaK88B5IxNJB9ABVkz8teZWmScyIzH188%22%5D&heroEntityKey=urn%3Ali%3Afsd_profile%3AACoAAAEaK88B5IxNJB9ABVkz8teZWmScyIzH188&keywords=noella%20coursaris%20musunka&origin=CLUSTER_EXPANSION&position=0&searchId=5ae5bf9d-3f8b-4a32-8809-5ea84df692f4&sid=p%2Ct&sortBy=%22date_posted%22
Noella Coursaris Musunka,Female,2024-01-27,"Feeling recharged and inspired this January following an exciting meeting at the The White House last week, talking about the work of Malaika, the importance of girls’ education, the need for community-building initiatives, and the future of Africa.",117,13,2,https://www.linkedin.com/search/results/content/?fromMember=%5B%22ACoAAAEaK88B5IxNJB9ABVkz8teZWmScyIzH188%22%5D&heroEntityKey=urn%3Ali%3Afsd_profile%3AACoAAAEaK88B5IxNJB9ABVkz8teZWmScyIzH188&keywords=noella%20coursaris%20musunka&origin=CLUSTER_EXPANSION&position=0&searchId=5ae5bf9d-3f8b-4a32-8809-5ea84df692f4&sid=p%2Ct&sortBy=%22date_posted%22
Noella Coursaris Musunka,Female,2024-01-27,Looking forward   Thank you!!!,116,5,3,https://www.linkedin.com/search/results/content/?fromMember=%5B%22ACoAAAEaK88B5IxNJB9ABVkz8teZWmScyIzH188%22%5D&heroEntityKey=urn%3Ali%3Afsd_profile%3AACoAAAEaK88B5IxNJB9ABVkz8teZWmScyIzH188&keywords=noella%20coursaris%20musunka&origin=CLUSTER_EXPANSION&position=0&searchId=5ae5bf9d-3f8b-4a32-8809-5ea84df692f4&sid=p%2Ct&sortBy=%22date_posted%22
Noella Coursaris Musunka,Female,2024-03-27,"Standing together for peace, wearing black in memory of the countless lives lost due to the ongoing conflict in our beloved Congo. Looking into the future I remain hopeful, being surrounded by powerful women and girls who are building towards lasting peace, security and prosperity 🇨🇩",113,Comment,2,https://www.linkedin.com/search/results/content/?fromMember=%5B%22ACoAAAEaK88B5IxNJB9ABVkz8teZWmScyIzH188%22%5D&heroEntityKey=urn%3Ali%3Afsd_profile%3AACoAAAEaK88B5IxNJB9ABVkz8teZWmScyIzH188&keywords=noella%20coursaris%20musunka&origin=CLUSTER_EXPANSION&position=0&searchId=5ae5bf9d-3f8b-4a32-8809-5ea84df692f4&sid=p%2Ct&sortBy=%22date_posted%22
Noella Coursaris Musunka,Female,2023-10-27,"Loved getting together with a wonderful group of executive leaders as part of AllBright's Dinner With A CEO event. Thank you Viviane for inviting me to speak on all things leadership, fundraising, values and Malaika!",112,3,0,https://www.linkedin.com/search/results/content/?fromMember=%5B%22ACoAAAEaK88B5IxNJB9ABVkz8teZWmScyIzH188%22%5D&heroEntityKey=urn%3Ali%3Afsd_profile%3AACoAAAEaK88B5IxNJB9ABVkz8teZWmScyIzH188&keywords=noella%20coursaris%20musunka&origin=CLUSTER_EXPANSION&position=0&searchId=5ae5bf9d-3f8b-4a32-8809-5ea84df692f4&sid=p%2Ct&sortBy=%22date_posted%22
Noella Coursaris Musunka,Female,2023-10-27,An incredible private lunch at Hauser & Wirth Monaco on the occasion of the 60th anniversary of AMADE - Association Mondiale des Amis de l'Enfance with the beautiful music by Kazuki Yamada.Thank you to Amade and to the Princess of Hanover Caroline 💙,109,1,1,https://www.linkedin.com/search/results/content/?fromMember=%5B%22ACoAAAEaK88B5IxNJB9ABVkz8teZWmScyIzH188%22%5D&heroEntityKey=urn%3Ali%3Afsd_profile%3AACoAAAEaK88B5IxNJB9ABVkz8teZWmScyIzH188&keywords=noella%20coursaris%20musunka&origin=CLUSTER_EXPANSION&position=0&searchId=5ae5bf9d-3f8b-4a32-8809-5ea84df692f4&sid=p%2Ct&sortBy=%22date_posted%22
Noella Coursaris Musunka,Female,2023-11-27,"It was such a great pleasure to have met you Patrice. My family is particularly football-focused, and what an amazing career you had! Every individual carries a unique story behind them, and yours is truly touching",108,2,0,https://www.linkedin.com/search/results/content/?fromMember=%5B%22ACoAAAEaK88B5IxNJB9ABVkz8teZWmScyIzH188%22%5D&heroEntityKey=urn%3Ali%3Afsd_profile%3AACoAAAEaK88B5IxNJB9ABVkz8teZWmScyIzH188&keywords=noella%20coursaris%20musunka&origin=CLUSTER_EXPANSION&position=0&searchId=5ae5bf9d-3f8b-4a32-8809-5ea84df692f4&sid=p%2Ct&sortBy=%22date_posted%22
Noella Coursaris Musunka,Female,2024-01-27,"Join me on set as I spent the day with Spell Magazine, definitely one of my highlights! 🌟",99,2,0,https://www.linkedin.com/search/results/content/?fromMember=%5B%22ACoAAAEaK88B5IxNJB9ABVkz8teZWmScyIzH188%22%5D&heroEntityKey=urn%3Ali%3Afsd_profile%3AACoAAAEaK88B5IxNJB9ABVkz8teZWmScyIzH188&keywords=noella%20coursaris%20musunka&origin=CLUSTER_EXPANSION&position=0&searchId=5ae5bf9d-3f8b-4a32-8809-5ea84df692f4&sid=p%2Ct&sortBy=%22date_posted%22
Noella Coursaris Musunka,Female,2024-03-27,"I loved getting together with some of the most brilliant professionals as part of the Concordia x AllBright event earlier this month. I’m so honoured to sit on the Advisory Board of Concordia and to be a member of AllBright, and it became abundantly clear to me that bringing together these two organisations in London would create something very exciting. As such, it was a great privilege to help put together this incredible luncheon and to contribute to conversations on female leadership, equity, and the role of today’s youth in different areas of society. Thank you to Matthew Swift and Viviane Paxinos.",96,4,0,https://www.linkedin.com/search/results/content/?fromMember=%5B%22ACoAAAEaK88B5IxNJB9ABVkz8teZWmScyIzH188%22%5D&heroEntityKey=urn%3Ali%3Afsd_profile%3AACoAAAEaK88B5IxNJB9ABVkz8teZWmScyIzH188&keywords=noella%20coursaris%20musunka&origin=CLUSTER_EXPANSION&position=0&searchId=5ae5bf9d-3f8b-4a32-8809-5ea84df692f4&sid=p%2Ct&sortBy=%22date_posted%22
Noella Coursaris Musunka,Female,2023-11-27,"It was an absolute joy to attend The Mother's Ball and support the wonderful charity mothers2mothers A truly inspiring night with amazing performances by The Kingdom Choir, Grace Carter and music by Cuppy. It was great to have some face time with my dear friend Roksanda, who will be hosting our Malaika event this Sunday! Can’t wait ❤️",95,Comment,0,https://www.linkedin.com/search/results/content/?fromMember=%5B%22ACoAAAEaK88B5IxNJB9ABVkz8teZWmScyIzH188%22%5D&heroEntityKey=urn%3Ali%3Afsd_profile%3AACoAAAEaK88B5IxNJB9ABVkz8teZWmScyIzH188&keywords=noella%20coursaris%20musunka&origin=CLUSTER_EXPANSION&position=0&searchId=5ae5bf9d-3f8b-4a32-8809-5ea84df692f4&sid=p%2Ct&sortBy=%22date_posted%22
Noella Coursaris Musunka,Female,2024-01-27,My pride and joy Malaika 💛,91,Comment,0,https://www.linkedin.com/search/results/content/?fromMember=%5B%22ACoAAAEaK88B5IxNJB9ABVkz8teZWmScyIzH188%22%5D&heroEntityKey=urn%3Ali%3Afsd_profile%3AACoAAAEaK88B5IxNJB9ABVkz8teZWmScyIzH188&keywords=noella%20coursaris%20musunka&origin=CLUSTER_EXPANSION&position=0&searchId=5ae5bf9d-3f8b-4a32-8809-5ea84df692f4&sid=p%2Ct&sortBy=%22date_posted%22
Noella Coursaris Musunka,Female,2023-12-27,"I'm so pleased to be part of the line-up of inspirational women sharing their stories on this season of  « Se révéler » podcast in partnership with L'Oréal Groupe 🎙 Thanks for having me! Repost via Les Glorieuses and friction.media Pour cette nouvelle saison de « Se révéler », produit par le Fonds L’Oréal pour les Femmes et le studio de podcast Frictions, la journaliste Laura Taouchanov est allé à la rencontre d’héroïnes qui, chaque jour, rendent la vie des femmes un peu moins compliquée.👩 Noella Coursaris Musunka est la fondatrice de Malaika, une école en RDC des filles qui les accompagne pour devenir les leaders de demain. 530 filles bénéficient actuellement de ce programme.Tous les épisodes abordent, en anglais, cette question cruciale - comment transforme-t-on une intuition, une conviction en un projet concret qui soutient chaque jour les femmes ?Pour en savoir plus, suivez @frictions.media 💪[Ce post est financé par Fonds L’Oréal pour les Femmes ]








    See translation",88,6,2,https://www.linkedin.com/search/results/content/?fromMember=%5B%22ACoAAAEaK88B5IxNJB9ABVkz8teZWmScyIzH188%22%5D&heroEntityKey=urn%3Ali%3Afsd_profile%3AACoAAAEaK88B5IxNJB9ABVkz8teZWmScyIzH188&keywords=noella%20coursaris%20musunka&origin=CLUSTER_EXPANSION&position=0&searchId=5ae5bf9d-3f8b-4a32-8809-5ea84df692f4&sid=p%2Ct&sortBy=%22date_posted%22
Noella Coursaris Musunka,Female,2023-10-27,"Such an honour to be on the board of Amade and to be able to attend AMADE - Association Mondiale des Amis de l'Enfance's brilliant gala dinner, celebrating 60 years of impact in protecting and furthering the development of children around the world. My deepest thanks to H.R.H. The Princess of Hanover and the incredible team for the invitation.",86,2,0,https://www.linkedin.com/search/results/content/?fromMember=%5B%22ACoAAAEaK88B5IxNJB9ABVkz8teZWmScyIzH188%22%5D&heroEntityKey=urn%3Ali%3Afsd_profile%3AACoAAAEaK88B5IxNJB9ABVkz8teZWmScyIzH188&keywords=noella%20coursaris%20musunka&origin=CLUSTER_EXPANSION&position=0&searchId=5ae5bf9d-3f8b-4a32-8809-5ea84df692f4&sid=p%2Ct&sortBy=%22date_posted%22
Noella Coursaris Musunka,Female,2023-11-27,"It is a deep passion of mine to see more African women in science, so it was special to be invited to attend the L’Oréal-UNESCO For Women in Science Young Talents Sub-Saharan Africa Awards, which recognize and support African women scientists for the excellence of their scientific research. This year 25 PhD candidates and 5 post-doctoral researchers were rewarded at the annual ceremony hosted in the beautiful Kasane, Botswana. His Excellency the President of Botswana Mr. Mokgweetsi Masisi, and the first lady, honored the ceremony with their presence. STEM is such an important part of Malaika's curriculum and I hope one day we might have Malaika's ex-students nominated for these awards! UNESCO L'Oréal Paris",82,Comment,1,https://www.linkedin.com/search/results/content/?fromMember=%5B%22ACoAAAEaK88B5IxNJB9ABVkz8teZWmScyIzH188%22%5D&heroEntityKey=urn%3Ali%3Afsd_profile%3AACoAAAEaK88B5IxNJB9ABVkz8teZWmScyIzH188&keywords=noella%20coursaris%20musunka&origin=CLUSTER_EXPANSION&position=0&searchId=5ae5bf9d-3f8b-4a32-8809-5ea84df692f4&sid=p%2Ct&sortBy=%22date_posted%22
Noella Coursaris Musunka,Female,2024-01-27,Special Washington❤️ Lets start 2024,81,Comment,1,https://www.linkedin.com/search/results/content/?fromMember=%5B%22ACoAAAEaK88B5IxNJB9ABVkz8teZWmScyIzH188%22%5D&heroEntityKey=urn%3Ali%3Afsd_profile%3AACoAAAEaK88B5IxNJB9ABVkz8teZWmScyIzH188&keywords=noella%20coursaris%20musunka&origin=CLUSTER_EXPANSION&position=0&searchId=5ae5bf9d-3f8b-4a32-8809-5ea84df692f4&sid=p%2Ct&sortBy=%22date_posted%22
Noella Coursaris Musunka,Female,2024-02-27,"Meet Francoise, one of our first Malaika graduates who graduated last year! 🎓 Her journey with us started at just 5 years old and we have had the privilege of watching her grow until 18 years old! As she said, she is now a leader, one with dreams to pursue a career but also to give back to others. Well done, Francoise, we are so proud of you!",81,6,1,https://www.linkedin.com/search/results/content/?fromMember=%5B%22ACoAAAEaK88B5IxNJB9ABVkz8teZWmScyIzH188%22%5D&heroEntityKey=urn%3Ali%3Afsd_profile%3AACoAAAEaK88B5IxNJB9ABVkz8teZWmScyIzH188&keywords=noella%20coursaris%20musunka&origin=CLUSTER_EXPANSION&position=0&searchId=5ae5bf9d-3f8b-4a32-8809-5ea84df692f4&sid=p%2Ct&sortBy=%22date_posted%22
Noella Coursaris Musunka,Female,2024-03-27,"I feel so fortunate to be able to attend so many inspirational events in my line of work. This gala dinner by Finding The Light in support of Kolisi Foundation is an excellent example of that. I'm particularly touched by the inspirational life path of Siya Kolisi - what a warrior! A beautiful evening, celebrating human spirit and a mission to change lives  - thank you Yannick Nyanga for joining me! ✨🎭",81,1,2,https://www.linkedin.com/search/results/content/?fromMember=%5B%22ACoAAAEaK88B5IxNJB9ABVkz8teZWmScyIzH188%22%5D&heroEntityKey=urn%3Ali%3Afsd_profile%3AACoAAAEaK88B5IxNJB9ABVkz8teZWmScyIzH188&keywords=noella%20coursaris%20musunka&origin=CLUSTER_EXPANSION&position=0&searchId=5ae5bf9d-3f8b-4a32-8809-5ea84df692f4&sid=p%2Ct&sortBy=%22date_posted%22
Noella Coursaris Musunka,Female,2023-10-27,"Huge news! We are overjoyed to be the recipient of the 2023 Peace and Sport Awards 🏆 The power of sport and its transformational effect within our community is undeniable, and we are proud to champion it every single day. A big bravo to our Coach Maguy, who received the award on behalf of Malaika and delivered a touching speech. We'd also like to congratulate our fellow nominees Zalmi foundation and Beirut Marathon Association for their outstanding work promoting peace through sport. Thank you to Peace and Sport, #TeamSaudi and his Royal Highness Prince Albert II of Monaco for this exceptional honour.",79,5,2,https://www.linkedin.com/search/results/content/?fromMember=%5B%22ACoAAAEaK88B5IxNJB9ABVkz8teZWmScyIzH188%22%5D&heroEntityKey=urn%3Ali%3Afsd_profile%3AACoAAAEaK88B5IxNJB9ABVkz8teZWmScyIzH188&keywords=noella%20coursaris%20musunka&origin=CLUSTER_EXPANSION&position=0&searchId=5ae5bf9d-3f8b-4a32-8809-5ea84df692f4&sid=p%2Ct&sortBy=%22date_posted%22
Noella Coursaris Musunka,Female,2024-01-27,Thank you for featuring mine and Malaika's work in the Everyday Heroes New African Woman Magazine  (NAW)!,78,Comment,0,https://www.linkedin.com/search/results/content/?fromMember=%5B%22ACoAAAEaK88B5IxNJB9ABVkz8teZWmScyIzH188%22%5D&heroEntityKey=urn%3Ali%3Afsd_profile%3AACoAAAEaK88B5IxNJB9ABVkz8teZWmScyIzH188&keywords=noella%20coursaris%20musunka&origin=CLUSTER_EXPANSION&position=0&searchId=5ae5bf9d-3f8b-4a32-8809-5ea84df692f4&sid=p%2Ct&sortBy=%22date_posted%22
Noella Coursaris Musunka,Female,2024-04-13,So good,76,Comment,2,https://www.linkedin.com/search/results/content/?fromMember=%5B%22ACoAAAEaK88B5IxNJB9ABVkz8teZWmScyIzH188%22%5D&heroEntityKey=urn%3Ali%3Afsd_profile%3AACoAAAEaK88B5IxNJB9ABVkz8teZWmScyIzH188&keywords=noella%20coursaris%20musunka&origin=CLUSTER_EXPANSION&position=0&searchId=5ae5bf9d-3f8b-4a32-8809-5ea84df692f4&sid=p%2Ct&sortBy=%22date_posted%22
Noella Coursaris Musunka,Female,2024-03-27,A Congo rendez-vous in London town. Great seeing you all!,76,Comment,1,https://www.linkedin.com/search/results/content/?fromMember=%5B%22ACoAAAEaK88B5IxNJB9ABVkz8teZWmScyIzH188%22%5D&heroEntityKey=urn%3Ali%3Afsd_profile%3AACoAAAEaK88B5IxNJB9ABVkz8teZWmScyIzH188&keywords=noella%20coursaris%20musunka&origin=CLUSTER_EXPANSION&position=0&searchId=5ae5bf9d-3f8b-4a32-8809-5ea84df692f4&sid=p%2Ct&sortBy=%22date_posted%22
