,title,date,author,link,text
79,A Practical Guide to Preparing Your Brand for National Media Exposure,"Jul 7, 2023",Nick Heethuis,https://www.entrepreneur.com/growing-a-business/a-practical-guide-to-preparing-your-brand-for-national/454267,"
In today's digital age, national media exposure can catapult your consumer brand into the spotlight overnight. For many of my clients, preparing for such exposure is a regular part of their marketing strategy. But is your online presence ready to handle this sudden influx of interest?Let's guide you through the practical steps to prepare your brand for national media exposure. Whether you're gearing up for a specific media event or simply want to be ready when the opportunity strikes, we'll cover the key areas you must focus on. From optimizing your website for an influx of traffic to updating your social media profiles, we'll cover the key areas you need to focus on to ensure your brand is ready to shine when the spotlight hits.Related: 3 Step Process to Get Exposure and Press Coverage for Your Business



Preparing your website for increased trafficYour website is your brand's home base. It needs to be ready to handle an increase in traffic without crashing. Check with your hosting provider to ensure your plan can handle a surge in traffic. If necessary, consider upgrading to a plan with more bandwidth.The website design should be user-friendly, with straightforward navigation to important pages like product details, your ""About Us"" page and your contact information page. Load times should be quick, as slow websites can deter potential customers. Use tools like Google Page Speed Insights to check your site's speed and get specific recommendations for improvement on your site.


In today's mobile-first world, ensuring your website is mobile-friendly is not just an option but a necessity. A responsive design that adjusts to different screen sizes is essential. To make your website more mobile-friendly, consider the following:Simplify your design: A cluttered website can be challenging to navigate on a small screen. Keep your design clean and simple, with plenty of white space.Make buttons and links large enough to be easily tapped with a finger.Use larger font sizes: Small text can be hard to read on a mobile screen.Test your website on various devices: Use tools like Google's Mobile-Friendly Test to see how your site performs and get specific recommendations for improvement.Also, consider adding a FAQ section to address common questions and reduce the load on your customer service team.Optimizing your product listingsNational media exposure can significantly increase traffic to your product listings, whether on Amazon, your website or another platform. Optimizing your listings is crucial to make the most of this opportunity.For Amazon listings, begin with a compelling product title incorporating relevant keywords. This enhances your product's visibility in search results and helps it stand out in the crowded marketplace.


High-quality images are also vital. Showcase your product from multiple angles, including close-ups to emphasize unique features and depict the product in use to provide potential customers with a comprehensive understanding of what they're purchasing.In addition to images, Amazon's A+ Content is a powerful tool for enhancing your product listings. This feature allows you to add additional images, comparison charts and more detailed product descriptions. Use it to tell a compelling story about your product and brand, enticing shoppers to add-to-cart.The bullet points on your product detail page should be clear, concise, and packed with valuable information. Optimize them for Amazon SEO by including relevant keywords but remember to keep them shopper friendly. These bullet points often form a customer's first impression of your product, so make them count.For product listings on other platforms, the same principles apply. Use high-quality images, write compelling descriptions and incorporate relevant keywords. Ensure your product listings are easy to find and navigate and provide all the information a customer might need to purchase.


Here is some additional context for optimizing your product listings on various platforms:Use clear and concise titles: Your product title should be descriptive and include the most important information about your product.Write detailed product descriptions: Your product description should tell a story. It should highlight the features and benefits of your product and explain why it's better than the competition.Use high-quality images: Images are often the first thing a customer sees, so make sure they're high-quality and showcase your product effectively. Include multiple images from different angles and consider using videos.SEO quick tips: Use relevant keywords in your product titles and descriptions to improve your search engine rankings. However, avoid keyword stuffing, which can harm your rankings and make your listings less appealing to customers.By optimizing your product listings, you can improve their visibility and capitalize on the influx of attention due to your national media exposure.Related: How to Optimize Your Site for Search Without Actually Doing SEOMaintaining consistent brand messaging across platformsConsistency is key when it comes to branding. It's essential that your brand messaging and visual patterns remain uniform across all platforms — be it your website, Amazon listings or social media profiles. This creates a unified brand experience, reinforcing your brand identity every time a potential customer interacts with you, regardless of the platform.


Start by ensuring your brand's voice is the same on every channel. This voice should reflect your brand's personality and values. For example, if your brand is playful and youthful, your voice might be informal and energetic. This voice should stay that way across all platforms, from the tone of your social media posts to the language in your product descriptions.Next, consider your visual branding. This includes your logo, color scheme, typography and recurring design elements. These should be consistent across all platforms to create a recognizable brand pattern. For instance, if your brand uses a particular shade of blue in its logo, that shade should appear in your social media graphics, website design and even your product packaging.Consistent branding not only helps increase brand recognition but also builds trust. It shows that your brand is professional, reliable and focused. It also makes your brand more memorable. When your brand messaging and visuals are consistent, they leave a stronger impression, making it easier for potential customers to remember your brand.Remember, every interaction a potential customer has with your brand is an opportunity to reinforce your brand identity. Maintaining consistent brand patterns and messaging across platforms allows you to make the most of these opportunities and build a strong, recognizable brand.


Setting up coupons and discounts properlyCoupons and discounts can be a great way to convert interested visitors into customers. However, it's crucial to set these up properly. Avoid allowing shoppers to coupon stack to avoid unexpected losses unless that's part of your strategy. Ensure the terms and conditions for each discount are clear to prevent confusion. Set expiration dates for your coupons to create a sense of urgency.Promote your discounts effectively through social media, email newsletters and on your website. Consider using a countdown timer for limited-time offers to increase the sense of urgency. Also, track the performance of your discounts to understand which ones are most effective and why. This will help you refine your discount strategy over time.Updating your social media profilesSocial media is often the first place people go to learn more about a brand they've seen in the media. Make sure your profiles are up-to-date and reflect your brand accurately. This includes your bio, profile pictures, and any pinned posts. Your bio should communicate what your brand is about and what makes it unique.Regularly post engaging content and interact with your followers to build a strong online community. Use a consistent tone of voice that aligns with your brand personality. Respond promptly to comments and messages, showing your audience you value their engagement.


Consider using social media management tools to schedule posts and monitor your brand mentions. This will help you maintain a consistent posting schedule and stay on top of any conversations about your brand.Related: How to Create a Standout Social-Media ProfileWhy preparation is essentialNational media exposure can be a game-changer for consumer brands, but only if you're prepared to make the most of it. By optimizing your product listings, preparing your website, setting up coupons correctly, updating your social media profiles and maintaining consistent brand patterns across platforms, you can ensure your brand is ready to shine in the spotlight.Remember, preparation is key. The more prepared you are, the better you'll be able to handle the surge in interest and convert shoppers into customers.
"
80,3 PR Strategies to Help Your Startup Attract Investors,"Jun 29, 2023",Evgeniya Zaslavskaya,https://www.entrepreneur.com/starting-a-business/3-pr-tips-to-help-your-startup-attract-investors/454234,"
Launching a product is a thrilling milestone for any startup. And it's the most obvious time to use PR to support your quest for world domination, along with the impending funding announcement that will no doubt follow. But what if you have a pre-launch startup?For example, Airbnb used press releases to generate buzz about its platform before it even launched. The company's first press release, issued in 2008, announced the launch of its website and invited people to sign up as hosts or guests. And in April 2009, Airbnb received $600,000 from Sequoia Capital, which was a turning point for the future market leader.My PR agency works not only with startups but also with venture capital and hedge funds. They all say in one voice: Media presence matters. Of course, articles alone won't pave the way for you to succeed. Investors consider a variety of factors when making decisions. Still, a personal brand and unique expertise that attracts the attention of the top-tier media helps to build investor confidence in you, laying the bricks for future growth.



So, here are the strategies you can employ to use PR to land funding without ruining your chances of being covered at launch.Related: How PR Can Attract Investors and Add Value to Your Startup


1. Define your target audienceBefore diving into the deep end of PR, take a moment to understand your target audience, just as you might research who's at your poker tournament table before you play. Who are they? What are their pain points? How does your product solve their problems?Identifying your future clients' needs and preferences will inform your PR strategy and help attract investors with a vested interest in your product's success.Remember, investors themselves are also part of your target audience, so you need to know what matters to them. A tip: VC companies receive more than 1,000 proposals a year and are primarily interested in businesses that require an investment of at least $250,000, as stated in Embroker. According to Harvard Business Review, more than 30% of deals come from leads from VCs' former colleagues or work acquaintances. Other contacts also play a role: 20% of deals come from referrals by other investors, and 8% from referrals by existing portfolio companies.Building your brand as a founder, and becoming the champion in your niche, is a great way to be referred, talked about, and strengthen a VC's view of your team — a metric that remains top of mind for potential investors.


2. Use all types of PR, and not just the obvious onesWhile much attention is paid to product launches and funding announcements, there are many other types of PR a pre-launch startup can leverage.Data stories, where you use the millions (or billions) of data points needed to make your solution work to find interesting, and often contrarian, insights, are massively underused. If you have data showing that a situation is much better or worse than the understood norms, there's a story in that.By offering data stories to tech publications as guest articles, you'll raise your position on the leaderboard of known subject experts, which will strengthen an investor's view of you and your team.Expert commentary is also underused and can be a great way to introduce yourself to your target journalists. By offering quotes on the day's topic, while in your particular niche, you can get your name in lights and be seen as a guiding voice. By the way, one study shows that PR campaigns that include an expert comment in the original press release have 64% more placements than those that do not — so don't underestimate commentary power.


They say content is queen and king. With strategic content marketing, such as blog posts, videos and podcasts, you can cleverly sprinkle keywords related to your company throughout your material. This not only pleases the SEO gods but also positions your company as a wise sage in the industry.For example, the painting app Procreate created a YouTube beginner's artist series, which gave it a way to attract new users. And thanks to transcription and wise SEO choices, this made them a name in that artistic niche.Self-publishing is a great way to build a platform that backs up your expert credentials, including in the eyes of investors. You can publish on LinkedIn, Medium and Substack, for example. And consistency is key. Try to have a new commentary on your niche topic at least once a week.Just be careful not to announce your startup or talk about your product, or journalists won't want to write about your launch when you're ready to open the floodgates because you already made the announcement yourself.


Related: 5 Effective Thought Leadership PR Tactics for Your Startup3. Journalists hold the keys, so get to know themJournalists and reporters are like gatekeepers to the arena of media. To capture their attention, establish relationships before your product launch on social media, share insights and offer exclusives. Remember, a little flattery never hurts, either.Be aware of the sheer amount of competition you'll face. Top-tier tech journalists receive 100-400 pitches daily from startups that want them to write their stories. It's often critical, and always wise, to have experienced people working for you when attempting to gain media coverage.According to HubSpot Blog Research, the most effective pitches are personalized to each recipient's interests. So, customize your pitches, show genuine interest in their work, and make them feel like they're an integral part of your journey.


Investors crave trust like plants crave sunlight. You can build a fortress of trust around your territory by strategically promoting positive stories, sharing tales of triumph and showcasing your expertise.PR can make a splash before you're ready to jumpLaunching a product is like jumping off a diving board — exciting and nerve-wracking all at once. But with a well-crafted PR strategy, you can make a big splash and catch the attention of both your future customers and potential investors.Understanding them is crucial for effective PR, so identify their needs first. Leverage data stories and expert commentary for media attention, use content marketing and self-publishing, and engage with journalists to enhance visibility — and don't forget about personalized pitches to build relationships and aid media coverage.After all, trust is key to winning investors, especially for a pre-launch startup, so use every tactic in the game to promote positive stories and showcase your expertise.


Related: How Public Relations Builds Trust and Credibility for Your Startup
"
81,Why a Solid HR Infrastructure is a Must-Have for Business Growth,"Jun 29, 2023",Steve Arizpe,https://www.entrepreneur.com/growing-a-business/why-a-robust-hr-infrastructure-is-crucial-for-business/454388,"
While it is a well-known fact that entrepreneurs and small and medium-sized business (SMB) leaders wear many hats and juggle numerous plates due to their size, it can be easy for them to become laser-focused on their products, services and customer base as they build their company, possibly dropping the most important plate – human resources (HR).As savvy business leaders and industry experts continue to emphasize the importance of implementing an HR infrastructure, especially one that is more robust that lays the groundwork for attracting and retaining top talent, it can be perceived as an overwhelming task, which may rank as a low priority that leaves companies vulnerable as they plan for growth.Related: Good Customer Service is a Disappearing Art — Here's How You Can Be Different



A robust HR program that makes a difference — handled in-house or by an external HR company — is a must-have component in today's business environment. As SMB leaders weigh their options, three things to keep in mind include:1. People are the greatest assetPeople are the foundation of success at all company levels. They are indispensable and often make or break a business. Employees are the ones who have intricate knowledge of a company's products/services; they are on the front lines interacting with clients and potential customers; and employees given the freedom to be intrapreneurs are often responsible for developing new products, services and processes that affect change and growth within a company.


The impact of people on a business cannot be overstated – without people, there is no business – they are an integral part of every facet of business operations. From initial customer contact and daily nurturing programs to product/service development and high-performing leadership, people are the greatest asset to business growth and ongoing success.It takes the right people in the right positions working for the right company to make a difference. This begins with a robust HR program that incorporates effective and efficient recruiting and hiring practices that attract qualified candidates based on a company's purpose, mission, corporate values and job qualifications, which may indicate they have a similar outlook and will be a great fit for the culture and role.While recruiting and hiring practices continue to evolve, one of the best ways to find top talent is through an employee referral program that offers monetary rewards for new hires. Employees serve as brand ambassadors who tout the benefits of working for a company to their network of like-minded connections. This saves recruiters time and money and helps new hires feel more comfortable and tied to a company with familiar faces in the workforce. An employee referral program should be a part of all HR programs.Related: 4 Ways to Make Sure Your Employees Are Your Best Asset


2. Culture is keyWhen entrepreneurs and SMB leaders adhere to the philosophy that people are a company's greatest asset, it goes without saying that creating and nurturing a culture that takes care of them should be a top priority. A culture that puts people first in all areas, including attracting, recruiting, onboarding, training, employee benefits, performance management, career development and recognition, is creating an environment that results in increased employee engagement and high levels of employee retention for long-term careers within a company.When companies take care of their people, there is a trickle-down effect, and everything else falls into place because happy employees typically display discretionary efforts and often consider their jobs as a calling, which leads to a stronger culture and greater growth opportunities.As SMB leaders take care of their people with robust HR initiatives, some tried-and-true components that should be part of the program include generous PTO, flexible schedules, competitive compensation packages, top-notch healthcare, training or upskilling opportunities, performance management, career planning, mentoring plans, tuition reimbursement, EAPs with mental health and wellness components, financial fitness plans, community involvement opportunities and employee recognition programs.When companies address employees' holistic wants and needs, from career and finances to health and community, workers feel more valued and content, freeing them to focus on their daily responsibilities. This creates a stronger culture that sets the stage for dedicated employees, increased engagement and greater employee retention that leads to company growth.


3. HR is dynamicSavvy leaders understand HR is a dynamic discipline that has dramatically risen in prominence through the years, constantly changing to meet the needs of an evolving workforce and the companies it serves. HR infrastructure should be tailored and refined to meet the needs of a company, as opposed to a stagnant, one-size-fits-all solution. When leaders work with in-house or external HR teams, they should develop a strategy that serves their needs and is scalable for future growth – always putting their people first.HR technology has played a significant role in dynamic HR that complements the human touch and should be part of a robust HR infrastructure. HR technology not only benefits HR departments with time/cost savings and greater employee insights, but it also streamlines processes for new hires and employees, providing consistent best practices across the company.From payroll processing, people analytics and performance reviews to onboarding, benefits enrollment and online training, HR technology leads to greater efficiencies and increased employee retention and performance.While a robust HR infrastructure is necessary for employee retention and the growth of a business, it should be viewed as a welcome addition to business operations because it helps leaders scale their business with consistent best practices and procedures efficiently to help companies take care of their people. As SMB leaders build their companies, it behooves them to implement an HR infrastructure that makes a difference.
"
