,title,date,author,link,text
57,I've Worked Remotely For Over 20 Years — 5 Common Mistakes Companies Make When It Comes to Remote Operations,"Mar 7, 2024",Lesley Pyle,https://www.entrepreneur.com/growing-a-business/5-common-mistakes-companies-make-with-remote-sops/467326,"
SOPs, or standard operating procedures, are a must for any company — remote or otherwise. However, when working with an entirely remote team, some special considerations need to be put in place. Directing and working remotely for over 20 years, I have a unique perspective on this that I would like to share.1. Out of sight, out of mindIt is common practice to share standard operating procedures during onboarding with new hires, but past that, most companies never mention operating procedures again — unless, of course, there is a change that needs to be made. It is a good idea to have employees review procedures regularly, even if no edits have been made. I recommend reviewing them quarterly in a meeting, or perhaps you could send a survey out a couple of times each year that requires employees to review standard operating procedures and provide feedback on areas they believe can be improved.I once worked with a team that sent out a survey once a year to employees, and to encourage participation every employee received a $50 gift card for completing the survey. Not only did all the employees fill out the survey, but that team had the best standard operating procedures because they were consistently updated and reviewed. Get your team involved, and don't just put operating procedures out of sight and out of mind after onboarding.



Related: I've Managed Remote Teams For 15 Years — Here Are My 3 Most Important Leadership Lessons.2. Ignoring the need for flexibilityRemote work allows employees to have more control over their schedules and work environments, but many companies still adhere to rigid structures that don't accommodate this flexibility. This lack of flexibility can hinder productivity and creativity, as employees may feel restricted and unable to adapt to their unique circumstances. Common working hours are a good start to establish, but keep in mind this is not meant to be the typical 9 to 5 where an employee is at their desk all day.


In my opinion, it is crucial to include in your operating procedures when you expect someone to work. You can mention a time limit such as a minimum of five hours daily, or you can offer specific hours such as 9 a.m. to 12 p.m. The best way to do this is to outline a set of hours that everyone needs to be working at the same time, regardless of time zone — and be sure to let everyone know what time zone they should be referring to! A default zone should be used for everyone, like central standard time.3. Inadequate communication proceduresWithout clear and efficient communication channels, remote teams can struggle to stay connected and aligned. This can lead to misunderstandings, delays and decreased productivity. It's important for companies to establish effective communication protocols, such as regular check-ins, team meetings and utilizing communication tools like video conferencing or messaging platforms. Additionally, providing guidelines on expected response times and communication etiquette can help remote workers feel supported and connected.Another company I worked with offered incentives for those who responded faster than the required time on a regular basis. This ranged from a special bonus to extra time off, and it applied to both internal and external communications. This was outlined in their operating procedures so everyone knew how long they had to respond to messages for coworkers and customers alike. It created a very collaborative environment where everyone was connected and stayed on top of things. It was highlighted in the procedures that everyone would use a single platform to communicate (which, for this particular company, was Slack).4. Failure to address technical challengesFrom unstable internet connections to outdated software, these issues can severely impact productivity and hinder remote workers from performing their tasks effectively. Failing to address these technical challenges not only frustrates employees but also prevents them from reaching their full potential. A good procedure to have in place is what to do when technology does not work — should employees call someone? Send a text? What steps should be taken to let the rest of the team know when something is not working?


The best way to tackle this issue is to include contact information in your operating procedures. That way if someone's computer crashes before a meeting, they can call/text/email the right person to let them know what is happening and ask for what the next steps should be. Include a grace period too; for example, let your employees know that if they are not able to get their computers up and running 10 minutes before a meeting they should reach out to their manager.Related: Remote Work Is the Great Equalizer in the Workplace. Here's How It Will Make Your Business a Better Place to Work.5. Insufficient training and onboarding proceduresMany remote companies tend to throw their new employees into the metaphorical deep end and hope they learn how to swim on their own. While some personalities can handle this, it is extremely difficult and stressful for any person to try to figure out how to operate within a company like that. It is incredibly important to have standard operating procedures for how to onboard a new member to the team from getting them logins to training them on how to use the software given to them to do their job.Your procedures do not have to be overly detailed here, just a general outline for everyone to follow. For example, step one for remote workers should be getting your new team members all the logins they need. Step two should be training on how to use the systems they will work in daily such as instant messaging software and time tracking software. From there your company can customize the steps as needed.


Standard operating procedures unite employees and give them direction within a company, and when working remotely, it is extra important to keep them up to date and in front of everyone so that your employees know what is expected of them and how to handle problems.
"
58,Conventional Business Models Weren't Cutting It — See How Innovating With AI is Changing the Game for Startups,"Mar 7, 2024",Doug Villhard,https://www.entrepreneur.com/science-technology/4-strategies-for-harnessing-new-technologies-as-a-growing/470357,"
Facing the stark reality of startup funding plunging to a five-year low in the final quarter of 2023, entrepreneurs are at a crossroads. This year demands a revolution in their business strategies, where AI emerges not just as a tool but as a necessity for planning, launching and expanding their ventures right from the outset.The McKinsey State of AI report highlights how the use of generative AI is growing across different business areas. This surge in AI adoption isn't merely a trend; it's a testament to its effectiveness in streamlining business processes, enhancing efficiency and driving growth. It signals a future where integrating AI could become not just advantageous for startups but essential for their survival, success and fundraising efforts.Related: How to Leverage AI to Supercharge Your Business



What are the biggest benefits of AI for startups?The first major benefit of using AI solutions in startups is strategic automation. By automating routine tasks such as data entry, scheduling and report generation, startups can significantly improve their operational efficiency. This automation frees up employees' time and energy for more strategic and creative tasks, thereby boosting overall productivity and efficiency. This strategic implementation of AI in workflow automation is revolutionizing startup operations, establishing a new benchmark for efficiency in the entrepreneurial landscape.You may already be aware of AI's ability to automate tasks, but it's also incredibly valuable during the early stages of brainstorming or prototyping. Generative AI tools are adept at quickly generating a wide range of ideas for products, marketing campaigns and business models.


Take, for example, Virgin Voyages' Jen AI, a cutting-edge AI tool that lets users collaborate with Jennifer Lopez to create customized invitations. This process, which involves a brief interactive session using augmented reality technology, simplifies the creation of personalized invitations ready for distribution to friends and family. Similarly, the World Wildlife Fund's #WorldWithoutNature campaign leveraged AI to create visuals of a world without nature, in partnership with over 200 companies, to underscore the dire consequences of environmental neglect. These instances illustrate how AI can streamline creative processes. By using AI for campaign and product development, startups can alleviate the creative burden on their teams, enabling a focus on growth and other business priorities.Related: How to Use AI and Automation to Boost Your Business Goals4 strategies for harnessing new technologies as a growing startupThis rapid innovation enabled by AI allows entrepreneurs to explore more possibilities efficiently. Here are four strategies for startups to integrate AI for business success.1. Begin with your business problem, not just the technology:


As you explore AI solutions for your startup, focus on those that address your unique business challenges. Avoid the temptation to choose a cutting-edge tool simply because it's popular; such choices can lead to wasted investments. An IBM study surveying 2,500 global executives reveals that top-performing companies achieve a 13% return on investment from AI projects, which is over double the average ROI of 5.9%. This statistic underscores the importance of strategic selection and application of AI technologies.Start by identifying the core issues your business faces. Don't let the allure of new technologies distract you from your actual needs. Know your purpose, and pinpoint specific challenges or inefficiencies in your business that AI or other technological tools could effectively address. When investing in these tools, prioritize them based on their potential impact on your profit and team productivity.2. Test new technologies with a pilot project before full-scale implementation:Rushing to adopt new technologies without fully understanding their impact on your team's productivity or customer perception could be detrimental. Therefore, you should consider introducing new technologies through small, low-risk pilot projects. This method allows you to evaluate the technology's effectiveness, pinpoint any potential issues and adjust as needed before investing heavily. Gathering data and feedback from your team during this pilot phase is vital in forming a comprehensive and effective technology implementation plan.


3. Empower your team with smart technology integration:The impact of technology in your startup hinges on how adeptly your team uses it. In developing your technology implementation plan, make education and skill development a priority. By investing in training, you ensure that your team members are skilled in using new tools, which helps streamline their workflows.Encourage a culture of curiosity and experimentation with technology, as this can spur greater innovation and efficiency. Additionally, consider how AI can directly benefit your employees and alleviate stress. Incorporating AI into your wellness initiatives is essential to prevent employee burnout due to the adoption of new technologies, especially as stress levels continue to escalate. For instance, if your startup uses AI to create 3D-printed objects, could you also use it to design ergonomic furniture for your remote workers? Or if AI is automating tasks and saving time, could this saved time be converted into paid breaks for your team? Implementing such strategies can significantly boost employee satisfaction and productivity.Related: Collaboration Is the Key to Super-Fast Growth (Along With a Little Help From A.I.)4. Avoid innovating in isolation:As you embark on your startup journey, often as a solo entrepreneur handling every aspect of your business, remember that AI can be your invaluable ally, almost like a deputy. However, your entrepreneurial path doesn't have to be a solitary one. Use AI to help you seek out collaborations and tap into external expertise.Consider forming partnerships with technology providers, consultants or local universities to gain additional technical knowledge and guidance. Actively participate in communities or networks of entrepreneurs, particularly those with a focus on technology adoption. These connections can offer you valuable peer support and a wealth of shared best practices, significantly enriching your startup experience and reducing the sense of isolation often felt in solo entrepreneurship.AI is transforming the way entrepreneurs approach business challenges and opportunities, offering diverse applications tailored to their specific needs. This adaptability makes AI a vital tool for entrepreneurs navigating the complexities of starting and developing their businesses.
"
59,This AI-Powered Image Generator Can be Yours at a Great Price,"Mar 7, 2024",Entrepreneur Store,https://www.entrepreneur.com/science-technology/this-ai-powered-image-generator-can-be-yours-at-a-great/470763,"
Content generation can help keep your business discoverable and relevant to clients, both new and old, which is why finding a resource for a continuously fresh selection of imagery can be a game-changer. In the age of AI image generation, there's actually a tool out there that fits this bill.During a limited-time offer, you can save an extra 20% on a lifetime subscription to Pixilio: The Ultimate AI Image Generator, and get it for just $31.99 (reg. $360) with code ENJOY20 through March 10 at 11:59 p.m. PT. You need zero design experience to use Pixilio, which lets you simply put in the prompt of your choosing with customizable parameters, and from there, it can generate a high-quality image in a matter of seconds.Its originality and fast-working nature are part of how Pixilio is designed to liberate businesses from the often repetitive and underwhelming selection on stock photography websites. By pairing this discounted lifetime subscription to Pixilio with a tool like ChatGPT to automate your company's writing, you can generate a full content team for under $100. For scrappy startups getting on their feet, this is amazing.One five-star reviewer of Pixilio wrote, ""I really like Pixilio."" To discover whether or not you will, you can get it for life for a remarkably slim investment.Don't forget that you can save an extra 20% on a lifetime subscription to Pixilio: The Ultimate AI Image Generator, and get it for just $31.99 (reg. $360) with code ENJOY20 through March 10 at 11:59 p.m. PT.



StackSocial prices subject to change.
"
60,Save an Extra 20% on PDF Reader Pro for Mac Through March 10,"Mar 7, 2024",Entrepreneur Store,https://www.entrepreneur.com/science-technology/save-an-extra-20-on-pdf-reader-pro-for-mac-through-march-10/470759,"
PDFs are extremely popular in the business world. Unfortunately, they are notorious for being difficult to edit or annotate when needed. This is why until March 10 at 11:59 p.m. PT, you can get PDF Reader Pro for Mac or PDF Reader Pro for Windows for an extra 20% savings with code ENJOY20 — just $31.99 (reg. $59) before this limited-time price comes to an end.Save your business time and money with this popular all-in-one PDF tool. Its features make it easy to convert PDFs into other file formats and vice versa. You can use a PDF reader to edit PDFs, annotate them, manage their privacy, add password protections, redact sections, and so much more.For those companies and professionals who work with large-sized files, you might find it comforting to hear that PDF Reader Pro can open a thousand-plus page document in just a couple of seconds.PDF Reader Pro makes its ongoing updates available to users who purchase this deal for life at no additional cost. They also have a technical support team that promises to be available for help 24/7.Grab this discount and discover what's propelled PDF Reader Pro to be downloaded by more than 90 million people around the world. It's also rated 4.7/5 stars on G2.



Don't forget that this coupon is only available for you to get one of the following versions at an extra 20% savings through March 10 at 11:59 p.m. PT:PDF Reader Pro For Mac for just $31.99 (reg. $59) with code ENJOY20.PDF Reader Pro For Windows for just $31.99 (reg. $59) with code ENJOY20.StackSocial prices subject to change.
"
61,An AI Scam Stole 3 Million Site Visitors. Business Clones Are Pirating Services. Here's How to Prep Yourself for Alarming Trends in AI.,"Mar 7, 2024",Ben Angel,https://www.entrepreneur.com/science-technology/how-to-prepare-yourself-for-these-alarming-trends-in-ai/470665,"
Will consumers clone your services to save money? It's already happening! In my new book, The Wolf is at The Door: How to Survive and Thrive in an AI-Driven World, and on this podcast episode, I peel back the curtains on AI developments to help prepare entrepreneurs for a future that is already here.Welcome to a world where AI SEO hijackers plot to seize your web traffic and customers, unauthorized cloning becomes a chilling reality, and massive AI model failures lead to unexpected domino effects like lawsuits and more.And, to celebrate the release of my brand new book, The Wolf is at The Door, I'm giving away a Free AI Success Kit, featuring a chapter from the book to help get you up to speed on the world of artificial intelligence fast.If listening to this show lights up your day, please take a moment to rate and review the podcast! This is a great way to support my team's mission of empowering more individuals like you to supercharge their lives and businesses. What's more, don't forget to follow the podcast if you haven't already. Thanks!About Beyond UnstoppableHosted by bestselling author Ben Angel, Beyond Unstoppable is a transformative exploration of biology, psychology and technology. Learn from world-renowned experts like Jim Kwik, Amy Porterfield, Mari Smith and Jason Feifer. Dive into advanced AI tools, biohacking, and strategies to make you unstoppable.Subscribe to Beyond Unstoppable: Entrepreneur | Apple | Spotify | Google
"
62,Get This Document-Scanning App with Full PDF Editing Capabilities and Save 20% with This Code,"Mar 7, 2024",Entrepreneur Store,https://www.entrepreneur.com/science-technology/get-this-document-scanning-app-with-full-pdf-editing/470758,"
A simple scan can be of incredible value to a business, and as an entrepreneur or team leader, you never want to have to wait on outdated technology to get the document management you need to operate fast and efficiently. That's why outfitting your phone with the best scanner on the market should be a no-brainer, especially when it's on sale for a remarkably low rate.You can save an additional 20% on a lifetime subscription to the iScanner App, making it just $31.99 (reg. $199), when you use code ENJOY20 through March 10 at 11:59 p.m. PT. iScanner has been hailed by a range of critics from publications like 9to5Mac and Gizmodo, which said, ""The iScanner App is yet another example of cleverly leveraging an always-connected camera to do more than just intelligently make photos look prettier.""iScanner offers users full PDF editing capabilities that go as specific as color correction and noise reduction. It can scan a variety of file types, including documents, passport photos, ID cards, and more. You can also use it to easily annotate, add text, merge documents, and other valuable actions. iScanner can solve math problems within its scans, offer area measurements, count similar objects, and even recognize text in over 20 languages.Discover how iScanner became the number-one U.S.-based scanning and document management tool — with 4.8/5 stars on the App Store — while this limited-time deal is still live.You can get a lifetime subscription to the iScanner App and save an extra 20% through March 10 at 11:59 p.m. PT, making it just $31.99 (reg. $199) with code ENJOY20.



StackSocial prices subject to change.
"
