,title,date,author,link,text
49,HR Teams Need AI to Unlock Organizational Success — But There's One Thing Holding Them Back.,"Nov 16, 2023",Alon Ghelber,https://www.entrepreneur.com/science-technology/hr-teams-need-this-1-thing-to-unlock-organizational-success/463787,"
Industry leaders have long recognized HR as the fulcrum of organizational success. It stands to reason, after all, that the department charged with molding an enterprise's identity and culture should have the most profound impact on how it achieves its organizational goals. It also follows, then, that with generative AI models at the vanguard of business innovation, human resources should be considered a pivotal area of development for leaders seeking to optimize their organizations through digital transformation.Current data bears this logic out, with recent research showing that 76% of HR leaders feel their organizations must leverage AI in the next 12 to 24 months to keep up with competitors in terms of organizational success. Yet, while some are embracing applications like generative AI in HR, benchmarking indicates that around 48% of leaders are still not exploring their use. This raises some key questions, namely: Are the benefits of AI genuinely significant in HR? And if so, why aren't HR leaders taking the plunge to embrace it?I'll explore these questions in this article, shedding some light on how enterprise leaders can confidently leverage AI to best empower organizational success.Related: Why Every Company Should Be Thinking About Artificial IntelligenceTransformative potentialIn HR departments, where there is such a strong administrative focus, the power of AI to automate repetitive tasks and expedite data processing is nothing short of transformative. As such, the potential applications for AI are both extensive and varied.



One area where AI can have a major impact is employee relations. For instance, enterprises can utilize AI to analyze responses to pulse surveys, allowing them to gain meaningful insights into employee sentiment without needing to invest substantial resources in the process. Additionally, AI can be used for predictive analytics, using massive volumes of current and historical data to forecast changes in employee turnover. In this sense, AI can enable enterprises to be more dynamic and responsive to HR trends to boost employee engagement and retention, even when operating at scale.AI can also serve to enhance talent acquisition. Businesses can leverage the power of AI algorithms to scan the resumes of job candidates and shortlist the most optimal matches — a traditionally painstaking task. Moreover, AI applications can help promote better outcomes in the screening process by selecting candidates based solely on objective, standardized criteria, eliminating the possibility of unconscious biases skewing results.Were this not enough, AI can also be applied to a plethora of other HR duties, from performance analysis to resource allocation, risk management, and more. So, if the benefits of embracing AI are so considerable, then what's at the root of HR leaders' misgivings?The AI fear factorIn my view, the trepidation around AI in HR can primarily be attributed to an aversion to perceived risk.


Of course, there certainly are risks associated with using artificial intelligence in HR. Utilizing generative applications, for instance, naturally raises concerns about ethics, privacy, and security, as it requires companies to provide large quantities of potentially sensitive data to AI models. In fact, Gartner predicts that by 2025, 70% of all enterprises will rank the ethical use of generative AI among their top concerns, and understandably so. In many cases, however, I believe that the perception of the risks around AI is skewed by a misunderstanding of how such tools should be implemented.In essence, it would appear to be a question of adoption. Companies that are leading the exploration of AI in HR are those with a proven track record of successful transformations, such as IBM, who have emphasized the benefits of the technology in improving aspects like candidate selection, hiring cycles, compensation planning and employee support. Those who are more hesitant, then, must be those who are less confident in their ability to adopt the technology.When uncertainty prevails around the implementation of new technologies, the potential benefits of using them, however immense, will always be dwarfed by the perceived risks.Related: The Top Fears and Dangers of Generative AI — and What to Do About Them


The thoughtful approachTo gain the confidence to embrace AI wholeheartedly, enterprise leaders need to carefully evaluate their approach to its adoption. That starts with dispelling misconceptions about the technology.AI models are not the all-knowing, ungovernable entities that they are often suggested to be. Quite the opposite, in fact. While modern AI models are undoubtedly impressive in their ability to process, analyze and extrapolate from data, the fact remains that they can only work from the data they are fed. This is why data governance is critical.By establishing comprehensive policies and guidelines on how data assets should be stored, updated and maintained, organizations can keep a firm grasp on what data AI models will have access to. Additionally, by designating teams to conduct regular assessments of AI models, companies can prevent erroneous or discriminatory outcomes in HR that might result from machine learning biases.In conjunction with proper data governance and regular auditing, businesses should seek to develop more comprehensive onboarding processes for those utilizing AI tools. This should entail the establishment of designated communication channels for employees to provide feedback on AI-powered technologies.


Moreover, a thoughtful approach to AI adoption should involve the utilization of a digital adoption platform, which can provide employees with personalized, real-time guidance on how to use AI tech proficiently. Such a platform can help mitigate risks associated with user error and enable IT to monitor the use of new tech to weed out shadow AI.By employing these measures, companies can create an internal framework that enables the seamless integration of AI tools for HR.Related: Watch Out for These 5 Artificial Intelligence Problems in HRThe future of AI in HRWhile AI applications have enormous potential in human resources, the sensitive nature of the data they will be required to handle is proving a cause for trepidation at many organizations. That needn't be the case, however, as taking a thoughtful approach to adoption can assuage the concerns associated with the use of generative AI.


By engaging in proper data governance and auditing and implementing purpose-built adoption solutions to facilitate the transition to AI, you can confidently embrace new technologies in HR. As a result, your enterprise will be empowered to evolve its internal culture, improve overall performance and reach its organizational goals with greater consistency and velocity.
"
50,4 Reasons Your PR Campaign Isn't Driving Sales — and How to Fix Them,"Nov 9, 2023",Kelsey Kloss,https://www.entrepreneur.com/growing-a-business/4-reasons-your-pr-campaign-isnt-driving-sales-and-how/464308,"
Many entrepreneurs who have tried PR and then stopped say something similar: ""I paid a lot for PR, but it didn't lead to sales.""It's certainly a frustrating situation to be in. Brand awareness is great, but it doesn't mean anything if it doesn't help you reach your goals. Your PR efforts need to be closely aligned with your overall marketing strategy. However, only one in five PR professionals is involved in developing a company's overall marketing strategy, per Meltwater. This leads to missed opportunities for connecting media coverage to your KPIs.Here's the good news: Fixing this is usually a matter of fine-tuning certain parts of your PR campaign so you can convert brand awareness into meaningful sales.



Below are four reasons why your campaign may not drive sales — and how to adjust your efforts to start making more from media coverage.Related: 5 Media Strategies Every Entrepreneur Needs to Know


1. There's no defined customer journeyYour company just got featured in a digital publication with 15 million monthly visitors. Congrats! But, now what?Your PR strategy should detail how a potential customer who just discovered you via the media moves from brand awareness to conversion. Keep in mind that most customers don't go directly from one to the other — even in the most simplified marketing funnel, they first must move through the interest/consideration phase.Work closely with your PR and marketing teams to determine how you will nurture new audiences in the consideration phase until they're ready to convert.That may involve these tactics on the website page your media coverage leads to:


A newsletter sign-up box (offering high-value content)An offer for a free trialA downloadable white paperA 1-1 consultationThis is especially important if your media coverage sends audiences to non-eCommerce pages. For example, if one of your spokespeople is featured as an expert and the article leads to their bio page, there should be a clear ""next step"" for customers (like those outlined above) to move them closer to a purchasing decision.Related: 5 Ways Companies Can Create Content That's Actually Helpful2. The landing page from the press has a bad UXIf the press directs new visitors to your website, but the links are broken, images are sized poorly, it's not optimized for mobile, or it's difficult to navigate, they'll quickly bounce off the page.The website pages you provide to the press should be among the most inviting, intentional ones you create since they play a key role in moving potential customers through the funnel. Better UX can increase conversions by up to 400 percent, per research from Forrester.


Whenever you're mentioned in the press, put your company's best foot forward to make an unforgettable first impression.Related: 5 Things Journalists Wish You Knew About Getting Press Coverage for Your Company3. You're targeting the wrong publicationsWhile getting coverage in a giant publication feels amazing, it may not lead to the most sales. Some of the most lucrative placements we've seen for clients have been in regional outlets where their community comes together to support local businesses.As an example of that, one of our firm's clients has been featured in several national publications that are fantastic for credibility and visibility, but a local broadcast segment contributed to a 224 percent increase in their online sales in just one month (not to mention a spike in brick-and-mortar sales).


Even for nationwide or global companies, a niche publication can reach more high-intent audiences. If you're a nutrition app company, landing on Good Morning America is great for exposure, but you may actually reach more customers who are ready to convert with coverage in a small outlet focused on healthy eating or weight loss.4. Your social media channels don't reflect the customer journeyAs mentioned before, potential customers typically aren't ready to buy when they hear about your company. However, they often engage with companies on social media after their first exposure to them in the media.For instance, if someone reads about you in an online article, they may follow you on Instagram as a next step to learn more about your company. Make sure your social media channels are nurturing new audiences through every stage of the marketing funnel.Social media strategy should be a key part of your 360-degree marketing efforts and reflect your media coverage for cohesiveness. Repurpose your broadcast appearances for TikTok or Instagram Reels and showcase quotes from your interviews in static posts. Then, just as you would for your landing pages, make sure there's a clear next step in the customer journey.


In fact, social media can be one way to shorten the customer journey from brand awareness to conversion. It has traditionally been thought of as a top-of-funnel brand awareness tool, but 93 percent of executives say that companies are increasingly moving eCommerce to social media, per a Sprout Social report.Throughout all of these efforts, think about what steps will lead your customers from brand awareness to conversion — and be there to offer them high-value content every step of the way. Also, make sure your PR team is actively part of overall marketing decisions. When you do so, you'll see more impactful results from your investment in PR.
"
51,Employee Benefit Costs Are Increasing. It's Time for Employers to Fight Back.,"Nov 8, 2023",Trent Bryson,https://www.entrepreneur.com/leadership/employer-strategies-for-managing-spiking-healthcare-costs/463586,"
Recent developments and analyses of the healthcare sector compel me to address the alarming rise in healthcare costs. We are witnessing the steepest climb since 2012, a pivotal year that saw the implementation of the Affordable Care Act (ACA).Click to learn how to save on business insurance now!Affordable Care Act and its ImplicationsThe ACA was crafted with the noble ambition of making healthcare more accessible and affordable for Americans. However, some unintended consequences have emerged from its implementation. Chiefly among them, healthcare plans now lack the incentive to manage and control costs diligently. The framework of the ACA unintentionally placed insurance companies in a position where increased payouts to providers translated to more profit, rather than encouraging thriftiness and cost-efficiency.



Additionally, the law created an incentive for insurers to acquire clinics, pharmacies, and the like, and to steer customers to them rather than rival providers. This strategy channeled revenue from the profit-capped insurance business to uncapped subsidiaries, which in theory could allow insurers to keep more of the premiums paid by patients. 


Pharmaceuticals and Vaccine PricingAnother layer of complexity to our rising costs is the pharmaceutical sector. The U.S. is unique in allowing pharmaceutical companies to advertise directly to consumers. Consequently, patients, influenced by polished commercials, are often inclined to request specific drugs, bypassing a physician's expertise in the process. This leads to potential over-prescription and soaring drug expenses.Moreover, recent pricing changes in vital vaccines have intensified the strain. Pfizer and Moderna, for instance, significantly increased the prices of their Covid-19 vaccines this year. As a result, the federal government now finds itself paying almost three times the original price per dose. Alarmingly, this rate is higher than what is being paid by countries that invested considerably less in vaccine research and development.Related: Why Better Employee Benefits Can Be More Attractive Than Higher SalariesIgnoring the ObviousTwo in 5 adults have obesity and 1 in 11 adults are considered severely obese. At 36.2% according to WHO, the United States is the most obese developed country in the world. It is well established that obesity is prevalent, associated with adverse health consequences, compromises the quality of life, and poses a burden on the health care system. There is a long history of ineffective dietary recommendations that ignore food processing as driving the obesity epidemic. It is a crisis that politicians are too afraid to take on for fear of being insensitive.


Inflation in StaffingAnother undeniable pressure on healthcare costs comes from the rising inflation in staffing across the sector. As demand for healthcare professionals outpaces supply, salaries and benefits have naturally seen an uptick. While this is a testament to the importance and value of healthcare workers, it undeniably contributes to the escalating costs of healthcare services. Just this week in California, we saw a strike with the union demanding higher wages.Demographic ChangesLastly, it's essential to consider the demographic shift. In 2010, the segment of the U.S. population aged 65 and older was at 13%. Today, it stands at over 16%. This increasing percentage corresponds to more significant healthcare needs and, subsequently, a surge in costs.New Strategies for Cost ManagementAs a consulting firm deeply entrenched in these challenges, we've been closely monitoring corporate responses. Many companies are proactively taking the reins to control pricing and costs. We are seeing a trend toward exploring self-insured models, reference-based pricing strategies, and even a rollback of the expansive coverage of benefits. This rollback is an effort to counteract the 'great resignation' and strike a balance between employee retention and cost-effectiveness.Get a business insurance quote in 3 simple steps


While the ACA has undoubtedly made healthcare more accessible for many, the interplay of its unintended consequences, rising drug prices, staffing inflation, and demographic shifts have synergistically elevated costs. As always, we are here to guide and assist you in better understanding and maneuvering through these intricate challenges. If you are not exploring self-insured or partially self-insured options, I would encourage you to reach out to our team and ask how it can help your company.
"
52,Former PR Exec Accused of Involving Celebrities in 'Fictitious' Campaigns Pleads Guilty to Defrauding Victims Out of $3.8 Million,"Nov 2, 2023",Madeline Garfinkle,https://www.entrepreneur.com/business-news/ex-pr-exec-pleads-guilty-to-multi-million-dollar-scheme/464776,"
Andrew Garson, 41, a once big-time public relations executive based in New York City, pled guilty in a Manhattan federal court on Wednesday for involvement in a scheme that ultimately defrauded his former employers out of millions.Despite having an established career and earning accolades, including being named a ""40 Under 40"" public relations executive by PRWeek magazine in July 2018, Garson spent years deceiving and causing substantial financial harm to his employers.According to court documents, between approximately 2014 and 2018, Garson held executive positions at two marketing public relations agencies in New York, referred to as PR Firm-1 and PR Firm-2. During his time at the firms, Garson covered expenses from PR Firm-1 by making unauthorized payments from PR Firm-2, causing the latter to ultimately pay for many of the projects and campaigns led by Garson at PR Firm-1. Garson also used his company credit card to buy a luxury watch for $14,000, falsely claimed it was for a client's event production, and later sold it for $4,000 and pocketed the funds personally.



Related: Christian Influencer Found Guilty of Defrauding Dozens, Ordered to Pay Nearly $90,000Furthermore, Garson submitted multiple reimbursement requests for the same expense, causing PR Firm-2 to reimburse him more than once for the same expense. Once his fraudulent behavior came to light, Garson was fired from PR Firm-2, after which he deceitfully obtained more than $5,000 in unemployment benefits from the New York State Department of Labor by providing false information about his separation from the company.


""Andrew Garson betrayed his employers time and time again, causing millions of dollars in losses,"" U.S. Attorney Damian Williams said in a statement. ""Garson's fraud scheme was multifaceted and manipulative, and he has now admitted to greedily exploiting his employers' trust to line his own pockets.""Garson, who pled guilty to one count of wire fraud, will pay $3,754,068 in restitution to the victims of his crime, and his sentencing is scheduled for February 28, 2024. Wire fraud carries a maximum 20-year sentence; a federal judge will sentence him.Separately, Garson was hit with a $10 million civil lawsuit in November 2020 from one of his former employers, alleging that during his tenure as an executive vice president for sports and entertainment projects, Garson deceitfully acquired $2.5 million. The former employer accused him of manipulating budgets and fabricating marketing campaigns, some entirely ""fictitious.""The lawsuit claims that he convinced celebrities such as Megan Fox and Mindy Kaling to participate in unauthorized projects. When the stars requested payment for their involvement, the firm was hit with ""demands for payment and/or lawsuits"" for ""over budget"" projects that were never approved. The lawsuit is still pending.


Related: DJ Envy Associate Arrested For 'Ponzi-Like' Scheme, Defrauding Investors Out of 'Millions'
"
