,title,date,author,link,text
0,"He Had a Side Hustle Driving for Uber When a Passenger Gave Him $100,000 — Now His Company Is On Track to Solve a Billion-Dollar Problem","Apr 22, 2024",Amanda Breen,https://www.entrepreneur.com/starting-a-business/lucky-uber-side-hustle-leads-to-100k-and-biotech-business/472981,"
Today, Joshua Britton is the founder and CEO of Debut, a biotechnology company delivering ""high-performing"" cosmetic bioactive ingredients ""at unprecedented speed."" But before the startup began to innovate in the biotech space, it was just an idea, one that stemmed from ""some academic research,"" ""a lucky Uber ride"" and a ""vision for the beauty industry,"" Britton says.Image Credit: Billy Economou, BE Studios. Joshua Britton.Britton completed his Ph.D. in biochemistry and organic chemistry before furthering his studies at University of California, Irvine. Afterward, he decided to apply what he'd learned to ""this new thing called cell-free and synthetic biology,"" which refers to the processes within biotechnology that enable the creation or modification of biological organisms. Essentially, enzymes or microbes can be ""taught"" how to make powerful ingredients — including plant or flower molecules — in a reactor in a lab setting.



Naturally, the process comes with massive implications for the multi-billion-dollar beauty industry, which relies on natural ingredients for fragrance and other properties. Britton decided it was time to bring the biotech mainstream. But, of course, he also needed to fund the venture. While working at the back of his professor's lab by day, he had a side hustle driving for Uber at night to earn some extra cash. When he got to talking with one passenger and pitched her his idea, she was sold — and wrote him a $100,000 check to support his efforts.Related: EntrepreneurTV Is Now Live — and Free. Start Streaming and Get Inspired.


Britton's passenger would be Debut's first investor, but certainly not its last: The company raised $22.6 million in a Series A round led by Material Impact in 2021 and $40 million in a Series B round led by BOLD, the venture capital fund of L'Oréal, the world's largest cosmetics company, last year.""Whenever people want [fragrance] products, they have to effectively use agriculture to get them.""Debut has already brought the technology to market with a consumer skincare brand called Deinde, which targets inflammaging, a process associated with the aging of the human body. The products contain Naringenin, a potent polyphenol typically found in grapefruit peel that's been clinically proven to strengthen the skin barrier and reduce inflammation. According to Britton, the clinical claims allow for ""product differentiation in market,"" and many brands are coming to Debut as they seek to convert from other mainstays like Vitamin C, niacinamide and squalane.But fragrance will be Debut's next frontier, a move that coincides with growing consumer demand for transparency and natural ingredients — and concerns over the beauty industry's impact on dwindling natural resources. The majority of fragrance ingredients from fragrance houses are cultivated, perhaps from the ""from the lavender fields of France"" or the roots of a certain type of tree, Britton says, which requires land, water and agrochemical use.


Related: Jeans Made Out of…What? One Company Dared to Go Where None Had Before — and Even Levi's Is On Board.""Whenever people want these products, they have to effectively use agriculture to get them,"" Britton explains. ""The fragrance industry has been very good at hiding the fact that the majority of fragrances are actually chemically derived. If you dig pretty deep into them, you'll find that they're made from petroleum-based synthesis. And that's just what we're looking to change.""""There could be 200 or 300 compounds in there all at different levels. And you have to be able to mimic that exactly in a bioreactor.""When it comes to fragrance, Debut is all about ""mimicking nature."" Sometimes, that means mirroring a single ingredient, a process that's not unlike making wine or beer, where a watery, sugary solution is mixed with a cell, but instead of producing wine or beer, it produces a fragrance model, Britton explains. It's a method that involves limited land use, no agrochemicals and ""very little waste.""


Of course, some scents ""are very complex mixtures"" that require a careful balance of different notes — and Debut has developed the technology to replicate those as well, Britton says. ""The nose is so sensitive that if you have a fragrance from a root, for example, what you'll see is there could be 200 or 300 compounds in there all at different levels,"" he explains. ""And you have to be able to mimic that exactly in a bioreactor. If you [don't], then you won't have the same smell, and the product won't be successful.""Related: The Future of Food: How Biotech Will Save Us AllDebut is all about putting successful products in the hands of consumers — foregoing biotech's standard horizontal integration model, whereby companies seek out a scientific solution that's then produced at a very small scale for a vertical one that emphasizes the end consumer and product from the start, according to Britton.""When we think about how to bring synthetic biology to people, it's in the form of tangible products,"" Britton says. ""That means that we have to not only do groundbreaking research but also interact with our consumers and users. We have to understand how to make formulations. We have to make physical products.""
"
1,The SEC's New Climate Transparency Rules Mean Sustainability Isn't Just a Buzzword Anymore — Here's How to Embrace It.,"Apr 22, 2024",Christine Wetzler,https://www.entrepreneur.com/green-entrepreneur/what-the-secs-new-climate-transparency-rules-mean-for-you/470994,"
Discussing sensitive topics can be challenging for business owners. This is one of the top three or four reasons I receive initial calls for public relations assistance addressing a hot-button issue. The latest confusing trend is sustainability and how to talk about it openly. Surprisingly, people need clarification about how much to talk about it, why it's important and when to bring it up. There's even a new word for this fear: ""greenhushing.""The most recent bit of pressure on companies regarding eco-messaging is the U.S. Securities and Exchange Commission's (SEC) recent efforts to enforce regulations that protect investors and maintain market integrity. Basically, the SEC has revised environmental transparency rules and introduced mandatory climate risk disclosures for public companies.This is the first time a sustainability mandate has emerged nationally, and it's expected to have a notable impact. In my opinion, even for private companies, it's a call to pay attention and stop neglecting this discussion.



We are entering an era where climate objectives, targets and governance frameworks will become mandatory in corporate reporting. This shift also aligns with the increasing consumer demand for environmentally and ethically sustainable products — a trend that, despite its popularity, has seen many companies struggle to translate into tangible demand.Related: Sustainability for Entrepreneurs — Why It Matters (and How to Achieve It).


The paradox of consumer demand and greenwashingConsumers' enthusiasm for sustainable products often starkly contrasts with their actual purchasing behavior. While surveys indicate a robust desire for sustainability, sales frequently need to catch up to expectations for new, environmentally conscious products. This discrepancy is exacerbated by greenwashing — where claims of environmental stewardship are not backed by practice — further eroding consumer trust and complicating the landscape for genuine initiatives.I'd counsel any company today to prepare for sustainability discussions and engagement. It is now an unavoidable topic. Because I have been a fractional CMO and external public relations consultant since 2002, I've received many calls from companies facing these watershed moments. Here is the advice I'd give a leadership team aiming to be more vocal about sustainability.The imperative of transparencyIn this context, the necessity for transparency is undeniable. Beyond mere regulatory compliance, transparency is crucial for cultivating consumer trust and loyalty. Companies must now proactively measure and refine their approaches to climate change, so this journey has got to start with a comprehensive understanding of your environmental footprint, including greenhouse gas emissions, resource utilization and waste generation.Typically facilitated by external consultants or an internal sustainability team, this foundational assessment is critical for setting realistic sustainability goals and improvement strategies. Employing standardized tools and frameworks like the Greenhouse Gas Protocol and Life Cycle Assessment provides a methodical approach to this task and will result in data and benchmarks you can use consistently in your messaging efforts.


Armed with this data, specific and time-bound goals can be set that meet compliance requirements (if necessary) and drive significant environmental and social improvements. Engaging stakeholders, particularly employees, at this stage, helps bring to the surface any practical concerns and integrate these insights into the goal-setting process.Related: 70% of Consumers Say They'll Buy 'Green' Products, but Only 5% Actually Do. That's Due to a Common Marketing Mistake By Eco-Friendly Brands.The role of public relations in implementationPublic relations in the realm of sustainable messaging goes beyond just issuing press releases. PR is a strategic tool for amplifying and embedding climate-change initiatives into the corporate ethos. Compelling storytelling highlighting a company's progress and impacts on sustainability can significantly boost its reputation and foster third-party credibility.Leveraging various channels — from press releases and social media to comprehensive sustainability reports — enables these stories to reach and resonate with a broad audience, sparking engagement and advancing the sustainability agenda.


Cultivating a sustainability-centric culture internally is essential. Companies can ensure that sustainability principles are deeply ingrained in every aspect of their operation through regular educational programs, active participation in sustainability initiatives and acknowledgment of individual and team contributions. This not only reinforces the company's commitment to sustainability among employees but also mobilizes them and other stakeholders as ambassadors of these values.Continuous monitoring and evaluation of sustainability initiatives and how they are being perceived in public are vital measurement points to consider when assessing progress. Like any meaningful initiative, setting and tracking key performance indicators (KPIs) allow companies to measure effectiveness and identify areas for improvement. Further, engaging with employees and stakeholders through feedback will enrich this process and provide real-world insights.It seems counterintuitive, but in my experience, challenge is often in partnership with opportunity. Tackling tough subjects can uncover opportunities for innovation, stakeholder engagement and corporate accountability that otherwise would've been dormant. Talking specifically about sustainability is not always about compliance. It is a chance to appeal to buyers and lead the market with integrity, innovation and vision.
"
2,AI Will Radically Transform the Workplace — Here's How HR Teams Can Prepare for It,"Apr 19, 2024",Alex Goryachev,https://www.entrepreneur.com/science-technology/ai-will-transform-the-workplace-heres-how-hr-can-prepare/472581,"
Our workplaces are about to undergo an unprecedented level of transformation, and HR will take center stage. Artificial intelligence will dramatically reshape HR in a way that goes beyond recruiting, hiring and talent management. Leadership teams at all levels need to embrace this change to transform and lead their organizations forward.It's the people, and not the technology, that makes AI initiatives a success. Intrapreneurs, in particular, are the driving force behind it. As I shared in Fearless Innovation, I noticed this when I was working on the innovation agenda for the Great Places to Work study — the most innovative companies were those that had a leadership team that was embracing intrapreneurship and were open to change.HR is the beating heart of any organization, and as such, it needs to take center stage in both adopting and leading ethical and innovative AI transformation across the organization.



Related: How Artificial Intelligence Is Reinventing Human Resources4 tectonic shifts AI will drive in HR1. A new wave of massive reskilling


As AI becomes more prominent across business functions, the need for new skills will only grow. Forty percent of enterprise leaders believe that their workforce would need to reskill as a result of AI and machine learning. In fact, research shows almost a third of all hours worked in the U.S. could be automated by 2030.All of us need to reskill to some extent to be relevant in the AI era. Not only would people need to re-train, but generative AI is introducing a whole host of professions that have been non-existent until recently, from AI ethicists to human-AI interaction designers. Some of these roles might sound futuristic, yet they are becoming increasingly relevant as technology advances.2. The great restructureAs automation takes center stage across more business functions, there will be the inevitable need for organizations to restructure and rethink how they work. This transition will not only involve the integration of new technologies but also introduce a shift in the workforce dynamics. Intrapreneurs will need to identify gaps both in skills and operational processes and forge brand-new roles for themselves and those they manage. HR must play a key role in enabling a smooth and easy transition in this regard. The transition will not be smooth or easy, and it's only HR that has the capability to make it impactful.


3. Arrival of ""digital humans""""Digital human"" may sound like an oxymoron, but that's the term that's starting to appear in business and operational plans. More roles, regardless of industry, are becoming digitally enhanced where some form of AI assistance is embedded in their everyday work. A real-life example is the introduction of the digital nurse — AI-powered healthcare agents which have already been proven to outperform human nurses in certain tasks.Imagine the impact these digital roles will have on the workforce the more sophisticated and prevalent they become. Eventually, HR will need to create policies and systems in place that account for this new type of ""staff augmentation.""4. Regulating the robot


The threat of AI bias and misuse is serious. Not only can the technology put many jobs at peril, but potential improper implementation can expose organizations to serious liability and negatively affect the workforce. From avoiding bias to inclusivity, HR teams play a critical role in the ethical deployment and management of AI technologies.HR professionals will be tasked with navigating the delicate balance between leveraging AI for efficiency and ensuring that its application upholds fairness, privacy and non-discrimination.Related: How to Successfully Implement AI into Your Business — Overcoming Challenges and Building a Future-Ready TeamWhat HR intrapreneurs must do to embrace AI the right wayThe future of work is being shaped by AI adoption, and its success hinges on the right approach from the outset. My experience shows that for successful organizations, one universal trait stands out: the presence of change agents. Every organization, regardless of size, benefits from intrapreneurs who are open to change and committed to spearheading transformation efforts. These intrapreneurs are pivotal in driving the future of work, as they help orchestrate the integration of new technologies into their business models.


HR and talent leaders should harness this dynamic, encouraging a symbiotic relationship with intrapreneurs to develop customized solutions for AI adoption, ensuring that they are not just keeping pace with technological advances but are actively shaping their trajectory.Securing a seat at the table:HR should take a proactive stance in the adoption of AI, even if it is still in its early stages within your organization. By securing a position at the forefront of the AI initiative, HR can and should facilitate and guide the entire organization in embracing this significant change.As AI has the potential to impact every facet of the organization, it is imperative for HR to not only understand and advocate for this technology but also lead its integration across all departments. HR should encourage and support intrapreneurs and all employees to leverage AI in their daily tasks, demonstrating its value not just for operational efficiency but for personal and professional growth as well.


Master the technology:To effectively navigate and regulate AI, HR must first understand it thoroughly. Grasping the full potential of this technology is crucial for reaping its extensive benefits. HR plays a vital role in identifying the necessary tools and skills that employees must acquire and then integrating these learnings into daily work practices.Before implementing AI more broadly, HR should initiate comprehensive training programs that not only educate but also reassure employees about AI's role in the future of the business. By leading these educational initiatives, HR can shape the structure and effectiveness of these programs, ensuring they meet the needs of the organization and its workforce.Related: 3 Ways to Prepare Your Business For an AI Future


Looking aheadGenerative AI has the transformative potential to redefine the business landscape, but realizing this vast potential hinges on more than just the adoption of technology. It critically depends on the talent within the workforce, driven by HR and bold intrapreneurs. These visionary leaders don't just implement new tools; they exemplify their use, demonstrating the profound impact of AI across every level of the organization.HR plays a pivotal role in fostering this environment, enabling intrapreneurs to guide and inspire every individual they touch. Together, they turn each employee into a catalyst for change, igniting a widespread passion for innovation that deeply resonates and sustains long-term success.
"
3,They Designed One Simple Product With a 'Focus on Human Health' — and Made $40 Million Last Year,"Apr 18, 2024",Amanda Breen,https://www.entrepreneur.com/growing-a-business/simple-health-focused-product-led-to-40m-in-revenue-in-2023/472859,"
Branch Basics founders Marilee Nelson, Allison Evans and Kelly Love ""never set out to sell soap,"" let alone launch a cleaning brand that would generate tens of millions in annual sales.But the company's ""mission to create healthy homes"" while keeping cleaning routines simple continues to resonate with customers — 50% of whom are returning, according to the brand. Among other select accessories, Branch Basics offers a comprehensive ""starter kit,"" which features a fragrance-free, ""plant- and mineral-based"" cleaning concentrate along with various glass bottles that can be filled with different combinations of the solution and water to meet specific needs: from wiping down a bathroom counter to doing a load of laundry.Image Credit: Courtesy of Branch Basics. Marilee Nelson, left; Allison Evans, center; Kelly Love, right.



The story of how the company came to be begins with Nelson, who, after battling chronic illness, was told that she'd never have kids and needed to go on dialysis. Nelson wasn't sold on the prognosis and turned to another doctor who used ""food as medicine"" — a leap of faith that ""literally changed her life,"" eradicating those health issues and even inspiring her to become a medicinal cook. Later, after her 10-year-old son was exposed to pesticides and suffered brain and immune system damage, she took another hard look at environmental factors that might contribute to healing.""His immune system had been so damaged that he could not detoxify the things we're all exposed to every day,"" Nelson says, ""and he would have extreme reactions. I took one box and thought, Oh, I'll keep my favorite perfumes in here, favorite skincare products and things, in the closet, and when he gets better, I will bring them back out."" However, according to Nelson, the box's removal made such a significant difference that it showed her ""how important it is to [recognize] how powerful these chemicals are."" Nelson's son started to heal, and when word of mouth spread, she developed a course to help other people better understand the products in their homes.


Related: How This Pediatrician-Turned-Entrepreneur Transformed a Health Policy into a Consumer Product for Kids""Of course, the type of fuel we put in our bodies matters for how we feel.""Nelson's niece, Allison, had a similar experience. Diagnosed with polycystic ovarian syndrome, Evans was told by doctors that ""no lifestyle change"" could help her heal and to take birth control indefinitely; in college, she faced a range of symptoms — muscle aches, loss of motor skills and more — and says she was prescribed numerous medications to no avail. At the time, Evans and her aunt Marilee weren't particularly close, but she consulted with her and realized that some simple lifestyle changes just might help her feel better.According to Evans, removing certain products with synthetic ingredients and eating whole foods did help her condition improve, and as graduation neared, she decided to spend eight weeks with Nelson in the Texas Hill Country, where she'd learn more about healthy living from her aunt. Her friend Kelly joined her, and despite being in good health, also noticed a transformation — ""My dry itchy eyes, headaches, muscle aches are all gone,"" Love recalls, adding, ""the more I learned about all this, it just made sense to me: Of course, the type of fuel we put in our bodies matters for how we feel, how we think, how we act.""


Related: PVC Plastics Are Polluting Our Planet. This Startup Has a Solution.So, in 2012, the three women teamed up to launch Branch Basics, the cult-favorite cleaning brand known for its multipurpose concentrate.Image Credit: Courtesy of Branch BasicsAlthough Cleveland Clinic reports that most household cleaning products on the market ""are reasonably safe when used as directed,"" many cleaning supplies or household products can ""irritate the eyes or throat, or cause headaches and other health problems,"" particularly if they release volatile compounds (VOCs), which vaporize at room temperature, per the American Lung Association. The organization also notes that even naturally occurring fragrances, such as citrus, ""can react to produce dangerous pollutants indoors.""


""Nontoxic"" labels on products aren't the be-all and end-all either, Nelson notes. After all, ""it's the dose that makes the poison,"" as the Swiss physician and chemist Paracelsus said nearly 500 years ago. According to Nelson, looking at the ingredients themselves is key. The founders want people to feel empowered to examine any product — from Branch Basics or another company — and understand the ingredients being used. To that end, they offer a $99 ""Toss the Toxins"" course to ""walk you through a step-by-step process to remove products that pollute your home and body.""Related: Go Green Or Go Home: 3 Ways Industrial Facilities Can Clean Up Their Acts""Our 32-ounce liquid concentrate cleans your windows, cleans your baby's bottom, cleans your produce.""Branch Basics' ""minimalist"" product line is meant to make the whole process easier — and save time. ""We chose to use our products as a vehicle for our mission,"" Nelson says, ""so we came out with a concentrate that can replace literally every laundry [and] cleaning product in the house. It's so safe it can be used on the skin.""


""Our 32-ounce liquid concentrate cleans your windows, cleans your baby's bottom, cleans your produce, takes off your eye makeup, cleans your countertops [or] your hardwood floors — whatever depending on the the ratio,"" Evans adds.The approach is resonating with customers, the company reports. Gross sales grew around 42% year over year from 2022 to 2023, with revenue hitting $40 million last year. The company currently has more than 50,000 product subscribers, 600,000 email subscribers and 10,000 five-star reviews on its concentrate and Oxygen Boost, which amplifies the power of the concentrate ""for tough cleaning jobs.""Image Credit: Courtesy of Branch Basics""We know that human health is our priority... [that] keeps everything aligned.""The company's laser-focused commitment to its customers — it reportedly responds to every single customer question on Instagram and TikTok — no doubt fosters a lot of that brand loyalty. What's more, Branch Basics boasts a 6% referral rate compared to the industry's 2% average.""We approach everything [by asking] What do we want?"" Love says. ""What's missing in the market? What do we, as people who are moms, as people who are health-conscious, need and want? Because, most likely, other people would need and want those things, too. We know that human health is our priority, so when we formulate products or make our marketing plans, [that] keeps everything aligned.""This WOMEN ENTREPRENEUR® article is part of our ongoing series highlighting the stories, challenges and triumphs of running a business as a woman.
"
