,title,date,author,link,text
0,How Empathy-Based Leadership Can Transform Your Teams and Businesses,"Apr 25, 2024",Martin Rust,https://www.entrepreneur.com/growing-a-business/how-empathy-based-leadership-can-transform-your-team/472847,"
By now the expression ""the new normal"" should be familiar to us all. It's used to describe the profound changes in our daily lives, including where and how we work. It also describes the overall societal functioning that has settled into place following significant global events, such as the pandemic, ebbs and flows in the economy and geopolitical conflicts that seem to drop out of the sky.This term also includes adjustments in how we communicate, conduct business and interact personally and professionally. What was once considered one-off occurrences have now become expected, reflecting a shift in behaviors, expectations and norms that are accepted as the baseline for moving forward.This new normal complicates the business landscape, affecting supply chains, market accessibility and the behavior of employees and suppliers. Given these challenges, it's imperative for traditional strategic frameworks to undergo an overhaul to safeguard resilience and sustained prosperity.



The fallacy of strategic plansWork culture has undergone a seismic shift. The changing dynamics of workplace locations and the motivations behind work have rendered numerous conventional business models and strategies redundant. Today's workforce seeks more than just routine; they yearn for purpose and the chance to be part of growth and lifelong learning.Moreover, a glaring disconnect persists within many traditional strategic plans. Their extensive timelines and meticulous details often misalign with the fluid nature of real-world challenges, which are prone to abrupt changes. This dissonance makes it difficult for employees to envision their roles, widening the gap between executives, managers and their teams.


Extensive evidence highlights the shortcomings of strategic plans. A 2022 Harvard Business School study revealed that 60% of strategic plans fail to meet expectations, yielding poor outcomes. Moreover, 95% of employees questioned in the same study could not articulate or understand their organization's core strategies. Compounding these issues, a study conducted by McKinsey and Company found that only 30% of executives are convinced that their strategies are effective.And while many companies are beginning to see the light about the failure rate of strategic plans, many are unsure what to put in their place.Related: How to Be the Empathetic Leader Your Team NeedsAttrition is expensiveAccording to a 2022 Gallup survey, only 23% of U.S. employees feel engaged in their company's mission and see themselves as co-contributors to the company's successes. Because strategic plans tend to sideline the heart and soul of any organization — the employees expected to carry them out — it should be easy to see the correlation between failed strategic plans and disengaged employees.


Attrition is not just a line item on an HR report; it's a symptom of a deeper dysfunction within the organizational fabric. Also in 2022, Gallup published a survey revealing that disengaged employees cost the global economy $8.8 trillion annually, a testament to the high price of ignoring employee happiness. But what if I told you that the antidote isn't found in more rigorous performance management but in something as basic as empathy?Related: Does Empathy Have a Place in Your Workplace?The importance of an empathy-based approach to running a businessIn all that we encounter, from the significant to the seemingly inconsequential, it's crucial to acknowledge that at every turn, it's about the people. In my experience interacting with communities in conflict and post-conflict zones, understanding is vital, particularly when we're poised to make key decisions. Empathy ought to be the guiding force behind our every action, steering us through each decision we face.Navigating these pivotal moments requires a grasp of what matters. It might appear obvious, but amidst the chaos of daily challenges, this lucidity enables us to sift through the noise and distractions, honing in on what's essential: the well-being and consideration of those around us.


However, in my experience, true understanding extends beyond mere realization. It involves active listening—absorbing what others express and endeavoring to perceive the world from their perspective. This level of empathy sheds light on what's important and molds our decisions in a way that resonates with our deepest values.Empathy-based leadership, a concept I explore through various anecdotes in my book, From War Zones to Boardrooms: Optimize the Moment When Strategic Planning Fails, is about seeing beyond the immediate tasks and understanding the aspirations, challenges and emotions of those we work with. It's about creating an environment where employees feel genuinely seen and heard, which I've found to be a powerful motivator for loyalty and engagement.It's about hearing the unsaid, recognizing the effort behind the results and understanding the context of so-called failures. This approach has not only helped me build stronger connections with my team but has also fostered a culture of trust and openness in my consulting practice.Related: Try This Approach to Create an Enriching and Caring Workplace


Another key aspect of empathy-based leadership is adaptability. Recognizing that each team member is unique and may require different approaches to feel supported and motivated should be foundational. A common expression among young people is ""meeting people where they're at."" It speaks truth and wisdom. By adapting our leadership style to meet these diverse needs, we can create a more inclusive and supportive workplace environment.When we approach challenges from a place of understanding and compassion, we're more likely to uncover the root causes of issues rather than just addressing symptoms. This can lead to more sustainable outcomes and a stronger sense of collective ownership over them.Perhaps the most compelling argument for empathy-based leadership is its impact on business outcomes. Leaders who show more empathy toward their direct reports are viewed as better performers by their bosses. Empathetic leadership can lead to increased employee engagement, higher morale and improved productivity and innovation.
"
1,Redefining the Future with Artificial Intelligence Buyouts,"Apr 25, 2024",StackCommerce,https://www.entrepreneur.com/science-technology/redefining-the-future-with-artificial-intelligence-buyouts/473199,"
Artificial Intelligence (AI) is undoubtedly the next big technological frontier. Generative AI is projected to become a massive $1.3 trillion market by 2032. Meanwhile, major tech companies continue to invest heavily in the AI sector, unlocking capabilities that were previously unimaginable.However, the true winners in the AI revolution will be those who can effectively leverage it to solve real-world problems. This is the approach taken by RAD AI, a company that uses AI to streamline and optimize marketing efforts for its clients, many of whom are well-known brands. With thousands of investors already backing the company's growth, RAD AI stands at the forefront of this transformative shift.Let's explore the trends shaping the AI landscape and how RAD AI is positioned to influence the market.



Accelerating RAD AI's growth through strategic AI acquisitions.As the AI era continues to evolve, RAD AI is poised to among those leading the charge. The company is unveiling a groundbreaking strategy called Artificial Intelligence Buyouts (""AIBOs""), which aims to redefine the industry's landscape.The rationale behind AIBOs lies in the untapped potential within the creator economy. RAD AI has identified a significant gap, where small- and medium-size agencies—crucial to the creator economy's ecosystem—often lack the advanced AI capabilities needed to fully optimize their operations and client engagements. By strategically acquiring these agencies and integrating RAD AI's award-winning technology, the company can empower these agencies to enhance their efficiency, client acquisition, and long-term value.


The recent success of RAD AI's crowdfunding initiative has provided the necessary capital to begin realizing this vision. Furthermore, the planned Regulation A+ public fundraise in the second half of 2024 will further fuel the company's ambitions, enabling it to strategically acquire and transform agencies that can benefit most from RAD AI's AI innovations.The value proposition: Immediate impact and long-term growth.The integration of AIBOs into RAD AI's growth strategy has the potential to create significant value for shareholders. By leveraging RAD AI's technology platform and capabilities, the acquired agencies can immediately see improvements in efficiency, client satisfaction, and profitability, directly benefiting the company's investors through increased valuation and market presence.A bold future with AIBOs.As RAD AI unveils its AIBOs strategy, the company is on the cusp of a transformative future. This vision underscores RAD AI's commitment to leading the AI-driven marketing revolution and ensuring its investors are part of a journey marked by groundbreaking innovation, rapid growth, and substantial value creation.For investors seeking to capitalize on the AI renaissance, RAD AI presents a compelling opportunity. With more than 6,500 investors already backing the company, RAD AI is poised to drive the next wave of AI-powered solutions that will redefine marketing strategies and drive business success.


Disclosure: This is a paid advertisement for RAD AI's Regulation CF offering. Please read the offering circular at invest.radintel.ai*The company is considering undertaking an offering under Regulation A. The company is not under any obligation to make an offering under Regulation A. It may choose to make an offering to some, but not all, of the people who indicate an interest in investing, and that offering might not be made under Regulation.. If the company does go ahead with an offering, no offer to buy the securities can be accepted and no part of the purchase price can be received until it has filed an offering statement with the Securities and Exchange Commission (SEC) and only then accepted through the intermediary's platform. The information in that offering statement will be more complete than the information the company is providing now, and could differ in important ways. You must read the documents filed with the sec before investing. No money or other consideration is being solicited with the indications of interest, and if sent in response, will not be accepted. Indications of interest involve no obligation or commitment of any kind.
"
2,She Ditched Her Steady Job in Tech to Pursue Her Love of Food. Now She's a Food Network Champion and Celebrated Cookbook Author.,"Apr 25, 2024",Emily Washcovick,https://www.entrepreneur.com/science-technology/how-she-went-from-tech-expert-to-celebrity-chef/473169,"
Breaking the mold is standard for Chef Priyanka Naik, whose leap from a secure tech job to the unpredictable culinary world showcases her recipe for turning passion into sustainable success.A self-taught vegan chef from Staten Island, New York, with roots in Indian culture, Priyanka didn't find her calling in the hallowed halls of culinary schools. Instead, a less likely setting ignited her passion for cooking—a thriving tech career. But it was her commitment to sustainability and a plant-based lifestyle that truly set her apart in the competitive culinary landscape. Listen to the Behind the Review episode below to hear directly from Chef Priyanka Naik.""Cooking was a form of expression, a nod to my heritage, and a way to advocate for the environment,"" Priyanka said, reflecting on her early influences. ""My parents immigrated here in the late '70s from India, so… food was key to staying in touch with our roots and our family.""



Priyanka's culinary philosophy is deeply rooted in sustainability, which she views not only as a personal choice but as a global imperative. ""What we eat impacts not just our health but our planet,"" she said, emphasizing the importance of choosing ingredients that promote environmental health.Whether cooking at home or live on TV, Priyanka rejects single-use plastics, opts for locally sourced ingredients to reduce carbon footprints, and focuses on whole, unprocessed foods to minimize waste. She crafts each dish with the goal of showcasing that vegan food can be both delicious and environmentally conscious.


Related: 'A Lobstrosity': Social Media Is Losing It Over Martha Stewart's Latest Meal PostingPriyanka's commitment to sustainable cooking and her vibrant culinary style earned her a spot—and subsequently a win—on a Food Network cooking show in 2017. This victory served as a launching pad for her broader mission to advocate for sustainable living through food.""Winning on Food Network was a validation, a way to show a large audience that sustainable cooking can be vibrant, diverse, and delicious,"" she said. It was the beginning of a larger dialogue about the intersection of cuisine and sustainability.Priyanka's victory catapulted her into the culinary spotlight, allowing her to further her mission of sustainable, vegan cooking and publish a cookbook, The Modern Tiffin.


Parallel to her success in publishing, Priyanka has built a robust presence on social media, where she extends her culinary influence beyond the printed page. Her Instagram, YouTube, and blog are not just showcases for her recipes but also platforms for education and engagement on sustainability in the kitchen. She regularly shares tips on reducing food waste, choosing sustainable ingredients, and preparing meals that are both delicious and environmentally friendly.""Social media has been an invaluable tool for connecting with like-minded individuals and spreading the message about sustainable living,"" Priyanka said.Related: Jon Taffer's 10% Rule Is the Productivity Hack That Could Change Your LifeHer posts, often accompanied by vibrant photos and engaging videos, attract a diverse audience eager to learn about eco-friendly cooking practices. Through these interactions, Priyanka has cultivated a community that is as passionate about sustainable living as they are about culinary arts.


Priyanka's approach to engagement extends beyond digital platforms. She participates in public speaking engagements and cooking demonstrations, where she shares her story and culinary philosophy in person. These interactions enhance her community connections, providing more opportunities to advocate for a sustainable lifestyle.""It's about more than just food,"" Priyanka said. ""It's about making a difference in the world through the choices we make in our kitchens.""With every dish and blog post, Chef Priyanka leverages her platform to connect with and educate her audience about sustainable practices. Whether it's through Instagram stories, detailed blog posts about reducing kitchen waste, or public speaking engagements, she emphasizes the impact of individual choices on global sustainability. Her ability to weave storytelling with practical culinary advice has launched her into a relatable and inspiring figure in the food community.For those looking to turn their culinary passions into careers, Priyanka advises embracing their unique journey.


""Believe in your unique path. The road less traveled can be daunting, but it is ripe with opportunities to carve out a niche that is authentically yours,"" she said. Resilience, self-promotion, and authenticity are her cornerstones for building a brand that resonates with personal and professional values.Since her breakthrough on Food Network, Chef Priyanka Naik has adhered to these powerful principles for success:Embrace your unique background to stand out in a crowded field. Chef Priyanka's path from tech to the kitchen underscores the importance of pursuing your passions, no matter how unconventional they may seem.Make your values a cornerstone of your business. Educate your audience about the impact of their purchasing choices, whether that be for environmental, social, or ethical issues. This commitment can transform customers into advocates for your brand.Leverage social media. Use platforms like Instagram, YouTube, and LinkedIn not just to showcase products but also to connect with and educate your audience. A strong online presence can turn followers into a community.Feedback is crucial, whether it comes through social media or direct customer interactions. Use insights from your audience, such as in online reviews, to refine your approach and offerings.Related: The Top 15 Fast Food FranchisesSubscribe to Behind the Review for more from new business owners and reviewers every Thursday. Available on: Spotify, Apple Podcasts, Google Podcasts, Pandora and Soundcloud.


Editorial contributions by Charlotte Che and Kristi Lindahl.
"
3,Remove Ads and Protect Your Privacy When Browsing Online for Work and at Home,"Apr 24, 2024",Entrepreneur Store,https://www.entrepreneur.com/science-technology/remove-ads-and-protect-your-privacy-when-browsing-online/473117,"
Entrepreneurs and business leaders rely heavily on internet access and seamless user experiences to keep up with operations efficiently and productively. Uninvited advertisements and malware can get in the way of an easy workday and threaten your bottom line if left unchecked. That's why this limited-time deal is worth checking out.Only from April 22nd through 11:59 p.m. PT on the 30th, you can get an AdGuard Family Plan lifetime subscription for just $24.97 (reg. $79). One of the top data privacy tools on the market, AdGuard features ad-blocking and malware protection software that's among the best in the world. This deal is the best price for AdGuard Family on the web.AdGuard is highly recommended by critics and users alike. It comes with an excellent 4.7/5-star average on Trustpilot and 4.6/5 stars on G2. This offer gets you access to its services on up to nine devices.AdGuard Family is compatible with a range of popular devices, including those that run on Android and iOS operating systems. The lifetime subscription model of this deal enables professionals to use it to ensure protection for good without having to worry about keeping up with recurring payments.For those using it to monitor family computers at home, AdGuard Family's parental control features come in handy. They allow you to restrict certain inappropriate content and ensure a safe browsing experience for everyone in your household.Don't forget that from April 22nd through 11:59 p.m. PT on the 30th, you can get an AdGuard Family Plan lifetime subscription for just $24.97 (reg. $79).StackSocial prices subject to change.
"
4,Snag Microsoft Office for $30 During This Week-Long Price Drop,"Apr 23, 2024",Entrepreneur Store,https://www.entrepreneur.com/science-technology/snag-microsoft-office-for-30-during-this-week-long-price/473061,"
Does your business have a reliable suite of office programs and tools to serve your basic content creation and communication needs? If not, then you're not setting yourself or your team up for success. Lock in a tried-and-true suite of such programs for a staggeringly reduced rate for a limited time only.From April 22nd through April 30th at 11:59 p.m. PT, you can get Microsoft Office 2019 for Mac or Windows at a reduced rate of just $29.97 (reg. $229).Each option features a one-time download key with a lifetime license to live on that computer indefinitely. Both license options come with these well-respected and long-used programs:Microsoft Word 2019Microsoft OneNote 2019Microsoft Outlook 2019Microsoft Excel 2019Microsoft PowerPoint 2019The Windows version also includes Publisher 2019 and Access 2019, and the Mac version includes Teams Classic 2019. Each deal also features access to what's known as ""the best customer support"" for life.Windows users will need to use at least Windows 10 or Windows 11 as operating software, each of which is available for remarkably low rates across the web. Mac users will need at least Montery (version 12) installed, and of course, they could use Ventura or Sonoma, too.This deal is rated an average of 4.5/5 stars by verified purchasers. One recent five-star review by a buyer named Roger Mitchell explains the value well, stating, ""The software is very usable still despite being nearly 5 years old. The support team were very helpful and quick to respond with my question.""Set your team or self up with a reliable Microsoft Office product. Get a lifetime license at the following rate from April 22nd through April 30th at 11:59 PM PT:



Microsoft Office Professional Plus 2019 for Windows, on sale for $29.97 (reg. $229).Microsoft Office Home & Business 2019 for Mac, on sale for $29.97 (reg. $229).StackSocial prices subject to change.
"
5,How to Use Tech to Save Your Restaurant Money and Help Turn First-Time Patrons Into Loyal Customers,"Apr 23, 2024",Shawn P. Walchef,https://www.entrepreneur.com/science-technology/how-the-right-tech-will-save-your-restaurant-money/472693,"
William Connors, the Director of IT at Noble Restaurant Group, is helping lead a transformative journey in restaurant management by embracing and implementing cutting-edge technology solutions. The London-based Noble Restaurant Group owns and operates Chotto Matte, Alley Cats Pizza, Steak and Company, Angus Steakhouse, Ochre, and Muriel's Kitchen.Related: Chef Says This Is the No. 1 Thing That Makes a Restaurant Successful or NotConnors says the integration of Toast's POS system was seamless. ""Putting in a new till system can be very disruptive,"" he told Restaurant Influencers host Shawn Walchef of Cali BBQ Media. ""But the system was a resounding success, and all of a sudden, we had benefits that weren't even really expected.""



Connors has added Toast services to all of the restaurants within the Noble Restaurant Group. His team has continually improved their tech stacks as new technology becomes available.Related: The Philly Cheesesteak Was Invented At This Spot in 1930. Here's Why Fans Can't Stay Away 90 Years Later.


The Noble Group also works to incorporate personalized experiences into restaurant management through Tenzo, a software that consolidates labor, stock management, and sales analytics.By harnessing the capabilities of tech like Tenzo, they can offer tailored and predictive services to patrons which will separate them from the increasing competition within the industry.Related: 'Don't Be Afraid to Do Something That Nobody Understands': How This Entrepreneur Re-Invented His Career and Found Happiness""Tenzo basically consolidates your labor, your stock and your e-pos sales all into one platform,"" explains Connors. ""Everyone is going to be better in the long run, because with the competition, everyone ups their game quite a bit.""


""Toast is a good product, it's reliable,"" he continues. ""Everybody wants to modernize and run a successful business, but I think Toast, especially in the UK, they're riding a wave of positivity.""About Restaurant InfluencersRestaurant Influencers is brought to you by Toast, the powerful restaurant point-of-sale and management system that helps restaurants improve operations, increase sales and create a better guest experience.Toast — Powering Successful Restaurants. Learn more about Toast.
"
