,title,date,author,link,text
84,9 SEO Tips to Help You Rank No. 1 on Google in 2024,"Feb 16, 2024",Nick Zviadadze,https://www.entrepreneur.com/growing-a-business/9-seo-tips-to-help-you-rank-no-1-on-google-in-2024/468807,"
Many entrepreneurs and small business owners struggle to reach the top spot on Google after the Helpful Content Update. However, the consequences of not ranking well can be severe, from making your website hard to find to limiting your potential growth.Remember that, in 99% of cases, people click on the top results on Google. This means that if you're not positioned there, your competitors will get all the attention and you'll miss out on valuable customers.Thankfully, there's a way to navigate this challenge. In this article, I'll share nine SEO tips to help you avoid common SEO mistakes and catapult your business to the top position on Google.



Related: 5 Simple SEO Strategies to Improve Your RankingsWhy is SEO important?Search engine optimization (SEO) refers to optimizing your website and content to rank higher on search engines. When potential customers search for a service or product that you offer, SEO ensures you're their front-and-center option. It makes your website more visible, drives more traffic and gives you a chance to convert visitors into customers.


But it's not just about visibility — SEO helps build your online presence and credibility. It's a dynamic strategy that adapts to evolving customer needs, offering a cost-effective marketing approach and delivering measurable results.9 SEO tips to help you rank #1 on GoogleHere are the most important practices you need to follow to propel your website to the number one spot on Google:1. Do comprehensive keyword researchAlthough everybody understands how important keyword research is, not many people do a good job at it. They grab a handful of keywords and create content around it without diving deeper into the research.A better approach, however, is to find as many niche keywords as you can — let's say 200-300 keywords that are relevant to your business. If you identify 300 relevant keywords, you might uncover 20 excellent opportunities to rank first. If you settle for just 20 keywords, you'll get one or two opportunities at best. The math is simple — the more keywords you discover, the more chances there are to strike SEO gold.


2. Update old contentGoogle wants to provide its users with the most recent and relevant information. That's why it rewards up-to-date SEO content with high rankings.If you aim for that number one spot, you must ensure your content stays relevant and valuable. The best way to do that is to regularly update old content to keep it optimized and evergreen.Look at what your competitors are doing and one-up them. This will keep your audience hooked and signal to Google that your website provides quality content.3. Use the reverse outreach techniqueThe reverse outreach technique is a link-building strategy designed to attract a significant number of backlinks. The goal is to create quality content that earns backlinks naturally, making link-builders come to you instead of the other way around.


The best way to do that is to create content with original data that people can use as a source. Doing this makes your content a valuable resource that naturally attracts backlinks without the need for active link-building strategies such as guest posting.4. Optimize your content for EEATGoogle uses EEAT (experience, expertise, authoritativeness and trustworthiness) to determine whether search engine results display relevant information. Although it is not a ranking factor, it is a good indicator of the quality of your content.You can optimize your content for EEAT by:Including an author bioLinking to reputable sourcesShowcasing your social media presence, certifications and experienceInterlinking your contentRelated: Why Producing High-Quality Content Matters for Your Business


5. Steal competitor backlinksOne of the possible reasons why your competitors rank well on Google is because they have quality backlinks. In turn, what you can do is run their websites through Ahrefs, SEMrush or another SEO tool you prefer to find their backlinks.Reach out to the individuals or websites already linking to your competitors, and persuade them to link to your content. Your message should include some kind of incentive or value for their website to increase your chances of success.6. Make your content skimmableWe live in a world of information overload, which is why most people won't likely read your content from start to finish. Instead, they scan the text for specific information.That's why it's important to make your content skimmable. People who want to read the entire blog will do so, while the ones seeking information will be able to do that too.


Higher user retention on your site will then signal to Google that your content is valuable.To help make your content skimmable, you should break down your content into bite-size paragraphs, use many images, add bullet points and include other elements that improve readability and make your text user-friendly.7. Use optimal URL slugsOptimizing URL slugs can improve your click-through rates. A short, neat URL always gets more clicks than a long URL that copies your headline.For example, if your blog post talks about the best quick home workouts, www.example.com/best-quick-home-workouts is a better option than www.example.com/blog/best-home-workouts-to-lose-weight-quickly. It's short, relevant and invites more clicks.


8. Compress your imagesCompressing your website's images is like shedding unnecessary baggage for a smoother online experience. When you compress images, you reduce their file sizes, which makes your website load faster.Most visitors will leave your website if it loads slowly, which can hurt your rankings. So, this isn't just a technical tweak — it's a great way to improve the user experience.Related: How to Improve Your Website's Speed9. Use CTAs in your blog postsAlthough this isn't necessarily an SEO tip, many people forget to include calls to action (CTAs) in their content. Remember that the main goal of SEO for small businesses is to attract visitors and drive revenue.


So, including CTAs throughout your content serves as a roadmap, directing readers to the next steps in the buyer's journey. Whether it's exploring your products, signing up for newsletters or downloading a valuable resource, effective CTAs transform casual readers into active participants, guiding your SEO efforts.Navigating the SEO world after the Helpful Content Update can be challenging for small businesses. Although some traditional SEO techniques may not work, these nine SEO tips should help you turn things around and increase your chances of ranking first on Google.Use these tips to stay ahead of the competition in 2024, and watch your business thrive.
"
85,6 Instagram Story Strategies That Will Grow Your Following,"Feb 16, 2024",Dmitrii Khasanov,https://www.entrepreneur.com/growing-a-business/6-instagram-strategies-that-can-grow-your-reach/469036,"
Instagram has become indispensable to any business's digital marketing strategy, boasting over 1.3 billion active users, 3.76 billion daily visits and 500 million daily story users. This platform provides a substantial opportunity for businesses to engage with their target audience and enhance their return on investment (ROI). Despite its popularity, the competitive environment on Instagram can make it challenging for brands to stand out and make a significant impact.As more retail brands seek attention on the platform, standing out and making a meaningful impact can be challenging. Social media managers and marketers can employ several strategies to scale reach and, consequently, enhance ROI on Instagram. How? Let's figure it out together.The initial crucial step is to establish clear goals for your business to maximize the return on investment of Instagram stories. Define what you aim to achieve with Stories — driving more traffic to your website, increasing brand engagement, or generating buzz around the brand. Understanding your objectives, target audience, and engagement strategy is paramount. Create specific and measurable goals for each campaign, breaking them down into manageable steps to track success.



For instance, if your goal is to gain more followers, set a realistic target, such as reaching 10,000 in the next six months, by targeting individuals interested in your business, brand, category, or industry. It's extremely important to set achievable goals, allowing you to celebrate milestones as you reach them.So, what is the magic behind maximizing your ROI? Unfortunately, there are no special secrets or hidden formulas; all a business can do is focus on producing quality content and continually test new approaches. However, these strategies might accelerate the performance of your stories.


Related: 3 Ways to Use Instagram Stories to Boost Your Brand1. Provide more informationInstagram provides a unique way to boost your brand and turn visitors into buyers effortlessly by using the ""swipe up"" feature. Simply add an attractive image and a call to action and invite your audience to visit a link. When people swipe up on your Instagram Story, they'll be directed to the page you want them to explore. It's a simple yet effective way to engage and potentially convert your audience.2. Show that you are liveLive stories have a unique appeal as they draw your audience in by sending automatic notifications to your followers. When you decide to go live, generating buzz and excitement around something happening at the moment is essential. In this case, your business may create a sense of urgency and encourage active participation from your audience.Related: How Instagram Stories and Instagram Live Help You Interact with Your Customers


3. Storytelling still rocksCreating visual stories on Instagram is powerful for building brand awareness. Visuals are more engaging than text, effectively reaching a broader audience. With its focus on visuals, storytelling on Instagram helps build an emotional connection with viewers and sparks their curiosity to learn more about your brand. Through this approach, you can convey your brand's story and values compellingly, strengthening your connection with the audience.4. Collaborate with influencersInfluencer marketing campaigns have the potential to boost brand awareness and drive sales growth significantly. While reaching out to influencers directly on Instagram is an option, I would recommend using an influencer marketplace for more efficient and timely discovery of the best influencers for your campaign. Remember that you do not need to collaborate with celebrities and Instagram superstars; instead, consider micro and nano influencers as they make waves in 2024.Related: How Many Followers Do You Need To Make Money on Instagram?5. Do not be afraid of paid advertisingInstagram's advertising platform is a potent tool for expanding your brand's reach and engagement on the platform. With the average user spending 30 minutes daily on Instagram and 63% of American users checking the platform at least once a day, it offers a strategic means to maximize your ROI and attract attention to your paid content. Consistent posting plays a crucial role in increasing visibility. The more frequently you post, the higher the likelihood of appearing in the Explore feed, being featured on other accounts, or ranking highly in searches for keywords and hashtags you commonly use. Establishing a regular posting cadence is essential to maintaining audience interest. Posting consistently every week has the potential to double your followers compared to those who post less frequently than once a week.


6. Ask your followers and get engagementRemember that marketing is about understanding your audience's likes and dislikes, and Instagram Stories can help you learn more about them. Creating polls and asking questions in your stories prompts users to interact by clicking on them. These interactions provide valuable insights that can improve your business and marketing strategies. You can also use these features to effectively advertise new products, making it a versatile tool for engaging with your audience and conducting market research.
"
86,The Side Hustle She Started in Her Princeton Dorm Room Led to a $510 Million Business: 'Don't Take No for an Answer',"Feb 16, 2024",Amanda Breen,https://www.entrepreneur.com/starting-a-business/how-a-dorm-room-side-hustle-led-to-a-510-million-business/469736,"


  The Side Hustle She Started in Her Princeton Dorm Room Led to a $510 Million Business: 'Don't Take No for an Answer'
  
    Danielle Cohen-Shohet launched a successful side hustle in college, combining her love for design and entrepreneurship, which ultimately led to GlossGenius.
  





                  By          
            Amanda Breen
          
                                                    •
            
            
              Feb 16, 2024
            




          Share        


Copy


 






      Key Takeaways    



        Challenges in managing a client-first business and a passion for solving them with technology inspired Cohen-Shohet to found GlossGenius in 2015. 
      


        GlossGenius supports over 65,000 businesses, focusing on customer-centric enhancements like GeniusAI and Genius Loans.
      












This Side Hustle Spotlight Q&A features Danielle Cohen-Shohet, CEO and founder of GlossGenius, an all-in-one booking, payments and point-of-sale solution that helps beauty and wellness professionals drive bookings and grow their business.Image Credit: Courtesy of GlossGenius. Danielle Cohen-Shohet.When did you start your side hustle in the self-care industry, and what inspired it?



My interest began when I did freelance makeup artistry out of my Princeton University dorm room. I've always had a passion for design and art, and for as long as I can remember, I have been entrepreneurial. I have a tendency to want to become an expert at something I do, so when I became interested in makeup, I took it much further than most and started a side hustle in college. During that time, my twin sister and I also pursued a digital receipts payments venture. Those were both enriching experiences; however, I had no idea at the time that I'd later take a leap and combine those interests to start a software payments company now worth over $510 million.Related: These Sisters Started a Side Hustle After a 'Light Bulb' Moment Standing in Line for Coffee — Now Their Business Has Done $100 Million in Total Sales


What were some of the first steps you took to get that side hustle off the ground? I learned voraciously, strived to be the best and just rolled up my sleeves to start. Back when I was in college, makeup artistry tutorials were just starting to be democratized on YouTube, so I dove into them and just got my hands dirty practicing. I drilled college classmates and friends for feedback and just kept getting better from there. It sounds simple, but these first steps helped me succeed faster.Were there any challenges that came with running the side hustle? If so, how did you navigate those? Anything that you can grow from will have challenges. While doing makeup artistry, I experienced first-hand the pain points that many of our GlossGenius business customers face today: time management, coordinating schedules and growing a client base without the proper infrastructure, just to name a few. I dove headfirst into solving these challenges with manual spreadsheets and tools that I would hack together, which sparked the idea for what would later become GlossGenius. I wanted to provide other business owners with best-in-class technology and infrastructure that would make it easier to run a business.


How long did it take you to begin seeing consistent monthly revenue? On average, how much revenue did it bring in? For me, it was originally more so about satisfying a creative interest than revenue. It took several months before I started to earn real revenue, and it was meaningful enough to cover a lot of living expenses while in college.Related: She Spent Her Honeymoon Working on a Side Hustle. It Raised $35 Million and Counts Celebrities Among Its Investors.When did you decide to transition into startup mode and found GlossGenius, and what motivated that move?


After understanding the problems facing service-based self-care businesses, I decided to start a software company that would solve many of these problems with technology. I had graduated college and started a career in finance at Goldman Sachs, but I kept thinking about how to help self-care entrepreneurs run better businesses. It was really hard to manage a client-first business when there were so many scattered, disconnected systems.I had taught myself how to code, so I felt as if I could do anything. After getting a couple of years of experience at Goldman, I took a leap and left to start GlossGenius. Given the industry experience, my technical background and the digital receipts payments company I had pursued with my twin sister — who is my partner and chief business officer at GlossGenius — it just felt obvious to put all of this into a software payments company focused on the self-care industry.Image Credit: Courtesy of GlossGenius. Danielle Cohen-Shohet and Leah Cohen-Shohet.How have you approached scaling the company? 


Before we could even think about scaling the company, we first focused on solving a real problem that is a critical part of our customers' lives. There is so much opportunity to empower entrepreneurs to run, manage and scale their own local businesses. Our platform impacts customers' livelihoods, and our solutions are an important part of their everyday lives. That focus was foundational to have in place before scaling.With that in place, one of the things I did early on was learn everything about the business: Building products, launching products, recruiting, marketing, closing partnerships, handling customer support tickets and much more. Having a deep knowledge of all parts of the business has been important to scaling the company as it has helped me understand what excellence looks like in all parts of the business. With that type of understanding, I could surround myself with fantastic people and leaders to take teams even further.Related: The Sweet Side Hustle She Started 'On a Whim' Turned Into a $20,000-a-Month Income Stream: 'It's Simple, It's Affordable and It's Fun'Because there are so many problems to solve for businesses, we also had to remain disciplined in solving the most important problems for customers first. So as we've scaled, we have continued to flex discipline and only pursue initiatives that create value for our customers. We say no often and are thoughtful about how we sequence what we pursue. We obsess over our customers' needs and absorb their feedback like a sponge, as it plays a key role in driving GlossGenius' growth and new products. Keeping the connection with our customers as we've scaled is something I'm really proud of.


When you look to GlossGenius's future, what are you most excited about? We are creating a gateway for entrepreneurship, giving self-care business owners the infrastructure to scale their businesses and empower more entrepreneurship. While we've already built a platform that is mission-critical to our customers, there is still so much for us to do to achieve our mission. With the responsibility of serving over 65,000 businesses and powering billions of dollars of transaction activity, we are working to make our software products more intuitive and magical for customers.The recent launch of our GeniusAI, a generative AI-powered tool, is a good example of this. This tool helps beauty and wellness practitioners draft ready-made, personalized email marketing campaigns, enabling users to simply enter a few notes and receive messages tailored to their goals and brand. In an industry that has traditionally lagged in technological adoption, it is exciting that we get to be the company that puts this in customers' hands. Another recent GlossGenius product launch is Genius Loans — fast, flexible financing that helps customers grow their businesses. Products like this underscore our support of customers with what they need, when they need it — well beyond what's typically expected from SaaS platforms.What are some of the biggest lessons you've learned over the course of your entrepreneurial journey? 


I've learned that true success means helping others succeed. I am fortunate to lead a company that's so tightly aligned with our customers' success. With the opportunity to build and lead GlossGenius, I've had a masterclass in learning the special framework of how to make decisions that build long-term value for customers.Related: She Started a Furniture-Flipping Side Hustle to Pay Off a $10,000 Dental Bill. It Surpassed Her Full-Time Job's Income Within a Year — Earning Up to $37,000 a Month.Do you have any advice for people interested in starting a side hustle or business of their own? Be fearless. Don't take no for an answer. And importantly, surround yourself with like-minded people. You might find this through a community like the one we've created for entrepreneurs with GlossGenius, or you might look to people closest to you. I've had many close supporters along the way, but my strongest collaborator is my twin sister, Leah. She has been a thought partner from day one and has played an invaluable role in expanding the company into what it is today. So surround yourself with people who get you.
 "
87,A Lifetime Subscription to This AI-Powered Automation Tool Is Only $50 for Presidents' Day,"Feb 16, 2024",Entrepreneur Store,https://www.entrepreneur.com/science-technology/a-lifetime-subscription-to-this-ai-powered-automation-tool/469815,"
For generations, entrepreneurs and business leaders have paid assistants to help automate and streamline what can become an overwhelming number of daily responsibilities and tasks. For those who are up-and-coming or well-established, this sort of outsourcing can sometimes be tough to afford. That's a gap where AI is stepping in to add some value.During a limited-time Presidents' Day price drop, you can get a lifetime subscription to Taskio: The Ultimate AI Productivity Tool for just $49.99 (reg. $540). Described as the ""ultimate AI productivity tool,"" Taskio is designed to automate tasks that can help and support virtually any modern entrepreneur or business leader.Taskio has an AI-driven chat feature that can answer questions and support research-based initiatives in real time. Its intuitive network can also create content tailored to specific audiences and brands.



Taskio comes with features for generating custom imagery and copy for any content you need to support and grow your business. In addition to being able to create content that converts and connects to user bases, Taskio can embed it with helpful keywords to help its SEO value.For entrepreneurs working across borders, Taskio can provide real-time translation. For important meetings that you need to refer back to, Taskio can beat any human with its effortless speech-to-text transcription abilities.


This deal is rated an average of 4.3/5 stars by verified purchasers. One recent five-star review describes it as ""very useful for small businesses."" Discover why today.During a limited-time Presidents' Day price drop, you can get this exclusive deal for a lifetime subscription to Taskio: The Ultimate AI Productivity Tool for just $49.99 (reg. $540).StackSocial prices subject to change.
"
88,Get a Full Suite of Microsoft Office for $30 During This Presidents' Day Event,"Feb 13, 2024",Entrepreneur Store,https://www.entrepreneur.com/science-technology/get-a-full-suite-of-microsoft-office-for-30-during-this/469551,"
Setting up an office is an investment that you should temper based on your specific needs and budget. There are a ton of high-performing programs out there that are just a few years old, and while being priced lower than their newer-age counterparts, they can deliver what most workers need in a given day. For example, most of us can accomplish everything we need to work with Microsoft Office 2019, and all of us can save on it.During a special Presidents' Day price drop, you can get Microsoft Office Home & Business 2019 for Mac or Microsoft Office Professional Plus 2019 for Windows for just $29.97 (reg. $229) through February 19 at 11:59 p.m. PT.Each of these licenses includes:Excel 2019PowerPoint 2019Outlook 2019OneNote 2019Word 2019The Windows version also comes with Publisher 2019 and Access 2019, while the Mac version includes Teams Classic 2019. With your license, you get lifetime access to the full suite on the one computer you can install it on. This deal also comes with access to free customer service for life, as well as instant download and delivery upon purchase.For entrepreneurs looking to get to work with an affordable and reliable suite of programs, keep in mind that this deal is rated an average of 4.6/5 stars by verified purchasers. Plus its pricing is quite advantageous.



During a special Presidents' Day price drop, you can get the following versions when you order through February 19 at 11:59 p.m. PT:Microsoft Office Home & Business 2019 for Mac for just $29.97 (reg. $229).Microsoft Office Professional Plus 2019 for Windows for just $29.97 (reg. $229).StackSocial prices subject to change.
"
