,title,date,author,link,text
0,Stanford Professors On the Counterintuitive Strategy That Helps Google Hire Top Talent,"Apr 8, 2024","Robert I. Sutton and Hayagreeva ""Huggy"" Rao",https://www.entrepreneur.com/growing-a-business/how-google-attracts-top-talent-with-this-counterintuitive/470067,"
Everyone knows the exasperation of unnecessary friction.We've all navigated systems that create maddening ordeals rather than give us simple answers, services, or refunds. We've sat through endless meetings with blabbermouths and ill-defined agendas. We've pulled our hair out over rules, procedures, traditions, and technologies that once made sense, but are now antiquated, pointless, and inefficient. These are all soul-crushing forms of organizational friction that make it difficult to do simple things. And as professors at Stanford's School of Engineering and Graduate School of Business, we spent the last seven years researching the causes and cures for these problems.But one of our biggest discoveries surprised us. It turns out that friction isn't always a problem. In fact, sometimes it can be a solution.



      The rest of this article is locked.
    

      Join Entrepreneur+ today for access.
    





      Subscribe Now
          



      Already have an account? Sign In


 "
1,3 Customer Service Trends to Follow this Year,"Apr 4, 2024",Michelle Van Slyke,https://www.entrepreneur.com/growing-a-business/3-customer-service-trends-your-business-needs-to-follow/471717,"
Customer service has never been more important. Today's customers not only desire fast and seamless service but also expect a personalized and delightful customer experience (CX). To add even more to the mix, the stakes are high for businesses that don't measure up. According to a recent PwC report, one-third of customers would leave a brand they love after one bad experience.The good news is that succeeding in customer service can reap incredible benefits for businesses. In fact, 86% of customers are willing to pay more for a great CX, per the Tempkin Group. Due to these factors, customer service has become one of the top priorities for businesses in 2024. Here are three CX trends every business leader should buy into to help them excel in 2024.The evolving role of self-service technologyToday's customers expect fast, seamless and convenient service. One recent study found that half of all customers will not wait more than 3 minutes in a store. It's unrealistic to expect businesses to provide instant, in-person service all the time – that's where technology has to play a role. Gone are the days when these technologies were viewed as taboo. On the contrary, many of today's customers prefer customer service, which technology supports in some way. Per a recent study by Aspect, 73% of customers want the ability to solve product or service issues independently. Even many small businesses and franchises should invest in technologies like self-service kiosks or technology tools that support customer service efforts.



If your business hasn't invested in self-service technology for customers, 2024 might just be the year to do so. A great place to start is with self-service kiosks onsite. This is a tool that The UPS Store recently introduced, with over 1,800 self-service kiosks now installed at franchise locations across the country. These kiosks streamline online returns and item drop-offs for The UPS Store customers and offer an option to get in and out of the store faster than ever. Whether self-service works into your business plan or not, technology will be a key player in customer service in 2024.Related: 10 Reasons Why Good Customer Service Is Your Most Important Metric


Connecting with Gen-ZYou may not realize this, but Gen Z is growing up fast. The oldest members of this generation will be much closer to 30 this year than 20. With Gen Zers becoming a bigger sect of most companies' customer base, one of the biggest CX trends in 2024 will be the importance of appealing to this group. So, where should you start? One place is on social media. As the first actual digital-native generation, Gen Zers are often most comfortable interacting with companies on social media. A survey by Hubspot found that 90% of Gen Z expect brands to be active on social media, and 13% claim social media as the preferred form of customer service. If you're not on social media, 2024 is a great year to use it.This shouldn't just be reserved for large national brands; even small businesses should find ways to be active and interact with younger customers on social media. LinkedIn or Instagram are great places to start for most companies, but consider where you feel most comfortable or which platform your customers are most active on. Authenticity must be prioritized in social media customer service, especially when interacting with Gen Z. In addition to responding to customer needs, being active on social media will allow your company to build more trust with Gen Z and interact with customers more often.Related: What You Must Know About the Next Generations of ConsumersHarnessing customer insightsOne CX trend that has persisted in its importance is using customer service interactions for their insights. While customer service should prioritize the customer experience, all companies should also look for ways to learn from these interactions. This can be achieved through high-tech and low-tech means. For example, businesses can use data intelligence software to get real-time insights or social media analytics to collect information. Plenty of data intelligence vendors can offer real-time insights based on customer touchpoints. On the other hand, businesses can also tap their customer service employees for their insights following a customer interaction.


Employees often have some of the best feedback to offer since they interact daily with customers. All businesses should view their customer touchpoints as an opportunity to not only make their customers happy but also as a chance to learn and adapt for the future. In 2024, you should consider finding ways to better obtain customer insights, whether that be through investing in data analytics or looking for insights from your employees.Providing great customer service should always be a priority for business leaders, but it continues to be more important each year. As we move through 2024, be sure to keep tabs on customer service trends, especially when it comes to the importance of self-service, appealing to Gen Z and harnessing customer insights.
"
2,Save on Office Supplies With This $25 Sam's Club Membership,"Apr 4, 2024",Entrepreneur Store,https://www.entrepreneur.com/growing-a-business/save-on-office-supplies-with-this-25-sams-club-membership/471994,"
Running or managing a business can be tough, especially because you're constantly trying to keep your budget reasonable while also making the office a comfortable and healthy place to work. To help keep the office stored with food and quality supplies, consider saving on shopping with a membership to a proven wholesale club.For example, you can get this Sam's Club one-year membership with auto-renew, on sale for $25 (reg. $50). Described as a ""one-stop shopping location,"" Sam's Club has a fully-stocked grocery store, home goods, a wealth of clothing for everybody in the office or family, electronics that can help with a range of work, appliances, and more.Sam's Club is known for its high-end variety. Running on a limited-item business model, it promises that every product you find there is handpicked because it is of a quality that represents an elevated taste. This Sam's Club membership also comes with a variety of perks including instant savings, your own Sam's Club Mastercard®, members-only savings on gas, as well as access to Sam's Club's Tire and Battery Center, plus more.This limited-time deal is rated an astonishing average of 4.8/5 stars from more than 1,745 reviews. One recent five-star reviewer wrote, ""I had purchased this membership two years ago for our family at a great price from StackSocial. I returned again this year for the same deal!""Discover amazing savings and maximize your budget with this limited-time Sam's Club membership while it's available for 50 percent off.You can get this Sam's Club one-year membership with auto-renew, on sale for $25 (reg. $50).StackSocial prices subject to change.
"
3,The Philly Cheesesteak Was Invented At This Spot in 1930. Here's Why Fans Can't Stay Away 90 Years Later.,"Apr 2, 2024",Shawn P. Walchef,https://www.entrepreneur.com/growing-a-business/heres-where-the-philly-cheesesteak-was-invented/471584,"
At the heart of Philadelphia's culinary legacy stands Pat's King of Steaks, a landmark synonymous with the iconic Philly cheesesteak.Frank Olivieri, the executive chef and owner, traces the origins of this beloved sandwich to a serendipitous moment when his Uncle Pat grew weary of the daily hot dog fare and improvised with ribeye trimmings.""One day my uncle Pat got so tired of eating hot dogs he said to my grandfather, go down to the butcher and see what trimmings he has from the ribeye and bring it back, and we'll make that sandwich that we always like to make,"" Olivieri told host Shawn Walchef of Cali BBQ Media. That sandwich, cooked on the same open flat top as the hot dogs, became what we know now as the Philly cheesesteak.



Related: Chef Says This Is the No. 1 Thing That Makes a Restaurant Successful or NotFor Frank Olivieri, building connections and fostering hospitality is a family tradition deeply ingrained in Pat's King of Steaks. Inspired by his uncle's outgoing nature, Frank emulates Pat's approach of rubbing elbows with Philadelphia's elite and Hollywood stars — all while promoting the business. Olivieri explains, ""What I did was I found a way to let the business work for me rather than me work for the business.""


Philadelphia's legendary hospitality is evident in the enduring legacy of Pat's King of Steaks. Despite the city's infamous weather, loyal patrons brave the elements to savor the iconic cheesesteaks. ""Hospitality is somewhere between going to the French Laundry and that hot dog joint in Chicago where the women yell at you all the time,"" Olivieri laughs.Related: How The Nourish Spot Is Building a Legacy of Healthy Eating and Community ConnectionAbout Restaurant InfluencersRestaurant Influencers is brought to you by Toast, the powerful restaurant point-of-sale and management system that helps restaurants improve operations, increase sales and create a better guest experience.Toast — Powering Successful Restaurants. Learn more about Toast.
"
4,How An Unmarked Dive Bar in Vegas Became One of America's Must-See Destinations — Within 3 Years of Opening,"Apr 2, 2024",Kristen Bayrakdarian,https://www.entrepreneur.com/growing-a-business/how-an-unmarked-dive-bar-in-vegas-became-one-of-americas/471448,"
You might not guess that in Las Vegas — a place known for luxury resorts, opulent casinos, and just about any amenity imaginable — one of the city's most beloved establishments is in a single-story building a six-minute drive from the Strip.There's a sole neon sign in the window that says, simply, ""Open."" But inside is a bit of magic: a bar, called The Silver Stamp, that makes just about everyone feel like they're back home, no matter where they're from. And in a city like Las Vegas, that's a high-wire act. ""It's a transient city,"" says Andrew Smith, one of The Silver Stamp's co-owners. ""We have so many different people coming here."" And not just locals. Tourists seek the bar out in almost equal measure.The Silver Stamp has become so beloved that when Entrepreneur held a vote to select America's favorite mom-and-pop shop™ (out of 150 of the most popular small businesses in the country, selected in partnership with Yelp), the divef bar won first place.



Related: These Are America's Favorite 150 Mom & Pop Shops™, According to Yelp and EntrepreneurThis is all the more impressive given that Smith and his co-owner and life partner, Rose Signor, only opened the business three years ago, in February 2021. In that short time, they've paid off their two small investors, the business has averaged 23% revenue growth year over year, and by popular demand, extended their hours from 1 p.m. to 1 a.m.So what is the Silver Stamp getting right?""A lot of people say, 'I don't know what it is, but I just feel so comfortable in your space,'"" Signor says.Comfort — it's no small thing. It's possibly the most important feeling a mom-and-pop shop can evoke. But it's also mysterious. You can't simply buy comfort. You can't follow a checklist to create it. You have to understand, deeply, what it means to you.


Image Credit: Mike BellemeSignor and Smith met in 2017, when she hired him to work at Atomic Liquors, the oldest freestanding bar in Las Vegas. ""It was an instant connection,"" Smith says. They'd both been in the service industry for years — Smith had managed a nearby bar before coming to Atomic Liquors — and they both shared an interest in the craft beer industry. Smith had planned to move to the Northwest at some point, but when he met Signor, he had a good reason to stay. And Signor had actually moved from Las Vegas to Seattle back in 2011 — only to move back a year later. She missed Las Vegas and the desert, and was inspired to infuse Sin City with some of the wholesome beer culture she loved.But Signor and Smith's connection went deeper than a love of pilsners and IPAs. They'd grown up in small towns on opposite sides of the country — Peru, New York, and Yuma, Arizona, respectively — that instilled in them a strong sense of community and, perhaps more importantly, empathy. ""I remember seeing situations [growing up] where I felt truly bad for people getting treated poorly and embarrassed because they didn't have enough money,"" says Signor.Related: A Small Business Owner's Guide to Managing Funds and InvestmentsWhen Signor and Smith discovered that they had both, individually, been saving to open their own bars, joining forces was a no-brainer. ""We knew we wanted to do something together,"" Smith says. They started dreaming about the bar they'd open, and even collecting decorations. A vintage clock here, a disco ball there. A wooden toucan to hang from the ceiling, sock monkeys to dress in funny, seasonal outfits. Their nostalgic, oddball, something-for- everyone aesthetic was representative of their mission for the business. ""We'd been to so many establishments that have not made us feel welcome, or have made us and others feel like outcasts,"" Signor says. ""We wanted everyone to feel included.""In May 2018, they took the leap. They quit their jobs together and backpacked for nine months through Europe and the U.S. to learn more about the history of beer. When their former boss at Atomic Liquors, Lance Johns, reached out and told them he had bought a few buildings in the downtown area, and he would lease one to them, the couple jumped at the chance. They had a vision, and they were ready.  Image Credit: Mike BellemeConstruction on the Silver Stamp began at the end of 2019. A few months later, we all know what happened: The pandemic hit.Smith and Signor had planned to hold other jobs as they built out the space, but the shock to the service industry left them unemployed. They had already sunk $60K of their savings into gutting the space, buying materials and paying contractors, so they pressed ahead. But there were mistakes and setbacks during construction, and the funds dried up way before the bar was finished.


Related: Would You Turn Your Small Business Into a Franchise? Here's Why Everyone From Hardware Stores to Hot Dog Shops Are Doing It.""We were beside ourselves,"" Signor recalls. ""I remember stepping outside and thinking, We don't really have any money left.""At some point, the couple assessed their situation. Nothing was going to plan, sure, and the money was gone. But they had their own two hands, and a community of friends who were willing to help.They began spending long nights repurposing old, torn-out wood, running electrical lines, and laying plumbing themselves, to cut costs. They sought out any help they could get. ""One of the biggest things I learned during this process,"" Signor says, ""and this is even after we've opened — is to not be afraid to ask as many questions and to reach out to as many people as you can. Sometimes you think you're bothering people, but in that dire moment, I remember panicking and hitting everybody up, asking for suggestions, and looking to people that have a little bit more experience with the situation. There were some really surprising people that came forward to help us just by mentioning what our situation was."" People coached them through different processes, gave them a discount on their services, or lent them materials and machinery. They turned to others for counsel or attempted to replicate, through trial and error, what seemed to have worked for other successful establishments.One person they leaned on a lot was Lance Johns, who knew how hard they worked from when he was their boss. ""Lance is somebody that will give back to people who give to him,"" says Signor. ""Having a mentor saved us a lot of time not having to second-guess ourselves.""One thing they never doubted was how they wanted their bar to feel: inclusive and, of course, comforting.Related: Experts Say This Is the Key to Marketing a Mom and Pop BusinessThey poured those values into every detail and decision. Christmas lights strung across the ceiling help keep the ambience neither too dark nor too bright. Bar stools are repurposed gaming chairs, designed for people to sit in one place for an extended period of time. The collection of cozy nooks and small seating areas encourages intimate conversations, and the music is kept at a low enough decibel that you can hear your neighbor talk. There are only two screens, an anomaly in otherwise tech-saturated Las Vegas. And this low-tech ethos extends to printing physical menus, even though the bar has served over 1,700 different beers in three years — averaging out to nearly two new beers a day. Finally, there's the diversity of decorations and memorabilia — a bubbling lava lamp, vintage beer posters, kooky seasonal decorations, scavenged beer-can art installations — that Signor and Smith had collected over two years before the bar's opening. They're now strewn across the wood-panel walls and, really, everywhere, so that customers have something fun and different to look at in each corner. Customers have even begun adding their own contributions to the decor.


""We have been to enough bars in our life to know what makes us feel comfortable,"" Signor says, ""So how we created the bar was based on our own preferences."" By trusting their own well-defined feelings, they built something universally relatable.Image Credit: Mike BellemeBut creating an environment that is comfortable and relatable is about more than just creative decisions. It's also about financial decisions, and from the start, Signor and Smith were determined to keep costs down. ""We have low overhead because our decisions weren't fueled by [trying to make] money,"" Signor says. ""We intentionally made choices like a cheaper building off the beaten path and being our own managers and cutting out that salary.""Being intimately involved in the day-to-day operations of the space has also helped them foster the spirit of the bar and its employees. ""Our definition of a bartender isn't someone just serving drinks,"" says Signor. ""It's about building a relationship with these guests. When we're hiring, we look for people who genuinely appreciate other people, treat them with respect and kindness, and create a really safe space that people want to come back to."" Their ideal hire is someone who has positive energy, is able to leave their personal life at the door, can laugh and joke with people, and is humble (which they define as ""not intimidating and able to put people at ease"").Related: 50 Amazing Grants, Accelerators, and Free Resources Being Offered to Entrepreneurs by Champions of Small BusinessIt's painful to let people go when they don't live up to those standards, Signor says. But it's also essential. ""When prioritizing what to do next, I always think of the guest sitting in that barstool,"" she explains. ""We tell the staff to pretend we're the guests on the other side. What are they seeing? Really envision it from their perspective.""But, while Signor and Smith want their employees to put themselves in their customers' shoes (or, rather, stools), they also believe that employees have to be happy for customers to enjoy themselves. They offer health benefits — something they say is mostly unheard of in their industry, but something they wanted when they were employed by others. They are also transparent with their employees about finances and business decisions, sharing numbers and providing reasoning for changes. They take their workers' thoughts into consideration, whether it be opinions on events or on shifts in workflow. And they don't ask employees to do anything they wouldn't want to do. (The pair continue to work bar shifts alongside their staff — including cleanup duty.)""Don't be afraid to get feedback,"" says Signor. ""Our staff is so important to us and really we wouldn't be the bar that we are without them. So we lean on them, and they lean on us.""


The same way she encourages her employees to look at things through the customer's eyes, she makes a habit of looking at a situation from the viewpoint of her employees. ""I've learned to always try to put myself in the mindset of the other person,"" she says. ""I roleplay with myself in my head: If I say this to them, what do I think their response will yield? And could I say it differently? I just really try to understand where they're coming from before we approach the situation."" She adds, ""And then if we're frustrated, we sleep on it. That was something that my mentor told me: 'Always take a couple of days to reflect.'""These days, when Smith and Signor reflect on their business journey, it's notable that, in a city known for its fabulous attractions, The Silver Stamp has become its own must-see destination. ""We've become a bar people bring their families to when they're in town because they have to show their parents, their uncle,"" Smith says.Signor adds, ""We've had grown people cry when they first come in here. The space touches them immediately.""People are always looking for comfort, and the Silver Stamp shows that if you devote yourself and your business to that quality above all, people will feel it — and deeply appreciate it. You just need a vision, and a willingness to get your hands dirty. ""Every single aspect of this bar we've had our hands in,"" says Smith. He and Signor think it's funny that one of the bar's quirks that locals and tourists love — the fact that they don't have signage outside their building, giving the bar that local, in-the-know vibe — came about because they couldn't afford the sign they had designed.That's the kind of thing you never could have planned for. So, while Smith and Signor have received offers to franchise the bar, they don't think what they've created can be replicated. They do have other plans in the works. But The Silver Stamp will remain dependably unique — news that is its own kind of comfort.Related: Here's the Secret to Growing Your Small Business, According to Execs at UPS, Airbnb, Mastercard, and Other Big Brands
"
