,title,date,author,link,text
24,Let's Bring Back the Human Element to Paying Bills — Here's 3 Ways to Nurture Vendor Relationships for Business Success,"Feb 26, 2024",Nick Chandi,https://www.entrepreneur.com/growing-a-business/3-ways-to-nurture-your-vendor-relationships-to-fuel/469324,"
Turning a small business into a success involves many factors, but a big part of it is how well you get along with your suppliers. Since businesses rely on vendors for essential supplies, cultivating strong ties ensures a reliable supply chain, minimizing disruptions. Managing these connections can get tricky as businesses grow, but there are ways to make it smoother and more cost-effective.The human element is important in improving vendor relationships. Unlike large corporations, small businesses are more likely to engage in regular personal interactions with vendors through meetings, calls and visits. These personal connections often go beyond simple transactions and are more geared towards developing a symbiotic partnership with effective communication and mutual collaboration. The human touch adds empathy and reliability, transforming vendor relationships into partnerships built on trust and shared goals.How can the personal touch in Accounts Payable (AP) (the part of business where you make sure you pay your bills) help foster positive vendor relationships for the success of your small business? Consider these three approaches to ensure a strong and beneficial partnership.



Related: 3 Secrets to Streamlining Your Accounts Payable Process1. Personalize your communication strategiesTo build strong relationships with vendors, it's important to personalize communication. Understand each vendor's preferences and priorities, whether they prefer emails, phone calls, or in-person meetings. When you talk with them, take notes or write down what you remember about them after the meeting. Before you talk with them next, re-read your notes and ensure you don't ask the same question twice. A good Customer Relationship Manager (CRM) tool can help you keep track of how your clients want to be spoken to.


Successful personalized communication includes regular updates, timely responses, and expressing appreciation. Seeking feedback and addressing concerns promptly is important. Simple gestures like personalized thank-you notes, recognizing partnership milestones, or expressing appreciation for timely payments contribute to a positive and collaborative atmosphere in the vendor relationship.Related: 80% of Businesses Fail Due To a Lack of Cash. Here are 4 Reasons Why Cash Flow Forecasting Is So Important 2. Be transparent in financial transactionsTransparent financial dealings with vendors hold significant importance for several reasons. If you share financial information openly, it helps everyone trust each other and work together smoothly. Openly sharing financial information prevents misunderstandings and sets the stage for fair negotiations, potentially resulting in better terms for both parties.In terms of invoicing, clarity on payment terms is key. By discussing and agreeing upon invoices with clients before sending them out, you can ensure everyone is on the same page. No one likes costly, hidden surprises. Being clear ahead of time prevents misunderstandings and shows your commitment to fair and transparent business practices.


When creating invoices, use straightforward language and specify payment due dates. This expedites the payment process and establishes clear expectations, contributing to your business's streamlined and efficient financial workflow. By prioritizing transparency, you build stronger relationships with vendors and improve the overall efficiency of your financial transactions.Related: 4 Cash Flow Trends To Know About in 2024 3. Streamline processes for efficiencySmall businesses can make things run smoother by simplifying their payment processes. One way is by using software to handle tasks like paying invoices and keeping records automatically. This helps avoid mistakes and speeds up payments. Delayed payments are a common challenge, affecting 93% of companies. Another helpful strategy is setting up a standardized payment approval workflow for invoices, which are reviewed and approved quickly. This ensures that payments happen on time and keeps financial operations running smoothly.Also, adopting digital payments makes transactions faster and more accurate, making it easier for vendors. The total transaction value in the Digital Payments market is set to hit a whopping US $11.55 trillion in 2024! Connecting modern payment solutions with accounting systems is another smart move. This ensures that data is reconciled automatically, reducing the chance of errors and improving overall financial management. And with this, small businesses can save hours a week. Small businesses can make their financial processes more reliable and effective by making these changes.


The impact of streamlined procedures on vendor satisfaction and business success is substantial. Efficient processes mean vendors receive timely payments, fostering trust and reliability. This, in turn, improves the overall vendor experience, leading to stronger relationships.Related: Slow Payment Options Are Costing Your Business — Here's the Alternatives of the Future The success of small businesses hinges on strong vendor relationships built through personalized communication, transparent financial dealings, and streamlined accounts payable processes. Paying bills is not merely a financial transaction but a testament to the trust and reliability underpinning vendor relationships. Businesses uphold integrity and accountability by prioritizing transparent financial transactions, laying the groundwork for enduring partnerships.While technology helps us work more efficiently, the human touch – the personal connections we make – solidifies these relationships. Small businesses should prioritize open communication, mutually beneficial collaboration, and a personal touch to ensure enduring vendor connections, creating a powerful synergy for sustained growth and prosperity.
"
25,"AI May Not Take Your Job, But Someone Using AI Likely Will — Here's Why.","Feb 23, 2024",Lena Grundhoefer,https://www.entrepreneur.com/science-technology/ai-may-not-take-your-job-but-someone-using-ai-will/469505,"
Artificial intelligence is changing the way marketing and PR agencies are run.Research shows that 68% of public relations professionals use AI, 68% of SEO experts are exploring it, and 61.4% of marketers are using it. It's easy to see why.AI usage in social media is expected to grow at a compound annual growth rate (CAGR) of 28.04% through 2028, and large language models increasingly write online search results. We even have AI influencers taking over, with a reported 34% of American consumers putting their trust in them, and the highest-paid virtual influencer, Lu Do Magalu, is earning an estimated $16.2 million per year with sponsorships from brands like Adidas and Mac Cosmetics.



It's clear that AI is here to stay, and it's making a huge difference for companies in various ways, especially when creating online content. This is rapidly changing the tasks that marketers, SEOs, and PR professionals perform while augmenting their skill sets with powerful (albeit somewhat inaccurate) tools.If you want to build a successful agency, the traditional advice is to hyper-focus on one niche and be the best at it to generate revenue and grow your team. Using AI, however, a single person can do the work of an entire team, and many solopreneurs are using it to diversify their offerings as the technology creates dramatic shifts in legacy agency models.


Related: How to Own Your Online Narrative – Even When the Internet Owns YouExploring AI tools in marketingThere's no shortage of AI tools built for agencies–transcription tools like Otter AI and Descript, for example, make it easy to record and transcribe client meetings. These transcriptions make it easier to assign work to freelancers and ensure they have the client's exact wording and specifications.AI image-generation tools like Midjourney and Adobe Firefly can reduce operational costs while ensuring you have high-quality images for client social media, marketing, ads, and other channels. Runway ML takes visuals a step further by transforming text and images into video, and ElevenLabs provides AI-generated voiceovers.Finally, large language models like Perplexity make online research much faster and more efficient. Of course, there are also risks inherent in using AI in your agency.


Related: 10 AI Tools That You Should Be Using In Your Business This YearOvercoming risks of using AIExpect clients to have strict AI requirements, as a recent Cisco survey found that 27% of companies fully ban AI tools, while a majority limit employee use. This is because generative AI sparked a lot of controversy over the past two years, and there are various ethical considerations, including amplified biases and potential copyright infringement.Last month, a study from Gary Marcus and Reid Southen showed Midjourney v6 reproduces almost exact movie stills, and both Wacom and Magic: The Gathering drew heat online for using generative AI images in their advertising, and the latter fired their agency after the snafu.Related: What Will It Take to Build a Truly Ethical AI? These 3 Tips Can Help.


Making matters worse, AI image detectors like Hive and text detectors like Originality AI produce false positives, blurring the lines between human and machine-generated content. Even if you pledge not to use AI, the freelancers you hire may still introduce it into your workflow, causing unexpected problems.If you do use AI, there are four steps you can take to ensure it's being used safely and correctly.1. Don't publish AI outputs as your ownRaw AI outputs should never be used as the final published product, whether images or text. They aren't legally protectable, per the US Copyright Office's AI guidelines, and claiming AI outputs are your own is plagiarism. Since it's impossible to know what content most models were trained on, it's best to use AI either in the ideation phase or as one small piece of a finished product.2. Be transparent about using AIIf you use AI in any way, be upfront with clients and the public. Having AI usage laid out plainly in your contracts and any content using it is best. Being caught using AI without disclosing it can lead to drastic negative consequences, like this indie book cover contest that was canceled after the artist lied about the use of AI against the rules of the contest. If a publication doesn't want AI pitches or editorials, be sure to honor those requests.


3. Be careful with proprietary dataUnderstand that any information input into an AI may potentially be trained on or viewed by an outside party. Several instances were reported in the past year of ChatGPT leaking sensitive information to other users, and it's important to be mindful of what information is entered into any AI tools. Don't input anything into a prompt that you don't want anyone to see.4. Keep a human in the loopIt's easy to get lazy and submit mistakes you normally wouldn't when using AI. Channel Nine in Australia recently learned this the hard way when an image of politician Georgie Purcell was edited with Adobe Firefly and drew accusations of sexism. This technology isn't a replacement for humans–it's an augmentation. Be sure to thoroughly check any AI work before turning it in and making mistakes that ruin the reputation of your agency or client.Related: 3 Smart Things to Know Before Getting Started with AIGetting started with AI in your agencyAI can be a game-changer, and staying on top of technological advancements is important. It can give you a competitive edge over larger firms with a longer staff list. However, it requires purpose and care to implement correctly, and the consequences for misusing AI can be dire.


More than anything, honesty is the best policy. Companies are continuing to implement internal rules about the use of AI, and a subsection of consumers are always looking to catch a company using it without disclosure. As long as you properly label where AI is used in your workflow, the benefits and the efficiency that come out of it can be worth it.
"
26,The Owners of This Texas Farmers Market Took a Big Gamble. Here's How It Paid Off Bigger Than They Dreamed.,"Feb 22, 2024",Emily Washcovick,https://www.entrepreneur.com/growing-a-business/how-this-texas-farmers-markets-gamble-paid-off-big/470139,"
Fall Creek Farmers Market in Humble, Texas, is not just a spot to stop by for your Sunday morning coffee and a fresh vegetable or two. Owners Jonathan and Andrea Haskin built this vibrant space with a vision to change their community's food shopping habits and educate their customers on the importance of buying fresh and local items.The couple came up with the idea for the market in 2015 when they started taking a longer look at what kind of food they had available to them and realized they had to travel far and wide just to source quality ingredients from local farmers. What would happen if they brought their community closer to the source?Related: Top Health and Wellness Franchises



To their delight, the Haskin's neighbors embraced the concept. Situated in the beautiful Fall Creek neighborhood, the market's outdoor setup is near a golf course and several walking trails, drawing tons of people and their pets into the space every Sunday morning.Jonathan and Andrea prioritize being present in their space and providing a personalized experience for every visitor. Getting set up two hours before the market opens and staying until the last group trickles out, the pair walk around to greet and share their story with customers. In the market's early days, their daughters sat at the entrance making bracelets for shoppers as they walked in.


This community feel is what drew in reviewer Forest B., now a regular visitor of Fall Creek Farmers Market. ""All of the vendors were so personable, willing to share advice and their specific stories,"" his review reads. ""I particularly enjoyed the cultural diversity. So much to learn at each booth.""With 20+ vendors spanning global cuisines, there is no limit to the kind of food you can sample at Fall Creek Farmers Market. On his first visit alone, Forest tried a Colombian coffee blend, two empanada flavors, Vietnamese egg rolls, and an Italian ice dessert. The cherry on top was getting to engage with the vendors themselves, learning firsthand about their products and journeys.Related: 4 Reasons Why You Should Enter the Health and Wellness Industry""One [vendor] that's not mentioned in my review is the Indian couple who serve prepared foods there,"" Forest said. ""They are a little bit older. That's completely different, say, from the couple who owns Frostbite, which is the Italian ice vendor. They're youngsters and [are] actually looking to you to provide them information on your journey here in the United States. So you just learn quite a bit about the people. Sometimes people are a little surprised to find out that you know a lot about topics in their areas, but the way you learn a lot is by talking to people and being open and receptive.""


Forest's experience is a perfect example of Jonathan and Andrea's educational ecosystem in action. First and foremost, the market aims to teach its visitors about the importance of fresh, quality food. The Haskins ensure their vendors share this passion and make an effort to educate every customer who visits their booth. 90% of Fall Creek's vendors farm and ranch full-time. Some even take agriculture classes at Texas A&M.""They live it as we do,"" Jonathan said. ""And it starts from the inside. We are really passionate about immersing ourselves into the market, and we are very selective with who we allow [to be] a part of our team.""Jonathan and Andrea's goal is to be the tipping point that pushes customers into the world of local food shopping, and they've found that preparation is key. They engage with customers online ahead of each sale to make sure they have all the information they need for a smooth visit. Because offerings shift each week to spice things up for shoppers and ensure seasonal produce stays front and center, Jonathan and Andrea provide a list of vendors and produce options in advance to help customers plan their meals and build out their grocery lists before arriving at the market.Related: How This Healthy Food App Scored a $200K Investment


The most faithful customers do around 80% of their food shopping at Falls Creek Farmers Market, which was the vision the owners had in mind when they set out to build a business.""It's not a craft show. It's not a bake sale. You can actually come and get your pastured eggs and real items,"" Jonathan said. ""Knowing where your food is from is a big deal. It's like getting a root canal or heart surgery. So it feels really good to be able to serve and to be able to give them access as we have it.""Not only is shopping locally good for your health, but it's good for the local economy. Forest stressed the importance of spending your money and time at small businesses.""Business owners typically are here from other countries. [They] come from backgrounds in which there was virtually no safety net, so they bring their knowledge to the United States. When I'm looking at these businesses, I'm looking at how I can learn more so I can help other people in the community continue to start these small businesses that make our economy run.""


Beyond making visits, reviewing is a powerful way customers can show support. Jonathan and Andrea take every review they receive to heart, always looking to expand the offerings and inclusivity of their space. They find it important to stay receptive to feedback, keeping the dialogue with customers open, genuine, and full of love.In addition to prioritizing customer education and building community, Falls Creek Farmers Market believes:Passion starts from the inside. Put love and care into what you do and it will trickle down to your partners and employees—and ultimately your customers.Preparation is key. Communicate online with your customers ahead of a sale so they know what to expect. Plus, make time to help out with any problems that come up.Supporting local is a great way to learn new things. Opening up your mind and heart to small businesses might just help you discover an important lifestyle change.Listen to the episode below to hear directly from Jonathan, Andrea, and Forest, and subscribe to Behind the Review for more from new business owners and reviewers every Thursday.Available on: Spotify, Apple Podcasts, Google Podcasts, Pandora and Soundcloud.Editorial contributions by Callie Morgan and Kristi Lindahl.
"
