,title,date,author,link,text
31,What's Blocking You From Adopting Generative AI in Your Business? It's Likely One of These Three Things,"Apr 3, 2024","Sahar Hashmi, MD-PhD",https://www.entrepreneur.com/science-technology/whats-stopping-you-from-using-generative-ai-in-your/470921,"
Generative AI is catalyzing a significant paradigm shift in various business sectors, including coding, data science, content creation, virtual assistance, medical support, artistic innovation, media, marketing, game development, financial analysis and digital education, among others. This technology is enhancing business efficiencies broadly and transforming key industries such as healthcare, education and technology, as well as organizational workflows in numerous areas, thereby promising high returns. Consequently, generative AI is reshaping the future of work across a wide array of industries.MarketsandMarkets predicts substantial growth in the global AI industry, estimating it will reach $1,345.20 billion by 2030, with a compound annual growth rate (CAGR) of 36.8% from 2023 to 2030. In alignment with these financial expectations, the Infosys Knowledge Institute has shown that ""firms that use AI well can increase enterprise profit by 38% and will help deliver $14 trillion of gross added value to corporations by 2035.""Yet, despite these promising financial forecasts, the actual deployment of AI technologies, particularly generative AI, falls short of expectations. Gartner survey results published in Harvard Business Review indicate a potential gap in AI adoption: While 70% of organizations were exploring generative AI as of March and April 2023, only 4% had fully implemented these technologies.



So why do business leaders hesitate to integrate generative AI solutions into their operations?The reasons experts have identified for the slow adoption of generative AI primarily center on high costs, data complexities and a shortage of skilled professionals, among other factors. Additionally, there is prevalent mistrust among recent startups and technology industries concerning the effectiveness of available solutions and worries about potential pitfalls.


Despite these numerous factors, here are three potential key reasons that stand out for their hesitancy to embrace AI, along with suggested strategies to address these challenges.Related: You Can Fear It and Still Use It — Why Are So Many American Workers Shy About AI?3 reasons business leaders hesitate to adopt generative AI1. Resistance to change and egoLeadership often hesitates to adopt new technologies, preferring traditional business methods. For example, surgeons at MGH only adopted the Da Vinci surgical robot after losing patients to hospitals using the technology, as they found it hard to leave established practices for new training methods. Similarly, many business leaders stick to conventional workflows, perceiving new changes like AI adoption as disruptive, resource-draining and costly. Their personal discomfort with AI may lead them to reject such innovations, claiming they are ""too busy"" to explore new technological advancements.


2. Lack of expertise in the field of AI applicationsThe problem of leadership resistance is further exacerbated by the shortage of specialized training or expertise, coupled with the challenge of retaining skilled professionals in the realm of artificial intelligence (AI) applications. Despite the burgeoning enthusiasm for AI, there remains a critical need for specialized AI experts within business leadership teams. Although sourcing highly skilled individuals in the market is challenging, retaining them poses an additional hurdle, potentially leading businesses to shy away from considering AI solutions.3. The majority of generative AI solutions are still in the beta phaseWhile generative AI is transforming industries and businesses globally, most of its applications, including ChatGPT4, are still in the beta phase and continuously improving. The more these systems are used, the more data they gather to refine their responses.


However, they are not infallible; they can still experience ""hallucinations"" or produce errors, which might be detrimental depending on the context of use. Such inaccuracies or data security and privacy issues with generative AI applications can have serious implications, particularly in business settings, where they can affect clients or customers and potentially harm the business's reputation. These incidents can lead to distrust among business leaders, resulting in hesitation or outright refusal to adopt AI solutions.Related: This Is the New ChatGPT Trend That Will Enhance Your BusinessHow to thoughtfully adopt AI into your business1. Weigh the benefits and risks for business impactBusinesses that adapt swiftly to change often outperform their competitors, underscoring the importance for leadership to stay abreast of new trends using AI solutions and be ready to embrace them, even when the changes are challenging. A primary consideration is determining whether the AI trend is beneficial for the company's operations, specifically if it can enhance current processes or workflows efficiently and cost-effectively.


It's advisable to engage external expert advisors to assess the advantages and risks of new technological trends, as well as their potential impact on the business. This evaluation process might entail multiple discussions with external AI specialists, financial advisors and internal teams to reach an informed decision regarding the consideration to adopt an AI solution.2. Conduct in-depth technical evaluations of AI solutions before you choose and implement oneOnce the decision to adopt an AI solution has been made, the subsequent crucial step is to conduct an exhaustive market search for AI vendor offerings. It is vital to undertake comprehensive evaluations of AI technology solutions before adoption to minimize the risk of potential failures that could negatively impact a business.Investing in a meticulous and thorough due diligence process, which includes multiple rounds of assessment by different AI technology experts, is imperative. This method is more than a precautionary measure — it's a strategic investment that could save a business not just thousands, but potentially millions of dollars in the long run by ensuring that the selected AI solutions are well-aligned with the business's needs and are set up for successful integration.


3. Make time for ongoing specialized AI workshops and updates for leadership teamsIt is crucial for business leaders to allocate time to understand the basics of available AI business solutions in the market. A recommended approach is to organize regular lunch-hour workshops tailored toward specific AI solutions for leadership, led by AI industry experts. These workshops are an effective strategy to keep leaders engaged and informed about the latest developments in AI technology. By integrating customized learning/training into their schedules in an efficient and focused manner, leaders can stay abreast of advancements and better position their businesses to leverage AI innovations.Related: How Cutting Edge AI Tech Could Be Your Answer to Tackling StressAs we navigate the burgeoning era of generative AI solutions, which is finding its application across various business sectors, it's crucial for leadership to remain engaged and informed to avoid falling behind competitors. The dawn of this new generative AI era is upon us, escalating rapidly. To effectively leverage its advantages, business leaders need to be well-prepared and proactive, ensuring a deep understanding and strategic integration of these advanced technologies into their planning, doing so both efficiently and effectively to steer their business toward success.
"
32,Start an IT Career with This Extensive Bundle — Now an Extra 20% Off,"Apr 2, 2024",Entrepreneur Store,https://www.entrepreneur.com/science-technology/start-an-it-career-with-this-extensive-bundle-now-an/471983,"
Every business has IT needs these days. Whether your company is struggling with technology or you're interested in launching a lucrative career as an IT consultant or entrepreneur, The Complete CompTIA and IT Exam Lifetime Access Training Bundle can be a great asset. During our Secure Solutions Sale, you can get this resource library for an extra 20% off at just $39.99 when you use promo code SECURE20.This bundle includes access to five top-rated training libraries: CramWise, ExamsDigest, LinuxPath, DojoLab, and CodeDirect. Each has its benefits to help you learn valuable IT skills and study to pass a variety of important certification exams on your first attempt.With a 4.1/5-star average instructor rating, CramWise gives you access to more than 25 exam simulators and 40 hours of training to familiarize you with computer networks, basic security, and cloud services like AWS. With ExamsDigest, you'll go even further with exam simulators with Performance-based Questions (PBQs) and IT labs that follow specific CompTIA, Cisco, and AWS certification exam objectives. LinuxPath and CodeDirect, two more offerings from ExamsDigest, will help you delve into Linux and Python, respectively, learning how to perform command-line actions and code with the world's most popular programming language.Finally, DojoLab gives you labs and PBQs focused on CompTIA's most in-demand certification exams, including Core A+, Network+, Security+, and Linux+. It's a comprehensive guide to get you on the certification track.Become an IT expert with help from The Complete CompTIA and IT Exam Lifetime Access Training Bundle. Now through 11:59 p.m. PT on April 7th, you can get it for just $39.99 when you use promo code SECURE20.



StackSocial prices subject to change.
"
33,Train for Microsoft Tech Certification with This Bundle — $70 Through April 2,"Mar 31, 2024",Entrepreneur Store,https://www.entrepreneur.com/science-technology/train-for-microsoft-tech-certification-with-this-bundle/471852,"
Microsoft is one of the leading tech giants in the world and has been for a long time. For aspiring IT professionals, demonstrating a proven mastery of its software can make you a valuable hire and team member. To help acquire those skills, you can pick up The Complete 2024 Microsoft Tech Certification Training Super Bundle, which is on sale for just $69.97 (reg. $429).Designed to help users train and study for Microsoft certification opportunities, this bundle is outfitted with 11 courses and nearly 250 hours of content on Microsoft-centric IT.One of the most popular courses in the bundle, Managing Modern Desktops, has an average rating of 4.45/5 stars with students. Its 64 lectures cover a wide variety of helpful tips, including how to develop an operating system, how to deploy and migrate desktops to Windows 10, and how to manage user profiles.This course and others throughout the bundle are taught by instructors from IDUNOVA, which is an organization with over two decades of experience in the world of IT education. Some of the other courses in the bundle focus on topics like learning how to manage Microsoft Teams, working with Microsoft's Azure Administrator, mobility and security best practices for Microsoft software, Microsoft security operations, and a whole lot more.This educational resource is more than worth its discounted rate for those who want to pursue a career in Microsoft-focused IT.Through 11:59 p.m. PT on April 2, you can get The Complete 2024 Microsoft Tech Certification Training Super Bundle on sale for just $69.97 (reg. $429).StackSocial prices subject to change.
"
34,Save $63 on an Introduction to ChatGPT Course That Spans 25 Hours of Lessons,"Mar 31, 2024",Entrepreneur Store,https://www.entrepreneur.com/science-technology/save-63-on-an-introduction-to-chatgpt-course-that-spans-25/471911,"
The modern business climate features plenty of challenges, but there are some exciting solutions surfacing thanks to the rise of AI technology. According to the latest data, ChatGPT generated more than 1.6 billion visits in February 2024 (per ExplodingTopics), and if you're still trying to catch up to this trending tool, then we have an ideal educational offer.For a limited time, the Introduction to ChatGPT e-Learning course is discounted to only $16.97 (reg. $80) with no coupon required. This deal lasts through April 2 at 11:59 p.m. Pacific, so there's not much time to pounce on endless access to this nine-lesson package that spans 25 hours of content,Produced by International Open Academy, an established leader in online learning, this course carries a store rating of 4/5 and is primed to prepare users for new possibilities. An understanding of this incredibly popular AI platform is a fantastic way to identify shortcuts for consistent time-saving techniques along with fresh, customizable content that can be used in a variety of professional and personal purposes.



This best-on-web pricing makes it easier than ever to gain knowledge on how to most effectively explore and capitalize on ChatGPT's far-ranging capabilities. Key topics covered in this course include content creation, client services, market research, lead generation, data analysis, marketing and HR management,From freelance work to business ownership, these lessons can provide building blocks toward a more efficent and rewarding career. Unleash fresh economic potential, streamline projects and cater to more clients without becoming overwhelmed with these expanded resources.


Plus, users will receive a Certificate of Completion upon fully receiving each lesson and answering post-course exam questions. These are accredited by the International Council for Online Educational Standards and can be helpful in employment efforts.Make the most of evolving modern technology and use it to give your professional aspirations or business a boost by picking up the Introduction to ChatGPT for only $16.97 (reg. $80) through April 2 at 11:59 p.m. Pacific.StackSocial prices subject to change.
"
35,Streamline In-House Developer Work with This $40 Program,"Mar 29, 2024",Entrepreneur Store,https://www.entrepreneur.com/science-technology/streamline-in-house-developer-work-with-this-40-program/471834,"
Dev work is often what makes or breaks a project coming in on time and on budget. For teams and professionals out there doing your own coding and development, you should really secure a tool that will help you make the most of your time at a reasonable or even favorable rate. An example of the latter is that through April 2 at 11:59 p.m. PT, you can save on Microsoft Visual Studio Professional 2022 for Windows and get it for a rate of just $39.97 (reg. $499).Microsoft Visual Studio is equipped with a range of tools and features that help users code smarter, more efficiently, and faster. Its software is built on a 64-bit IDE, which is equipped to support large-scale projects and intense workloads.In addition to helping with collaboration and organization, Visual Studio supports building projects across different coding languages and platforms. For example, with Visual Studio Pro you can edit running ASP.NET pages in web designer view or even build responsive Web UIs in C# using Blazor.Microsoft Visual Studio also helps developers speed up the coding process with IntelliCode, which uses variable names, functions, and the type of code you're writing to generate suggestions to help you finish a line or block of code faster than you could type it out.This fantastic software is rated 4.6/5 stars on GetApp, and its current affordable rate is worth taking a serious look at.From now through April 2 at 11:59 p.m. PT, you can save on Microsoft Visual Studio Professional 2022 for Windows and get it for just $39.97 (reg. $499).StackSocial prices subject to change.
"
36,Secure Reliable Project Management Support for $25,"Mar 27, 2024",Entrepreneur Store,https://www.entrepreneur.com/science-technology/secure-reliable-project-management-support-for-25/471707,"
Project managers cost money, and they're not going to be worth it without the proper support. For equipping your team with the right gear, or yourself if you're handling their own project management, Microsoft has a program that's been serving teams well for years, and it's currently on sale.Through 11:59 p.m. PT on April 2, you can get Microsoft Project Professional 2021 for Windows on sale for just $24.97 (reg. $249). Rated 4.4/5 stars on GetApp and Capterra, Microsoft Project Professional 2021 helps guide teams in professional projects toward successful execution and efficient production.This lifetime license comes with a range of pre-built templates for getting various projects started on the right foot. It empowers users to build projects online and locally on their computer's server, and even sync the two to build something out according to their availability and access.When underway on production of a project, Microsoft Project Professional can enable users to submit timesheets and even differentiate hours spent on a project versus non-project work. It has generators for what-if scenarios to help plan out how to work through specific assignments.When you're building out a project with different due dates and tasks, Microsoft Project Professional can build visually complex schedules and auto-populate start and end dates based on context.This deal is worth looking at for teams trying to improve productivity without maxing out their budgets.Through 11:59 p.m. PT on April 2, you can get Microsoft Project Professional 2021 for Windows on sale for just $24.97 (reg. $249).StackSocial prices subject to change.
"
37,Unleash Productivity and Save $70 on This Elite Mac Tool,"Mar 27, 2024",Entrepreneur Store,https://www.entrepreneur.com/science-technology/unleash-productivity-and-save-70-on-this-elite-mac-tool/471705,"
Productivity is paramount for most entrepreneurs. You only have so many hours in a day, and for anyone, time really is money. If you're a Mac user, you may be missing out on productivity and customization hacks for your computer. MacPilot's mission is to help you tap into these hacks.Your Mac's potential has yet to be unleashed, but MacPilot can tap into the power of UNIX to unlock more than 1,200 features to optimize your experience and streamline your productivity. You don't need to learn any command line tools or file operations — MacPilot is easy for absolutely any Mac user to use.With MacPilot, you can display hidden files in Finder, toggle animations, customize your dock with spacers and smart menus, change the screenshot file format, run maintenance tools, and much more. You'll have better access to your system profile to understand how your Mac is working under the hood and be able to optimize and repair your system by running common maintenance scripts that most users overlook.Do things like view a complete list of network ports, error codes, and key combos, show the Quit menu more apparently, and just generally be able to take better care of your Mac with fewer keystrokes and clicks.Tech Journey writes, ""Mac Pilot is the Swiss Army Knife that does all the user interface customization, combining with custom system tweaks and under the hood maintenance in a single convenient package.""



Find out what it can do when you get a lifetime license to MacPilot for just $29.97 — more than 70% off $99 —now through 11:59 p.m. PT on April 2.StackSocial prices subject to change.
"
38,Visualize Your Projects Better with MS Visio — $25 Through April 2,"Mar 26, 2024",Entrepreneur Store,https://www.entrepreneur.com/science-technology/visualize-your-projects-better-with-ms-visio-25/471642,"
When approaching a given project, having a reliable tool to help you diagram things out can make a world of difference. To make the most of your team's time and budget, consider taking advantage of the features and curated support of a program like Microsoft Visio Professional.Through April 2 at 11:59 p.m. PT, you can get Microsoft Visio Professional 2021 for Windows on sale for just $24.97 (reg. $249). Featuring a range of tools to help users better diagram out their approach to specific projects, Visio has been used by teams from around the world for years. This one-time purchase gives you a lifetime license for on-premises diagramming on one PC for life.The license features all of Visio Standard's standard templates, shapes, and collaboration features. It also adds the ability to link diagrams to live data from both internal and external sources. It supports the generation of flowcharts with a diverse and expansive library of templates, stencils, and shapes. To help you turn numbers into information, you can use these charts to present to salespeople, investors, and team members.Visio also has support for organizing org charts and building floor plans for a range of spaces, It has network diagramming tools to help users simplify complex systems and illustrate how specific devices and networks function. This Microsoft Visio license also comes with brainstorming tools like fishbone diagrams and SWOT analysis features.Through April 2 at 11:59 p.m. PT, you can get Microsoft Visio Professional 2021 for Windows on sale for just $24.97 (reg. $249).StackSocial prices subject to change.
"
39,Improve Your Team's Output with Microsoft Office Professional Plus 2019,"Mar 26, 2024",Entrepreneur Store,https://www.entrepreneur.com/science-technology/improve-your-teams-output-with-microsoft-office/471640,"
Entrepreneurs need to think ahead when starting a business. How are you going to set your employees or team members up with the tools they need to succeed? For a long time now, teams and individuals around the world have relied on the comprehensive suite of tools included with Microsoft Office to prepare for success.Through April 2 at 11:59 p.m. PT only, you can get Microsoft Office Professional Plus 2019 for Windows or Microsoft Office Home & Business 2019 for Mac for just $29.97 (reg. $229). This lifetime license is good for a single download and lifetime use on a computer of your choice. You can download it and get to work immediately after purchasing.Each of these Microsoft Office Licenses includes:



OutlookPowerPointExcelMicrosoft WordOneNoteThe Windows version also comes with Publisher and Access, while the Mac version includes Teams Classic. In addition to access to Word's writing document-creating powers, PowerPoint's deck-generating wonder, and Excel's spreadsheet mastery, these licenses also include free access to an acclaimed customer support team.This deal is rated an average of 4.6/5 stars by verified purchasers. One recent five-star review from a verified buyer named Timothy Russel reads, ""Great price, no problem with download or key provided. It just works! Look forward to future purchases.""


Set your team off on the right foot while this limited-time discount makes these amazing tools available for a bargain.Through April 2 at 11:59 p.m. PT only, you can get one of the following 2019 Office versions:Microsoft Office Professional Plus 2019 for Windows for just $29.97 (reg. $229).Microsoft Office Home & Business 2019 for Mac for just $29.97 (reg. $229).StackSocial prices subject to change.
"
